fecha_semana,nombre_semana,author,datetime,datetime_parsed_utc,url,text,replies,retweets,likes,bookmarks,views,query_used,is_reply,in_reply_to_url
,semana_10febrero_26_16febrero_26,@TampicososTV,2026-02-15T19:19:48.000Z,2026-02-15T19:19:48+00:00,https://x.com/TampicososTV/status/2023115040648241195,"En dos semanas van como diez robos/asaltos, o como lo llamaría @MonicaVTampico “hechos aislados” Tampico sigue pa’ trás",1,0,4,0,0,@MonicaVTampico since:2026-02-10 until:2026-02-16,False,
,semana_10febrero_26_16febrero_26,@55Arguelles,2026-02-14T03:26:54.000Z,2026-02-14T03:26:54+00:00,https://x.com/55Arguelles/status/2022512849470570871,Adiós el mal humor,0,0,0,0,0,@MonicaVTampico since:2026-02-10 until:2026-02-16,False,
,semana_10febrero_26_16febrero_26,@VoxPopuliNoti,2026-02-14T03:02:46.000Z,2026-02-14T03:02:46+00:00,https://x.com/VoxPopuliNoti/status/2022506777313448362,Gobierno de Tampico rehabilita el Parque Las Tortugas y suma 38 espacios públicos recuperados Gobierno municipal apuesta por áreas verdes para fortalecer convivencia social y seguridad https:// voxpopulinoticias.com.mx/2026/02/gobier no-de-tampico-rehabilita-el-parque-las-tortugas/ … #Tampico #Tamaulipas #Espaciospúblicos @MonicaVTampico,0,0,0,0,0,@MonicaVTampico since:2026-02-10 until:2026-02-16,False,
,semana_10febrero_26_16febrero_26,@JaiboTuitero,2026-02-13T23:28:43.000Z,2026-02-13T23:28:43+00:00,https://x.com/JaiboTuitero/status/2022452910291063097,"Tranquis, ya mero vuelven tus patrones del pan",0,0,0,0,0,@MonicaVTampico since:2026-02-10 until:2026-02-16,False,
,semana_10febrero_26_16febrero_26,@TampicososTV,2026-02-13T21:51:49.000Z,2026-02-13T21:51:49+00:00,https://x.com/TampicososTV/status/2022428522258804923,"El cinismo. Para eso querían ganar Tampico. Cada vez peor tu gobierno, @MonicaVTampico .",1,0,2,0,0,@MonicaVTampico since:2026-02-10 until:2026-02-16,False,
,semana_10febrero_26_16febrero_26,@TampicososTV,2026-02-13T20:16:42.000Z,2026-02-13T20:16:42+00:00,https://x.com/TampicososTV/status/2022404584862621900,"Aumento en las cuotas para pequeños deportistas, aumento en la inseguridad, basurero por toda la ciudad y aumento en la inseguridad… el verdadero carnaval de @MonicaVTampico @TampicoGob .",0,0,1,0,0,@MonicaVTampico since:2026-02-10 until:2026-02-16,False,
,semana_10febrero_26_16febrero_26,@tuespacio_1,2026-02-12T12:54:14.000Z,2026-02-12T12:54:14+00:00,https://x.com/tuespacio_1/status/2021930847793033364,"Si hace, está haciéndose una mansión de media cuadra en la Colonia Petrolera, si quieres saber dónde yo te digo, va a ser vecina mia.",0,0,0,0,0,@MonicaVTampico since:2026-02-10 until:2026-02-16,False,
,semana_10febrero_26_16febrero_26,@TampicososTV,2026-02-12T01:42:01.000Z,2026-02-12T01:42:01+00:00,https://x.com/TampicososTV/status/2021761677818048748,Qué horror de baches en la Av. Hidalgo y @MonicaVTampico sin hacer algo.,1,1,2,0,0,@MonicaVTampico since:2026-02-10 until:2026-02-16,False,
,semana_10febrero_26_16febrero_26,@JaiboTuitero,2026-02-12T01:36:04.000Z,2026-02-12T01:36:04+00:00,https://x.com/JaiboTuitero/status/2021760182418608200,"Ya mero regresan tus patrones del pan, tranquis",0,0,0,0,0,@MonicaVTampico since:2026-02-10 until:2026-02-16,False,
,semana_10febrero_26_16febrero_26,@FrancoIgnacioL5,2026-02-12T01:02:05.000Z,2026-02-12T01:02:05+00:00,https://x.com/FrancoIgnacioL5/status/2021751630597624119,"Por eso votó el pueblo ""bueno y sabio""",0,0,0,0,0,@MonicaVTampico since:2026-02-10 until:2026-02-16,False,
,semana_10febrero_26_16febrero_26,@TampicososTV,2026-02-11T23:50:06.000Z,2026-02-11T23:50:06+00:00,https://x.com/TampicososTV/status/2021733512890429641,"Regalar tamales, conducir un podcast, jugar con IA, gastar en viajes para todo su equipo. Haciendo lo que sea menos gobernar y administrar una ciudad que cada vez la tienes peor, @MonicaVTampico ! @TampicoGob",2,0,2,0,0,@MonicaVTampico since:2026-02-10 until:2026-02-16,False,
,semana_10febrero_26_16febrero_26,@TampicososTV,2026-02-10T00:49:13.000Z,2026-02-10T00:49:13+00:00,https://x.com/TampicososTV/status/2021023617547632726,Desafortunadamente así nos tiene este gobierno de cuarta.,0,0,0,0,0,@MonicaVTampico since:2026-02-10 until:2026-02-16,False,
,semana_10febrero_26_16febrero_26,@JaiboTuitero,2026-02-16T22:33:43.000Z,2026-02-16T22:33:43+00:00,https://x.com/JaiboTuitero/status/2023526230839132571,"Tranquilo, ya mero vuelven tus patrones del PAN",0,0,0,0,0,reply_to:https://x.com/TampicososTV/status/2023115040648241195,True,https://x.com/TampicososTV/status/2023115040648241195
,semana_10febrero_26_16febrero_26,@MonicaVTampico,2026-02-13T04:33:59.000Z,2026-02-13T04:33:59+00:00,https://x.com/MonicaVTampico/status/2022167345477931507,"Desde nuestro municipio hermano de Ciudad Madero iniciamos esta gran fiesta del Carnaval Conurbado 2026, con la tradicional Quema del Mal Humor y la coronación del Rey y la Reina. ¡Que viva esta gran fiesta que une a nuestra zona conurbada!",1,2,4,0,0,reply_to:https://x.com/55Arguelles/status/2022512849470570871,True,https://x.com/55Arguelles/status/2022512849470570871
,semana_10febrero_26_16febrero_26,@elgraficotamps,2026-02-14T19:51:52.000Z,2026-02-14T19:51:52+00:00,https://x.com/elgraficotamps/status/2022760723642761422,Gobierno de Tampico rehabilita el Parque Las Tortugas y suma 38 espacios públicos recuperados,0,0,0,0,0,"""gobierno de tampico"" since:2026-02-10 until:2026-02-16",False,
,semana_10febrero_26_16febrero_26,@LaRedAltamiraMx,2026-02-14T08:17:54.000Z,2026-02-14T08:17:54+00:00,https://x.com/LaRedAltamiraMx/status/2022586081317916916,LA RED: Gobierno de Tampico rehabilita más de 38 espacios públicos Click para leer más WEB: https:// laredmultimedia.com/gobierno-de-ta mpico-rehabilita-mas-de-38-espacios-publicos/ … #SomosLARED #EstamosEnTodasPartes #RED58TeInforma,0,0,0,0,0,"""gobierno de tampico"" since:2026-02-10 until:2026-02-16",False,
,semana_10febrero_26_16febrero_26,@HOYTamaulipas,2026-02-14T04:57:20.000Z,2026-02-14T04:57:20+00:00,https://x.com/HOYTamaulipas/status/2022535608489668802,#Tamaulipas Gobierno de #Tampico rehabilita el Parque Las Tortugas y suma 38 espacios públicos recuperados - Entérate,0,0,0,0,0,"""gobierno de tampico"" since:2026-02-10 until:2026-02-16",False,
,semana_10febrero_26_16febrero_26,@EContre17,2026-02-14T01:59:10.000Z,2026-02-14T01:59:10+00:00,https://x.com/EContre17/status/2022490770868236457,,0,0,0,0,0,"""gobierno de tampico"" since:2026-02-10 until:2026-02-16",False,
,semana_10febrero_26_16febrero_26,@EleeseNoticias,2026-02-14T01:37:01.000Z,2026-02-14T01:37:01+00:00,https://x.com/EleeseNoticias/status/2022485196717879305,Gobierno de Tampico rehabilita el Parque Las Tortugas y suma 38 espacios públicos recuperados https:// eleese.com.mx/2026/02/13/gob ierno-de-tampico-rehabilita-el-parque-las-tortugas-y-suma-38-espacios-publicos-recuperados/ …,0,0,0,0,0,"""gobierno de tampico"" since:2026-02-10 until:2026-02-16",False,
,semana_10febrero_26_16febrero_26,@ArnoldoArnold,2026-02-11T11:37:36.000Z,2026-02-11T11:37:36+00:00,https://x.com/ArnoldoArnold/status/2021549173397672274,UAT y Gobierno de Tampico realizan jornadas dentales gratuitas,0,0,0,0,0,"""gobierno de tampico"" since:2026-02-10 until:2026-02-16",False,
,semana_10febrero_26_16febrero_26,@OscarMalibran,2026-02-10T03:00:12.000Z,2026-02-10T03:00:12+00:00,https://x.com/OscarMalibran/status/2021056579827802132,"LOCAL | Gobierno de Tampico Entrega Becas a 10 Niños para la Barca Academy La alcaldesa de Tampico, Mónica Villarreal Anaya, entregó 10 becas a futbolistas infantiles y juveniles para participar en la Barca Academy la cual llega por primera vez al estado de Tamaulipas.",1,0,0,0,0,"""gobierno de tampico"" since:2026-02-10 until:2026-02-16",False,
,semana_10febrero_26_16febrero_26,@OscarMalibran,2026-02-10T03:01:14.000Z,2026-02-10T03:01:14+00:00,https://x.com/OscarMalibran/status/2021056839354548383,La academia se llevará a cabo del 11 al 15 de febrero en la Ciudad Deportiva de Tampico ofreciendo a los jóvenes deportistas la oportunidad de entrenar bajo la metodología del FC Barcelona.,1,0,0,0,0,reply_to:https://x.com/OscarMalibran/status/2021056579827802132,True,https://x.com/OscarMalibran/status/2021056579827802132
,semana_10febrero_26_16febrero_26,@OscarMalibran,2026-02-10T03:01:15.000Z,2026-02-10T03:01:15+00:00,https://x.com/OscarMalibran/status/2021056842928095622,"Los seleccionados por la Secretaría de Deportes de Tampico que representarán al municipio en esta experiencia formativa son: Icker Cerda, Liam Salazar, André Del Toro, Alberto Ruelas, Christian Hernández, Aitana Rodríguez, Matías Montoya, Diego Reyna, Jorge López y Félix Leyva.",1,0,0,0,0,reply_to:https://x.com/OscarMalibran/status/2021056579827802132,True,https://x.com/OscarMalibran/status/2021056579827802132
,semana_10febrero_26_16febrero_26,@OscarMalibran,2026-02-10T03:01:16.000Z,2026-02-10T03:01:16+00:00,https://x.com/OscarMalibran/status/2021056846220624329,"En el evento estuvo presente la Alcaldesa de Tampico, Mónica Villarreal Anaya; Pablo Aldekoa, Director de Activaciones de la Barca Academy; Jorge Lozano Ceceña, Director de Deportes de Tampico; Homero Peraza Guerra, Subsecretario de deportes y parte de la Directiva de la Barca",0,0,0,0,0,reply_to:https://x.com/OscarMalibran/status/2021056579827802132,True,https://x.com/OscarMalibran/status/2021056579827802132
,semana_10febrero_26_16febrero_26,@EdithM1941328,2026-02-15T23:51:27.000Z,2026-02-15T23:51:27+00:00,https://x.com/EdithM1941328/status/2023183405370990900,Tampico ALDO EN MAZATLAN #AldoEnCarnaval,0,0,0,0,0,tampico since:2026-02-10 until:2026-02-16,False,
,semana_10febrero_26_16febrero_26,@Mrluso0ficial,2026-02-15T23:49:59.000Z,2026-02-15T23:49:59+00:00,https://x.com/Mrluso0ficial/status/2023183034661646448,¡Mira mi último video en #TikTok subí una lista de mis dibujos! Check out my latest TikTok video! I uploaded a list of my drawings! #Draws #Drawing #pokemon #anime #marvel #spiderman #mariobros #tampico #art #artist #ArtistOnTwitter,0,0,1,0,0,tampico since:2026-02-10 until:2026-02-16,False,
,semana_10febrero_26_16febrero_26,@TamaulipasHabla,2026-02-15T23:48:00.000Z,2026-02-15T23:48:00+00:00,https://x.com/TamaulipasHabla/status/2023182536479011119,#CdVictoria |Representantes de partidos políticos ante el Consejo General del @TodosSomosIETAM solicitaron que el nuevo esquema de transparencia LA INFO #Tampico #CdMadero #Altamira #Matamoros #Reynosa #NuevoLaredo #RioBravo #ValleHermoso #Tamaulipas,0,0,0,0,0,tampico since:2026-02-10 until:2026-02-16,False,
,semana_10febrero_26_16febrero_26,@TamaulipasHabla,2026-02-15T23:47:45.000Z,2026-02-15T23:47:45+00:00,https://x.com/TamaulipasHabla/status/2023182473459634289,#CdVictoria |Cinco de cada diez personas que cumplieron una condena en prisión tienen dificultades para integrarse al empleo formal LA INFO #Tampico #CdMadero #Altamira #Matamoros #Reynosa #NuevoLaredo #RioBravo #ValleHermoso #SanFernando #Tamaulipas,0,1,1,0,0,tampico since:2026-02-10 until:2026-02-16,False,
,semana_10febrero_26_16febrero_26,@LindaPriro97266,2026-02-15T23:44:37.000Z,2026-02-15T23:44:37+00:00,https://x.com/LindaPriro97266/status/2023181687279243391,Ese narco maldito ratero secuestrador Javier Santillan García y su narco maldita familia calle D 103 col.Fdo.San Pedro Tampico ayer y hoy han estado golpeando mi barda café que tiene de pared mi barda y techo agarrado a mi barda en complicidadconvecinosyMónicaVillarrealnaros666,0,0,1,0,0,tampico since:2026-02-10 until:2026-02-16,False,
,semana_10febrero_26_16febrero_26,@TvAstronoticias,2026-02-15T23:41:28.000Z,2026-02-15T23:41:28+00:00,https://x.com/TvAstronoticias/status/2023180894295445649,Celebra CEDES Altamira Día de San Valentín con matrimonios colectivos #Tamaulipas #ElMante #Tampico #cdvictoria #Altamira #ciudadmadero #Reynosa #Matamoros #Xicotencatl #NLD #RioBravo #ValleHermoso #NuevoLaredo #Dallas #SanAntonio #NuevoLeon #UANL Enlace https:// facebook.com/Astronoticias/ posts/pfbid0QJeVGTWhTjQmWLcD6kCKEMnQ5Cjusza4goK4D2M63i7G1SKG53jp9Yjb4Gh8EauXl …,0,0,0,0,0,tampico since:2026-02-10 until:2026-02-16,False,
,semana_10febrero_26_16febrero_26,@rastatlacuache,2026-02-15T23:39:18.000Z,2026-02-15T23:39:18+00:00,https://x.com/rastatlacuache/status/2023180348591603819,"Vete a Tampico, Reynosa, san Fernando. Vete tu solo ahí, para que veas de primera mano por qué desaparecen los camiones de pasajeros. Sal de tu zona de confort y sal más a la calle.",45,1,74,0,0,tampico since:2026-02-10 until:2026-02-16,False,
,semana_10febrero_26_16febrero_26,@TamaulipasHabla,2026-02-15T23:37:41.000Z,2026-02-15T23:37:41+00:00,https://x.com/TamaulipasHabla/status/2023179942637474136,"#CdVictoria |El rector de la @UAT_mx , @DamasoAnayaUAT , mantiene un modelo de gestión basado en la cercanía con la comunidad universitaria LA INFO #Tampico #CdMadero #Altamira #Matamoros #Reynosa #NuevoLaredo #RioBravo #ValleHermoso #Tamaulipas",0,0,0,0,0,tampico since:2026-02-10 until:2026-02-16,False,
,semana_10febrero_26_16febrero_26,@MuroPoliticoMX,2026-02-15T23:34:24.000Z,2026-02-15T23:34:24+00:00,https://x.com/MuroPoliticoMX/status/2023179114270925084,"#Tamaulipas |El rector de la Universidad Autónoma de Tamaulipas (UAT), Dámaso Anaya Alvarado, consolida un modelo de gestión basado en la cercanía con su comunidad LA NOTA #CdVictoria #Tampico #CdMadero #Altamira #Matamoros #Reynosa",0,0,0,0,0,tampico since:2026-02-10 until:2026-02-16,False,
,semana_10febrero_26_16febrero_26,@MuroPoliticoMX,2026-02-15T23:33:56.000Z,2026-02-15T23:33:56+00:00,https://x.com/MuroPoliticoMX/status/2023178996062752809,#Tamaulipas |El Gobierno Municipa impulsa un programa de estímulos fiscales que fortalece la economía del hogar LA NOTA #CdVictoria #Tampico #CdMadero #Altamira #Matamoros #Reynosa #NuevoLaredo #RioBravo #ValleHermoso #SanFernando,0,0,0,0,0,tampico since:2026-02-10 until:2026-02-16,False,
,semana_10febrero_26_16febrero_26,@elsolde_tampico,2026-02-15T23:30:00.000Z,2026-02-15T23:30:00+00:00,https://x.com/elsolde_tampico/status/2023178006953369913,"Esto declaró el presidente nacional del Partido Acción Nacional, Jorge Romero...",0,0,0,0,0,tampico since:2026-02-10 until:2026-02-16,False,
,semana_10febrero_26_16febrero_26,@cruzazulismo1,2026-02-15T23:27:41.000Z,2026-02-15T23:27:41+00:00,https://x.com/cruzazulismo1/status/2023177425472155970,"Cómo carajo vas a criticar la cdmx si eres de TAMPICO, no mames.",1,0,0,0,0,tampico since:2026-02-10 until:2026-02-16,False,
,semana_10febrero_26_16febrero_26,@minombreesjenny,2026-02-15T23:26:51.000Z,2026-02-15T23:26:51+00:00,https://x.com/minombreesjenny/status/2023177214229966877,“En dos semanas vas a Tampico?” Harta la tengo pero no me detiene,0,0,1,0,0,tampico since:2026-02-10 until:2026-02-16,False,
,semana_10febrero_26_16febrero_26,@MuroPoliticoMX,2026-02-15T23:25:58.000Z,2026-02-15T23:25:58+00:00,https://x.com/MuroPoliticoMX/status/2023176991663648924,#Tamaulipas |Morena no ha correspondido al respaldo político que el Verde le ha otorgado en las urnas y en el Congreso de la Unión. LA NOTA #CdVictoria #Tampico #CdMadero #Altamira #Matamoros #Reynosa #NuevoLaredo #RioBravo #ValleHermoso #SanFernando,0,0,0,0,0,tampico since:2026-02-10 until:2026-02-16,False,
,semana_10febrero_26_16febrero_26,@MuroPoliticoMX,2026-02-15T23:25:32.000Z,2026-02-15T23:25:32+00:00,https://x.com/MuroPoliticoMX/status/2023176882796351831,"#Tamaulipas |Aunque la ley obliga a propietarios a mantener limpios sus predios, también corresponde a los alcaldes vigilar y hacer cumplir la normativa cuando esos terrenos se convierten en basureros LA NOTA #CdVictoria #Tampico #Matamoros #Reynosa",0,0,0,0,0,tampico since:2026-02-10 until:2026-02-16,False,
,semana_10febrero_26_16febrero_26,@MuroPoliticoMX,2026-02-15T23:24:48.000Z,2026-02-15T23:24:48+00:00,https://x.com/MuroPoliticoMX/status/2023176700851577029,#Tamaulipas |La posibilidad de reclasificar las tarifas eléctricas en Tamaulipas durante 2026 enfrenta obstáculos técnicos. LA NOTA #CdVictoria #Tampico #CdMadero #Altamira #Matamoros #Reynosa #NuevoLaredo #RioBravo #ValleHermoso #SanFernando https:// muropolitico.mx/2026/02/15/cho que-tecnico-frena-baja-en-tarifas-electricas/ …,0,0,0,0,0,tampico since:2026-02-10 until:2026-02-16,False,
,semana_10febrero_26_16febrero_26,@MuroPoliticoMX,2026-02-15T23:24:01.000Z,2026-02-15T23:24:01+00:00,https://x.com/MuroPoliticoMX/status/2023176500783308912,"#Tamaulipas |Durante enero de 2026, las exportaciones por Nuevo Laredo registraron una disminución de 3.5 por ciento LA NOTA #CdVictoria #Tampico #CdMadero #Altamira #Matamoros #Reynosa #NuevoLaredo #RioBravo #ValleHermoso #SanFernando https:// muropolitico.mx/2026/02/15/cae n-exportaciones-pero-comercio-resiste/ …",0,0,0,0,0,tampico since:2026-02-10 until:2026-02-16,False,
,semana_10febrero_26_16febrero_26,@OscarMalibran,2026-02-15T23:22:16.000Z,2026-02-15T23:22:16+00:00,https://x.com/OscarMalibran/status/2023176062016831641,#ESTATAL| Correcaminos Tampico Campeón del Torneo Estatal de Futbol Categoría 2010 y Menores En una emocionante final Correcaminos Tampico se proclamó Campeón del Torneo Estatal de Futbol Categoría 2010 y Menores venciendo - al conjunto de Gen Diablos Azules,1,0,0,0,0,tampico since:2026-02-10 until:2026-02-16,False,
,semana_10febrero_26_16febrero_26,@lovebiebs__swag,2026-02-15T23:35:25.000Z,2026-02-15T23:35:25+00:00,https://x.com/lovebiebs__swag/status/2023179370752618796,"Está si me gustó, así que dinámica para el rey de los carnavales este 2026 -10 cuidades -10 canciones -10 películas ALDO EN MAZATLAN #AldoEnCarnaval",94,19,35,0,0,reply_to:https://x.com/EdithM1941328/status/2023183405370990900,True,https://x.com/EdithM1941328/status/2023183405370990900
,semana_10febrero_26_16febrero_26,@latinus_us,2026-02-14T02:33:15.000Z,2026-02-14T02:33:15+00:00,https://x.com/latinus_us/status/2022499346567008291,Congreso de Perú discutirá el martes la destitución del presidente interino José Jerí. #Latinus #InformaciónParaTi,2,5,20,0,0,reply_to:https://x.com/LindaPriro97266/status/2023181687279243391,True,https://x.com/LindaPriro97266/status/2023181687279243391
,semana_10febrero_26_16febrero_26,@slpnoticias,2026-02-15T18:11:16.000Z,2026-02-15T18:11:16+00:00,https://x.com/slpnoticias/status/2023097795809362050,"REPORTAN LA DESAPARICION DE TODOS LOS PASAJEROS Y CHOFER DE UN AUTOBÚS EN VALLES #CdValles #SLP SOLO ENCUENTRAN PERTENENCIAS AL INTERIOR Está noche trascendió que en la carretera Valles -El Mante, se encontraba un autobús de la línea vencedor abandonado, con el motor",431,4104,12094,0,0,reply_to:https://x.com/rastatlacuache/status/2023180348591603819,True,https://x.com/rastatlacuache/status/2023180348591603819
,semana_10febrero_26_16febrero_26,@Darkzek02,2026-02-16T00:22:42.000Z,2026-02-16T00:22:42+00:00,https://x.com/Darkzek02/status/2023191269980434652,"Te preguntaron bien maldito hijo de perra, contesta como se debe o largate a chingar a tu puta, perra, maldita, culera, sangrona madre.",5,2,690,0,0,reply_to:https://x.com/rastatlacuache/status/2023180348591603819,True,https://x.com/rastatlacuache/status/2023180348591603819
,semana_10febrero_26_16febrero_26,@JoelMiguez3,2026-02-16T00:05:58.000Z,2026-02-16T00:05:58+00:00,https://x.com/JoelMiguez3/status/2023187059771597192,"""sal de tu zona de confort"" claro pq le encanta que lo maten, que lo degollen, que lo secuestren y violen, ese pensamiento mexicanl promedio de verse bien vergas ante todos es el culpable de que su país esté así",1,1,311,0,0,reply_to:https://x.com/rastatlacuache/status/2023180348591603819,True,https://x.com/rastatlacuache/status/2023180348591603819
,semana_10febrero_26_16febrero_26,@laffing_luffy,2026-02-16T00:42:48.000Z,2026-02-16T00:42:48+00:00,https://x.com/laffing_luffy/status/2023196329892106750,"Pues por algo está preguntando pedazo de pinche animal sin comprensión lectora, no puedes nadamás responder ? Ahuevo te quieres hacer el interesante y conocedor de todo puto neandertal de mierda",0,0,262,0,0,reply_to:https://x.com/rastatlacuache/status/2023180348591603819,True,https://x.com/rastatlacuache/status/2023180348591603819
,semana_10febrero_26_16febrero_26,@businessmenstoc,2026-02-15T23:56:13.000Z,2026-02-15T23:56:13+00:00,https://x.com/businessmenstoc/status/2023184607122952516,Está preguntando bien wey,0,0,254,0,0,reply_to:https://x.com/rastatlacuache/status/2023180348591603819,True,https://x.com/rastatlacuache/status/2023180348591603819
,semana_10febrero_26_16febrero_26,@rnelterskelter,2026-02-16T00:55:46.000Z,2026-02-16T00:55:46+00:00,https://x.com/rnelterskelter/status/2023199589491212312,"No identificaste el signo de interrogacion, puñetas?",1,0,98,0,0,reply_to:https://x.com/rastatlacuache/status/2023180348591603819,True,https://x.com/rastatlacuache/status/2023180348591603819
,semana_10febrero_26_16febrero_26,@xhoaxjonas,2026-02-16T01:56:00.000Z,2026-02-16T01:56:00+00:00,https://x.com/xhoaxjonas/status/2023214747831898448,"Qué onda compa está preguntando, es una duda genuina porque no es normal vivir con miedo",0,0,76,0,0,reply_to:https://x.com/rastatlacuache/status/2023180348591603819,True,https://x.com/rastatlacuache/status/2023180348591603819
,semana_10febrero_26_16febrero_26,@Leon_RojiBlanco,2026-02-16T05:16:35.000Z,2026-02-16T05:16:35+00:00,https://x.com/Leon_RojiBlanco/status/2023265229593776141,Zona de confort? Puta madre arriesguemos la vida para sentirnos importantes mi gente.,0,0,43,0,0,reply_to:https://x.com/rastatlacuache/status/2023180348591603819,True,https://x.com/rastatlacuache/status/2023180348591603819
,semana_10febrero_26_16febrero_26,@FerminIcarus,2026-02-16T05:12:21.000Z,2026-02-16T05:12:21+00:00,https://x.com/FerminIcarus/status/2023264162231566625,"A qué respuesta tan tonta, ojalá y todas las respuestas que insultan tu comprensión de lectura te sirvan para mejorar.",0,0,24,0,0,reply_to:https://x.com/rastatlacuache/status/2023180348591603819,True,https://x.com/rastatlacuache/status/2023180348591603819
,semana_10febrero_26_16febrero_26,@Galicajo,2026-02-16T02:35:10.000Z,2026-02-16T02:35:10+00:00,https://x.com/Galicajo/status/2023224606971015271,"Sólo está preguntando, pinche ridículo.",0,0,15,0,0,reply_to:https://x.com/rastatlacuache/status/2023180348591603819,True,https://x.com/rastatlacuache/status/2023180348591603819
,semana_10febrero_26_16febrero_26,@ob35cne,2026-02-16T04:33:13.000Z,2026-02-16T04:33:13+00:00,https://x.com/ob35cne/status/2023254315578593482,"responde lo que pregunta pedazo de mierda, para que le haces a la mamada",0,0,15,0,0,reply_to:https://x.com/rastatlacuache/status/2023180348591603819,True,https://x.com/rastatlacuache/status/2023180348591603819
,semana_10febrero_26_16febrero_26,@coloraturaaaa,2026-02-16T07:13:14.000Z,2026-02-16T07:13:14+00:00,https://x.com/coloraturaaaa/status/2023294586056270269,Salir de su zona de confort es exponerse a lo que lo maten? Semejante simio hijo de la gran puta unga unga,0,0,12,0,0,reply_to:https://x.com/rastatlacuache/status/2023180348591603819,True,https://x.com/rastatlacuache/status/2023180348591603819
,semana_10febrero_26_16febrero_26,@Saypollito,2026-02-16T05:51:11.000Z,2026-02-16T05:51:11+00:00,https://x.com/Saypollito/status/2023273936453087498,"Tu si saliste re pendejo y vales madres....no se está quejando ni se está burlando, ni menos está negando la situación, solo está preguntando para entender.....",0,0,11,0,0,reply_to:https://x.com/rastatlacuache/status/2023180348591603819,True,https://x.com/rastatlacuache/status/2023180348591603819
,semana_10febrero_26_16febrero_26,@martinvzga,2026-02-16T02:32:36.000Z,2026-02-16T02:32:36+00:00,https://x.com/martinvzga/status/2023223960507121925,"Vete a la verga, Tampico y alrededores si es seguro mamón jajaja",0,0,10,0,0,reply_to:https://x.com/rastatlacuache/status/2023180348591603819,True,https://x.com/rastatlacuache/status/2023180348591603819
,semana_10febrero_26_16febrero_26,@kevinecc3,2026-02-16T02:28:45.000Z,2026-02-16T02:28:45+00:00,https://x.com/kevinecc3/status/2023222990092087403,"ERES UN PUÑETAS, NO LEES O QUE VERG@",0,0,9,0,0,reply_to:https://x.com/rastatlacuache/status/2023180348591603819,True,https://x.com/rastatlacuache/status/2023180348591603819
,semana_10febrero_26_16febrero_26,@diyorca,2026-02-16T05:17:43.000Z,2026-02-16T05:17:43+00:00,https://x.com/diyorca/status/2023265514521268700,sal de tu zona de comfort y regresa a la escuela bro,0,0,7,0,0,reply_to:https://x.com/rastatlacuache/status/2023180348591603819,True,https://x.com/rastatlacuache/status/2023180348591603819
,semana_10febrero_26_16febrero_26,@Reoneru19,2026-02-16T01:58:29.000Z,2026-02-16T01:58:29+00:00,https://x.com/Reoneru19/status/2023215375739973727,"Yo cuando me enteré lo de Coahuila, Nuevo León y Tamaulipas durante el 2009-2016, si estuvo bien cañón viajar en carretera",1,0,5,0,0,reply_to:https://x.com/rastatlacuache/status/2023180348591603819,True,https://x.com/rastatlacuache/status/2023180348591603819
,semana_10febrero_26_16febrero_26,@LuciHerre,2026-02-16T07:12:02.000Z,2026-02-16T07:12:02+00:00,https://x.com/LuciHerre/status/2023294281272946720,O sea y no vas a responder? Nadamas te querias ver pendejo de a gratis?,0,0,5,0,0,reply_to:https://x.com/rastatlacuache/status/2023180348591603819,True,https://x.com/rastatlacuache/status/2023180348591603819
,semana_10febrero_26_16febrero_26,@cloudarx,2026-02-16T06:27:44.000Z,2026-02-16T06:27:44+00:00,https://x.com/cloudarx/status/2023283133722828805,No digas mmds che resentido... zona de confort la persona esta preguntando porque desconoce el tema no para que un wey que carece de comprensión lectora quiera aleccionarlo,0,0,5,0,0,reply_to:https://x.com/rastatlacuache/status/2023180348591603819,True,https://x.com/rastatlacuache/status/2023180348591603819
