fecha_semana,nombre_semana,author,datetime,datetime_parsed_utc,url,text,replies,retweets,likes,bookmarks,views,query_used,is_reply,in_reply_to_url
,semana_02diciembre_25_08diciembre_25,@55Arguelles,2025-12-02T21:07:07.000Z,2025-12-02T21:07:07+00:00,https://x.com/55Arguelles/status/1995962958934159477,excelente noticia Alcaldesa,0,0,0,0,0,to:MonicaVTampico since:2025-12-02 until:2025-12-08,False,
,semana_02diciembre_25_08diciembre_25,@MonicaVTampico,2025-12-02T20:44:39.000Z,2025-12-02T20:44:39+00:00,https://x.com/MonicaVTampico/status/1995957307000471916,"Agradezco al Gobierno del Estado, al @Dr_AVillarreal y a la Secretaría de Turismo por su respaldo. Este enlace, logrado junto al sector empresarial, OMA y Viva Aerobus, traerá más turismo, inversión, competitividad y bienestar.",2,0,3,0,0,to:MonicaVTampico since:2025-12-02 until:2025-12-08,False,
,semana_02diciembre_25_08diciembre_25,@MonicaVTampico,2025-12-02T20:44:35.000Z,2025-12-02T20:44:35+00:00,https://x.com/MonicaVTampico/status/1995957289346629948,"Reabrimos junto a Viva Aerobus, OMA y el sector empresarial el vuelo Tampico–Villahermosa. Hoy recibimos a los pasajeros del primer vuelo, una ruta que fortalece la conectividad, impulsa la economía y abre nuevas oportunidades para la región.",5,1,4,0,0,reply_to:https://x.com/55Arguelles/status/1995962958934159477,True,https://x.com/55Arguelles/status/1995962958934159477
,semana_02diciembre_25_08diciembre_25,@MonicaVTampico,2025-12-04T20:14:26.000Z,2025-12-04T20:14:26+00:00,https://x.com/MonicaVTampico/status/1996674476709490894,"Iniciamos el Operativo “Navidad Segura: Tampico te Cuida 2025” para que todas y todos disfruten la temporada con tranquilidad. Con 34 dependencias cuidamos la seguridad y el bienestar de familias, comercios y visitantes.",10,1,3,0,0,from:MonicaVTampico since:2025-12-02 until:2025-12-08,False,
,semana_02diciembre_25_08diciembre_25,@TampicoGob,2025-12-04T20:09:14.000Z,2025-12-04T20:09:14+00:00,https://x.com/TampicoGob/status/1996673168409612504,"¡Tampico vive una Navidad que va con todos! Te invitamos a disfrutar en familia las actividades que preparamos para compartir la tradición y la alegría de estas fechas. En #Tampico, la Navidad se celebra en grande y juntos. ¡Te esperamos!",1,0,1,0,0,from:TampicoGob since:2025-12-02 until:2025-12-08,False,
,semana_02diciembre_25_08diciembre_25,@TampicososTV,2025-12-07T23:11:06.000Z,2025-12-07T23:11:06+00:00,https://x.com/TampicososTV/status/1997806099119116321,"Es más importante la @JaibaBrava_TM que el torneo de freestyle. Abre las cuadras alrededor de la presidencia, @MonicaVTampico ! @TampicoGob",0,0,2,0,0,@TampicoGob since:2025-12-02 until:2025-12-08,False,
,semana_02diciembre_25_08diciembre_25,@DobbyRA8,2025-12-07T13:48:56.000Z,2025-12-07T13:48:56+00:00,https://x.com/DobbyRA8/status/1997664626700427423,@gobtam @TampicoGob @ciudadmaderogob @CongresoTams @Mx_Diputados @Hacienda_Mexico @FMF @LigaBBVAMX @LigaBBVAFemenil @LigaBBVAMXCorp @LigaMXExpansion entre todos hagan 1 esfuerzo para remodelar su estadio y q con dicha inversion logre ser 1 de las sedes del Mundial Femenil del 31,0,0,0,0,0,@TampicoGob since:2025-12-02 until:2025-12-08,False,
,semana_02diciembre_25_08diciembre_25,@TampicososTV,2025-12-07T04:10:01.000Z,2025-12-07T04:10:01+00:00,https://x.com/TampicososTV/status/1997518939396706450,"Me informan que desde que @MonicaVTampico llegó al palco le salieron topes innecesarios, está lleno de basura y monte y más oscuro que muchas calles y avenidas de Tampico. @TampicoGob",0,0,27,0,0,@TampicoGob since:2025-12-02 until:2025-12-08,False,
,semana_02diciembre_25_08diciembre_25,@Jaume_Osante,2025-12-07T02:44:29.000Z,2025-12-07T02:44:29+00:00,https://x.com/Jaume_Osante/status/1997497413456551956,"Inclusión que transforma vidas, unidos por una sociedad sin barreras #Tampico #RevistaDebate #nota @DIF_Tampico @TampicoGob",0,0,0,0,0,@TampicoGob since:2025-12-02 until:2025-12-08,False,
,semana_02diciembre_25_08diciembre_25,@Jaume_Osante,2025-12-05T00:52:28.000Z,2025-12-05T00:52:28+00:00,https://x.com/Jaume_Osante/status/1996744446247907578,Lanzan operativo integral por temporada navideña en Tampico Tampico refuerza seguridad esta Navidad para cuidar a todas las familias #Tampico #RevistaDebate #nota @TampicoGob @MonicaVTampico,0,0,0,0,0,@TampicoGob since:2025-12-02 until:2025-12-08,False,
,semana_02diciembre_25_08diciembre_25,@DobbyRA8,2025-12-04T18:03:01.000Z,2025-12-04T18:03:01+00:00,https://x.com/DobbyRA8/status/1996641404928643101,Ojala @gobtam @GobCiudadMadero @TampicoGob @conadeoficial @CongresoTams y no solo remodelación si no también ampliación de capacidad para que la @LigaBBVAMX no se ponga sus moños @jaibabravamx,0,0,0,0,0,@TampicoGob since:2025-12-02 until:2025-12-08,False,
,semana_02diciembre_25_08diciembre_25,@Jaume_Osante,2025-12-04T03:29:32.000Z,2025-12-04T03:29:32+00:00,https://x.com/Jaume_Osante/status/1996421585964507323,Tampico recibe a la ciencia con alegría y talento juvenil #Tampico #RevistaDebate #nota @MonicaVTampico @TampicoGob,0,0,0,0,0,@TampicoGob since:2025-12-02 until:2025-12-08,False,
,semana_02diciembre_25_08diciembre_25,@Jaume_Osante,2025-12-04T03:27:58.000Z,2025-12-04T03:27:58+00:00,https://x.com/Jaume_Osante/status/1996421193893888331,Tampico avanza con mejores servicios y calles más iluminadas #Tampico #RevistaDebate #nota @MonicaVTampico @TampicoGob https:// jaumeosante.com/tamaulipas/tam pico-refuerza-su-infraestructura-con-nuevas-unidades-y-mejor-iluminacion/ …,0,0,0,0,0,@TampicoGob since:2025-12-02 until:2025-12-08,False,
,semana_02diciembre_25_08diciembre_25,@TampicososTV,2025-12-04T01:40:40.000Z,2025-12-04T01:40:40+00:00,https://x.com/TampicososTV/status/1996394189685440682,"Casi 8 de la noche y sin luz las lámparas de los camellones a altura de UNE. De mal en peor, @TampicoGob , @MonicaVTampico .",0,0,4,0,0,@TampicoGob since:2025-12-02 until:2025-12-08,False,
,semana_02diciembre_25_08diciembre_25,@TampicososTV,2025-12-03T23:28:43.000Z,2025-12-03T23:28:43+00:00,https://x.com/TampicososTV/status/1996360984345325613,"Para que sigan las fotos y el atole con el dedo, en unos minutos más @MonicaVTampico presentará unidades nuevas para Servicios Públicos. Anuncian compras de unidades y más compras, pero cero trabajo. Tampico es un cochinero desde hace un año! @TampicoGob",0,1,3,0,0,@TampicoGob since:2025-12-02 until:2025-12-08,False,
,semana_02diciembre_25_08diciembre_25,@Jaume_Osante,2025-12-03T02:48:33.000Z,2025-12-03T02:48:33+00:00,https://x.com/Jaume_Osante/status/1996048882548240590,Tampico revive su historia con la restauración de la Antigua Aduana #Tampico #RevistaDebate #nota @TampicoGob,0,0,0,0,0,@TampicoGob since:2025-12-02 until:2025-12-08,False,
,semana_02diciembre_25_08diciembre_25,@Jaume_Osante,2025-12-03T02:47:21.000Z,2025-12-03T02:47:21+00:00,https://x.com/Jaume_Osante/status/1996048583892627497,Tampico–Villahermosa impulsa turismo y negocios regionales #Tampico #RevistaDebate #nota @TampicoGob,0,0,0,0,0,@TampicoGob since:2025-12-02 until:2025-12-08,False,
,semana_02diciembre_25_08diciembre_25,@Jaume_Osante,2025-12-02T03:18:06.000Z,2025-12-02T03:18:06+00:00,https://x.com/Jaume_Osante/status/1995693931254915309,Bazar Navideño con Causa del DIF Tampico ayudará a quienes más lo necesitan #Tampico #RevistaDebate #nota @DIF_Tampico @TampicoGob https:// jaumeosante.com/tamaulipas/dif -tampico-anuncia-primer-gran-bazar-navideno-con-causa/ …,0,0,0,0,0,@TampicoGob since:2025-12-02 until:2025-12-08,False,
,semana_02diciembre_25_08diciembre_25,@Jaume_Osante,2025-12-02T03:13:18.000Z,2025-12-02T03:13:18+00:00,https://x.com/Jaume_Osante/status/1995692725937852773,Tampico impulsa bienestar emocional en secundarias con nueva etapa educativa #Tampico #RevistaDebate #nota @TampicoGob,0,0,0,0,0,@TampicoGob since:2025-12-02 until:2025-12-08,False,
,semana_02diciembre_25_08diciembre_25,@record_mexico,2025-12-07T03:11:50.000Z,2025-12-07T03:11:50+00:00,https://x.com/record_mexico/status/1997504293323379188,¡GRÍTALO! La Jaiba Brava es el nuevo campeón de Liga de Expansión. Enhorabuena.,15,95,838,0,0,reply_to:https://x.com/DobbyRA8/status/1997664626700427423,True,https://x.com/DobbyRA8/status/1997664626700427423
,semana_02diciembre_25_08diciembre_25,@MXESTADIOS,2025-12-04T16:39:36.000Z,2025-12-04T16:39:36+00:00,https://x.com/MXESTADIOS/status/1996620411115917707,Cómo ven? Propuesta para remodelar el Estadio Tamaulipas. No oficial aún.,26,32,790,0,0,reply_to:https://x.com/DobbyRA8/status/1996641404928643101,True,https://x.com/DobbyRA8/status/1996641404928643101
,semana_02diciembre_25_08diciembre_25,@hernnd51498,2025-12-07T07:05:48.000Z,2025-12-07T07:05:48+00:00,https://x.com/hernnd51498/status/1997563175429095671,Queremos Estadio Estimadas... Alxaldesa y Senadora @PartidoMorenaMx,0,0,1,0,0,@MonicaVTampico since:2025-12-02 until:2025-12-08,False,
,semana_02diciembre_25_08diciembre_25,@hernnd51498,2025-12-04T20:40:40.000Z,2025-12-04T20:40:40+00:00,https://x.com/hernnd51498/status/1996681079428915547,@MonicaVTampico @erasmoglz @olgapsosa Consagrense Apoyen!!!!,0,0,0,0,0,@MonicaVTampico since:2025-12-02 until:2025-12-08,False,
,semana_02diciembre_25_08diciembre_25,@AnaC8291079432,2025-12-02T21:12:16.000Z,2025-12-02T21:12:16+00:00,https://x.com/AnaC8291079432/status/1995964255624200566,Dónde quedaron las palabras de @lopezobrador_ “primero los pobres”? El @CongresoTams le autorizará cobrar nuevos impuestos a @MonicaVTampico y @erasmoglz que afectaran gravemente a las familias. https:// expreso.press/2025/12/02/fre naran-cobros-municipales-que-esten-fuera-de-la-ley/?fbclid=IwZnRzaAOcNFZleHRuA2FlbQIxMQBzcnRjBmFwcF9pZAo2NjI4NTY4Mzc5AAEe88Ssr9wp-EPZAmPGW7HGvAqKJamwtM_w7LUABpDZH99hYhxfLKfIz6sYQcA_aem_QgdthM9ErH0xCWX3dyJJmA … @Dr_AVillarreal @Claudiashein @Betoprietoh @GobiernoMX,0,0,0,0,0,@MonicaVTampico since:2025-12-02 until:2025-12-08,False,
,semana_02diciembre_25_08diciembre_25,@JuanPizanaMtz,2025-12-02T18:39:23.000Z,2025-12-02T18:39:23+00:00,https://x.com/JuanPizanaMtz/status/1995925781768192338,y presidenta @MonicaVTampico seguimos fortaleciendo las acciones que mejoran la calidad de vida de nuestra gente. Tampico va con todos. #JuntosPodemos #Tampico #Tamaulipas,0,0,0,0,0,@MonicaVTampico since:2025-12-02 until:2025-12-08,False,
,semana_02diciembre_25_08diciembre_25,@JuanPizanaMtz,2025-12-02T18:39:21.000Z,2025-12-02T18:39:21+00:00,https://x.com/JuanPizanaMtz/status/1995925773665140784,"Se llevó a cabo la Sesión de la Comisión de Bienestar, donde se presentaron los avances y los nuevos programas sociales, entre ellos Cuidado Casa por Casa, iniciativa que ya está beneficiando a numerosas familias tampiqueñas. Gracias al impulso y liderazgo de nuestra compañera",1,0,0,0,0,reply_to:https://x.com/JuanPizanaMtz/status/1995925781768192338,True,https://x.com/JuanPizanaMtz/status/1995925781768192338
,semana_02diciembre_25_08diciembre_25,@LindaPriro97266,2025-12-07T04:20:50.000Z,2025-12-07T04:20:50+00:00,https://x.com/LindaPriro97266/status/1997521659708981325,"Hoy me querían secuestrar ya que estos narcos vecinos mandan video que voy de salida, Tampico esta horrible y Mónica Villarreal niega todo, guardia estatal y fiscalia se hacen que no pasa nada, secuestros, robos, daños a propiedad, amenazas, tapan la cochera con vehículo",0,0,0,0,0,"""monica villarreal"" since:2025-12-02 until:2025-12-08",False,
,semana_02diciembre_25_08diciembre_25,@LindaPriro97266,2025-12-07T04:04:32.000Z,2025-12-07T04:04:32+00:00,https://x.com/LindaPriro97266/status/1997517558136910294,"Estos son los destrozos que ocasionó el narco Javier Santillan García calle D 103 col.Fdo.San Pedro Tampico macheteo el brazo de su árbol gigante de aguacate que me tienen dentro de mi patio trasero lo sabe Mónica Villarreal, guardia estatal, fiscalia y no hacen nada",0,0,1,0,0,"""monica villarreal"" since:2025-12-02 until:2025-12-08",False,
,semana_02diciembre_25_08diciembre_25,@LindaPriro97266,2025-12-07T03:59:10.000Z,2025-12-07T03:59:10+00:00,https://x.com/LindaPriro97266/status/1997516207399018753,Este es el narco Javier Santillan calle D 103 col.Fdo.San Pedro Tampico arriba de la cimbra del cuarto qué está construyendo agarrado de mi barda y mi barda de pared de su cuarto y me tiene robado terreno desde 2012 Mónica Villarreal su cómplice y guardia estatal.,0,0,0,0,0,"""monica villarreal"" since:2025-12-02 until:2025-12-08",False,
,semana_02diciembre_25_08diciembre_25,@LindaPriro97266,2025-12-07T03:32:19.000Z,2025-12-07T03:32:19+00:00,https://x.com/LindaPriro97266/status/1997509450924708252,A las 4:13 p.m. tomé esa foto ya que el narco Sebastian Santillan no paraba de amenazar y golpeaba mi barda diciendo que Mónica Villarreal y policias ellos los tienen comprados calle D 103 col.Fdo.San Pedro Tampico,0,0,2,0,0,"""monica villarreal"" since:2025-12-02 until:2025-12-08",False,
,semana_02diciembre_25_08diciembre_25,@outsidermex,2025-12-06T17:06:56.000Z,2025-12-06T17:06:56+00:00,https://x.com/outsidermex/status/1997352066512007398,"Monica Villarreal una de las más corruptas administraciones … contratos a sus familiares, licitaciones a modo… igualito que el PRIAN",0,0,0,0,0,"""monica villarreal"" since:2025-12-02 until:2025-12-08",False,
,semana_02diciembre_25_08diciembre_25,@VaxTamaulipas,2025-12-06T12:48:15.000Z,2025-12-06T12:48:15+00:00,https://x.com/VaxTamaulipas/status/1997286968116265443,"#cdmx,#tampico,#reynosafollow,#cdvictoria «LIGADO a ABOGADO de ZETAS y el MAYO ZAMBADA»: «AMERICO ROMPE con RABAGO el CONTACTO con SAN PEDRO y HOMBRE de TODAS las CONFIANZAS de las MALETAS de CARMONA»…era representante en CDMX e intermediario del CDG con Monica Villarreal.",0,8,10,0,0,"""monica villarreal"" since:2025-12-02 until:2025-12-08",False,
,semana_02diciembre_25_08diciembre_25,@EContre17,2025-12-06T07:21:00.000Z,2025-12-06T07:21:00+00:00,https://x.com/EContre17/status/1997204611266982123,,0,0,0,0,0,"""monica villarreal"" since:2025-12-02 until:2025-12-08",False,
,semana_02diciembre_25_08diciembre_25,@LindaPriro97266,2025-12-06T05:05:41.000Z,2025-12-06T05:05:41+00:00,https://x.com/LindaPriro97266/status/1997170558686085545,"La vieja guardia en alerta página de Facebook, encendido del pino ahí está Mónica Villarreal, esposo. hija y el yerno qué es narco familiar de los Vela y quiere ser presidente de Tampico y viven en San Pedro N.L.",0,0,0,0,0,"""monica villarreal"" since:2025-12-02 until:2025-12-08",False,
,semana_02diciembre_25_08diciembre_25,@EleeseNoticias,2025-12-06T04:17:20.000Z,2025-12-06T04:17:20+00:00,https://x.com/EleeseNoticias/status/1997158390783791589,Mónica Villarreal da inicio a las celebraciones decembrinas con el encendido del Pino Navideño https:// eleese.com.mx/2025/12/05/mon ica-villarreal-da-inicio-a-las-celebraciones-decembrinas-con-el-encendido-del-pino-navideno/ …,0,0,0,0,0,"""monica villarreal"" since:2025-12-02 until:2025-12-08",False,
,semana_02diciembre_25_08diciembre_25,@JuanPizanaMtz,2025-12-06T02:53:28.000Z,2025-12-06T02:53:28+00:00,https://x.com/JuanPizanaMtz/status/1997137285641384106,"Así se vivió el Encendido del Pino en Tampico Las familias del puerto se reunieron para dar la bienvenida a la temporada más bonita del año, acompañadas por la presidenta Mónica Villarreal. Entre luces, juegos, música y mucha alegría, Tampico Va Con Todos. ¡Que",1,0,0,0,0,"""monica villarreal"" since:2025-12-02 until:2025-12-08",False,
,semana_02diciembre_25_08diciembre_25,@larazontampico,2025-12-05T22:17:14.000Z,2025-12-05T22:17:14+00:00,https://x.com/larazontampico/status/1997067768370233653,"En el corazón de #Tampico se instalará un nuevo Centro de Control y Prevención de Diabetes; informó hoy la alcaldesa, Mónica Villarreal Anaya. https:// expreso.press/?p=759947",0,0,0,0,0,"""monica villarreal"" since:2025-12-02 until:2025-12-08",False,
,semana_02diciembre_25_08diciembre_25,@JuanPizanaMtz,2025-12-05T20:49:43.000Z,2025-12-05T20:49:43+00:00,https://x.com/JuanPizanaMtz/status/1997045744881356929,"El día de hoy se llevó acabo la inauguración del CECODIAT en la Col. Solidaridad, Voluntad y Trabajo, donde se dará atención a todos los tampiqueños, que así lo requieran Sin duda la compañera presidenta Mónica Villarreal va con todos #JuntosPodemos #Tampico #Tamaulipas",0,0,0,0,0,"""monica villarreal"" since:2025-12-02 until:2025-12-08",False,
,semana_02diciembre_25_08diciembre_25,@LindaPriro97266,2025-12-05T06:30:37.000Z,2025-12-05T06:30:37+00:00,https://x.com/LindaPriro97266/status/1996829546033877251,Mónica Villarreal y fiscal María Concepción Cornejo Oliver se meten a mi perfil y dicen a la gente es mentira y que no me hagan caso. Mónica sacó muertos y los trituro en su féretro y vendió los espacios y no aviso a familiares y no ha dicho en que gasto ese dinero.,0,0,0,0,0,"""monica villarreal"" since:2025-12-02 until:2025-12-08",False,
,semana_02diciembre_25_08diciembre_25,@LindaPriro97266,2025-12-05T06:27:09.000Z,2025-12-05T06:27:09+00:00,https://x.com/LindaPriro97266/status/1996828673639698587,"El otro hijo de Mónica Villarreal es uno de los 5 que andaban disparando con diabolos y pararon al hospital esto salio en noticias Telediario Tampico, yo lo reconocí en oxxo de bolitam me quisieron atropellar y hicieron maldad, ya se calmaron , Facebook lo quitó.",0,0,0,0,0,"""monica villarreal"" since:2025-12-02 until:2025-12-08",False,
,semana_02diciembre_25_08diciembre_25,@LindaPriro97266,2025-12-05T06:22:22.000Z,2025-12-05T06:22:22+00:00,https://x.com/LindaPriro97266/status/1996827468158861378,"El narco esposo de la hija de Mónica Villarreal que es de Tampico pero viven en San Pedro Garza García Nuevo León también quiere ser presidente de Tampico el es familiar de los narcos Vela de Tampico, Mónica Villarreal ya compró casa en Tampico al igual que la fiscal sicaria.",0,0,0,0,0,"""monica villarreal"" since:2025-12-02 until:2025-12-08",False,
,semana_02diciembre_25_08diciembre_25,@LindaPriro97266,2025-12-05T06:05:51.000Z,2025-12-05T06:05:51+00:00,https://x.com/LindaPriro97266/status/1996823311796654496,El hijo de Mónica Villarreal quiere ser presidente de Tampico el del cártel de profeco Manuel Leal Villarreal hijo del maldito ratero Mario Leal Rodríguez fue jefe de la SET cuando estaba casado con Mónica Villarreal hicieron mucho daño.,4,2,3,0,0,"""monica villarreal"" since:2025-12-02 until:2025-12-08",False,
,semana_02diciembre_25_08diciembre_25,@LindaPriro97266,2025-12-05T06:02:23.000Z,2025-12-05T06:02:23+00:00,https://x.com/LindaPriro97266/status/1996822440069280248,"El hijo de Mónica Villarreal es delegado del cártel profeco en 53 municipios unos de Tamaulipas, Veracruz, Hidalgo, San Luis Potosí y, Manuel Leal Villarreal ya es dueño de trailers, camiones de volteo que trabajan en los 3 municipios .",0,2,3,0,0,"""monica villarreal"" since:2025-12-02 until:2025-12-08",False,
,semana_02diciembre_25_08diciembre_25,@LindaPriro97266,2025-12-05T05:58:06.000Z,2025-12-05T05:58:06+00:00,https://x.com/LindaPriro97266/status/1996821363957579946,"Seguido hay balaceras en el libramiento poniente en Tampico, choques espantosos dicen porque los van correteando, atropellados y muertos porque es muy alta la velocidad que los corretean, hace días se escucho 3 bombazos, robos por donde quiera y Mónica Villarreal y fiscal niegan",0,1,4,0,0,"""monica villarreal"" since:2025-12-02 until:2025-12-08",False,
,semana_02diciembre_25_08diciembre_25,@LindaPriro97266,2025-12-05T03:46:22.000Z,2025-12-05T03:46:22+00:00,https://x.com/LindaPriro97266/status/1996788211515818200,"Tampico esta horrible inseguridad, pero todo lo niegan como acostumbran narco Mónica Villarreal, guardia estatal, fiscal sicaria María Concepción Cornejo Oliver sus cómplices que tienen en cada colonia.",3,1,4,0,0,"""monica villarreal"" since:2025-12-02 until:2025-12-08",False,
,semana_02diciembre_25_08diciembre_25,@elgraficotamps,2025-12-05T01:34:48.000Z,2025-12-05T01:34:48+00:00,https://x.com/elgraficotamps/status/1996755101600411963,Mónica Villarreal reafirma su compromiso con la Educación y los Jóvenes,0,0,0,0,0,"""monica villarreal"" since:2025-12-02 until:2025-12-08",False,
,semana_02diciembre_25_08diciembre_25,@EleeseNoticias,2025-12-05T00:46:34.000Z,2025-12-05T00:46:34+00:00,https://x.com/EleeseNoticias/status/1996742963204882836,"Pone en Marcha Mónica Villarreal Operativo “Navidad Segura, Tampico Te Cuida 2025”. https:// eleese.com.mx/2025/12/04/pon e-en-marcha-monica-villarreal-operativo-navidad-segura-tampico-te-cuida-2025/ …",0,0,0,0,0,"""monica villarreal"" since:2025-12-02 until:2025-12-08",False,
,semana_02diciembre_25_08diciembre_25,@SedenerTam,2025-12-04T22:35:58.000Z,2025-12-04T22:35:58+00:00,https://x.com/SedenerTam/status/1996710093891469433,"El secretario de Desarrollo Energético, @walter_julian , visitó a la presidenta municipal de Tampico, Mónica Villarreal, para platicar sobre las acciones que se realizarán para disminuir la intensidad energética que existe en el sur del estado",1,1,2,0,0,"""monica villarreal"" since:2025-12-02 until:2025-12-08",False,
,semana_02diciembre_25_08diciembre_25,@EleeseNoticias,2025-12-04T21:46:58.000Z,2025-12-04T21:46:58+00:00,https://x.com/EleeseNoticias/status/1996697766114803726,Mónica Villarreal reafirma su compromiso con la Educación y los Jóvenes https:// eleese.com.mx/2025/12/03/mon ica-villarreal-reafirma-su-compromiso-con-la-educacion-y-los-jovenes/ …,0,0,0,0,0,"""monica villarreal"" since:2025-12-02 until:2025-12-08",False,
,semana_02diciembre_25_08diciembre_25,@EleeseNoticias,2025-12-04T21:45:28.000Z,2025-12-04T21:45:28+00:00,https://x.com/EleeseNoticias/status/1996697385108648068,Mónica Villarreal fortalece Servicios Públicos con la entrega de nuevas unidades y equipo de trabajo https:// eleese.com.mx/2025/12/03/mon ica-villarreal-fortalece-servicios-publicos-con-la-entrega-de-nuevas-unidades-y-equipo-de-trabajo/ …,0,0,0,0,0,"""monica villarreal"" since:2025-12-02 until:2025-12-08",False,
,semana_02diciembre_25_08diciembre_25,@portalnt,2025-12-04T03:50:44.000Z,2025-12-04T03:50:44+00:00,https://x.com/portalnt/status/1996426920184193346,Mónica Villarreal reafirma su compromiso con la Educación y los Jóvenes https:// noticiasdetampico.mx/monica-villarr eal-reafirma-su-compromiso-con-la-educacion-y-los-jovenes/ …,0,0,1,0,0,"""monica villarreal"" since:2025-12-02 until:2025-12-08",False,
,semana_02diciembre_25_08diciembre_25,@portalnt,2025-12-04T03:34:17.000Z,2025-12-04T03:34:17+00:00,https://x.com/portalnt/status/1996422781270110287,Mónica Villarreal fortalece Servicios Públicos con la entrega de nuevas unidades y equipo de trabajo https:// noticiasdetampico.mx/monica-villarr eal-fortalece-servicios-publicos-con-la-entrega-de-nuevas-unidades-y-equipo-de-trabajo/ …,0,0,0,0,0,"""monica villarreal"" since:2025-12-02 until:2025-12-08",False,
,semana_02diciembre_25_08diciembre_25,@EContre17,2025-12-04T03:33:46.000Z,2025-12-04T03:33:46+00:00,https://x.com/EContre17/status/1996422653134164437,,0,0,0,0,0,"""monica villarreal"" since:2025-12-02 until:2025-12-08",False,
,semana_02diciembre_25_08diciembre_25,@JuanPizanaMtz,2025-12-04T02:38:27.000Z,2025-12-04T02:38:27+00:00,https://x.com/JuanPizanaMtz/status/1996408730787975527,"La compañera presidenta Mónica Villarreal encabezó la entrega de nuevo equipamiento para fortalecer los servicios públicos y mejorar la infraestructura del municipio. Se entregaron 12 camionetas, 23 desbrozadoras y un minitractor, herramientas que agilizarán las labores de",1,0,1,0,0,"""monica villarreal"" since:2025-12-02 until:2025-12-08",False,
,semana_02diciembre_25_08diciembre_25,@JuanPizanaMtz,2025-12-03T23:34:04.000Z,2025-12-03T23:34:04+00:00,https://x.com/JuanPizanaMtz/status/1996362330490478739,"Esto fue posible gracias a la compañera y presidenta Mónica Villarreal, en beneficio de todas y todos los tampiqueños. Tampico Va Con Todos #JuntosPodemos #Tampico #Tamaulipas",0,0,0,0,0,"""monica villarreal"" since:2025-12-02 until:2025-12-08",False,
,semana_02diciembre_25_08diciembre_25,@JuanPizanaMtz,2025-12-03T21:18:57.000Z,2025-12-03T21:18:57+00:00,https://x.com/JuanPizanaMtz/status/1996328326466851079,presidenta Mónica Villarreal por hacer posible estas celebraciones que unen a nuestras familias. ¡Ven y disfruta la magia navideña!,0,0,0,0,0,"""monica villarreal"" since:2025-12-02 until:2025-12-08",False,
,semana_02diciembre_25_08diciembre_25,@JuanPizanaMtz,2025-12-03T16:54:43.000Z,2025-12-03T16:54:43+00:00,https://x.com/JuanPizanaMtz/status/1996261829899927798,compañera presidenta Mónica Villarreal por hacer posible estas celebraciones que unen a nuestras familias. ¡Ven y disfruta la magia navideña!,0,0,0,0,0,"""monica villarreal"" since:2025-12-02 until:2025-12-08",False,
,semana_02diciembre_25_08diciembre_25,@portalnt,2025-12-03T03:34:59.000Z,2025-12-03T03:34:59+00:00,https://x.com/portalnt/status/1996060568881693062,Mónica Villarreal Anaya refuerza liderazgo regional con la reapertura de la ruta aérea Tampico–Villahermosa. https:// noticiasdetampico.mx/monica-villarr eal-anaya-refuerza-liderazgo-regional-con-la-reapertura-de-la-ruta-aerea-tampico-villahermosa/ …,0,0,0,0,0,"""monica villarreal"" since:2025-12-02 until:2025-12-08",False,
,semana_02diciembre_25_08diciembre_25,@EleeseNoticias,2025-12-03T02:28:53.000Z,2025-12-03T02:28:53+00:00,https://x.com/EleeseNoticias/status/1996043934103962069,Mónica Villarreal Anaya refuerza liderazgo regional con la reapertura de la ruta aérea Tampico–Villahermosa. https:// eleese.com.mx/2025/12/02/mon ica-villarreal-anaya-refuerza-liderazgo-regional-con-la-reapertura-de-la-ruta-aerea-tampico-villahermosa/ …,0,0,0,0,0,"""monica villarreal"" since:2025-12-02 until:2025-12-08",False,
