Query_Str,Post_URL,Author_Name,Author_Web_Page_URL,Author_Handle,Verified_Status,UTC_Time,Ads,Tweet_Content,Post_ID,Tweet_URL,Reply_Count,Repost_Count,Like_Count,View_Count,Bookmark_Count,Tweet_Image_URL,Replying_to,Reply_to_Whom,Reply_to_Whom_URL,Reply_to_Whom_Username,Reply_to_Whom_Handle,Language,Type
(@@TampicoGob OR @@MonicaVTampico) min_replies:0 min_faves:0 min_retweets:0,https://x.com/search?q=(@@TampicoGob OR @@MonicaVTampico) min_replies:0 min_faves:0 min_retweets:0 until:2025-05-29 since:2025-05-28&src=typed_query,David Cancino,https://x.com/davidcancino,davidcancino,True,2025-05-28 18:39:46+00:00,False,Bogotá es mamerta en Chapinero. La gente que muele de verdad quiere Indumil y cemento.,1927796960397824370,https://x.com/davidcancino/status/1927796960397824370,11,68,493,13291,3,,False,,,,,es,Top
(@@TampicoGob OR @@MonicaVTampico) min_replies:0 min_faves:0 min_retweets:0,https://x.com/search?q=(@@TampicoGob OR @@MonicaVTampico) min_replies:0 min_faves:0 min_retweets:0 until:2025-05-29 since:2025-05-28&src=typed_query,Simón Levy,https://x.com/SimonLevyMx,SimonLevyMx,True,2025-05-28 18:45:41+00:00,False,"Carnal Edgar!! ¡Qué chingón leerte, neta! No sabes lo que significa para mí que alguien como tú se acuerde de nuestros tiempos en Tepito, cuando nos veíamos y hacíamos chamba en barrio, calle y sueños que se rifaban diario carnalito. Lorena, su carnal, los artículos pa’l cabello… ¡claro que me acuerdo! Ahí se aprendía más de comercio que en cualquier universidad. Después la vida me puso en otro camino, pero la neta, mi corazón siempre ha sido de estar con la tropa, de correo mayor y del huevito con arroz, de esos pasillos con lonas, regateo y talento que se respira con los valedores. Que me digas que me sigues y que apoyas mis locuras jaja, no sabes cuánto se agradece. Porque uno puede llegar a donde sea, pero si olvida de dónde viene, ya se perdió. Yo sigo siendo el mismo morro ya medio ruco, que caminaba entre bultos, con la mirada al frente y el corazón firme. Gracias por registrarte para el libro camarada, por seguir aprendiendo conmigo, pero sobre todo por recordarme que el barrio no olvida, y yo tampoco. Te mando un fuerte abrazo, con respeto, con gratitud y con emoción. Tomate una cheve por mí! Simón",1927798448356741529,https://x.com/SimonLevyMx/status/1927798448356741529,5,16,265,34521,9,https://pbs.twimg.com/media/GsDqc1AaUAEGZe6.jpg,False,,,,,es,Top
(@@TampicoGob OR @@MonicaVTampico) min_replies:0 min_faves:0 min_retweets:0,https://x.com/search?q=(@@TampicoGob OR @@MonicaVTampico) min_replies:0 min_faves:0 min_retweets:0 until:2025-05-29 since:2025-05-28&src=typed_query,Nazly Escalona 🇻🇪,https://x.com/nazlyescalona,nazlyescalona,True,2025-05-28 18:59:35+00:00,False,"A @TomasGuanipa le regalaron un curul el domingo y hoy Diosdado lo presenta como “fugado” en su estructura inventada de conspiradores. Tomás coordinado con María Corina… más irreal, imposible.",1927801944287973381,https://x.com/nazlyescalona/status/1927801944287973381,23,181,282,17229,19,https://pbs.twimg.com/media/GsDtpdiX0AAd-91.jpg,False,,,,,es,Top
(@@TampicoGob OR @@MonicaVTampico) min_replies:0 min_faves:0 min_retweets:0,https://x.com/search?q=(@@TampicoGob OR @@MonicaVTampico) min_replies:0 min_faves:0 min_retweets:0 until:2025-05-29 since:2025-05-28&src=typed_query,𝑻𝑨𝑴𝑨𝑹𝑨,https://x.com/TamaraCruz14,TamaraCruz14,False,2025-05-28 19:37:47+00:00,False,Y en la Meriendita de Hoy imitaremos a 👇🏼☕️🍪☕️🍪☕️🍪,1927811560149340616,https://x.com/TamaraCruz14/status/1927811560149340616,8,29,259,12770,11,https://pbs.twimg.com/media/GsD2ZaXWkAAzG7I.jpg,False,,,,,es,Top
(@@TampicoGob OR @@MonicaVTampico) min_replies:0 min_faves:0 min_retweets:0,https://x.com/search?q=(@@TampicoGob OR @@MonicaVTampico) min_replies:0 min_faves:0 min_retweets:0 until:2025-05-29 since:2025-05-28&src=typed_query,Marina Rosenberg,https://x.com/_MarinaRos,_MarinaRos,True,2025-05-28 19:44:56+00:00,False,"Acompañamos a la @comjudiachile en su llamado. En tiempos complejos, la vía del diálogo, la cooperación internacional y el respeto mutuo debe prevalecer. Instamos al gobierno chileno a fortalecer los vínculos y no cerrarlos 🇨🇱🤝🇮🇱",1927813359660941507,https://x.com/_MarinaRos/status/1927813359660941507,0,136,322,6325,6,,False,,,,,es,Top
(@@TampicoGob OR @@MonicaVTampico) min_replies:0 min_faves:0 min_retweets:0,https://x.com/search?q=(@@TampicoGob OR @@MonicaVTampico) min_replies:0 min_faves:0 min_retweets:0 until:2025-05-29 since:2025-05-28&src=typed_query,Mónica Benavent,https://x.com/monicabenaventv,monicabenaventv,False,2025-05-28 19:49:37+00:00,False,"Abuelo, hoy tu equipo ha hecho algo muy bonito. Faltabas tú. 🥹 Gracias por tanto.",1927814537870299378,https://x.com/monicabenaventv/status/1927814537870299378,4,11,245,10644,3,,False,,,,,es,Top
(@@TampicoGob OR @@MonicaVTampico) min_replies:0 min_faves:0 min_retweets:0,https://x.com/search?q=(@@TampicoGob OR @@MonicaVTampico) min_replies:0 min_faves:0 min_retweets:0 until:2025-05-29 since:2025-05-28&src=typed_query,🍃🌷ƬαƝα🌷🍃,https://x.com/Tana_Pato,Tana_Pato,False,2025-05-28 19:56:50+00:00,False,⚘️🍃 Happy Hump Day ⚘️🍃 💋💋💋💋,1927816355564142652,https://x.com/Tana_Pato/status/1927816355564142652,120,198,5728,84735,157,https://pbs.twimg.com/media/GsD6wkqXEAAh_k8.jpg,False,,,,,en,Top
(@@TampicoGob OR @@MonicaVTampico) min_replies:0 min_faves:0 min_retweets:0,https://x.com/search?q=(@@TampicoGob OR @@MonicaVTampico) min_replies:0 min_faves:0 min_retweets:0 until:2025-05-29 since:2025-05-28&src=typed_query,EVTV,https://x.com/EVTVMiami,EVTVMiami,True,2025-05-28 20:27:24+00:00,False,"#LaEntrevista | ENTREVISTA ESPECIAL CON MARÍA CORINA MACHADO 🇻🇪 . No te puedes perder a Miguel Ángel Rodríguez (@MiguelContigo), quien estará conversando con la vicepresidenta del gobierno electo de Venezuela @MariaCorinaYA en una entrevista especial. 📅 Miércoles #28Mayo ⏰ 7:00 PM - 9:00 PM . 🇺🇸Florida Comcast 1090 🇨🇴Colombia HD Multiplay canal 90 🇵🇦Panamá Tigo canal 439 🇵🇪Perú TelecableSmart, Internet Smart Perú, EmserTel - 🔌Conéctate a nuestra señal EN VIVO en📶 http://evtv.online 💻y descarga nuestra app 📲 EVTV Plus",1927824047200719302,https://x.com/EVTVMiami/status/1927824047200719302,17,270,509,9988,7,https://pbs.twimg.com/amplify_video_thumb/1927823860235198464/img/JFig39URdZYx5Epd.jpg,False,,,,,es,Top
(@@TampicoGob OR @@MonicaVTampico) min_replies:0 min_faves:0 min_retweets:0,https://x.com/search?q=(@@TampicoGob OR @@MonicaVTampico) min_replies:0 min_faves:0 min_retweets:0 until:2025-05-29 since:2025-05-28&src=typed_query,Marimar Fernández G.P.🇲🇽🇪🇸🇺🇦,https://x.com/Marimarfgp,Marimarfgp,True,2025-05-28 21:08:04+00:00,False,"@Juan_OrtizMX Prestarse para hacerle un fraude a la Constitución, otorgando una sobrerrepresentacion, no es solo un acto antidemocrático, fue una conspiración antipatriótica. Esta traidora vende Patria no tiene derecho a criticar a quienes no convalidamos la destrucción de la república.",1927834279507087517,https://x.com/Marimarfgp/status/1927834279507087517,5,84,326,1921,3,,True,Juan_OrtizMX,https://x.com/Juan_OrtizMX,Juan Ortiz 🗳️👁‍🗨,Juan_OrtizMX,es,Top
(@@TampicoGob OR @@MonicaVTampico) min_replies:0 min_faves:0 min_retweets:0,https://x.com/search?q=(@@TampicoGob OR @@MonicaVTampico) min_replies:0 min_faves:0 min_retweets:0 until:2025-05-29 since:2025-05-28&src=typed_query,Simpsonito,https://x.com/SoySimpsonito,SoySimpsonito,True,2025-05-28 21:25:15+00:00,False,- 🎶 ¡Pum-kachichin-kachichica-pu-pum! Yo soy Layda Sansores y te vengo a invitar // A que este domingo salgas a votar // Nuestros candidatos ya están seleccionados y somos campeones en acarreados 🫳🎤 🎶,1927838604476174644,https://x.com/SoySimpsonito/status/1927838604476174644,19,62,465,13681,29,https://pbs.twimg.com/amplify_video_thumb/1927838515909275648/img/peH8TVGOOZWV6S7P.jpg;https://pbs.twimg.com/media/GsEO6oOXEAAy6EA.jpg,False,,,,,es,Top
(@@TampicoGob OR @@MonicaVTampico) min_replies:0 min_faves:0 min_retweets:0,https://x.com/search?q=(@@TampicoGob OR @@MonicaVTampico) min_replies:0 min_faves:0 min_retweets:0 until:2025-05-29 since:2025-05-28&src=typed_query,El Ranchero Loco,https://x.com/EIRancheroLoco,EIRancheroLoco,False,2025-05-28 21:33:25+00:00,False,No había visto a Alana vestida de monjita. 😍,1927840660377190553,https://x.com/EIRancheroLoco/status/1927840660377190553,6,6,326,33155,61,https://pbs.twimg.com/media/GsEQ3TVWgAA69Tk.jpg,False,,,,,es,Top
(@@TampicoGob OR @@MonicaVTampico) min_replies:0 min_faves:0 min_retweets:0,https://x.com/search?q=(@@TampicoGob OR @@MonicaVTampico) min_replies:0 min_faves:0 min_retweets:0 until:2025-05-29 since:2025-05-28&src=typed_query,Mauricio Tabe Echartea,https://x.com/mauriciotabe,mauriciotabe,True,2025-05-28 21:34:10+00:00,False,"¡Ya arrancamos con la reiluminación de Polanco!📍 Hace unas semanas anunciamos la colocación de nuevas luminarias y estamos cumpliendo, porque con #MHReiluminado💡 vamos a hacer de nuestras calles y parques espacios más iluminados, seguros y caminables para todos. Además, estos trabajos se realizan con recursos de mitigación por obras que se realizan en la zona.",1927840849360204155,https://x.com/mauriciotabe/status/1927840849360204155,22,332,389,15303,1,https://pbs.twimg.com/amplify_video_thumb/1927836096190177280/img/_i8y0XCntjVHm2pB.jpg,False,,,,,es,Top
(@@TampicoGob OR @@MonicaVTampico) min_replies:0 min_faves:0 min_retweets:0,https://x.com/search?q=(@@TampicoGob OR @@MonicaVTampico) min_replies:0 min_faves:0 min_retweets:0 until:2025-05-29 since:2025-05-28&src=typed_query,El Financiero,https://x.com/ElFinanciero_Mx,ElFinanciero_Mx,True,2025-05-28 21:35:00+00:00,False,"Mónica Soto, presidenta del TEPJF, dijo que ya no es momento de discutir sobre la elección judicial, sino participar el próximo domingo y ejercer el derecho a voto. https://www.elfinanciero.com.mx/nacional/eleccion-judicial/2025/05/28/eleccion-judicial-monica-soto-presidenta-tepjf-critica-a-quienes-llaman-a-no-votar/",1927841057909395893,https://x.com/ElFinanciero_Mx/status/1927841057909395893,754,126,245,33200,11,https://pbs.twimg.com/media/GsEOiQ_WAAADrU_.jpg,False,,,,,es,Top
(@@TampicoGob OR @@MonicaVTampico) min_replies:0 min_faves:0 min_retweets:0,https://x.com/search?q=(@@TampicoGob OR @@MonicaVTampico) min_replies:0 min_faves:0 min_retweets:0 until:2025-05-29 since:2025-05-28&src=typed_query,monica,https://x.com/mernesmiko,mernesmiko,False,2025-05-28 21:35:30+00:00,False,cómo me va a chocar la manita🤏🏻😭 la quiero tanto💖💖💖,1927841185613189154,https://x.com/mernesmiko/status/1927841185613189154,4,15,334,2172,35,https://pbs.twimg.com/amplify_video_thumb/1927841167527329792/img/iMb0ZZPjEU4oRzg1.jpg,False,,,,,es,Top
(@@TampicoGob OR @@MonicaVTampico) min_replies:0 min_faves:0 min_retweets:0,https://x.com/search?q=(@@TampicoGob OR @@MonicaVTampico) min_replies:0 min_faves:0 min_retweets:0 until:2025-05-29 since:2025-05-28&src=typed_query,"DRA. MERCEDES PAVON ""SUPERMUELITA FIFÍ""",https://x.com/GARCIPAVON,GARCIPAVON,True,2025-05-28 21:46:51+00:00,False,"No sra. no se confunda, estaremos disfrutando conviviendo en familia, desde casita con carnita asada, cervecita, etc... y no perdiendo el tiempo en esta farsa simulada de ""votación"". No se enoje, le hace daño, no le vaya a dar un inf@rto, de por si, le dio el viej@zo muy rápido, desde que apoya a los morenarcos 🥹",1927844038981349526,https://x.com/GARCIPAVON/status/1927844038981349526,51,154,735,25719,1,,True,sabinaberman,https://x.com/sabinaberman,Sabina Berman,sabinaberman,es,Top
(@@TampicoGob OR @@MonicaVTampico) min_replies:0 min_faves:0 min_retweets:0,https://x.com/search?q=(@@TampicoGob OR @@MonicaVTampico) min_replies:0 min_faves:0 min_retweets:0 until:2025-05-29 since:2025-05-28&src=typed_query,Cyndy M. 👊🏼🎯,https://x.com/M2Cyndy,M2Cyndy,True,2025-05-28 21:47:48+00:00,False,"@Juan_OrtizMX Esa traidora no merece ni ser escuchada, es una vendida servil, que voten los farsantes y los crédulos.",1927844278895575512,https://x.com/M2Cyndy/status/1927844278895575512,8,118,520,2466,2,,True,Juan_OrtizMX,https://x.com/Juan_OrtizMX,Juan Ortiz 🗳️👁‍🗨,Juan_OrtizMX,es,Top
(@@TampicoGob OR @@MonicaVTampico) min_replies:0 min_faves:0 min_retweets:0,https://x.com/search?q=(@@TampicoGob OR @@MonicaVTampico) min_replies:0 min_faves:0 min_retweets:0 until:2025-05-29 since:2025-05-28&src=typed_query,La Catrina Norteña,https://x.com/catrina_nortena,catrina_nortena,True,2025-05-28 21:59:06+00:00,False,"#TodosAVotar 🚨 DESPEDAZA LA PRESIDENTA del @TEPJF_informa, Monica Soto, a Salinas Pliego, @ChapoyPati, @RicardoAnayaC y a toda la fachiza que hace un Boicot para No Votar ""Hacer un llamado a no ejercer un derecho fundamental como el de votar, NO es Democrático por más que se busquen argumentos para sostenerlo"". Mónica Soto me representa...",1927847122642108499,https://x.com/catrina_nortena/status/1927847122642108499,48,1497,2610,31016,56,https://pbs.twimg.com/ext_tw_video_thumb/1927845110743498752/pu/img/rBQpjzf-VDE_0n1M.jpg,False,,,,,es,Top
(@@TampicoGob OR @@MonicaVTampico) min_replies:0 min_faves:0 min_retweets:0,https://x.com/search?q=(@@TampicoGob OR @@MonicaVTampico) min_replies:0 min_faves:0 min_retweets:0 until:2025-05-29 since:2025-05-28&src=typed_query,Alejandra,https://x.com/Notiparaco,Notiparaco,True,2025-05-28 22:00:13+00:00,False,@AngelicaLozanoC Resentida ¿entonces fue suya? ¿Usted cree que somos estúpidos y no sabemos que usted ayudó a hundirla para que la pasaran a su comision y machetearla para luego aprobarla y parecer así como la heroina? Usted es una verguenza para el pueblo trabajador y para la mujeres.,1927847402733469885,https://x.com/Notiparaco/status/1927847402733469885,14,327,1080,5589,0,,True,AngelicaLozanoC,https://x.com/AngelicaLozanoC,Angélica Lozano Correa,AngelicaLozanoC,es,Top
(@@TampicoGob OR @@MonicaVTampico) min_replies:0 min_faves:0 min_retweets:0,https://x.com/search?q=(@@TampicoGob OR @@MonicaVTampico) min_replies:0 min_faves:0 min_retweets:0 until:2025-05-29 since:2025-05-28&src=typed_query,Fuerza Informativa Azteca,https://x.com/AztecaNoticias,AztecaNoticias,True,2025-05-28 22:04:18+00:00,False,"""En ese jodido México estamos sobreviviendo"" Jonathan desapareció en junio de 2023 en Berriozábal, #Chiapas; su familia acudió a la Fiscalía estatal, quienes en lugar de hacer su trabajo, pidieron 30 tamales para una 'pronta investigación'. Pero la historia no terminó ahí. Todavía pidieron dinero para la gasolina y el joven fue encontrado sin vida. Una #OpiniónFIA de @roberto_ruizg",1927848433122959852,https://x.com/AztecaNoticias/status/1927848433122959852,33,782,1436,47015,47,https://pbs.twimg.com/amplify_video_thumb/1927848253158035456/img/S1Z2N1sr4Q4Y1DZs.jpg,False,,,,,es,Top
(@@TampicoGob OR @@MonicaVTampico) min_replies:0 min_faves:0 min_retweets:0,https://x.com/search?q=(@@TampicoGob OR @@MonicaVTampico) min_replies:0 min_faves:0 min_retweets:0 until:2025-05-29 since:2025-05-28&src=typed_query,Juncal Solano,https://x.com/juncalssolano,juncalssolano,True,2025-05-28 22:14:22+00:00,False,"MÓNICA SOTO LO DEJA CLARO La Presidenta del @TEPJF_informa dijo que ya quedó atrás la discusión sobre sí la #EleccionJudicial era necesaria o no, ya es CONSTITUCIÓN. Ya no es tema de debate, es una REALIDAD en México por lo que la gente debe informarse y participar. ¿Oyeron @AztecaNoticias @AccionNacional ?",1927850965492765061,https://x.com/juncalssolano/status/1927850965492765061,90,694,1318,15871,22,https://pbs.twimg.com/amplify_video_thumb/1927850344618303488/img/H7v6JCHZHj2-O_Ex.jpg,False,,,,,es,Top
(@@TampicoGob OR @@MonicaVTampico) min_replies:0 min_faves:0 min_retweets:0,https://x.com/search?q=(@@TampicoGob OR @@MonicaVTampico) min_replies:0 min_faves:0 min_retweets:0 until:2025-05-29 since:2025-05-28&src=typed_query,Dany Santoyo,https://x.com/danysantoyo_,danysantoyo_,True,2025-05-28 22:16:07+00:00,False,"La Presidenta del TEPJF, Mónica Soto, se lo deja bien claro a Ricardo Salinas Pliego, Tv Azteca, al PRIAN y a todos aquellos que llaman al boicot de la #ElecciónJudicial. YA ES UNA REALIDAD CONSTITUCIONAL en México, ya no es tema de debate, punto.",1927851407626956996,https://x.com/danysantoyo_/status/1927851407626956996,104,731,1188,50634,33,https://pbs.twimg.com/amplify_video_thumb/1927850344618303488/img/H7v6JCHZHj2-O_Ex.jpg,False,,,,,es,Top
(@@TampicoGob OR @@MonicaVTampico) min_replies:0 min_faves:0 min_retweets:0,https://x.com/search?q=(@@TampicoGob OR @@MonicaVTampico) min_replies:0 min_faves:0 min_retweets:0 until:2025-05-29 since:2025-05-28&src=typed_query,MonotribuCristo.,https://x.com/monotribucristo,monotribucristo,True,2025-05-28 22:31:22+00:00,False,JJJAJJAAA JAJAJAJA JAJAJAJA JAJAJAJA JAJAJAJA JAJAJAJA JAJAJAJA JAJAJAJA JAJAJAJA JAJAJAJA JAJAJAJA JAJAJAJA JAJAJAJA JAJAJAJA JAJAJAJA JAJAJAJA JAJAJAJA JAJAJAJA JAJAJAJA JAJAJAJA JAJAJAJA JAJAJAJA JAJAJAJA JAJAJAJA JAJAJAJA JAJAJAJA JAJAJAJA JAJAJAJA,1927855241719935415,https://x.com/monotribucristo/status/1927855241719935415,5,108,324,11415,28,https://pbs.twimg.com/amplify_video_thumb/1927844278518038528/img/OuXTv2kqJmsaOUWD.jpg,False,,,,,es,Top
(@@TampicoGob OR @@MonicaVTampico) min_replies:0 min_faves:0 min_retweets:0,https://x.com/search?q=(@@TampicoGob OR @@MonicaVTampico) min_replies:0 min_faves:0 min_retweets:0 until:2025-05-29 since:2025-05-28&src=typed_query,Evelyn Salgado Pineda,https://x.com/EvelynSalgadoP,EvelynSalgadoP,True,2025-05-28 22:39:55+00:00,False,"Seguimos trabajando con el corazón por un Guerrero más justo y solidario. 🫶🏻 En #Chilpancingo, junto a la presidenta honoraria del @DIF_Gro, @LizSalgadoP_, realizamos la entrega mensual de 454 aparatos ortopédicos funcionales a igual número de beneficiarios de la región Acapulco y Costa Chica🦽🤝, respondiendo a necesidades reales y fortaleciendo la inclusión social a través de este noble programa.🫂 (1/2)",1927857395419730249,https://x.com/EvelynSalgadoP/status/1927857395419730249,413,14,362,1676,2,https://pbs.twimg.com/media/GsEgEfqWwAAgW8Y.jpg;https://pbs.twimg.com/media/GsEgEfwWwAA9G3S.jpg;https://pbs.twimg.com/media/GsEgEgBWkAAhYco.jpg;https://pbs.twimg.com/media/GsEgEfwW4AAL4Eq.jpg,False,,,,,es,Top
(@@TampicoGob OR @@MonicaVTampico) min_replies:0 min_faves:0 min_retweets:0,https://x.com/search?q=(@@TampicoGob OR @@MonicaVTampico) min_replies:0 min_faves:0 min_retweets:0 until:2025-05-29 since:2025-05-28&src=typed_query,Diego Ordóñez🇪🇨,https://x.com/diegoordonezg,diegoordonezg,False,2025-05-28 22:48:27+00:00,False,"Recuerdo la foto: fuera de Teleamazonas, gritábamos contra el intento de clausura. La de camiseta con la palabra “Libertad” es M Holguin. Luego le ofrecieron un puesto en Gamavisión, y se hizo fanática correista. Así, hasta que ahora se cambió de bando con jugoso cargo.",1927859542643143109,https://x.com/diegoordonezg/status/1927859542643143109,41,195,242,7021,2,,False,,,,,es,Top
(@@TampicoGob OR @@MonicaVTampico) min_replies:0 min_faves:0 min_retweets:0,https://x.com/search?q=(@@TampicoGob OR @@MonicaVTampico) min_replies:0 min_faves:0 min_retweets:0 until:2025-05-29 since:2025-05-28&src=typed_query,REFUGIO El Montecito De los Canichones,https://x.com/canichones,canichones,True,2025-05-28 22:51:01+00:00,False,HOLAAAAA TRIBUUUUUU CANICHONA - La Colecta solidaria del MORFI viene de ORO !!! YA TENEMOS DONADOS $8 millones de pesos !!! Si 5Mil personas Más nos DONAN $2000 lo remil logramos !! (Y nos sobra plata) Queres ser parte de esta CRUZADA DEL AMOR como hacemos todos los meses para que estos vagos tengan la panzota llena y chochos !!? Acá te dejo TODAS NUESTRAS CUENTAS Y ALIAS - BANCO SANTANDER - Alias: CUERDA.ABEDUL.PASTO - MERCADO PAGO - Alias: REFUGIO.EL.MONTECITO - PayPal - Alias @CANICHONES76 Muchísimas Gracias Chicos por ayudarnos siempre !! Los queremos Fuerte !! ❤️🐶🐶🐶❤️ @canichones,1927860189568340046,https://x.com/canichones/status/1927860189568340046,9,181,331,11044,3,https://pbs.twimg.com/amplify_video_thumb/1927859466587815936/img/5bpV0jC4_wmr7Tnk.jpg,False,,,,,es,Top
(@@TampicoGob OR @@MonicaVTampico) min_replies:0 min_faves:0 min_retweets:0,https://x.com/search?q=(@@TampicoGob OR @@MonicaVTampico) min_replies:0 min_faves:0 min_retweets:0 until:2025-05-29 since:2025-05-28&src=typed_query,MiguelÁngelRodríguez,https://x.com/MiguelContigo,MiguelContigo,True,2025-05-28 23:17:06+00:00,False,#27May 🔵 ESTAMOS EN VIVO: ENTREVISTA ESPECIAL CON MARÍA CORINA MACHADO 🇻🇪 @MariaCorinaYA por @EVTVMiami,1927866752332963973,https://x.com/MiguelContigo/status/1927866752332963973,15,151,373,16116,3,https://pbs.twimg.com/media/GsEokvbaUAE78z1.jpg,False,,,,,es,Top
(@@TampicoGob OR @@MonicaVTampico) min_replies:0 min_faves:0 min_retweets:0,https://x.com/search?q=(@@TampicoGob OR @@MonicaVTampico) min_replies:0 min_faves:0 min_retweets:0 until:2025-05-29 since:2025-05-28&src=typed_query,🇻🇪 * M * U * R * A * T * A *,https://x.com/MurataVEN,MurataVEN,False,2025-05-28 23:24:32+00:00,False,"DIOS OBRA EN CADA UNO DE NOSOTROS. 🇻🇪 Somos una generación que vivió en carne propia el lado más oscuro del mal, por eso HOY EL BIEN SE UNE para derrotarlo. Junto a María Corina TODOS somos guerreros templarios dentro y fuera de Venezuela UNIDOS contigo de la mano de Dios.",1927868622799519847,https://x.com/MurataVEN/status/1927868622799519847,37,901,2646,38191,41,https://pbs.twimg.com/amplify_video_thumb/1927866064970412032/img/l0dxiM3WQ5j8rMMJ.jpg,False,,,,,es,Top
(@@TampicoGob OR @@MonicaVTampico) min_replies:0 min_faves:0 min_retweets:0,https://x.com/search?q=(@@TampicoGob OR @@MonicaVTampico) min_replies:0 min_faves:0 min_retweets:0 until:2025-05-29 since:2025-05-28&src=typed_query,Puro Frijol,https://x.com/oco_motora,oco_motora,False,2025-05-28 23:24:57+00:00,False,"Personal de la administración central del usurpador Mazariegos, Guadalupe Miranda alias LupitaMichi https://x.com/oco_motora/status/1927796906895302836?t=NK5bflTgB3GVRhvhtQrZdg&s=19",1927868729766932684,https://x.com/oco_motora/status/1927868729766932684,22,413,693,74117,23,https://pbs.twimg.com/media/GsEqZK-WsAE_CMM.jpg;https://pbs.twimg.com/media/GsEqZL-WQAAx4Gd.jpg;https://pbs.twimg.com/media/GsEqZL_XAAAoBBm.jpg,False,,,,,es,Top
(@@TampicoGob OR @@MonicaVTampico) min_replies:0 min_faves:0 min_retweets:0,https://x.com/search?q=(@@TampicoGob OR @@MonicaVTampico) min_replies:0 min_faves:0 min_retweets:0 until:2025-05-29 since:2025-05-28&src=typed_query,Mónica🌻⁰⁶⁸,https://x.com/monicaaasc__,monicaaasc__,False,2025-05-28 23:47:46+00:00,False,Awww😍 un juanesnutriaquilador y un labubuquilador❤️🖤,1927874471265780120,https://x.com/monicaaasc__/status/1927874471265780120,0,26,419,4613,9,https://pbs.twimg.com/media/GsEvnT9WsAA_W2V.jpg;https://pbs.twimg.com/media/GsEvnT7WgAAYM2n.jpg,False,,,,,es,Top
(@@TampicoGob OR @@MonicaVTampico) min_replies:0 min_faves:0 min_retweets:0,https://x.com/search?q=(@@TampicoGob OR @@MonicaVTampico) min_replies:0 min_faves:0 min_retweets:0 until:2025-05-30 since:2025-05-29&src=typed_query,NDL Noticias,https://x.com/ndl_noticias,ndl_noticias,True,2025-05-29 01:38:42+00:00,False,"Por Fuerte Ola de Calor en Tampico, Ordena Alcaldesa Mónica Villarreal Instalar 5 módulos de Hidratación https://ndlnoticias.com/2025/05/por-fuerte-ola-de-calor-en-tampico-ordena-alcaldesa-monica-villarreal-instalar-5-modulos-de-hidratacion/ @MonicaVTampico",1927902387303317993,https://x.com/ndl_noticias/status/1927902387303317993,0,1,0,86,0,https://pbs.twimg.com/media/GsFJAO-XUAAgcp5.jpg;https://pbs.twimg.com/media/GsFJAO8WUAAMXds.jpg,False,,,,,es,Top
(@@TampicoGob OR @@MonicaVTampico) min_replies:0 min_faves:0 min_retweets:0,https://x.com/search?q=(@@TampicoGob OR @@MonicaVTampico) min_replies:0 min_faves:0 min_retweets:0 until:2025-05-30 since:2025-05-29&src=typed_query,NOTIVIZA,https://x.com/Notiviza,Notiviza,True,2025-05-29 03:41:54+00:00,False,"La alcaldesa Mónica Villarreal Anaya, destacó que Tampico se continúa consolidando como uno de los principales destinos para el desarrollo de congresos y convenciones de talla nacional e internacional. https://www.notivizanoreste.com.mx/turismo/avanza-tampico-en-consolidacion-como-preferido-para-convenciones/@TampicoGob @MonicaVTampico",1927933390927348095,https://x.com/Notiviza/status/1927933390927348095,0,1,0,61,0,https://pbs.twimg.com/media/GsFlGnHWoAAuRau.jpg;https://pbs.twimg.com/media/GsFlI6YW0AA6jVM.jpg,False,,,,,es,Top
(@@TampicoGob OR @@MonicaVTampico) min_replies:0 min_faves:0 min_retweets:0,https://x.com/search?q=(@@TampicoGob OR @@MonicaVTampico) min_replies:0 min_faves:0 min_retweets:0 until:2025-05-30 since:2025-05-29&src=typed_query,David Ed Castellanos,https://x.com/dect1608,dect1608,True,2025-05-29 18:39:52+00:00,False,#ÚltimoMinuto 🚨🚨🚨🚨La alcaldesa de #Tampico anunció el retiro de los topes en el paso deprimido #SanPedro #AvHidalgo @MonicaVTampico insistió en que son reductores de velocidad #Tamaulipas,1928159373534130238,https://x.com/dect1608/status/1928159373534130238,15,8,24,4470,2,https://pbs.twimg.com/amplify_video_thumb/1928158850785378304/img/NrtcsX1TUTvRbsYj.jpg;https://pbs.twimg.com/media/GsIyQkpX0AAnVNe.jpg,False,,,,,es,Top
(@@TampicoGob OR @@MonicaVTampico) min_replies:0 min_faves:0 min_retweets:0,https://x.com/search?q=(@@TampicoGob OR @@MonicaVTampico) min_replies:0 min_faves:0 min_retweets:0 until:2025-05-30 since:2025-05-29&src=typed_query,Alberto,https://x.com/jralberto77,jralberto77,False,2025-05-29 18:59:56+00:00,False,@dect1608 @MonicaVTampico O sea que no hay para cuándo los quiten...,1928164424008802321,https://x.com/jralberto77/status/1928164424008802321,1,0,0,247,0,,True,dect1608,https://x.com/dect1608,David Ed Castellanos,dect1608,es,Top
