Query_Str,Post_URL,Author_Name,Author_Web_Page_URL,Author_Handle,Verified_Status,UTC_Time,Ads,Tweet_Content,Post_ID,Tweet_URL,Reply_Count,Repost_Count,Like_Count,View_Count,Bookmark_Count,Tweet_Image_URL,Replying_to,Reply_to_Whom,Reply_to_Whom_URL,Reply_to_Whom_Username,Reply_to_Whom_Handle,Language,Type
(@@TampicoGob OR @@MonicaVTampico) min_replies:0 min_faves:0 min_retweets:0,https://x.com/search?q=(@@TampicoGob OR @@MonicaVTampico) min_replies:0 min_faves:0 min_retweets:0 until:2025-05-28 since:2025-05-27&src=typed_query,La Comadrita,https://x.com/lacomadritasoy,lacomadritasoy,True,2025-05-27 06:22:48+00:00,False,"CAMPAÑA MORADA 💜 Debo informar al público que en esta recta final mi apoyo total es ÚNICAMENTE para @dania_mdz Cada creador de contenido, cada ex habitante y gente del público es libre de apoyar a quien quiera. Dejen la toxicidad por un momento y dedíquense a votar por su favorit@ Que comiencen los juegos del hambre queridos seres de luz 🔥✨ DANIA GANADORA #LCDLFAllStars",1927249109762630117,https://x.com/lacomadritasoy/status/1927249109762630117,73,120,956,62378,20,https://pbs.twimg.com/amplify_video_thumb/1927249026904104961/img/rFx_0VNOQwAGa4tp.jpg,False,,,,,es,Top
(@@TampicoGob OR @@MonicaVTampico) min_replies:0 min_faves:0 min_retweets:0,https://x.com/search?q=(@@TampicoGob OR @@MonicaVTampico) min_replies:0 min_faves:0 min_retweets:0 until:2025-05-28 since:2025-05-27&src=typed_query,Mónica O. abogada,https://x.com/Monicao2712,Monicao2712,True,2025-05-27 06:38:19+00:00,False,@LuisaAlcalde @_JRLB_ Todo depende a quién pongan de candidatos. Ya no vamos aceptar corruptos y chapulines. Están avisados. Es cuanto.,1927253013485310428,https://x.com/Monicao2712/status/1927253013485310428,25,194,576,3500,0,,True,LuisaAlcalde,https://x.com/LuisaAlcalde,Luisa Alcalde,LuisaAlcalde,es,Top
(@@TampicoGob OR @@MonicaVTampico) min_replies:0 min_faves:0 min_retweets:0,https://x.com/search?q=(@@TampicoGob OR @@MonicaVTampico) min_replies:0 min_faves:0 min_retweets:0 until:2025-05-28 since:2025-05-27&src=typed_query,Mónica O. abogada,https://x.com/Monicao2712,Monicao2712,True,2025-05-27 07:07:29+00:00,False,"🚨ATENCIÓN ‼️ Nuestro candidato @cesargutipri nos enseña lo que debemos hacer con los cuadernillos que repartió MORENA. 📢 Hay que romperlos y a la basura! ¡No a las imposiciones de la cúpula dorada! Nadie va a manipular al #SupremoPueblo.👊 Vamos a votar el 1o de junio por los candidatos del pueblo, aunque se incomoden los de la cúpula dorada. Boleta morada 🟣 #vota49 vota por Cesar Mario Gutiérrez Priego @cesargutipri para ministro de la @SCJN #GutierrezPriego49 🙌🫶 #YoSiVoto #EleccionesJudiciales #Elecciones2025 #EleccionJudicial",1927260353307508992,https://x.com/Monicao2712/status/1927260353307508992,65,275,720,22288,20,https://pbs.twimg.com/ext_tw_video_thumb/1927259068558618624/pu/img/-6aMjTYrbZ2o39s9.jpg,False,,,,,es,Top
(@@TampicoGob OR @@MonicaVTampico) min_replies:0 min_faves:0 min_retweets:0,https://x.com/search?q=(@@TampicoGob OR @@MonicaVTampico) min_replies:0 min_faves:0 min_retweets:0 until:2025-05-28 since:2025-05-27&src=typed_query,Reporte Ya,https://x.com/ReporteYa,ReporteYa,True,2025-05-27 07:18:34+00:00,False,#27May #MariaCorina @GastonLevar : Maria Corina Machado este miércoles 28 EN VIVO con nosotros y para toda la #LegionGuarimba. Mirá cómo lo anunciamos. @MariaCorinaYA @ChacoCma @hacemosguarimba #HastaElFinal,1927263143626940908,https://x.com/ReporteYa/status/1927263143626940908,6,102,193,13087,1,https://pbs.twimg.com/amplify_video_thumb/1927208550180261888/img/Et-RxWsw3wK5IV3D.jpg,False,,,,,es,Top
(@@TampicoGob OR @@MonicaVTampico) min_replies:0 min_faves:0 min_retweets:0,https://x.com/search?q=(@@TampicoGob OR @@MonicaVTampico) min_replies:0 min_faves:0 min_retweets:0 until:2025-05-28 since:2025-05-27&src=typed_query,Terna honesto,https://x.com/rataneda,rataneda,False,2025-05-27 09:27:12+00:00,False,"* Veronika Mendoza postula - Otra vez? No se cansa de perder!? * Veronika Mendoza decide no postular - Lo hace porque no le quedaba otra! * Keiko postula - Es su problema si postula o no, si no te gusta no votes por ella!",1927295511922434510,https://x.com/rataneda/status/1927295511922434510,16,121,593,10595,3,,False,,,,,es,Top
(@@TampicoGob OR @@MonicaVTampico) min_replies:0 min_faves:0 min_retweets:0,https://x.com/search?q=(@@TampicoGob OR @@MonicaVTampico) min_replies:0 min_faves:0 min_retweets:0 until:2025-05-28 since:2025-05-27&src=typed_query,Tucusito 🌹,https://x.com/WAHM28,WAHM28,False,2025-05-27 09:36:40+00:00,False,"Que Dios te bendiga, te cuide, te ampare, te proteja y te favorezca, que no te apartes de Él. Que La Virgen te cubra con su manto, que te acompañe tu Ángel de la guarda, que te guíe el Espiritu Santo y que Dios te regale el mejor dia de tu vida. La paz sea contigo. #27May #Maria",1927297894425461113,https://x.com/WAHM28/status/1927297894425461113,35,55,258,2958,7,https://pbs.twimg.com/media/Gr8jOKbXwAAXkYj.jpg,False,,,,,es,Top
(@@TampicoGob OR @@MonicaVTampico) min_replies:0 min_faves:0 min_retweets:0,https://x.com/search?q=(@@TampicoGob OR @@MonicaVTampico) min_replies:0 min_faves:0 min_retweets:0 until:2025-05-28 since:2025-05-27&src=typed_query,Código Magenta,https://x.com/CodigoMagentaMx,CodigoMagentaMx,True,2025-05-27 11:14:25+00:00,False,"⭕ Ante la intimidación, respondemos con periodismo crítico. Esta es una respuesta puntal a los alegatos de #TaniaContrerasLópez. La candidata a magistrada alega que no hay un sólo elemento probatorio de las publicaciones de Código Magenta. Por eso, a las pruebas me remito. 📍https://codm.info/4dzhjCp",1927322496887369798,https://x.com/CodigoMagentaMx/status/1927322496887369798,26,887,1269,25946,44,https://pbs.twimg.com/amplify_video_thumb/1927320089172275200/img/u72SwB0H4SaTJaf7.jpg,False,,,,,es,Top
(@@TampicoGob OR @@MonicaVTampico) min_replies:0 min_faves:0 min_retweets:0,https://x.com/search?q=(@@TampicoGob OR @@MonicaVTampico) min_replies:0 min_faves:0 min_retweets:0 until:2025-05-28 since:2025-05-27&src=typed_query,🌼margaritismo🌼,https://x.com/tulipismoo,tulipismoo,False,2025-05-27 11:31:11+00:00,False,una foto de cuando se estaban enamorando sin saberlo que penita 😩🥹,1927326714725638398,https://x.com/tulipismoo/status/1927326714725638398,0,15,344,5117,20,https://pbs.twimg.com/media/Gr89bpPWEAAJTge.jpg,False,,,,,es,Top
(@@TampicoGob OR @@MonicaVTampico) min_replies:0 min_faves:0 min_retweets:0,https://x.com/search?q=(@@TampicoGob OR @@MonicaVTampico) min_replies:0 min_faves:0 min_retweets:0 until:2025-05-28 since:2025-05-27&src=typed_query,polari,https://x.com/polasopinion,polasopinion,False,2025-05-27 11:39:35+00:00,False,"in her ups and downs, there he is, stayed with her no matter what happened. kahit na may tampuhan, he always prioritizes her and think of her. bianca deserves to be love that way, without hesitation and without confusion TUESto SAVE DUSTBIA TUESto SAVE DUSTBIA",1927328830043062342,https://x.com/polasopinion/status/1927328830043062342,0,95,263,4314,14,https://pbs.twimg.com/amplify_video_thumb/1927328724149559296/img/CimeOso4aZMfo2K0.jpg,False,,,,,en,Top
(@@TampicoGob OR @@MonicaVTampico) min_replies:0 min_faves:0 min_retweets:0,https://x.com/search?q=(@@TampicoGob OR @@MonicaVTampico) min_replies:0 min_faves:0 min_retweets:0 until:2025-05-28 since:2025-05-27&src=typed_query,Carlos Martin Huerta,https://x.com/carlosmartinh,carlosmartinh,True,2025-05-27 12:44:58+00:00,False,"⚠️ ¡Precaución! Se han detectado motos que provocan el famoso “montachoques” para extorsionar a conductores en calles de la ciudad. 🚨 La modalidad consiste en simular un accidente menor para exigir dinero, intimidar ó algún otro delito. 📍 El último caso reportado fue en calle Keppler, zona de Angelópolis en El Cortijo, #Puebla. 🚗 El automovilista tuvo suerte de que ocurriera frente a su fraccionamiento.",1927345282469028086,https://x.com/carlosmartinh/status/1927345282469028086,45,546,1056,111539,72,https://pbs.twimg.com/amplify_video_thumb/1927344570053922817/img/m3D9ph2Lq0LolEvY.jpg;https://pbs.twimg.com/amplify_video_thumb/1927344570079096832/img/aLRnkLyhDeQZFzoP.jpg,False,,,,,es,Top
(@@TampicoGob OR @@MonicaVTampico) min_replies:0 min_faves:0 min_retweets:0,https://x.com/search?q=(@@TampicoGob OR @@MonicaVTampico) min_replies:0 min_faves:0 min_retweets:0 until:2025-05-28 since:2025-05-27&src=typed_query,Danky🇨🇱,https://x.com/Danky73,Danky73,False,2025-05-27 12:45:14+00:00,False,"🔴 Gabriel Boric y Carolina Tohá son cómplices del criminal Monsalve, lo pusieron a cargo de la seguridad del país, ellos le taparon todos sus crímenes. Cuántos ""Monsalve"" más habrán en este gobierno de izquierda miserable ⁉️#GobiernoDeCriminales #LicenciasTruchas",1927345348265005433,https://x.com/Danky73/status/1927345348265005433,24,302,332,4865,0,https://pbs.twimg.com/media/Gr9OYVqWIAAg3oN.jpg,False,,,,,es,Top
(@@TampicoGob OR @@MonicaVTampico) min_replies:0 min_faves:0 min_retweets:0,https://x.com/search?q=(@@TampicoGob OR @@MonicaVTampico) min_replies:0 min_faves:0 min_retweets:0 until:2025-05-28 since:2025-05-27&src=typed_query,Chubbsoft & Tomatito Girl 🍅,https://x.com/chubbsoft,chubbsoft,False,2025-05-27 12:53:07+00:00,False,La tomatita se viste con el buzo peligroso jeje✨️✨️✨️,1927347335597523217,https://x.com/chubbsoft/status/1927347335597523217,41,21,1698,23593,31,https://pbs.twimg.com/media/Gr9QLCYXYAEVsn3.jpg,False,,,,,es,Top
(@@TampicoGob OR @@MonicaVTampico) min_replies:0 min_faves:0 min_retweets:0,https://x.com/search?q=(@@TampicoGob OR @@MonicaVTampico) min_replies:0 min_faves:0 min_retweets:0 until:2025-05-28 since:2025-05-27&src=typed_query,CNN Chile,https://x.com/CNNChile,CNNChile,True,2025-05-27 13:13:59+00:00,False,"#CNNChileRadio | Alcalde de Maipú, Tomás Vodanovic, por escándalo de licencias médicas: ""En la comuna tenemos 52 casos y vamos a incluir querellas en cada uno. El ímpetu es desvincular a todos los funcionarios involucrados"". 📡 Sigue la señal aquí: https://live.cnnchile.com",1927352586522296746,https://x.com/CNNChile/status/1927352586522296746,5,124,374,13360,6,https://pbs.twimg.com/amplify_video_thumb/1927352479089360897/img/JCerfF4xJALOaK4N.jpg,False,,,,,es,Top
(@@TampicoGob OR @@MonicaVTampico) min_replies:0 min_faves:0 min_retweets:0,https://x.com/search?q=(@@TampicoGob OR @@MonicaVTampico) min_replies:0 min_faves:0 min_retweets:0 until:2025-05-28 since:2025-05-27&src=typed_query,trino camacho,https://x.com/trinomonero,trinomonero,True,2025-05-27 14:30:35+00:00,False,"Viernes 30, Sábado 31 de Mayo y Domingo 1 de Junio nos vemos en CDMX en el CCXP para firma y venta de originales y Serigrafías #trinomonero",1927371863035936948,https://x.com/trinomonero/status/1927371863035936948,8,49,247,5321,2,https://pbs.twimg.com/media/Gr9mflTXoAEo8MJ.jpg,False,,,,,es,Top
(@@TampicoGob OR @@MonicaVTampico) min_replies:0 min_faves:0 min_retweets:0,https://x.com/search?q=(@@TampicoGob OR @@MonicaVTampico) min_replies:0 min_faves:0 min_retweets:0 until:2025-05-28 since:2025-05-27&src=typed_query,Así Las Cosas,https://x.com/asilascosasw,asilascosasw,True,2025-05-27 14:33:32+00:00,False,"@MiguelMezaC @DefensorxsAC @warkentin Tania Gisela Contreras se encuentra relacionada con una red de corrupción, sobornos, extorsiones y tráfico de huachicol en el Estado de Tamaulipas: @DefensorxsAC. https://eleccionjudicial.defensorxs.com/project/tania-gisela-contreras-lopez/",1927372602751807909,https://x.com/asilascosasw/status/1927372602751807909,5,286,891,44203,15,https://pbs.twimg.com/media/Gr9m_04WEAAwOuw.jpg,True,asilascosasw,https://x.com/asilascosasw,Miguel Alfonso Meza,asilascosasw,es,Top
(@@TampicoGob OR @@MonicaVTampico) min_replies:0 min_faves:0 min_retweets:0,https://x.com/search?q=(@@TampicoGob OR @@MonicaVTampico) min_replies:0 min_faves:0 min_retweets:0 until:2025-05-28 since:2025-05-27&src=typed_query,Federico Döring 🇺🇦,https://x.com/FDoringCasar,FDoringCasar,True,2025-05-27 15:00:01+00:00,False,Comparto mi intervención en #SalaDeGuerra con @monicagarzag en @adn40 de la farsa democrática de la venganza judicial del #NarcoGobiernoDeMorena y las razones para NO votar este domingo en el contexto de la elección de José López Portillo y su campaña de 1976 #YoNoVotoElPrimeroDeJunio,1927379270994645281,https://x.com/FDoringCasar/status/1927379270994645281,40,426,986,10969,14,https://pbs.twimg.com/amplify_video_thumb/1927149156675538944/img/3Eh0OfCPGTdsOn0t.jpg,False,,,,,es,Top
(@@TampicoGob OR @@MonicaVTampico) min_replies:0 min_faves:0 min_retweets:0,https://x.com/search?q=(@@TampicoGob OR @@MonicaVTampico) min_replies:0 min_faves:0 min_retweets:0 until:2025-05-28 since:2025-05-27&src=typed_query,Ocesa Total,https://x.com/ocesa_total,ocesa_total,True,2025-05-27 15:19:40+00:00,False,"Lo mismo de la otra vez… ¡Mora llega a prender fuego a la tarima de GDL, CDMX y MTY! 🇲🇽😮‍💨🔥 #PreventaBanamex: 29 de mayo. Venta general a partir del 30 de mayo.",1927384214283886905,https://x.com/ocesa_total/status/1927384214283886905,0,18,298,14618,8,https://pbs.twimg.com/media/Gr9xuSFWUAAr6g_.jpg,False,,,,,es,Top
(@@TampicoGob OR @@MonicaVTampico) min_replies:0 min_faves:0 min_retweets:0,https://x.com/search?q=(@@TampicoGob OR @@MonicaVTampico) min_replies:0 min_faves:0 min_retweets:0 until:2025-05-28 since:2025-05-27&src=typed_query,Mónica O. abogada,https://x.com/Monicao2712,Monicao2712,True,2025-05-27 15:46:10+00:00,False,"🚨🚨¡PELIGRO‼️ BUCHONA SANDRA CUEVAS RONDANDO📢 Todos sabemos que @RicardoMonrealA es un traidor, lo que me preocupa es que esta señora ande colgandose de nuestra presidenta @Claudiashein y alrato la reciban con bombo y platillos en MORENA. De una vez se les informa @LuisaAlcalde si esta señora entra al movimiento, nos salimos todo el pueblo! ¡Lo que nos faltaba! Además es la que amenazaba a desde la alcaldía a nuestra presidenta, ahora resulta que la usaban! Es una ofensa a nuestro intelecto, por Dios! Todos sabemos la fichita que es. Nunca reciban esta basura @LuisaAlcalde nunca!",1927390882723938812,https://x.com/Monicao2712/status/1927390882723938812,115,423,767,18622,5,,False,,,,,es,Top
(@@TampicoGob OR @@MonicaVTampico) min_replies:0 min_faves:0 min_retweets:0,https://x.com/search?q=(@@TampicoGob OR @@MonicaVTampico) min_replies:0 min_faves:0 min_retweets:0 until:2025-05-28 since:2025-05-27&src=typed_query,Jorge Romero Herrera,https://x.com/JorgeRoHe,JorgeRoHe,True,2025-05-27 15:47:53+00:00,False,"#Veracruz y #BocaDelRío seguirán pintándose de azul con @Indira_rs y @maryjosegamboa. 👏🏻🔵 @AccionNacional seguirá llegando a cada rincón de Veracruz, para conocerlas, conocerlos y trabajar por todas y todos ustedes. 🇲🇽 Este 1 de junio #VotaPAN. 🦀🔵",1927391317312537038,https://x.com/JorgeRoHe/status/1927391317312537038,25,127,364,27999,1,https://pbs.twimg.com/amplify_video_thumb/1927390959106424832/img/c6FRSwe5Uwjol55o.jpg,False,,,,,es,Top
(@@TampicoGob OR @@MonicaVTampico) min_replies:0 min_faves:0 min_retweets:0,https://x.com/search?q=(@@TampicoGob OR @@MonicaVTampico) min_replies:0 min_faves:0 min_retweets:0 until:2025-05-28 since:2025-05-27&src=typed_query,tamii ~,https://x.com/l4linef4sta,l4linef4sta,False,2025-05-27 16:22:23+00:00,False,lo RIDÍCULO que tenés que ser para no poder entender que un PRESIDENTE no te puede HOSTIGAR ni MANDAR A TU EJÉRCITO DE TROLLS A QUE LO HAGAN POR EL SIMPLE HECHO DE 1 SER MUJER 2 PENSAR DISTINTO. así que more cerra el orto y deja de ser tan mogolica.,1927399999408632260,https://x.com/l4linef4sta/status/1927399999408632260,83,768,10154,143178,71,,False,,,,,es,Top
(@@TampicoGob OR @@MonicaVTampico) min_replies:0 min_faves:0 min_retweets:0,https://x.com/search?q=(@@TampicoGob OR @@MonicaVTampico) min_replies:0 min_faves:0 min_retweets:0 until:2025-05-28 since:2025-05-27&src=typed_query,Rochi🎸🦂🐐,https://x.com/rochicabj1905,rochicabj1905,True,2025-05-27 16:38:06+00:00,False,"Pero en vez de quejarse con Tato y con Luz, por qué no va directamente con la Tana y se lo dice a ella? #GranHermano",1927403952095539484,https://x.com/rochicabj1905/status/1927403952095539484,39,115,658,12038,9,,False,,,,,es,Top
(@@TampicoGob OR @@MonicaVTampico) min_replies:0 min_faves:0 min_retweets:0,https://x.com/search?q=(@@TampicoGob OR @@MonicaVTampico) min_replies:0 min_faves:0 min_retweets:0 until:2025-05-28 since:2025-05-27&src=typed_query,MÓNICA RODRÍGUEZ 🐤,https://x.com/MONYRODRIGUEZOF,MONYRODRIGUEZOF,True,2025-05-27 16:44:14+00:00,False,"Me hace sentir odio esto 😭😭😭💫Que paguen en esta y todas las vidas, tanta crueldad. 😡",1927405498627760584,https://x.com/MONYRODRIGUEZOF/status/1927405498627760584,55,167,417,20312,3,,False,,,,,es,Top
(@@TampicoGob OR @@MonicaVTampico) min_replies:0 min_faves:0 min_retweets:0,https://x.com/search?q=(@@TampicoGob OR @@MonicaVTampico) min_replies:0 min_faves:0 min_retweets:0 until:2025-05-28 since:2025-05-27&src=typed_query,rosito,https://x.com/freerosito__,freerosito__,False,2025-05-27 16:47:18+00:00,False,"@JuanLaMattina muchas gracia por recalcarlo juan, estos mensajes valen oro 🙏 ayer a mi hija Toñi (8 añitos) le salió tu tuit y lleva desde entonces con un ataque de ansiedad tremendo. ni ha comido ni dormido desde entonces. gracias por este nuevo tuit, le vas a dar una alegría inmensa ❤️‍🩹✨",1927406269108744704,https://x.com/freerosito__/status/1927406269108744704,0,4,413,4539,1,,True,JuanLaMattina,https://x.com/JuanLaMattina,,JuanLaMattina,es,Top
(@@TampicoGob OR @@MonicaVTampico) min_replies:0 min_faves:0 min_retweets:0,https://x.com/search?q=(@@TampicoGob OR @@MonicaVTampico) min_replies:0 min_faves:0 min_retweets:0 until:2025-05-28 since:2025-05-27&src=typed_query,Diablito,https://x.com/DiabloRojo111,DiabloRojo111,False,2025-05-27 18:13:21+00:00,False,Deja tú de lado la pregunta pendejisima de ese cabron jajajaja es que puta madre pero bueno LA PRESIDENTA FELICITA AL CAMPEON VIVA LA 4T VIVA LA MAESTRA DELFINA VIVA LA PRESIDENTA VIVA MEXICO Y VIVA EL CAMPEON TOLUCAAAAA,1927427923545301284,https://x.com/DiabloRojo111/status/1927427923545301284,10,44,368,16642,38,https://pbs.twimg.com/ext_tw_video_thumb/1927379479820705792/pu/img/6GhNJAcg_VCJqg2m.jpg,False,,,,,es,Top
(@@TampicoGob OR @@MonicaVTampico) min_replies:0 min_faves:0 min_retweets:0,https://x.com/search?q=(@@TampicoGob OR @@MonicaVTampico) min_replies:0 min_faves:0 min_retweets:0 until:2025-05-28 since:2025-05-27&src=typed_query,(FRAPP)🇵🇸🇨🇱 EN LA JARANETA ✊️ #Jara2026,https://x.com/Informa3Chile,Informa3Chile,False,2025-05-27 18:34:59+00:00,False,"🔴 12 de Octubre de 2023: Tomás Mocciatti destruye, pulveriza la Gestión Municipal de Evelyn Matthei en Providencia con el Auge del Comercio Ambulante y el Deterioro del Comercio 🔴 Mosciatti menciona la dificultad de caminar por Providencia debido a la presencia de vendedores ambulantes, describiéndolo como ""imposible en algunos sectores."" 🔴 Resalta el alto costo del estacionamiento subterráneo en Providencia y el deterioro progresivo del comercio debido a la competencia de los vendedores ambulantes. 🔴 Mosciatti señala la contradicción en Providencia: contribuciones altas y condiciones de vida costosas frente al deterioro de la seguridad en las calles y el comercio establecido. 🔴 Atribuye la inseguridad y la mala gestión a la administración de Matthei, sugiriendo que ha afectado negativamente la calidad de vida en la zona. Esa misma Evelyn Matthei que Destruyo Providencia entre 2016-2024, es la misma que dice tener las Recetas para Mejorar Chile, no queremos más ambulantes ni abultadas horas extras, ya lo vivimos con Desbordes y Sichel",1927433368418811953,https://x.com/Informa3Chile/status/1927433368418811953,0,301,325,16104,16,https://pbs.twimg.com/ext_tw_video_thumb/1927433335069880320/pu/img/fVEsQNgGKomD9jEg.jpg,False,,,,,es,Top
(@@TampicoGob OR @@MonicaVTampico) min_replies:0 min_faves:0 min_retweets:0,https://x.com/search?q=(@@TampicoGob OR @@MonicaVTampico) min_replies:0 min_faves:0 min_retweets:0 until:2025-05-28 since:2025-05-27&src=typed_query,Asociacion de Protección Animal Mi Mejor Amigo,https://x.com/AsociacionMi,AsociacionMi,True,2025-05-27 19:12:05+00:00,False,"Max después de 7 meses hospitalizado tratando de que no perdiera la patita, hoy por fin sale 💪🏻💪🏻💙😍 el médico veterinario Jhon Munevar se la pudo salvar, 💙💙 de él solo debemos una cuenta de 300 mil pesos, si 30 corazones se unen con 10 mil pesos podremos pagar, infinitas gracias por tantoooo. Bancolombia Ahorros 35270197653 NIT 901039372 Nequi 3118009018 Ahorro a la mano 13118239988 DaviPlata 3118239988 Paypal vivianieto@yahoo.es",1927442706319507622,https://x.com/AsociacionMi/status/1927442706319507622,48,471,1344,16235,28,https://pbs.twimg.com/amplify_video_thumb/1927442432670527488/img/c98snrJiGwInFosw.jpg,False,,,,,es,Top
(@@TampicoGob OR @@MonicaVTampico) min_replies:0 min_faves:0 min_retweets:0,https://x.com/search?q=(@@TampicoGob OR @@MonicaVTampico) min_replies:0 min_faves:0 min_retweets:0 until:2025-05-28 since:2025-05-27&src=typed_query,EVTV,https://x.com/EVTVMiami,EVTVMiami,True,2025-05-27 19:36:25+00:00,False,"#LaEntrevista | ENTREVISTA ESPECIAL CON MARÍA CORINA MACHADO 🇻🇪 . No te puedes perder a Miguel Ángel Rodríguez (@MiguelContigo), quien estará conversando con la vicepresidenta del gobierno electo de Venezuela @MariaCorinaYA en una entrevista especial. 📅 Miércoles #28Mayo ⏰ 7:00 PM - 9:00 PM . 🇺🇸Florida Comcast 1090 🇨🇴Colombia HD Multiplay canal 90 🇵🇦Panamá Tigo canal 439 🇵🇪Perú TelecableSmart, Internet Smart Perú, EmserTel - 🔌Conéctate a nuestra señal EN VIVO en📶 http://evtv.online 💻y descarga nuestra app 📲 EVTV Plus",1927448829512593766,https://x.com/EVTVMiami/status/1927448829512593766,26,238,437,10102,12,https://pbs.twimg.com/media/Gr-sAOaWAAA2-5F.jpg,False,,,,,es,Top
(@@TampicoGob OR @@MonicaVTampico) min_replies:0 min_faves:0 min_retweets:0,https://x.com/search?q=(@@TampicoGob OR @@MonicaVTampico) min_replies:0 min_faves:0 min_retweets:0 until:2025-05-28 since:2025-05-27&src=typed_query,Mónica Saade,https://x.com/MonicaSaadeX,MonicaSaadeX,True,2025-05-27 19:55:11+00:00,False,Otro bandido más que niega al drogadicto 👇,1927453549937459238,https://x.com/MonicaSaadeX/status/1927453549937459238,20,453,725,20159,21,https://pbs.twimg.com/ext_tw_video_thumb/1927452610681786368/pu/img/pFc5wdn4JFevUIu4.jpg,False,,,,,es,Top
(@@TampicoGob OR @@MonicaVTampico) min_replies:0 min_faves:0 min_retweets:0,https://x.com/search?q=(@@TampicoGob OR @@MonicaVTampico) min_replies:0 min_faves:0 min_retweets:0 until:2025-05-28 since:2025-05-27&src=typed_query,Código Magenta,https://x.com/CodigoMagentaMx,CodigoMagentaMx,True,2025-05-27 20:20:00+00:00,False,"⭕ Esta es una respuesta puntal a los alegatos de #TaniaContrerasLópez. La candidata a magistrada alega que no hay un sólo elemento probatorio de las publicaciones de Código Magenta. Por eso, a las pruebas me remito. 📍https://codm.info/4dzhjCp",1927459795294126188,https://x.com/CodigoMagentaMx/status/1927459795294126188,5,193,269,14477,7,https://pbs.twimg.com/amplify_video_thumb/1927329667259805696/img/LyhxbT843jgoXpJB.jpg,False,,,,,es,Top
(@@TampicoGob OR @@MonicaVTampico) min_replies:0 min_faves:0 min_retweets:0,https://x.com/search?q=(@@TampicoGob OR @@MonicaVTampico) min_replies:0 min_faves:0 min_retweets:0 until:2025-05-28 since:2025-05-27&src=typed_query,Tatiana Astengo,https://x.com/TatianaAstengoB,TatianaAstengoB,False,2025-05-27 20:29:52+00:00,False,jajajajajajajajajajajajajajajajajajajajajajajajajajajajajajajajajajajajajjajajajajajajajajajajajajajajajajajajajajajajajajajajajajajajajajaja Destruido. 😂 jajajajajajajajajajajajajajajajajajajajajajajajajajajajajajajajajajaja,1927462280121163974,https://x.com/TatianaAstengoB/status/1927462280121163974,131,507,2639,122730,200,https://pbs.twimg.com/amplify_video_thumb/1927409337737023490/img/7vumS2q0peaiOyOG.jpg,False,,,,,es,Top
(@@TampicoGob OR @@MonicaVTampico) min_replies:0 min_faves:0 min_retweets:0,https://x.com/search?q=(@@TampicoGob OR @@MonicaVTampico) min_replies:0 min_faves:0 min_retweets:0 until:2025-05-28 since:2025-05-27&src=typed_query,Antonio Astiazarán,https://x.com/tonoastiazaran,tonoastiazaran,True,2025-05-27 20:47:30+00:00,False,"Mayo es el mes de las mamás... y hoy las celebramos con cariño. Junto a mi esposa @pattyruibal, reconocimos a las mujeres que todos los días entregan lo mejor de sí como servidoras públicas y como mamás. Su visión, esfuerzo y compromiso hacen más grande a Hermosillo. ¡Feliz Mes de las Madres! 👩‍👧‍👦 #TrabajoQueSeNota",1927466717006987743,https://x.com/tonoastiazaran/status/1927466717006987743,6,20,67,2536,0,https://pbs.twimg.com/media/Gr-8wuGXsAAzfy2.jpg;https://pbs.twimg.com/media/Gr-8wtyXwAEtjAy.jpg;https://pbs.twimg.com/media/Gr-8wt-WsAAkcJg.jpg;https://pbs.twimg.com/media/Gr-8wr_XgAALJRW.jpg,False,,,,,es,Top
(@@TampicoGob OR @@MonicaVTampico) min_replies:0 min_faves:0 min_retweets:0,https://x.com/search?q=(@@TampicoGob OR @@MonicaVTampico) min_replies:0 min_faves:0 min_retweets:0 until:2025-05-28 since:2025-05-27&src=typed_query,🧚🏻‍♀️🎀 Tinkerbell 🎀🧚🏻‍♀️,https://x.com/Pomchi_Puppy,Pomchi_Puppy,False,2025-05-27 21:22:52+00:00,False,I’m a Tinkiecorn today since I have my Unicorn jumper on🐾 #tinkerbellthepomchi #pomchi #tatertotsquad #dogsoftwitter #dogsofx,1927475617433284842,https://x.com/Pomchi_Puppy/status/1927475617433284842,43,22,261,1551,3,https://pbs.twimg.com/media/Gr_E2aoXoAARrBL.jpg,False,,,,,en,Top
