Query_Str,Post_URL,Author_Name,Author_Web_Page_URL,Author_Handle,Verified_Status,UTC_Time,Ads,Tweet_Content,Post_ID,Tweet_URL,Reply_Count,Repost_Count,Like_Count,View_Count,Bookmark_Count,Tweet_Image_URL,Replying_to,Reply_to_Whom,Reply_to_Whom_URL,Reply_to_Whom_Username,Reply_to_Whom_Handle,Language,Type
(@@TampicoGob OR @@MonicaVTampico) min_replies:0 min_faves:0 min_retweets:0,https://x.com/search?q=(@@TampicoGob OR @@MonicaVTampico) min_replies:0 min_faves:0 min_retweets:0 until:2025-05-29 since:2025-05-28&src=typed_query,Código Magenta,https://x.com/CodigoMagentaMx,CodigoMagentaMx,True,2025-05-28 06:00:30+00:00,False,"⭕Esta es una respuesta puntal a los alegatos de #TaniaContrerasLópez. La candidata a magistrada alega que no hay un sólo elemento probatorio de las publicaciones de Código Magenta. Por eso, a las pruebas me remito https://codm.info/4dzhjCp",1927605885687279672,https://x.com/CodigoMagentaMx/status/1927605885687279672,3,224,341,26632,7,,False,,,,,es,Top
(@@TampicoGob OR @@MonicaVTampico) min_replies:0 min_faves:0 min_retweets:0,https://x.com/search?q=(@@TampicoGob OR @@MonicaVTampico) min_replies:0 min_faves:0 min_retweets:0 until:2025-05-29 since:2025-05-28&src=typed_query,Doña Prohibida,https://x.com/tribasprohibida,tribasprohibida,False,2025-05-28 09:57:55+00:00,False,"Ella tiene muy claro el hambre de representación y la necesidad de muchas de nosotras de vernos reflejadas y contadas. Que, en el fondo, no es otra cosa que sentirnos vistas y dignificadas tanto en historias como en personas admiradas y admirables. #mafin",1927665631941239040,https://x.com/tribasprohibida/status/1927665631941239040,2,15,262,10616,107,https://pbs.twimg.com/amplify_video_thumb/1927604809831497729/img/WTu-AP6FD2Iku293.jpg,False,,,,,es,Top
(@@TampicoGob OR @@MonicaVTampico) min_replies:0 min_faves:0 min_retweets:0,https://x.com/search?q=(@@TampicoGob OR @@MonicaVTampico) min_replies:0 min_faves:0 min_retweets:0 until:2025-05-29 since:2025-05-28&src=typed_query,Vicky Dávila,https://x.com/VickyDavilaH,VickyDavilaH,True,2025-05-28 11:13:48+00:00,False,"Aquí en Manizales conocí a este combo de mujeres repilas. “Nadie lo hace como Frisby lo hace”, me dijeron saliendo de comer pollito. Y luego me hablaron del país, del Gobierno y del paro y vean en lo que terminó la conversación. Ufff!!!! “Eso sí lo tumba”. #JuntosSomosMillones",1927684729345569108,https://x.com/VickyDavilaH/status/1927684729345569108,45,140,459,15866,0,https://pbs.twimg.com/amplify_video_thumb/1927684440131579904/img/LOEMjjSPyBwoRk5y.jpg,False,,,,,es,Top
(@@TampicoGob OR @@MonicaVTampico) min_replies:0 min_faves:0 min_retweets:0,https://x.com/search?q=(@@TampicoGob OR @@MonicaVTampico) min_replies:0 min_faves:0 min_retweets:0 until:2025-05-29 since:2025-05-28&src=typed_query,Melissa Ⓜ️,https://x.com/Melissa_Bely,Melissa_Bely,True,2025-05-28 12:21:08+00:00,False,"¡ Increíble ! El INE apoyando la censura para que no se escriba acerca del huachicol 👇 No cesa el acoso del Instituto Electoral de Tamaulipas. ""Primero fue la intención de ejercer censura presente y futura contra un columnista de EL UNIVERSAL que escribió sobre el huachicol y el Poder Judicial en Tamaulipas. Ahora, el Instituto Electoral de Tamaulipas envía a este diario un requerimiento tan absurdo como ofensivo. Pide que El Gran Diario de México le informe cuánto se pagó para que se publicara ese contenido periodístico. Como estamos seguros de que la ignorancia no puede llegar a esos niveles, no queda otra manera de interpretar la solicitud del Instituto Electoral de Tamaulipas, que no sea la del acoso."" Bajo Reserva",1927701672421208445,https://x.com/Melissa_Bely/status/1927701672421208445,9,223,362,5016,5,https://pbs.twimg.com/media/GsCSdLDWoAE3PBG.jpg,False,,,,,es,Top
(@@TampicoGob OR @@MonicaVTampico) min_replies:0 min_faves:0 min_retweets:0,https://x.com/search?q=(@@TampicoGob OR @@MonicaVTampico) min_replies:0 min_faves:0 min_retweets:0 until:2025-05-29 since:2025-05-28&src=typed_query,まなみちょぱ【高橋愛美】,https://x.com/ma_na_mi_cho_pa,ma_na_mi_cho_pa,True,2025-05-28 12:44:11+00:00,False,"🎂Birthday stream,tickets now on sale https://tiget.net/events/403371 My photos now on sale📸online store http://manamichopa.official.ec 🎥Youtube https://youtube.com/@manamichopastaff?si=dZiLZHa0GXU5Ipng",1927707472522862879,https://x.com/ma_na_mi_cho_pa/status/1927707472522862879,3,24,461,10181,48,https://pbs.twimg.com/media/GsCXur_awAAoko4.jpg,False,,,,,en,Top
(@@TampicoGob OR @@MonicaVTampico) min_replies:0 min_faves:0 min_retweets:0,https://x.com/search?q=(@@TampicoGob OR @@MonicaVTampico) min_replies:0 min_faves:0 min_retweets:0 until:2025-05-29 since:2025-05-28&src=typed_query,Juanita Gómez L.,https://x.com/JuanitaGomezL,JuanitaGomezL,True,2025-05-28 13:06:00+00:00,False,A los encapuchados los usuarios de TM en Bogotá los están mandando a trabajar,1927712965739913234,https://x.com/JuanitaGomezL/status/1927712965739913234,335,184,591,238992,17,https://pbs.twimg.com/amplify_video_thumb/1927705560142540800/img/P50Eg998ZYLrh74s.jpg,False,,,,,es,Top
(@@TampicoGob OR @@MonicaVTampico) min_replies:0 min_faves:0 min_retweets:0,https://x.com/search?q=(@@TampicoGob OR @@MonicaVTampico) min_replies:0 min_faves:0 min_retweets:0 until:2025-05-29 since:2025-05-28&src=typed_query,Angelica Monsalve Gaviria,https://x.com/alazamo123,alazamo123,True,2025-05-28 13:06:21+00:00,False,"A propósito de Katherine Miranda @KatheMirandaP Cathy Juvinao @CathyJuvinao @JotaPeHernandez y muchos otros. Congresistas indolentes, congresistas ignorantes, congresistas operadores de los políticos y de las mafias económicas que les vale nada la necesidad de quienes los eligieron y dicen representar. A esos, tenemos que expulsarlos del Congreso, a esos debemos condenarlos al ostracismo, al olvido, y a sus partidos, castigarlos con la indiferencia para que sus “líderes” no puedan seguir viviendo de la teta publica y terminen donde deben terminar: en el basurero de la historia. Es hora que votemos a conciencia, es hora que entendamos que en el Congreso deben estar los mejores y los más comprometidos y no esos títeres que son manejados por los clanes departamentales y económicos a su antojo para presionar al gobierno central de turno a que les den plata para que el mecanismo siga funcionando y asi poder hacer lo que ellos quieran con la necesidad de la gente. Por eso es que ponen tanto dinero y despliegan tanto poder, precisamente para hacer más dinero y obtener más poder con el voto de la gente. Colombia así lo reclama.",1927713052553810325,https://x.com/alazamo123/status/1927713052553810325,81,1193,2147,22369,14,,False,,,,,es,Top
(@@TampicoGob OR @@MonicaVTampico) min_replies:0 min_faves:0 min_retweets:0,https://x.com/search?q=(@@TampicoGob OR @@MonicaVTampico) min_replies:0 min_faves:0 min_retweets:0 until:2025-05-29 since:2025-05-28&src=typed_query,Bere Aguilar,https://x.com/bereaguilarv,bereaguilarv,True,2025-05-28 13:08:49+00:00,False,"¡Escándalo! Ahora el Instituto Electoral de Tamaulipas exige a El Universal que le informe cuánto le pagó a Héctor de Mauleón por escribir la columna sobre el huachicol y el PJ en Tamps. ¡Ya párale, Tania Contreras! No cesa el acoso del Instituto Electoral de Tamaulipas. Primero fue la intención de ejercer censura presente y futura contra un columnista de EL UNIVERSAL que escribió sobre el huachicol y el Poder Judicial en Tamaulipas. Ahora, el Instituto Electoral de Tamaulipas envía a este diario un requerimiento tan absurdo como ofensivo. Pide que El Gran Diario de México le informe cuánto se pagó para que se publicara ese contenido periodístico. Como estamos seguros de que la ignorancia no puede llegar a esos niveles, no queda otra manera de interpretar la solicitud del Instituto Electoral de Tamaulipas, que no sea la del acoso. Bajo Reserva",1927713673927102775,https://x.com/bereaguilarv/status/1927713673927102775,126,2502,4009,35861,43,https://pbs.twimg.com/media/GsCdXpNXMAARUMe.jpg,False,,,,,es,Top
(@@TampicoGob OR @@MonicaVTampico) min_replies:0 min_faves:0 min_retweets:0,https://x.com/search?q=(@@TampicoGob OR @@MonicaVTampico) min_replies:0 min_faves:0 min_retweets:0 until:2025-05-29 since:2025-05-28&src=typed_query,PandaDelMal 🐼 😈,https://x.com/Pandita__toxico,Pandita__toxico,True,2025-05-28 13:40:37+00:00,False,"Que CHASM la Cochiloca de la Taddei. Es una miserable arrastrada, vividora y mafiosa. 🐼🤢🤮🤮🤮",1927721677565112560,https://x.com/Pandita__toxico/status/1927721677565112560,20,76,238,1713,1,,False,,,,,es,Top
(@@TampicoGob OR @@MonicaVTampico) min_replies:0 min_faves:0 min_retweets:0,https://x.com/search?q=(@@TampicoGob OR @@MonicaVTampico) min_replies:0 min_faves:0 min_retweets:0 until:2025-05-29 since:2025-05-28&src=typed_query,TRONK,https://x.com/TronkOficial,TronkOficial,True,2025-05-28 14:03:20+00:00,False,"Los hongos y Ulises planean seguir exponiendo las malas actitudes de Tato y Luz Eugenia y Devi siguen con el tema de la carne de Tato y ahora quieren sumar el tema de la cerveza que Luz le sacó a La Tana, un problema ya solucionado entre ellas hace varias semanas: ""Pone cara de piedra y le dijo 'Tanita, yo no he sido', siempre con la sonrisita te la manda y te dice 'La chilindrina tiene que ser la Tana' o te dice 'he soñado esto'"" Selva dice que cuando entró Augusto, el amigo de Tato, mostró la mismas actitudes soberbias: ""Por algo es amigo"" Ulises recalcó que cuando La Tana se desató, Luz le dijo: ""¡No! vas a hacer justo lo que Selva quiere"". Lo que le sorprendió porque, según él, Luz no sabe de juego y no entiende nada",1927727393390711125,https://x.com/TronkOficial/status/1927727393390711125,339,164,914,179442,125,https://pbs.twimg.com/ext_tw_video_thumb/1927727262536777728/pu/img/_o4ZqOoxClDK8xE4.jpg,False,,,,,es,Top
(@@TampicoGob OR @@MonicaVTampico) min_replies:0 min_faves:0 min_retweets:0,https://x.com/search?q=(@@TampicoGob OR @@MonicaVTampico) min_replies:0 min_faves:0 min_retweets:0 until:2025-05-29 since:2025-05-28&src=typed_query,F🧡JIM🍊RISM🍊 🇵🇪🧡🍊💪🇵🇪🧡🍊💪🇵🇪🧡🍊💪,https://x.com/AlvanRaphael,AlvanRaphael,False,2025-05-28 14:12:43+00:00,False,"Ya es momento que a esta bruja de TATIANA ASTENGO le pongan un alto , esta ofendiendo y descriminando a nuestros policías que dan su vida día a día por nosotros @PoliciaPeru @MininterPeru",1927729753059991898,https://x.com/AlvanRaphael/status/1927729753059991898,144,296,835,48431,38,https://pbs.twimg.com/ext_tw_video_thumb/1927729714401087489/pu/img/WG40-5b1xrwmJmn_.jpg,False,,,,,es,Top
(@@TampicoGob OR @@MonicaVTampico) min_replies:0 min_faves:0 min_retweets:0,https://x.com/search?q=(@@TampicoGob OR @@MonicaVTampico) min_replies:0 min_faves:0 min_retweets:0 until:2025-05-29 since:2025-05-28&src=typed_query,Eco_1_LVM,https://x.com/Eco1_LVM,Eco1_LVM,True,2025-05-28 14:37:05+00:00,False,"🚨🚨🚨-Tabasco- Atoraron a “El Pitufo y 11 narco pitufines” de los Menchos Boys, tras operativos en Amatitlán, Cunduacán y Paraíso. -Juan Roberto ""El Pitufo"", Jefe de plaza en Paraíso -11 Narco pitufines, 6 son de Guatemala. -Aseguraron armas, drogas y dinero en efectivo",1927735887204397428,https://x.com/Eco1_LVM/status/1927735887204397428,3,28,257,16588,11,https://pbs.twimg.com/media/GsCw-w2WAAAmYWZ.jpg;https://pbs.twimg.com/media/GsCw-yhWAAAahqD.jpg,False,,,,,es,Top
(@@TampicoGob OR @@MonicaVTampico) min_replies:0 min_faves:0 min_retweets:0,https://x.com/search?q=(@@TampicoGob OR @@MonicaVTampico) min_replies:0 min_faves:0 min_retweets:0 until:2025-05-29 since:2025-05-28&src=typed_query,diego manarelli,https://x.com/manarellidiego,manarellidiego,False,2025-05-28 14:41:36+00:00,False,"AHORA LLORIQUEAN EBELIN ORTIZ,MÓNICA SÁNCHEZ, TATIANA ABSTENGO PQ QUIEREN RECIBIR REGALÍAS POR SUS ADEFESIOS DE PELÍCULAS QUÉ FUERON UN COMPLETO FRACASO,PELÍCULAS OBRAS ALGUNOS FINANCIADAS CON NUESTRO DINERO Y RECIBIERON PAGO X ELLO..PERO QUIEREN SEGUIR LUCRADO LAS DESCARADAS",1927737024447987895,https://x.com/manarellidiego/status/1927737024447987895,45,120,280,4411,1,https://pbs.twimg.com/media/GsCym40XQAAO3XC.jpg;https://pbs.twimg.com/media/GsCym4nWwAEUc5r.jpg;https://pbs.twimg.com/media/GsCym7HWMAAUNgE.jpg,False,,,,,es,Top
(@@TampicoGob OR @@MonicaVTampico) min_replies:0 min_faves:0 min_retweets:0,https://x.com/search?q=(@@TampicoGob OR @@MonicaVTampico) min_replies:0 min_faves:0 min_retweets:0 until:2025-05-29 since:2025-05-28&src=typed_query,Nacho Rodriguez (El Chapucero),https://x.com/NachoRgz,NachoRgz,True,2025-05-28 14:52:44+00:00,False,"Bueno ¿y esa empresa no tiene una cuenta bancaria?¿Esta empresa está a su nombre? ¿Es usted socia, y si es así quiénes son los otros socios? ¿Es usted representante legal, o solo sirve como ""vendedora""? Ahora, ya que tengo su atención ¿cómo se compró ese collar Tiffany que usa en la entrevista? Que cuesta más de 100 mil pesos. Supongo que lo compró en cash porque usted dice que no tiene cuentas bancarias. ¿O fue un regalo?",1927739824733065392,https://x.com/NachoRgz/status/1927739824733065392,59,159,438,32419,10,,False,,,,,es,Top
(@@TampicoGob OR @@MonicaVTampico) min_replies:0 min_faves:0 min_retweets:0,https://x.com/search?q=(@@TampicoGob OR @@MonicaVTampico) min_replies:0 min_faves:0 min_retweets:0 until:2025-05-29 since:2025-05-28&src=typed_query,Lu Montenegro,https://x.com/lumsjp,lumsjp,False,2025-05-28 14:59:05+00:00,False,"Señor te pido por mi hermana, dale paz y fortaleza, ayúdala a sanar, para mí no te pido nada señor, te agradezco por todos los familiares y amigos que nos acompañan en esta prueba y por las personas que aún sin conocernos rezan por mi hermana y por mi familia.",1927741423509536951,https://x.com/lumsjp/status/1927741423509536951,91,44,934,34200,11,,False,,,,,es,Top
(@@TampicoGob OR @@MonicaVTampico) min_replies:0 min_faves:0 min_retweets:0,https://x.com/search?q=(@@TampicoGob OR @@MonicaVTampico) min_replies:0 min_faves:0 min_retweets:0 until:2025-05-29 since:2025-05-28&src=typed_query,Federico Döring 🇺🇦,https://x.com/FDoringCasar,FDoringCasar,True,2025-05-28 15:00:01+00:00,False,Comparto la clase de historia al #NarcoPartidoDeMorena en #SalaDeGuerra con @monicagarzag en @adn40 que pretende cambiar con la farsa electoral de su golpe de estado a la @SCJN la carrera judicial por la carrera del #HuachicolFiscal #YoNoVotoElPrimeroDeJunio,1927741655479689345,https://x.com/FDoringCasar/status/1927741655479689345,25,455,826,10134,18,https://pbs.twimg.com/amplify_video_thumb/1927516820799414273/img/fxalEvpqqqW4GuHC.jpg,False,,,,,es,Top
(@@TampicoGob OR @@MonicaVTampico) min_replies:0 min_faves:0 min_retweets:0,https://x.com/search?q=(@@TampicoGob OR @@MonicaVTampico) min_replies:0 min_faves:0 min_retweets:0 until:2025-05-29 since:2025-05-28&src=typed_query,Código Magenta,https://x.com/CodigoMagentaMx,CodigoMagentaMx,True,2025-05-28 15:06:31+00:00,False,"⭕️ El #PAN de #Tamaulipas presentó una denuncia ante la @FGRMexico en contra de #TaniaContrerasLópez y dos miembros del Tribunal Electoral del Estado de Tamaulipas por asociación delictuosa y tráfico de influencias. 🔹La acusación alega que #Contreras López, candidata a magistrada del #PoderJudicial de Tamaulipas y ex consejera jurídica del estado, operó la designación ilegal de #SeleneLópezSánchez y de #RicardoBarrientosTreviño como magistrados del tribunal electoral local. 🔹La denuncia sostiene que estos nombramientos fueron utilizados por #ContrerasLópez para promover una denuncia contra Código Magenta por calumnia y violencia política en razón de género, lo cual califica como un mecanismo para censurar a un medio que exhibió relaciones familiares polémicas de la candidata a magistrada. 🔺A continuación se reproduce un extracto de la denuncia presentada por @AccionNacional: 🔺“El Pleno del Tribunal Electoral local está compuesto por cinco personas, cuatro de las cuáles tienen vínculos directos con Tania Contreras López. No sólo eso, dos miembros del tribunal, Selene López Sánchez y Ricardo Arturo Barrientos Treviño, no han sido ratificados por el @senadomexicano y fueron nombrados ilegalmente como magistrados. Selene López Sánchez, quien fue designada magistrada apenas ocho días después de entrar al tribunal, es prima hermana de Tania Contreras. Arturo Barrientos Treviño tiene una relación personal con la familia de la candidata y fue subordinado del esposo de Tania Contreras López, #JorgeLuisBeas, actual subsecretario de Gobierno de Tamaulipas, a quienes se señala a la imputada de acordar su designación, quienes tienen una unión con el propósito de delinquir en la comisión de los delitos de tráfico de influencias”. ➡️ ¿Por qué importa? Este medio ha exhibido un asunto de interés público: las relaciones familiares de Tania Contreras López, quien no sólo es una candidata a un puesto de elección popular, sino que aspira a dirigir el Tribunal Supremo de Justicia de Tamaulipas. ➡️ El intento de censura del recurso promovido por Tania Contreras López es una advertencia preocupante sobre la manipulación del Poder Judicial. En una primera instancia, el secretario ejecutivo del Instituto Electoral de Tamaulipas, el primer filtro de la denuncia de la candidata, desechó parcialmente la queja promovida por Contreras López dado que existe una clara jurisprudencia de la Sala Superior del Tribunal Electoral del Poder Judicial de la Federación respecto a que “los periodistas y los medios de comunicación se encuentran excluidos del universo de destinatarios de las normas que prohíben la calumnia electoral”. ➡️ Su primo hermano, #JuanJoséContreras, fue alcalde del municipio de #Hidalgo y ha gestionado concesiones a favor de la #ColumnaArmada #PedroJMéndez, un brazo armado del #CártelDelGolfo cuyo líder cuenta con una orden de aprehensión federal vigente por tráfico de migrantes. ➡️ El cuñado de Tania Contreras López, #JuanCarlosMaderoLarios, fue señalado como el epicentro de una red de corrupción y contrabando de combustible en la Agencia Nacional de #Aduanas. La denuncia la hizo el propio secretario de la Defensa Nacional del sexenio anterior, el general #LuisCresencioSandoval, en una carta dirigida al ex titular del Centro Nacional de Inteligencia, #AudomaroMartínezZapata. ▪️ Contexto: Aunque la autoridad electoral de Tamaulipas no tiene jurisdicción para notificar a las partes fuera del estado, en menos de dos semanas se han realizado por lo menos diez notificaciones en las instalaciones de Código Magenta y en el domicilio particular de su director editorial. ▪️Utilizando conexiones políticas y familiares dentro del Tribunal Electoral del Poder Judicial de Tamaulipas, Tania Contreras López exige sanciones para periodistas que ejercen el derecho a la crítica. La candidata a magistrada exige como medidas cautelares que se remuevan todas las publicaciones en las que es mencionada y que el medio de comunicación se abstenga de mencionarla hasta después de la #ElecciónJudicial.",1927743291136651447,https://x.com/CodigoMagentaMx/status/1927743291136651447,25,1026,1493,18495,13,https://pbs.twimg.com/media/GsC4Q7AWQAADtoo.jpg,False,,,,,es,Top
(@@TampicoGob OR @@MonicaVTampico) min_replies:0 min_faves:0 min_retweets:0,https://x.com/search?q=(@@TampicoGob OR @@MonicaVTampico) min_replies:0 min_faves:0 min_retweets:0 until:2025-05-29 since:2025-05-28&src=typed_query,Mhoni Vidente,https://x.com/mhonividente,mhonividente,True,2025-05-28 15:50:43+00:00,False,Hoy en este Día voy a dar a mis seres queridos lo mejor de mi y los llenare de Cariños y Amor.Hoy no me cansaré hasta lograr mi felicidad y por más tropiezos que tenga en la vida siempre seguiré adelante. Hoy no me afectará lo que dicen de mi y al contrario eso me hará más fuerte. HOY VOY A SER INVENCIBLE,1927754414833406147,https://x.com/mhonividente/status/1927754414833406147,40,62,493,24172,10,https://pbs.twimg.com/media/GsDCbMIXUAAJyIZ.jpg,False,,,,,es,Top
(@@TampicoGob OR @@MonicaVTampico) min_replies:0 min_faves:0 min_retweets:0,https://x.com/search?q=(@@TampicoGob OR @@MonicaVTampico) min_replies:0 min_faves:0 min_retweets:0 until:2025-05-29 since:2025-05-28&src=typed_query,Mónica Arosemena,https://x.com/MnicaArosemena1,MnicaArosemena1,False,2025-05-28 15:50:58+00:00,False,"NO SEÑOR PRESIDENTE!! ESTA BASURA, MARCELA HOLGUÍN, CORRESITA RECALCITRANTE NO PUEDE ESTAR EN SU GOBIERNO!! POR RESPETO A TODOS LOS QUE VOTAMOS Y LO SEGUIMOS APOYANDO A USTED, SÁQUELA DE SU GOBIERNO!!",1927754477576089895,https://x.com/MnicaArosemena1/status/1927754477576089895,170,823,2041,30121,5,https://pbs.twimg.com/media/GsDCelXXUAEGwmV.jpg,False,,,,,es,Top
(@@TampicoGob OR @@MonicaVTampico) min_replies:0 min_faves:0 min_retweets:0,https://x.com/search?q=(@@TampicoGob OR @@MonicaVTampico) min_replies:0 min_faves:0 min_retweets:0 until:2025-05-29 since:2025-05-28&src=typed_query,MaAlexandraSemprún,https://x.com/MaAlexandra,MaAlexandra,False,2025-05-28 15:51:00+00:00,False,"Yo no conocía personalmente a @JuanPGuanipa, ni siquiera me gustaba la imagen que proyectaba, me caía medio mal. Alguna vez me lo tropezaba en LUZ, porque dábamos clase en salones contiguos. Entonces llegó la pandemia (sigue...)",1927754486375719231,https://x.com/MaAlexandra/status/1927754486375719231,41,710,2706,277986,120,,False,,,,,es,Top
(@@TampicoGob OR @@MonicaVTampico) min_replies:0 min_faves:0 min_retweets:0,https://x.com/search?q=(@@TampicoGob OR @@MonicaVTampico) min_replies:0 min_faves:0 min_retweets:0 until:2025-05-29 since:2025-05-28&src=typed_query,(💜) SINIESTRA |,https://x.com/motherlucecita,motherlucecita,False,2025-05-28 16:01:33+00:00,False,"HOY ENTRA ELLA, MADRE FOLKLORICA, te amo Luciana🔱🏳️‍⚧️💛 VUELVE LUCIANA #GranHermano",1927757142548701357,https://x.com/motherlucecita/status/1927757142548701357,11,71,413,18785,3,https://pbs.twimg.com/media/GsDE5mFWoAAh9H1.jpg;https://pbs.twimg.com/media/GsDE5qMXUAAdLU9.jpg;https://pbs.twimg.com/media/GsDE53UXQAAMfQH.jpg;https://pbs.twimg.com/media/GsDE56jWEAARiNQ.jpg,False,,,,,es,Top
(@@TampicoGob OR @@MonicaVTampico) min_replies:0 min_faves:0 min_retweets:0,https://x.com/search?q=(@@TampicoGob OR @@MonicaVTampico) min_replies:0 min_faves:0 min_retweets:0 until:2025-05-29 since:2025-05-28&src=typed_query,laSegunda,https://x.com/La_Segunda,La_Segunda,True,2025-05-28 17:00:02+00:00,False,En Puerto Montt una persona con 460 días de permiso médico salió 20 veces del país. En Temuco un docente viajó cinco veces al extranjero y en Arica una enfermera se fue 27 días a Orlando. http://lasegunda.com,1927771859988402594,https://x.com/La_Segunda/status/1927771859988402594,28,587,423,15103,10,https://pbs.twimg.com/media/GsDR8-mXQAArGw3.jpg,False,,,,,es,Top
(@@TampicoGob OR @@MonicaVTampico) min_replies:0 min_faves:0 min_retweets:0,https://x.com/search?q=(@@TampicoGob OR @@MonicaVTampico) min_replies:0 min_faves:0 min_retweets:0 until:2025-05-29 since:2025-05-28&src=typed_query,Amilcar Mendez,https://x.com/AmilcarMendez,AmilcarMendez,False,2025-05-28 17:19:17+00:00,False,"@MaAlexandra @JuanPGuanipa Querida profa, reciba mi saludo y respeto. Quienes hemos tenido el privilegio de compartir con @JuanPGuanipa damos fe de su calidad humana: un gran político, excelente jefe, magnífico profesor, padre admirable, esposo intachable… ¡Un ser humano excepcional y un verdadero amigo!",1927776705038385336,https://x.com/AmilcarMendez/status/1927776705038385336,3,44,391,15200,3,,True,MaAlexandra,https://x.com/MaAlexandra,MaAlexandraSemprún,MaAlexandra,es,Top
(@@TampicoGob OR @@MonicaVTampico) min_replies:0 min_faves:0 min_retweets:0,https://x.com/search?q=(@@TampicoGob OR @@MonicaVTampico) min_replies:0 min_faves:0 min_retweets:0 until:2025-05-29 since:2025-05-28&src=typed_query,Boniatobill🔻☮️😇,https://x.com/muzeriqui,muzeriqui,False,2025-05-28 17:37:44+00:00,False,El mondarino... El que da asco verlo y más escucharlo se lleva más de 6000 euros todos los meses solo por alabar a su ama la Frutera... Mientras tanto no hay dinero para comida en condiciones..para niños y abuelos en los comedores.. Seguid votando a esta gentuza...,1927781349043147225,https://x.com/muzeriqui/status/1927781349043147225,219,1678,2354,26182,25,https://pbs.twimg.com/media/GsDa63CWsAAVyAc.jpg,False,,,,,es,Top
(@@TampicoGob OR @@MonicaVTampico) min_replies:0 min_faves:0 min_retweets:0,https://x.com/search?q=(@@TampicoGob OR @@MonicaVTampico) min_replies:0 min_faves:0 min_retweets:0 until:2025-05-29 since:2025-05-28&src=typed_query,検査官 Sómberlein Раскóльников,https://x.com/crimenicastigo,crimenicastigo,False,2025-05-28 18:04:41+00:00,False,"@MedinaMonica_Co Hola Mónica, me pongo a tus órdenes para hacerte un hijo prietito y que te adopten en su grupo las mamás de los güeros.",1927788129345298704,https://x.com/crimenicastigo/status/1927788129345298704,1,1,259,4932,1,,True,MedinaMonica_Co,https://x.com/MedinaMonica_Co,Mónica Co.,MedinaMonica_Co,es,Top
(@@TampicoGob OR @@MonicaVTampico) min_replies:0 min_faves:0 min_retweets:0,https://x.com/search?q=(@@TampicoGob OR @@MonicaVTampico) min_replies:0 min_faves:0 min_retweets:0 until:2025-05-29 since:2025-05-28&src=typed_query,tatooinelegrand,https://x.com/tatoamericano,tatoamericano,True,2025-05-28 18:37:46+00:00,False,"Esto está como para novela de Gustavo Bolívar... "" Sin tamales no hay paraíso"".",1927796457161028067,https://x.com/tatoamericano/status/1927796457161028067,55,611,1201,16989,1,,False,,,,,es,Top
