Query_Str,Post_URL,Author_Name,Author_Web_Page_URL,Author_Handle,Verified_Status,UTC_Time,Ads,Tweet_Content,Post_ID,Tweet_URL,Reply_Count,Repost_Count,Like_Count,View_Count,Bookmark_Count,Tweet_Image_URL,Replying_to,Reply_to_Whom,Reply_to_Whom_URL,Reply_to_Whom_Username,Reply_to_Whom_Handle,Language,Type
(@@TampicoGob OR @@MonicaVTampico) min_replies:0 min_faves:0 min_retweets:0,https://x.com/search?q=(@@TampicoGob OR @@MonicaVTampico) min_replies:0 min_faves:0 min_retweets:0 until:2025-05-23 since:2025-05-22&src=typed_query,MÓNICA RODRÍGUEZ 🐤,https://x.com/MONYRODRIGUEZOF,MONYRODRIGUEZOF,True,2025-05-22 23:56:18+00:00,False,No mueren de hambre. LOS MATAN DE HAMBRE.,1925702288502358205,https://x.com/MONYRODRIGUEZOF/status/1925702288502358205,30,391,918,14957,3,,False,,,,,es,Top
(@@TampicoGob OR @@MonicaVTampico) min_replies:0 min_faves:0 min_retweets:0,https://x.com/search?q=(@@TampicoGob OR @@MonicaVTampico) min_replies:0 min_faves:0 min_retweets:0 until:2025-05-24 since:2025-05-23&src=typed_query,SpookyCoincidence,https://x.com/spookynicks_,spookynicks_,False,2025-05-23 00:18:15+00:00,False,"la vida no es justa, a ella no solo le dieron la cara más angelada del mundo si no también ese tremendo orto y al resto nos tocó ser la mona jimenez",1925707814971805933,https://x.com/spookynicks_/status/1925707814971805933,4,134,2821,29258,22,,False,,,,,es,Top
(@@TampicoGob OR @@MonicaVTampico) min_replies:0 min_faves:0 min_retweets:0,https://x.com/search?q=(@@TampicoGob OR @@MonicaVTampico) min_replies:0 min_faves:0 min_retweets:0 until:2025-05-24 since:2025-05-23&src=typed_query,Dr. Ribeiro_MD,https://x.com/DrRibeiro_MD,DrRibeiro_MD,True,2025-05-23 00:25:56+00:00,False,@monicabergamo O ditador que anistiou os terroristas e entregou o governo pros civis de forma voluntária. Em contraste com os “democratas” que se dizem “jornalistas” mas passam pano pra tirano que é pego mandando ser criativo pra fechar revista.,1925709748126560415,https://x.com/DrRibeiro_MD/status/1925709748126560415,3,23,461,2701,2,,True,monicabergamo,https://x.com/monicabergamo,Mônica Bergamo,monicabergamo,pt,Top
(@@TampicoGob OR @@MonicaVTampico) min_replies:0 min_faves:0 min_retweets:0,https://x.com/search?q=(@@TampicoGob OR @@MonicaVTampico) min_replies:0 min_faves:0 min_retweets:0 until:2025-05-24 since:2025-05-23&src=typed_query,kei ✧,https://x.com/tsmanuscriptt,tsmanuscriptt,False,2025-05-23 00:37:22+00:00,False,"JUSTO pampita que perdió a una nena y ya bastante tiene que cargar con ese dolor se va a poner a ojear a una pendeja ajena. Mamita, el nivel de pelotudez que maneja esta mina",1925712626656432279,https://x.com/tsmanuscriptt/status/1925712626656432279,5,19,291,62224,33,https://pbs.twimg.com/ext_tw_video_thumb/1925668171630927872/pu/img/DRC4msdAmHXDS0il.jpg,False,,,,,es,Top
(@@TampicoGob OR @@MonicaVTampico) min_replies:0 min_faves:0 min_retweets:0,https://x.com/search?q=(@@TampicoGob OR @@MonicaVTampico) min_replies:0 min_faves:0 min_retweets:0 until:2025-05-24 since:2025-05-23&src=typed_query,desaparecidas argentina,https://x.com/desaparecidaorg,desaparecidaorg,False,2025-05-23 00:52:45+00:00,False,"Mónica Patricia Dávila tiene 63 años, desapareció el 18/5/25 en Los Hornos, La Plata, provincia de Buenos Aires. Es delgada, altura 1,50. Tiene dificultad para caminar. Por favor compartir y avisar #Urgente a la policía local, o al ☎️ 911 #LosHornos #LaPlata #BuenosAires",1925716495658606593,https://x.com/desaparecidaorg/status/1925716495658606593,0,771,202,7258,0,https://pbs.twimg.com/media/GrmE8obWYAAbrCw.jpg,False,,,,,es,Top
(@@TampicoGob OR @@MonicaVTampico) min_replies:0 min_faves:0 min_retweets:0,https://x.com/search?q=(@@TampicoGob OR @@MonicaVTampico) min_replies:0 min_faves:0 min_retweets:0 until:2025-05-24 since:2025-05-23&src=typed_query,Pelwchi,https://x.com/pelwchi,pelwchi,True,2025-05-23 00:55:24+00:00,False,"Otra prueba más de la ingobernabilidad de @MarinadelPilar en BC. En lugar de atender la inseguridad, desapariciones, feminicidios e impunidad... ¿Qué creen que está haciendo? Una campaña para limpiar su imagen, repartiendo ""ayudas"" tarjetas, dinero, despensas, obligando a trabajadores de oficinas de gobierno a asistir para que aplaudan como focas y hagan ""la ola"". ⚠️Hoy sicarios se vistieron de enfermeros y rematan en el Hospital General de Tijuana. a Wendy Lizeth Martinez de 39 años, quien un día antes había sufrido un ataque armado.",1925717164008378582,https://x.com/pelwchi/status/1925717164008378582,14,234,299,9154,7,https://pbs.twimg.com/ext_tw_video_thumb/1925717071859490816/pu/img/oD7JxN7XcRjXc0uB.jpg;https://pbs.twimg.com/media/GrmFeoxWAAEVV_3.jpg,False,,,,,es,Top
(@@TampicoGob OR @@MonicaVTampico) min_replies:0 min_faves:0 min_retweets:0,https://x.com/search?q=(@@TampicoGob OR @@MonicaVTampico) min_replies:0 min_faves:0 min_retweets:0 until:2025-05-24 since:2025-05-23&src=typed_query,Rochi🎸🦂🐐,https://x.com/rochicabj1905,rochicabj1905,True,2025-05-23 01:19:17+00:00,False,La Tana no se puede ir: 🇦🇷 KATIA AL 9009 🇺🇾 VOTO KATIA AL 7020 #GranHermano,1925723175721095210,https://x.com/rochicabj1905/status/1925723175721095210,15,151,627,7213,9,https://pbs.twimg.com/ext_tw_video_thumb/1925723137921957888/pu/img/Eq1F1duQOlfqJFqH.jpg,False,,,,,es,Top
(@@TampicoGob OR @@MonicaVTampico) min_replies:0 min_faves:0 min_retweets:0,https://x.com/search?q=(@@TampicoGob OR @@MonicaVTampico) min_replies:0 min_faves:0 min_retweets:0 until:2025-05-24 since:2025-05-23&src=typed_query,Agustín,https://x.com/Agucassa,Agucassa,False,2025-05-23 01:21:21+00:00,False,"Tana: ""te pones a tomar y haces mamarrachos"" LA DESTROZÓ #GranHermano",1925723693239427217,https://x.com/Agucassa/status/1925723693239427217,142,938,8469,155766,179,https://pbs.twimg.com/ext_tw_video_thumb/1925723662373490688/pu/img/YJ-1HJ0Rfs4v3RNZ.jpg,False,,,,,es,Top
(@@TampicoGob OR @@MonicaVTampico) min_replies:0 min_faves:0 min_retweets:0,https://x.com/search?q=(@@TampicoGob OR @@MonicaVTampico) min_replies:0 min_faves:0 min_retweets:0 until:2025-05-24 since:2025-05-23&src=typed_query,LalaAri,https://x.com/LalaLm327,LalaLm327,True,2025-05-23 01:24:43+00:00,False,"Juan Pablo, esta diciendo que la Tana le hizo la fulminante porque no le conto que Luz le tomo la cerveza, HACE 3 SEMANAS. No no no no ES UN PELOTUDO!!!!!!!! ES UN MISMISMO PELOTUDO #Granhermano",1925724539331260788,https://x.com/LalaLm327/status/1925724539331260788,5,101,597,3243,3,,False,,,,,es,Top
(@@TampicoGob OR @@MonicaVTampico) min_replies:0 min_faves:0 min_retweets:0,https://x.com/search?q=(@@TampicoGob OR @@MonicaVTampico) min_replies:0 min_faves:0 min_retweets:0 until:2025-05-24 since:2025-05-23&src=typed_query,laura,https://x.com/micachapame,micachapame,False,2025-05-23 01:27:19+00:00,False,"tana: aprendé a quererte insegura eugenia: mirá como tira golpes bajos la ESTÚPIDA tana: te falta amor, tomás y haces mamarrachos LA ACOGOTADA DEVORÓ, AYER EUGENIA LE TIRÓ DEL NOVIO Y QUE NO TENÍA AMIGOS A LUZ Y AHORA LLORA GOLPES BAJOS JAJAJJJSJJS LUZ AL 9009 #GranHermano",1925725197316878440,https://x.com/micachapame/status/1925725197316878440,62,598,6282,202066,164,https://pbs.twimg.com/amplify_video_thumb/1925724768222707712/img/ox1EH9dPOKqAC1eM.jpg,False,,,,,es,Top
(@@TampicoGob OR @@MonicaVTampico) min_replies:0 min_faves:0 min_retweets:0,https://x.com/search?q=(@@TampicoGob OR @@MonicaVTampico) min_replies:0 min_faves:0 min_retweets:0 until:2025-05-24 since:2025-05-23&src=typed_query,Antonio Guerrero Rodriguez,https://x.com/Guerrerotony161,Guerrerotony161,False,2025-05-23 01:31:35+00:00,False,Hoy mami cumple 93. Le prometí publicar estás fotos en familia para que llegaran a tantas gentes que la admiran y aman como madre de #LosCinco #Cuba,1925726267338285428,https://x.com/Guerrerotony161/status/1925726267338285428,98,823,920,9659,0,https://pbs.twimg.com/media/GrmNovOWMAAwU4t.jpg;https://pbs.twimg.com/media/GrmNqtrXIAE5MR2.jpg;https://pbs.twimg.com/media/GrmNsBQXgAEag6F.jpg;https://pbs.twimg.com/media/GrmN0oOWwAAsdQO.jpg,False,,,,,es,Top
(@@TampicoGob OR @@MonicaVTampico) min_replies:0 min_faves:0 min_retweets:0,https://x.com/search?q=(@@TampicoGob OR @@MonicaVTampico) min_replies:0 min_faves:0 min_retweets:0 until:2025-05-24 since:2025-05-23&src=typed_query,Gianina Iglesias,https://x.com/giglesias19,giglesias19,False,2025-05-23 01:44:42+00:00,False,El lunes ya estaba bancando a la Tana en la Previa. Luego hizo la fulminante y me confirmó que merece el aguante. Hoy es ella contra todos los hongos y la verdad SIGO BANCANDO #GranHermano,1925729569601970553,https://x.com/giglesias19/status/1925729569601970553,2,20,411,24220,9,https://pbs.twimg.com/ext_tw_video_thumb/1925729161600987137/pu/img/LD-eUt_-hUG8WsD0.jpg,False,,,,,es,Top
(@@TampicoGob OR @@MonicaVTampico) min_replies:0 min_faves:0 min_retweets:0,https://x.com/search?q=(@@TampicoGob OR @@MonicaVTampico) min_replies:0 min_faves:0 min_retweets:0 until:2025-05-24 since:2025-05-23&src=typed_query,Mónica O. abogada,https://x.com/Monicao2712,Monicao2712,True,2025-05-23 02:13:29+00:00,False,"🚨🚨¡ATENCIÓN PUEBLO DE MÉXICO!📢 Debemos hacer que la justicia llegue a la gente.📢 Por eso yo con @cesargutipri. Por una @SCJN de puertas abiertas, que sea verdadera garante de los derechos humanos. ¡Hasta que la justicia se haga ley!Vota por el ##AbogadoDelPueblo César Mario Gutiérrez Priego, @cesargutipri para ministro de la @SCJN. Boleta morada 🟣 #vota49 #GutierrezPriego49 🙌🫶 #YoSiVoto #EleccionJudicial #EleccionesJudiciales",1925736814867779964,https://x.com/Monicao2712/status/1925736814867779964,6,304,585,2737,9,https://pbs.twimg.com/ext_tw_video_thumb/1925736740876083200/pu/img/MHaFB-sBn7TCEzq8.jpg,False,,,,,es,Top
(@@TampicoGob OR @@MonicaVTampico) min_replies:0 min_faves:0 min_retweets:0,https://x.com/search?q=(@@TampicoGob OR @@MonicaVTampico) min_replies:0 min_faves:0 min_retweets:0 until:2025-05-24 since:2025-05-23&src=typed_query,Monica gab. Lic. en Interiorismo!!,https://x.com/MonicaToledoCa1,MonicaToledoCa1,False,2025-05-23 02:27:39+00:00,False,Mexico ocupa más ciudadanos conscientes y menos fanáticos…!,1925740379279597855,https://x.com/MonicaToledoCa1/status/1925740379279597855,101,438,831,7738,5,https://pbs.twimg.com/media/Grmaqp5XEAAYqnU.jpg,False,,,,,es,Top
(@@TampicoGob OR @@MonicaVTampico) min_replies:0 min_faves:0 min_retweets:0,https://x.com/search?q=(@@TampicoGob OR @@MonicaVTampico) min_replies:0 min_faves:0 min_retweets:0 until:2025-05-24 since:2025-05-23&src=typed_query,134 años de gloria💛🖤🇺🇾,https://x.com/Miriam_CAP1891,Miriam_CAP1891,False,2025-05-23 03:17:53+00:00,False,"ERA LA TORA OBVIO POR ESO LE SACÓ SU COMIDA, LO QUE NUNCA PODRÁS ES CONSEGUIR EL AMOR DE LA GENTE ASÍ COMO LO TIENE TATO!!👊🏻👊🏻 TATO AL 9009 🇦🇷 VOTO TATO AL 7020 🇺🇾 #GranHermano",1925753022103048370,https://x.com/Miriam_CAP1891/status/1925753022103048370,34,140,353,8148,2,https://pbs.twimg.com/media/GrmmJHbXcAADsaB.jpg,False,,,,,es,Top
(@@TampicoGob OR @@MonicaVTampico) min_replies:0 min_faves:0 min_retweets:0,https://x.com/search?q=(@@TampicoGob OR @@MonicaVTampico) min_replies:0 min_faves:0 min_retweets:0 until:2025-05-24 since:2025-05-23&src=typed_query,kiwi,https://x.com/notwikiwi,notwikiwi,False,2025-05-23 03:33:59+00:00,False,"Miss Tumbes me está vendiendo su saquito, su bolerito me lo está vendiendo, unidad a 30 soles, 2x50, aprovéchame casera.",1925757070789263374,https://x.com/notwikiwi/status/1925757070789263374,5,13,415,23587,3,https://pbs.twimg.com/media/Grmp2NhWQAAQUWD.jpg,True,notwikiwi,https://x.com/notwikiwi,,notwikiwi,es,Top
(@@TampicoGob OR @@MonicaVTampico) min_replies:0 min_faves:0 min_retweets:0,https://x.com/search?q=(@@TampicoGob OR @@MonicaVTampico) min_replies:0 min_faves:0 min_retweets:0 until:2025-05-24 since:2025-05-23&src=typed_query,kiwi,https://x.com/notwikiwi,notwikiwi,False,2025-05-23 03:38:37+00:00,False,"Miss Cusco, ahí está para encima una caja de chelas. ¿Qué es eso? ¿Por qué el fotógrafo le dijo posa así? La odia, la odia, te odian, hermana. Pero ¿sabes qué me da? Me da Silvana Cañote. El rostro se parece un poco, no? Pero esas panticitas… Dios mío.",1925758237158047903,https://x.com/notwikiwi/status/1925758237158047903,4,8,216,23094,7,https://pbs.twimg.com/media/Grmq6FnWgAEQqG2.jpg,True,notwikiwi,https://x.com/notwikiwi,,notwikiwi,es,Top
(@@TampicoGob OR @@MonicaVTampico) min_replies:0 min_faves:0 min_retweets:0,https://x.com/search?q=(@@TampicoGob OR @@MonicaVTampico) min_replies:0 min_faves:0 min_retweets:0 until:2025-05-24 since:2025-05-23&src=typed_query,kiwi,https://x.com/notwikiwi,notwikiwi,False,2025-05-23 03:40:46+00:00,False,¿Cómo que Gamarra? Miss mercado de frutas. Miss terminal pesquero. Miss mercado 2 de Surquillo. Ya no saben qué inventarse la Jessica. ¿Y esa foto qué? Me da Mónica Cabrejos. Me da Laura Bozzo. Está sentada así como si fuera un talk show. ¿Qué es eso? Y todavía se tapa la cuca.,1925758777342496977,https://x.com/notwikiwi/status/1925758777342496977,4,22,299,21577,7,https://pbs.twimg.com/media/GrmrZmNWMAAf7Zc.jpg,True,notwikiwi,https://x.com/notwikiwi,,notwikiwi,es,Top
(@@TampicoGob OR @@MonicaVTampico) min_replies:0 min_faves:0 min_retweets:0,https://x.com/search?q=(@@TampicoGob OR @@MonicaVTampico) min_replies:0 min_faves:0 min_retweets:0 until:2025-05-24 since:2025-05-23&src=typed_query,Cultura Pop,https://x.com/RCulturaPop,RCulturaPop,False,2025-05-23 04:51:11+00:00,False,"Como el caso ""Alexa Hoffman"" no le funcionó. Ahora @MonickHuitron busca ganar reproducciones a costillas de @JorgeCarbajalOf",1925776498566283273,https://x.com/RCulturaPop/status/1925776498566283273,37,29,246,13182,5,https://pbs.twimg.com/media/Grm7hTwXQAAFUZC.jpg,False,,,,,es,Top
(@@TampicoGob OR @@MonicaVTampico) min_replies:0 min_faves:0 min_retweets:0,https://x.com/search?q=(@@TampicoGob OR @@MonicaVTampico) min_replies:0 min_faves:0 min_retweets:0 until:2025-05-24 since:2025-05-23&src=typed_query,diego manarelli,https://x.com/manarellidiego,manarellidiego,False,2025-05-23 05:14:09+00:00,False,ÉSTA NO ES UNA DE LAS TANTAS ARTISTAS QUE SALIERON APOYAR A LA DELINCUENTE SUSANA VILLARÁN POR TODO LADOS SALÍA LA INFELIZ A PEDIR NO A LA REVOCACIÓN.Y AHORA LOS LIMEÑOS X CULPA DE ESTA MIERDA TENEMOS QUE PAGAR PEAJES CARÍSIMO POR MI QUE TE QUITEN TODA TUS REGALÍAS MÓNICA SÁNCHEZ,1925782279143457142,https://x.com/manarellidiego/status/1925782279143457142,119,253,696,22306,10,https://pbs.twimg.com/ext_tw_video_thumb/1925782210029711360/pu/img/rLNFlLyyIFywUtUl.jpg,False,,,,,es,Top
(@@TampicoGob OR @@MonicaVTampico) min_replies:0 min_faves:0 min_retweets:0,https://x.com/search?q=(@@TampicoGob OR @@MonicaVTampico) min_replies:0 min_faves:0 min_retweets:0 until:2025-05-24 since:2025-05-23&src=typed_query,Ryo 💞,https://x.com/ryo_hermoso,ryo_hermoso,True,2025-05-23 05:22:43+00:00,False,¡QUE VIVA NUESTRA QUERIDA PRESIDENTA NORMA PIÑA! 👏👏 Para ella todo mi APOYO RESPETO Y GRATITUD! 👏👏👏 Fue a poner MUY EN ALTO EL NOMBRE DE MÉXICO! 🇲🇽 Esto fue en La CUMBRE JUDICIAL IBEROAMERICANA! #YoNoVotoElPrimeroDeJunio Recibiendo LA OVACIÓN DE LOS ASISTENTES.👇👏👏,1925784437452575160,https://x.com/ryo_hermoso/status/1925784437452575160,282,4236,10484,107733,171,https://pbs.twimg.com/ext_tw_video_thumb/1925784378375823360/pu/img/JJ_u2Gl742Q6d39N.jpg,False,,,,,es,Top
(@@TampicoGob OR @@MonicaVTampico) min_replies:0 min_faves:0 min_retweets:0,https://x.com/search?q=(@@TampicoGob OR @@MonicaVTampico) min_replies:0 min_faves:0 min_retweets:0 until:2025-05-24 since:2025-05-23&src=typed_query,Amaranta Arcadia 🌺🌷🦗🐝🦋🐞🦀🐒,https://x.com/amarcadia,amarcadia,False,2025-05-23 05:59:01+00:00,False,"@MonicaVTampico Veo que está respondiendo en @LaJornada el tema de cultura en #Tampico. Lo que se discute es que hay áreas que no son atendidas en términos culturales. Por ejemplo, lo que cita de Literatura y lectura, son grupos de lectura que no formó el municipio. Y ...",1925793568959922413,https://x.com/amarcadia/status/1925793568959922413,1,0,0,90,0,,True,MonicaVTampico,https://x.com/MonicaVTampico,Mónica Villarreal Anaya,MonicaVTampico,es,Top
(@@TampicoGob OR @@MonicaVTampico) min_replies:0 min_faves:0 min_retweets:0,https://x.com/search?q=(@@TampicoGob OR @@MonicaVTampico) min_replies:0 min_faves:0 min_retweets:0 until:2025-05-24 since:2025-05-23&src=typed_query,Monica 🍀⚘️🌍📚🐞🎧,https://x.com/Monica09058845,Monica09058845,True,2025-05-23 06:01:50+00:00,False,Eccomiiiii....buongiorno a tutti amici miei☕️☕️☕️😘😘😘...una rosa del mio giardino🤩🤩🤩,1925794279030505679,https://x.com/Monica09058845/status/1925794279030505679,130,50,404,3943,1,https://pbs.twimg.com/media/GrnLsNHWwAAHqQ3.jpg,False,,,,,it,Top
(@@TampicoGob OR @@MonicaVTampico) min_replies:0 min_faves:0 min_retweets:0,https://x.com/search?q=(@@TampicoGob OR @@MonicaVTampico) min_replies:0 min_faves:0 min_retweets:0 until:2025-05-24 since:2025-05-23&src=typed_query,AnaAIonso,https://x.com/anaalonsogonza1,anaalonsogonza1,False,2025-05-23 07:46:38+00:00,False,"Dijo el que nos metió en una guerra ilegal porque, con los pies encima de una mesa y con su ridículo acento tejano, aseguró que había ARMAS DE DESTRUCCIÓN MASIVA… 192 VÍCTIMAS ESO, sí que fue inaceptable, mamarracho!",1925820654445559894,https://x.com/anaalonsogonza1/status/1925820654445559894,69,331,610,6578,3,https://pbs.twimg.com/media/GrnjrW8WMAAEYdO.jpg,False,,,,,es,Top
(@@TampicoGob OR @@MonicaVTampico) min_replies:0 min_faves:0 min_retweets:0,https://x.com/search?q=(@@TampicoGob OR @@MonicaVTampico) min_replies:0 min_faves:0 min_retweets:0 until:2025-05-24 since:2025-05-23&src=typed_query,Pasiones Ocultas,https://x.com/LatidosDePasion,LatidosDePasion,True,2025-05-23 10:35:40+00:00,False,La policía la encontró en un restaurante de lujo. - Sobrina de un narco. - Traficaba entre Colombia y México. - Salió libre... y JAMÁS delató a nadie. Era “La Reina del Pacífico”. La mujer que CRUZÓ el infierno… sin una sola mancha de sangre. 👇🧵,1925863193668165892,https://x.com/LatidosDePasion/status/1925863193668165892,21,288,1633,320531,582,https://pbs.twimg.com/media/GroKXoeXwAAD7bZ.jpg,False,,,,,es,Top
(@@TampicoGob OR @@MonicaVTampico) min_replies:0 min_faves:0 min_retweets:0,https://x.com/search?q=(@@TampicoGob OR @@MonicaVTampico) min_replies:0 min_faves:0 min_retweets:0 until:2025-05-24 since:2025-05-23&src=typed_query,LA MONA QUILOMBERA 2.0 🗡🐵,https://x.com/MONAQUILOMBERA,MONAQUILOMBERA,False,2025-05-23 11:49:45+00:00,False,AMO A ESTOS DEMENTES ENOJADOS PORQUE LA TORA SE LLEVÓ 3 MASITAS SIN TACC DE TATO 🙏🏽😭,1925881836695163142,https://x.com/MONAQUILOMBERA/status/1925881836695163142,20,8,214,12528,6,,False,,,,,es,Top
(@@TampicoGob OR @@MonicaVTampico) min_replies:0 min_faves:0 min_retweets:0,https://x.com/search?q=(@@TampicoGob OR @@MonicaVTampico) min_replies:0 min_faves:0 min_retweets:0 until:2025-05-24 since:2025-05-23&src=typed_query,ℙ𝕒𝕓𝕝𝕠 𝕃𝕖𝕠𝕟 𝕊𝕚𝕝𝕧𝕒,https://x.com/pabloleonsilva,pabloleonsilva,True,2025-05-23 12:48:20+00:00,False,"En esta designación @DanielNoboaOk si que la embarró,. Si hay otra gente de más confianza, porque esta mujer que estuvo hasta metida con la ley mordaza y es amiga de #jeronimo.",1925896579279446343,https://x.com/pabloleonsilva/status/1925896579279446343,90,406,548,13546,1,,False,,,,,es,Top
(@@TampicoGob OR @@MonicaVTampico) min_replies:0 min_faves:0 min_retweets:0,https://x.com/search?q=(@@TampicoGob OR @@MonicaVTampico) min_replies:0 min_faves:0 min_retweets:0 until:2025-05-24 since:2025-05-23&src=typed_query,MIB,https://x.com/deporpiba_,deporpiba_,False,2025-05-23 13:01:00+00:00,False,Que ser vacío de alma y lleno de miseria sos @toritavillar Hoy fuiste una buena empleada al costo de ser una pésima persona Me parece aberrante vender los valores por billetes que se gastan pronto Definitivamente siempre te faltó amor Me quedo del lado TATO de la vida SIEMPRE,1925899766753300959,https://x.com/deporpiba_/status/1925899766753300959,9,101,402,2640,1,,False,,,,,es,Top
(@@TampicoGob OR @@MonicaVTampico) min_replies:0 min_faves:0 min_retweets:0,https://x.com/search?q=(@@TampicoGob OR @@MonicaVTampico) min_replies:0 min_faves:0 min_retweets:0 until:2025-05-24 since:2025-05-23&src=typed_query,Bere Aguilar,https://x.com/bereaguilarv,bereaguilarv,True,2025-05-23 13:06:37+00:00,False,"El gobierno de Tamaulipas, al rescate de Tania Contreras. En donde de plano se olvidaron de cuidar las apariencias fue en el gobierno de Tamaulipas, que acudió al rescate de la magistrada Tania Contreras, en el ojo del huracán por su intención de censurar cualquier información sobre ella y el huachicol fiscal, con el pretexto de que es “violencia política de género”. Desde el gobierno tamaulipeco, Jorge Luis Beas Gámez, subsecretario de Legalidad y Servicios Gubernamentales, se dedicó a difundir el video que Tania Contreras grabó para decirse víctima de la prensa a la que quiere censurar. Además de su cargo como responsable de la “legalidad” en la administración estatal, Jorge Luis es esposo de Contreras. Todo en familia y con el gobierno, pues. Bajo Reserva",1925901178958729403,https://x.com/bereaguilarv/status/1925901178958729403,60,1778,2681,42317,33,https://pbs.twimg.com/media/Gros6gsXkAAWIRI.jpg,False,,,,,es,Top
(@@TampicoGob OR @@MonicaVTampico) min_replies:0 min_faves:0 min_retweets:0,https://x.com/search?q=(@@TampicoGob OR @@MonicaVTampico) min_replies:0 min_faves:0 min_retweets:0 until:2025-05-24 since:2025-05-23&src=typed_query,nataMIRitis,https://x.com/nataMIRitis,nataMIRitis,False,2025-05-23 13:36:14+00:00,False,Mónica no vuelve a hacer una guardia en la vida. Por eso le da igual que el resto las hagamos,1925908632954192335,https://x.com/nataMIRitis/status/1925908632954192335,1,56,350,18295,1,,False,,,,,es,Top
(@@TampicoGob OR @@MonicaVTampico) min_replies:0 min_faves:0 min_retweets:0,https://x.com/search?q=(@@TampicoGob OR @@MonicaVTampico) min_replies:0 min_faves:0 min_retweets:0 until:2025-05-24 since:2025-05-23&src=typed_query,Mónica Naranjo,https://x.com/monicanaranjo,monicanaranjo,False,2025-05-23 14:07:14+00:00,False,ALGUIEN ESTÁ DE CUMPLE…!! 🎂😎🎉 Seguimos sumando y cantando vida…!! 🎶😌 #GreatestHitsTour #MónicaNaranjo,1925916436142100825,https://x.com/monicanaranjo/status/1925916436142100825,88,82,715,15784,8,https://pbs.twimg.com/media/Gro6ycDWIAATj8U.jpg,False,,,,,es,Top
(@@TampicoGob OR @@MonicaVTampico) min_replies:0 min_faves:0 min_retweets:0,https://x.com/search?q=(@@TampicoGob OR @@MonicaVTampico) min_replies:0 min_faves:0 min_retweets:0 until:2025-05-24 since:2025-05-23&src=typed_query,Mar Lara 🌊,https://x.com/MarLara_Oficial,MarLara_Oficial,True,2025-05-23 14:15:28+00:00,False,"Hace 5 meses me tuve que despedir de ti y fue el momento más difícil y doloroso de mi vida, cada día duele más tu partida en cuerpo pero sé que estás conmigo en alma y me acompañas en todo momento, te extraño mi Tomiringo, el brillo de tus ojos siempre será mi constelación favorita 🤍",1925918505796272546,https://x.com/MarLara_Oficial/status/1925918505796272546,134,207,1943,30142,37,https://pbs.twimg.com/media/Gro8qaEW4AAjYAp.jpg,False,,,,,es,Top
(@@TampicoGob OR @@MonicaVTampico) min_replies:0 min_faves:0 min_retweets:0,https://x.com/search?q=(@@TampicoGob OR @@MonicaVTampico) min_replies:0 min_faves:0 min_retweets:0 until:2025-05-24 since:2025-05-23&src=typed_query,Joline,https://x.com/tres_joline,tres_joline,False,2025-05-23 14:31:33+00:00,False,"MOMOKO TANIKAWA 🔥 What a goal! The first touch, the 🥜, the shot — just wow 🤯",1925922555438747782,https://x.com/tres_joline/status/1925922555438747782,2,49,418,14282,27,https://pbs.twimg.com/amplify_video_thumb/1925922447443828737/img/jM8mNI0heVZJjv5x.jpg,False,,,,,en,Top
(@@TampicoGob OR @@MonicaVTampico) min_replies:0 min_faves:0 min_retweets:0,https://x.com/search?q=(@@TampicoGob OR @@MonicaVTampico) min_replies:0 min_faves:0 min_retweets:0 until:2025-05-24 since:2025-05-23&src=typed_query,Antonia Tomasi Vásquez,https://x.com/toniatomasi,toniatomasi,True,2025-05-23 14:32:44+00:00,False,"Con 78 años, y mi alma y mi corazón lleno de esperanza, arriesgando mi seguridad, salí a votar las últimas elecciones. El nombramiento de Marcela Aguiñaga, me ha dejado con la ingrata sensación de que se cambio todo para no cambiar nada. Exijo el respeto que nos merecemos.",1925922851426631699,https://x.com/toniatomasi/status/1925922851426631699,106,388,1024,50131,7,,False,,,,,es,Top
(@@TampicoGob OR @@MonicaVTampico) min_replies:0 min_faves:0 min_retweets:0,https://x.com/search?q=(@@TampicoGob OR @@MonicaVTampico) min_replies:0 min_faves:0 min_retweets:0 until:2025-05-24 since:2025-05-23&src=typed_query,Gurú Político,https://x.com/guruchuirer,guruchuirer,True,2025-05-23 14:46:08+00:00,False,"🚨Duro Golpe al Narco: Aseguran 1.28 Toneladas de Cocaína en Michoacán, con Valor de 310 MDP👇 @OHarfuch https://www.noticiaszmg.com/zmg82196.htm",1925926225316331626,https://x.com/guruchuirer/status/1925926225316331626,2,140,271,2255,3,,False,,,,,es,Top
(@@TampicoGob OR @@MonicaVTampico) min_replies:0 min_faves:0 min_retweets:0,https://x.com/search?q=(@@TampicoGob OR @@MonicaVTampico) min_replies:0 min_faves:0 min_retweets:0 until:2025-05-24 since:2025-05-23&src=typed_query,Monica gab. Lic. en Interiorismo!!,https://x.com/MonicaToledoCa1,MonicaToledoCa1,False,2025-05-23 15:08:58+00:00,False,Y esto no está prohibido 🚫 verdad Guadalupe Taddei??? Sigue haciéndote pendeja ya sabemos que eres una traidora vendida. Toda tu familia está en la nómina de Morena.,1925931971902869521,https://x.com/MonicaToledoCa1/status/1925931971902869521,37,555,690,6827,5,https://pbs.twimg.com/media/GrpI63NXUAAoY4u.jpg,False,,,,,es,Top
