Query_Str,Post_URL,Author_Name,Author_Web_Page_URL,Author_Handle,Verified_Status,UTC_Time,Ads,Tweet_Content,Post_ID,Tweet_URL,Reply_Count,Repost_Count,Like_Count,View_Count,Bookmark_Count,Tweet_Image_URL,Replying_to,Reply_to_Whom,Reply_to_Whom_URL,Reply_to_Whom_Username,Reply_to_Whom_Handle,Language,Type
(@@TampicoGob OR @@MonicaVTampico) min_replies:0 min_faves:0 min_retweets:0,https://x.com/search?q=(@@TampicoGob OR @@MonicaVTampico) min_replies:0 min_faves:0 min_retweets:0 until:2025-05-25 since:2025-05-24&src=typed_query,Volkova,https://x.com/generalsummoner,generalsummoner,False,2025-05-24 03:41:44+00:00,False,"TOXIMILO VAN A DORMIR JUNTOS ARRIBA. HOY NO DUERMO. JUEPUTA. HOY ME TRASNOCHO. @CanalRCN, A MI NO ME PONGAS A LOS CULEONES DESDE YA TE DIGO. A MI ME PONES EL TOXIMILO. #LaCasaDeLosFamososCol2 #LCDLFCOL #LaCasaDeLosFamososCol",1926121409572458679,https://x.com/generalsummoner/status/1926121409572458679,13,26,391,6387,6,https://pbs.twimg.com/media/Grr1NeLXIAAyKRL.jpg,False,,,,,es,Top
(@@TampicoGob OR @@MonicaVTampico) min_replies:0 min_faves:0 min_retweets:0,https://x.com/search?q=(@@TampicoGob OR @@MonicaVTampico) min_replies:0 min_faves:0 min_retweets:0 until:2025-05-25 since:2025-05-24&src=typed_query,FLORENCIA 🖤💛🖤,https://x.com/Flo_0708,Flo_0708,True,2025-05-24 03:50:58+00:00,False,Tato - Luz - Luciana - Luchi 🖇️💘💘💘. #GranHermano #GranHermanoAr,1926123735028732030,https://x.com/Flo_0708/status/1926123735028732030,3,39,233,3582,2,,False,,,,,es,Top
(@@TampicoGob OR @@MonicaVTampico) min_replies:0 min_faves:0 min_retweets:0,https://x.com/search?q=(@@TampicoGob OR @@MonicaVTampico) min_replies:0 min_faves:0 min_retweets:0 until:2025-05-25 since:2025-05-24&src=typed_query,P. Santacruz 🇻🇦🇪🇸,https://x.com/Fernand3705321,Fernand3705321,False,2025-05-24 05:27:06+00:00,False,24 de mayo: María Auxiliadora. «En el cielo nos quedaremos gratamente sorprendidos al conocer todo lo que María Auxiliadora ha hecho por nosotros en la tierra». San Juan Bosco (1815-1888),1926147925979152462,https://x.com/Fernand3705321/status/1926147925979152462,1,143,542,8568,27,https://pbs.twimg.com/media/GrsNVDXXoAEdPhK.jpg,False,,,,,es,Top
(@@TampicoGob OR @@MonicaVTampico) min_replies:0 min_faves:0 min_retweets:0,https://x.com/search?q=(@@TampicoGob OR @@MonicaVTampico) min_replies:0 min_faves:0 min_retweets:0 until:2025-05-25 since:2025-05-24&src=typed_query,Linda Salazar ✌🏼️,https://x.com/LindaSalazar24,LindaSalazar24,False,2025-05-24 06:24:21+00:00,False,"La más dedicada, entregada y guerrera del condado. Orgullosa de ti SIEMPRE! ⚔️🛡️",1926162332486414411,https://x.com/LindaSalazar24/status/1926162332486414411,16,95,957,19294,14,,False,,,,,es,Top
(@@TampicoGob OR @@MonicaVTampico) min_replies:0 min_faves:0 min_retweets:0,https://x.com/search?q=(@@TampicoGob OR @@MonicaVTampico) min_replies:0 min_faves:0 min_retweets:0 until:2025-05-25 since:2025-05-24&src=typed_query,𝑴𝒆𝒍ania🩵,https://x.com/melania0880,melania0880,False,2025-05-24 07:38:55+00:00,False,"Me desperté con un nudo en el pecho. No dejo de pensar en @JuanPGuanipa. Y sí, lo sé: no es el único. Son muchos los que han sido perseguidos, detenidos, silenciados. Mi compromiso es con todos, con cada nombre y con cada historia. Pero esto me duele distinto. Porque a Juan Pablo lo hemos tenido cerca, lo hemos escuchado, lo hemos visto estar… sin cálculos, sin máscaras. Recuerdo como si fuera ayer aquella entrevista con Camila, donde ella decía que su mayor sueño era conocerlo. Y bastó un mensaje, un solo mensaje, para que él entrara al espacio y le regalara a esa niña un momento inolvidable. Así era. Así es. Hoy alguien me escribió llorando. Desesperado. Y yo entiendo esa rabia. Porque también la siento. Una arrechera monumental, de esas que no se apagan. Pero entre todo lo malo, hay algo que sí me da fuerza: Venezuela está despierta. Y eso no lo detiene nadie.",1926181099228590154,https://x.com/melania0880/status/1926181099228590154,132,1065,3058,65765,18,https://pbs.twimg.com/media/Grsrf59WwAAXiTc.jpg;https://pbs.twimg.com/media/Grsrf59WIAANVBn.jpg;https://pbs.twimg.com/media/Grsrf5-XsAAXtMD.jpg,False,,,,,es,Top
(@@TampicoGob OR @@MonicaVTampico) min_replies:0 min_faves:0 min_retweets:0,https://x.com/search?q=(@@TampicoGob OR @@MonicaVTampico) min_replies:0 min_faves:0 min_retweets:0 until:2025-05-25 since:2025-05-24&src=typed_query,Homero Boscan,https://x.com/homeroboscan,homeroboscan,True,2025-05-24 07:45:45+00:00,False,"Desertó Tomas Guanipa del grupo de alacranes que armaron para Maduro Capriles, Stalin Gonzalez y Requesens. El arresto de su hermano, Juan Pablo lo hizo reflexionar. Llama a no votar.",1926182817676890180,https://x.com/homeroboscan/status/1926182817676890180,59,256,463,23781,19,https://pbs.twimg.com/media/GrstEGRXIAEBZ4N.jpg,False,,,,,es,Top
(@@TampicoGob OR @@MonicaVTampico) min_replies:0 min_faves:0 min_retweets:0,https://x.com/search?q=(@@TampicoGob OR @@MonicaVTampico) min_replies:0 min_faves:0 min_retweets:0 until:2025-05-25 since:2025-05-24&src=typed_query,José Manuel Padron,https://x.com/Mex_Liber1,Mex_Liber1,False,2025-05-24 08:08:39+00:00,False,"#FueraMarina #NarcoGobernadoraBC Oye @MarinadelPilar , cuéntanos como te hiciste de una mansión en San Diego de $4,475,000 (CUATRO MILLONES CUATROCIENTOS SETENTA Y CINCO MILLONES) de DOLARES! O lo que es lo mismo cuánto juntaste del narco, cuánto de los presupuestos estatal y municipales, cuánto del huachicoleo fiscal, cuánto de los secuestros, extorsiones y demás mañas MORENARCAS? Que tan urgida estás de vender una propiedad que nunca jamás vas a habitar? Quien va a realizar las operaciones a tu nombre en Estados Unidos y como vas a declarar la venta y pago de impuestos? Eres todo un misterio junto con el narco de tu maridito. Disfruta tu mantarraya, y por cierto quien pagará tu autofestejo? 👇👇 https://youtu.be/bLYxvhiCfOg?si=oikos1ck81tNPl2V",1926188581896233149,https://x.com/Mex_Liber1/status/1926188581896233149,14,257,329,5821,3,,False,,,,,es,Top
(@@TampicoGob OR @@MonicaVTampico) min_replies:0 min_faves:0 min_retweets:0,https://x.com/search?q=(@@TampicoGob OR @@MonicaVTampico) min_replies:0 min_faves:0 min_retweets:0 until:2025-05-25 since:2025-05-24&src=typed_query,okdiario.com,https://x.com/okdiario,okdiario,False,2025-05-24 08:46:09+00:00,False,Paralizado el desahucio de Mónica García en Cercedilla tras darse de baja el abogado del Ayuntamiento https://okdiario.com/madrid/paralizado-desahucio-monica-garcia-cercedilla-darse-baja-abogado-del-ayuntamiento-14811049?utm_term=Autofeed&utm_medium=social&utm_source=Twitter#Echobox=1748063159,1926198017687789712,https://x.com/okdiario/status/1926198017687789712,80,454,450,19805,10,,False,,,,,es,Top
(@@TampicoGob OR @@MonicaVTampico) min_replies:0 min_faves:0 min_retweets:0,https://x.com/search?q=(@@TampicoGob OR @@MonicaVTampico) min_replies:0 min_faves:0 min_retweets:0 until:2025-05-25 since:2025-05-24&src=typed_query,Romàn🔻,https://x.com/wiesenthal1632,wiesenthal1632,True,2025-05-24 09:43:25+00:00,False,"📢Un ""Manolo"" que utiliza imágenes de atractivas mujeres para sembrar sus venenosos mensajes. 🧵👇",1926212431950340493,https://x.com/wiesenthal1632/status/1926212431950340493,12,205,751,37987,5,https://pbs.twimg.com/media/GrtGdnUWkAArUoH.jpg,True,wiesenthal1632,https://x.com/wiesenthal1632,,wiesenthal1632,es,Top
(@@TampicoGob OR @@MonicaVTampico) min_replies:0 min_faves:0 min_retweets:0,https://x.com/search?q=(@@TampicoGob OR @@MonicaVTampico) min_replies:0 min_faves:0 min_retweets:0 until:2025-05-25 since:2025-05-24&src=typed_query,まなみちょぱ【高橋愛美】,https://x.com/ma_na_mi_cho_pa,ma_na_mi_cho_pa,True,2025-05-24 10:04:13+00:00,False,"In today, let see my liveshow💃 You can join online from anywhere in the world,tickets now on sale 🔗 https://tiget.net/events/389087 🎥Youtube https://youtube.com/@manamichopastaff?si=j11095dsCXjPI7Xi My photos now on sale📸 http://manamichopa.official.ec",1926217664629764583,https://x.com/ma_na_mi_cho_pa/status/1926217664629764583,3,44,588,60686,88,https://pbs.twimg.com/media/GrtMwfGWIAA5Tsv.jpg,False,,,,,en,Top
(@@TampicoGob OR @@MonicaVTampico) min_replies:0 min_faves:0 min_retweets:0,https://x.com/search?q=(@@TampicoGob OR @@MonicaVTampico) min_replies:0 min_faves:0 min_retweets:0 until:2025-05-25 since:2025-05-24&src=typed_query,DELPY 📱🎬,https://x.com/delpynews,delpynews,True,2025-05-24 11:20:00+00:00,False,"▶️ESTO ES ARTE | 😍🇵🇾 Con 14 años, la gimnasta Ana Carolina de Conto nos emocionó al ritmo de Pájaro Campana. 🤩 Ella está compitiendo en el Panamericano de Gimnasia Rítmica Asunción 2025.🤸🏻 📹@coparaguay",1926236736998306212,https://x.com/delpynews/status/1926236736998306212,5,363,1414,48399,47,https://pbs.twimg.com/amplify_video_thumb/1926234912752881664/img/-anmNvMXCt5uqYTz.jpg,False,,,,,es,Top
(@@TampicoGob OR @@MonicaVTampico) min_replies:0 min_faves:0 min_retweets:0,https://x.com/search?q=(@@TampicoGob OR @@MonicaVTampico) min_replies:0 min_faves:0 min_retweets:0 until:2025-05-25 since:2025-05-24&src=typed_query,Bere Aguilar,https://x.com/bereaguilarv,bereaguilarv,True,2025-05-24 11:55:08+00:00,False,"Fuerte golpe dieron las autoridades en Coahuila con la detención de Juan Manuel ""El Mono"" Muñoz, quien ha sido acusado por lavado de dinero y narcotráfico, y ayer cayó en Torreón tras un escándalo. Cuentan que tras la incautación de dos pipas repletas de huachicol cuyos choferes fueron detenidos, ""El Mono"" acudió con seis guardaespaldas con la intención de liberarlos. Pero se le volteó el chirrión por el palito, pues, a pesar de su prepotencia, lo encerraron con todo y su escolta y hasta les encontraron dosis de droga. El famoso ""Mono"" es conocido por sus gasolineras en esa entidad en las que vende muy barato el litro... y ahora ya se sabe por qué. El asunto está ya en la cancha de la FGR. Ni modo que lo dejen ir. Templo Mayor",1926245577764835379,https://x.com/bereaguilarv/status/1926245577764835379,23,546,1072,15368,13,https://pbs.twimg.com/media/GrtmJJdXUAAA8Ay.jpg,False,,,,,es,Top
(@@TampicoGob OR @@MonicaVTampico) min_replies:0 min_faves:0 min_retweets:0,https://x.com/search?q=(@@TampicoGob OR @@MonicaVTampico) min_replies:0 min_faves:0 min_retweets:0 until:2025-05-25 since:2025-05-24&src=typed_query,Miguel H Otero,https://x.com/miguelhotero,miguelhotero,True,2025-05-24 12:49:06+00:00,False,María Corina Machado habló tras el secuestro de Juan Pablo Guanipa: “Tengo claro que el régimen me está buscando desesperadamente” - Infobae https://www.infobae.com/venezuela/2025/05/24/maria-corina-machado-tras-el-secuestro-de-juan-pablo-guanipa-tengo-claro-que-el-regimen-me-esta-buscando-desesperadamente/,1926259159395123681,https://x.com/miguelhotero/status/1926259159395123681,9,188,238,9127,1,,False,,,,,es,Top
(@@TampicoGob OR @@MonicaVTampico) min_replies:0 min_faves:0 min_retweets:0,https://x.com/search?q=(@@TampicoGob OR @@MonicaVTampico) min_replies:0 min_faves:0 min_retweets:0 until:2025-05-25 since:2025-05-24&src=typed_query,SOS VENEZUELA,https://x.com/SosVzlaSosVzla,SosVzlaSosVzla,True,2025-05-24 13:07:41+00:00,False,"Aterricemos señores, MCM es nuestra líder, la amamos, ella lucha con el alma y el corazón por la libertad de Venezuela, pero ella no es intocable, no es perfecta, dejemos de idealizarla como si fuera una extraterrestre con superpoderes. Y esa es la realidad, no le pongan tantas cargas a ella, no es justo, demasiado está haciendo y es un ser humano. Debemos estar pilas, ella debe cuidarse al máximo. Guanipa es un hombre muy pilas, inteligente, estaba resguardado, pero lo traicionaron. En cuanto al régimen, ellos no son invencibles, y tampoco tienen superpoderes, ellos son unos delincuentes degenerados, son una panda de criminales que lo único que saben hacer es reprimir, violentar y amedrentar. Están llenos de odio y son capaces de hacer lo que sea, no les importa nadaaaaaa y ahora más que nunca ellos van a darla toda con tal de perpetuarse. Van a darle donde más le duele a MCM para desatar su furia contra ella y van a hacerlo con su gente. La mala noticia para el régimen es que su ciclo se acabó, están muy vulnerables, y ya el mundo sabe quienes son estas ratas y lo que son capaces de hacer, ellos van a luchar con toda para no soltar el poder, pero ¡ESTÁN ACABADOS! Por todo esto y con más razón MCM debe salir de donde está y cerrar su círculo. Dejémonos de tonterías, esa es la realidad. Nuestro país nos necesita fuertes. Prohibido tirar la toalla. Sí seremos libres. ¡VIVA VENEZUELA LIBRE! 🇻🇪 🗽❤️",1926263835213627773,https://x.com/SosVzlaSosVzla/status/1926263835213627773,12,122,491,8611,8,,False,,,,,es,Top
(@@TampicoGob OR @@MonicaVTampico) min_replies:0 min_faves:0 min_retweets:0,https://x.com/search?q=(@@TampicoGob OR @@MonicaVTampico) min_replies:0 min_faves:0 min_retweets:0 until:2025-05-25 since:2025-05-24&src=typed_query,Mhoni Vidente,https://x.com/mhonividente,mhonividente,True,2025-05-24 13:21:11+00:00,False,Hoy en este día Mágico le ruego con toda mi Alma a la Virgen Maria que me proteja con su manto Celestial y que no pueda ningun demonio y enfermedad pueda hacerme daño y tener una vida llena de Sorpresas agradables y Abundancia. Hoy recupero mi estabilidad emocional y le digo al mundo entero que voy hacer muy feliz HOY VOY ESTAR BENDECIDO,1926267234231415143,https://x.com/mhonividente/status/1926267234231415143,11,41,305,20462,8,https://pbs.twimg.com/media/Grt5w5vXgAAk0yx.jpg,False,,,,,es,Top
(@@TampicoGob OR @@MonicaVTampico) min_replies:0 min_faves:0 min_retweets:0,https://x.com/search?q=(@@TampicoGob OR @@MonicaVTampico) min_replies:0 min_faves:0 min_retweets:0 until:2025-05-25 since:2025-05-24&src=typed_query,Mhoni Vidente,https://x.com/mhonividente,mhonividente,True,2025-05-24 13:22:22+00:00,False,Hoy en este día Mágico le ruego con toda mi Alma a la Virgen Maria que me proteja con su manto Celestial y que no pueda ningun demonio y enfermedad pueda hacerme daño y tener una vida llena de Sorpresas agradables y Abundancia. Hoy recupero mi estabilidad emocional y le digo al mundo entero que voy hacer muy feliz HOY VOY ESTAR BENDECIDO,1926267533075579211,https://x.com/mhonividente/status/1926267533075579211,19,47,389,15438,12,https://pbs.twimg.com/media/Grt5w5vXgAAk0yx.jpg,False,,,,,es,Top
(@@TampicoGob OR @@MonicaVTampico) min_replies:0 min_faves:0 min_retweets:0,https://x.com/search?q=(@@TampicoGob OR @@MonicaVTampico) min_replies:0 min_faves:0 min_retweets:0 until:2025-05-25 since:2025-05-24&src=typed_query,Mhoni Vidente,https://x.com/mhonividente,mhonividente,True,2025-05-24 13:26:09+00:00,False,Hoy en este día Mágico le ruego con toda mi Alma a la Virgen Maria que me proteja con su manto Celestial y que no pueda ningun demonio y enfermedad pueda hacerme daño y tener una vida llena de Sorpresas agradables y Abundancia. Hoy recupero mi estabilidad emocional y le digo al mundo entero que voy hacer muy feliz HOY VOY ESTAR BENDECIDO,1926268482674405756,https://x.com/mhonividente/status/1926268482674405756,8,31,204,12027,5,https://pbs.twimg.com/media/Grt5w5vXgAAk0yx.jpg,False,,,,,es,Top
(@@TampicoGob OR @@MonicaVTampico) min_replies:0 min_faves:0 min_retweets:0,https://x.com/search?q=(@@TampicoGob OR @@MonicaVTampico) min_replies:0 min_faves:0 min_retweets:0 until:2025-05-25 since:2025-05-24&src=typed_query,Iván Simonovis,https://x.com/Simonovis,Simonovis,True,2025-05-24 14:30:24+00:00,False,"El régimen tiene preso a los 3 hermanos Guanipa, 1, 2 están en los calabozos y 3, Tomás lo tienen preso con ambición y dinero.",1926284651108196654,https://x.com/Simonovis/status/1926284651108196654,121,1684,3421,120120,64,https://pbs.twimg.com/media/GruJrlLWIAEULu0.jpg,False,,,,,es,Top
(@@TampicoGob OR @@MonicaVTampico) min_replies:0 min_faves:0 min_retweets:0,https://x.com/search?q=(@@TampicoGob OR @@MonicaVTampico) min_replies:0 min_faves:0 min_retweets:0 until:2025-05-25 since:2025-05-24&src=typed_query,El Universal,https://x.com/El_Universal_Mx,El_Universal_Mx,True,2025-05-24 14:35:16+00:00,False,"🔴La columna ""Huachicol y poder judicial en Tamaulipas"", publicada el 1 de mayo, abordó presuntos vínculos de Contreras López con una red de corrupción y huachicol, basándose en documentos de la Sedena una investigación de Código Magenta. https://www.eluniversal.com.mx/nacion/de-mauleon-y-el-universal-alistan-impugnacion-contra-intento-de-censura-articulo-19-asegura-que-medidas-cautelares-violan-el-debido-proceso/",1926285875672993861,https://x.com/El_Universal_Mx/status/1926285875672993861,5,126,264,19793,2,,False,,,,,es,Top
(@@TampicoGob OR @@MonicaVTampico) min_replies:0 min_faves:0 min_retweets:0,https://x.com/search?q=(@@TampicoGob OR @@MonicaVTampico) min_replies:0 min_faves:0 min_retweets:0 until:2025-05-25 since:2025-05-24&src=typed_query,Mhoni Vidente,https://x.com/mhonividente,mhonividente,True,2025-05-24 14:40:22+00:00,False,Hoy en este día Mágico le ruego con toda mi Alma a la Virgen Maria que me proteja con su manto Celestial y que no pueda ningun demonio y enfermedad pueda hacerme daño y tener una vida llena de Sorpresas agradables y Abundancia. Hoy recupero mi estabilidad emocional y le digo al mundo entero que voy hacer muy feliz HOY VOY ESTAR BENDECIDO,1926287162657399238,https://x.com/mhonividente/status/1926287162657399238,35,88,886,40420,23,https://pbs.twimg.com/media/Grt5w5vXgAAk0yx.jpg,False,,,,,es,Top
(@@TampicoGob OR @@MonicaVTampico) min_replies:0 min_faves:0 min_retweets:0,https://x.com/search?q=(@@TampicoGob OR @@MonicaVTampico) min_replies:0 min_faves:0 min_retweets:0 until:2025-05-25 since:2025-05-24&src=typed_query,Chubbsoft & Tomatito Girl 🍅,https://x.com/chubbsoft,chubbsoft,False,2025-05-24 14:49:25+00:00,False,Nunca pensé que me vería igual que todas las embarazadas en la calle jejej 🍅🍅,1926289437916323921,https://x.com/chubbsoft/status/1926289437916323921,32,3,507,15495,11,https://pbs.twimg.com/media/GruOCL2WIAAq-iY.jpg,False,,,,,es,Top
(@@TampicoGob OR @@MonicaVTampico) min_replies:0 min_faves:0 min_retweets:0,https://x.com/search?q=(@@TampicoGob OR @@MonicaVTampico) min_replies:0 min_faves:0 min_retweets:0 until:2025-05-25 since:2025-05-24&src=typed_query,Monica Garza,https://x.com/monicagarzag,monicagarzag,True,2025-05-24 15:58:00+00:00,False,"Es miserable que pretendan convertir una tragedia en una herramienta más de su doctrina. No es igual “dar la vida por la patria” por voluntad,que ser ejecutados por criminales. ¡No se confundan! Mi columna👇🏻 Ximena, José, Héctor, Adela… ¿Quién sigue? https://www.razon.com.mx/opinion/2025/05/24/ximena-jose-hector-adela-quien-sigue/",1926306698869735698,https://x.com/monicagarzag/status/1926306698869735698,102,499,1449,21428,4,,False,,,,,es,Top
(@@TampicoGob OR @@MonicaVTampico) min_replies:0 min_faves:0 min_retweets:0,https://x.com/search?q=(@@TampicoGob OR @@MonicaVTampico) min_replies:0 min_faves:0 min_retweets:0 until:2025-05-25 since:2025-05-24&src=typed_query,Monica gab. Lic. en Interiorismo!!,https://x.com/MonicaToledoCa1,MonicaToledoCa1,False,2025-05-24 16:37:50+00:00,False,Ya me canse . Es todo el tuit . Tu decides!!,1926316722128064767,https://x.com/MonicaToledoCa1/status/1926316722128064767,56,627,1084,13923,5,https://pbs.twimg.com/media/Grum2QAWMAECHpb.jpg,False,,,,,es,Top
(@@TampicoGob OR @@MonicaVTampico) min_replies:0 min_faves:0 min_retweets:0,https://x.com/search?q=(@@TampicoGob OR @@MonicaVTampico) min_replies:0 min_faves:0 min_retweets:0 until:2025-05-25 since:2025-05-24&src=typed_query,Vichoguate,https://x.com/vichoguate,vichoguate,True,2025-05-24 16:43:57+00:00,False,"PNC reporta que capturó, otra vez, a Jonathan Daniel García Mendoza de 22 años, anoche en la zona 10. Conducía una moto que había sido hurtada en la zona 16. El pasado 13 de mayo fue detenido por situación similar en la zona 14.",1926318260418498592,https://x.com/vichoguate/status/1926318260418498592,40,97,341,23124,9,https://pbs.twimg.com/media/GruoO4DXsAE8Dbf.jpg;https://pbs.twimg.com/media/GruoPOBWwAE-avm.jpg;https://pbs.twimg.com/media/GruoPqlWYAAdR70.jpg;https://pbs.twimg.com/media/GruoP-PWgAAwcBP.jpg,False,,,,,es,Top
(@@TampicoGob OR @@MonicaVTampico) min_replies:0 min_faves:0 min_retweets:0,https://x.com/search?q=(@@TampicoGob OR @@MonicaVTampico) min_replies:0 min_faves:0 min_retweets:0 until:2025-05-25 since:2025-05-24&src=typed_query,Duquesa de Alba,https://x.com/duquesacayetana,duquesacayetana,False,2025-05-24 16:58:00+00:00,False,A ésta foto habría que sumarle el audio en el que decía que pampita siempre iba ser infeliz (quien no después de semejante tragedia) y que se iba a morir cuando supiera que estaba esperando una nena. A meses del motorhome fue a refregarle el embarazo. El peor ser humano vivo.,1926321798791958620,https://x.com/duquesacayetana/status/1926321798791958620,12,39,610,16934,12,,False,,,,,es,Top
(@@TampicoGob OR @@MonicaVTampico) min_replies:0 min_faves:0 min_retweets:0,https://x.com/search?q=(@@TampicoGob OR @@MonicaVTampico) min_replies:0 min_faves:0 min_retweets:0 until:2025-05-25 since:2025-05-24&src=typed_query,Tendencias,https://x.com/TTendenciaX,TTendenciaX,True,2025-05-24 16:59:00+00:00,False,"""Momo"": Porque le pidieron una foto y le pifió de cámara.",1926322048701255794,https://x.com/TTendenciaX/status/1926322048701255794,7,17,454,37245,16,https://pbs.twimg.com/ext_tw_video_thumb/1926320503653842945/pu/img/KXHtQAKBHtTrMwla.jpg,False,,,,,es,Top
(@@TampicoGob OR @@MonicaVTampico) min_replies:0 min_faves:0 min_retweets:0,https://x.com/search?q=(@@TampicoGob OR @@MonicaVTampico) min_replies:0 min_faves:0 min_retweets:0 until:2025-05-25 since:2025-05-24&src=typed_query,Mónica García,https://x.com/Monica_Garcia_G,Monica_Garcia_G,True,2025-05-24 17:32:37+00:00,False,Nos llaman woke por defender los derechos humanos. Mejor eso que intentar justificar un genocidio. Madrid conoce bien la barbarie y lleva los bombardeos en su memoria. No vamos a permitir que se utilice nuestro nombre para legitimar el horror.,1926330509145092601,https://x.com/Monica_Garcia_G/status/1926330509145092601,670,236,692,95227,15,https://pbs.twimg.com/amplify_video_thumb/1926323632076128260/img/ER69G53Unu56nnZG.jpg,False,,,,,es,Top
(@@TampicoGob OR @@MonicaVTampico) min_replies:0 min_faves:0 min_retweets:0,https://x.com/search?q=(@@TampicoGob OR @@MonicaVTampico) min_replies:0 min_faves:0 min_retweets:0 until:2025-05-25 since:2025-05-24&src=typed_query,Berenice,https://x.com/BereniceDiazG,BereniceDiazG,True,2025-05-24 17:51:30+00:00,False,"#Tijuana Todo listo para el evento de este sábado en ""apoyo"" para la Gobernadora @MarinadelPilar en la unidad deportiva Mariano Matamoros. Una respuesta a la carne asada masiva de la semana pasada. Escenario, sonido, luces, decenas de sillas, camiones rentados... ¿De donde sale ese presupuesto? 📹:Tijuana Pública",1926335259559313488,https://x.com/BereniceDiazG/status/1926335259559313488,196,129,387,29641,10,https://pbs.twimg.com/ext_tw_video_thumb/1926335247055998976/pu/img/9S0TsuR4nde9Dhnb.jpg,False,,,,,es,Top
(@@TampicoGob OR @@MonicaVTampico) min_replies:0 min_faves:0 min_retweets:0,https://x.com/search?q=(@@TampicoGob OR @@MonicaVTampico) min_replies:0 min_faves:0 min_retweets:0 until:2025-05-25 since:2025-05-24&src=typed_query,Darío Madrid,https://x.com/Dario_Madrid_F,Dario_Madrid_F,True,2025-05-24 18:02:21+00:00,False,Como es costumbre el presente hilo puede leerse en mi página web. Sirva como homenaje a esos españoles del siglo XVI que no se detenían ni siquiera ante un volcán. 124.400 gracias por leerlo y difundirlo. https://dariomadrid.com/francisco-montano-el-espanol-que-bajo-al-crater-del-volcan-popocatepelt-a-buscar-azufre-para-elaborar-polvora/,1926337990084710640,https://x.com/Dario_Madrid_F/status/1926337990084710640,8,62,358,9139,11,,True,Dario_Madrid_F,https://x.com/Dario_Madrid_F,,Dario_Madrid_F,es,Top
(@@TampicoGob OR @@MonicaVTampico) min_replies:0 min_faves:0 min_retweets:0,https://x.com/search?q=(@@TampicoGob OR @@MonicaVTampico) min_replies:0 min_faves:0 min_retweets:0 until:2025-05-25 since:2025-05-24&src=typed_query,Mónica Palacios,https://x.com/MoniPalaciosZ,MoniPalaciosZ,True,2025-05-24 18:07:40+00:00,False,"¡El #PresidenteIlegítimo miente! No tiene un plan real para generar empleo, salvar la salud pública ni rescatar la educación. Cada palabra que dice, cada promesa que lanza, es puro humo. #NoboaEsFraude",1926339330210980335,https://x.com/MoniPalaciosZ/status/1926339330210980335,1,428,795,15385,13,https://pbs.twimg.com/amplify_video_thumb/1926339217333915649/img/JbcIbF9iE1zh2xcN.jpg,False,,,,,es,Top
(@@TampicoGob OR @@MonicaVTampico) min_replies:0 min_faves:0 min_retweets:0,https://x.com/search?q=(@@TampicoGob OR @@MonicaVTampico) min_replies:0 min_faves:0 min_retweets:0 until:2025-05-25 since:2025-05-24&src=typed_query,By Viral 24,https://x.com/ByViral24,ByViral24,True,2025-05-24 18:10:20+00:00,False,"🚨🇺🇸🇨🇴🔴Está es la esposa prepago y NARCOTRAFICANTE del “abogado” @migueldelrioabg Investigada y vinculada de lavar millones de dólares al cártel de los soles, y dirigir una red de prostitución y trata de Blancas. Será Pedida en extradición a USA @SecRubio",1926339998766297528,https://x.com/ByViral24/status/1926339998766297528,48,959,1586,76629,48,https://pbs.twimg.com/amplify_video_thumb/1778422453347192832/img/PHzWldrqnwSiKTtP.jpg,False,,,,,es,Top
