"path";"id";"parent_id";"level";"object_id";"object_type";"object_key";"query_status";"query_time";"query_type";"message";"created_time";"like_count";"comment_count";"error.message"
"964877296876825_1123385406018019/964877296876825_1118367256519834";"38";"1";"1";"964877296876825_1118367256519834";"data";"data.*";"fetched (200)";"2025-11-14 07:56:22.072345";"Facebook:/<page-id>/posts";"Hoy participé en la Mesa de Seguridad y Construcción de Paz en #CdMadero, donde evaluamos estrategias y resultados en temas importantes como el Transporte Público y Tránsito y Vialidad.  Junto con los alcaldes de Ciudad Madero, Erasmo González Robledo, y de Altamira, Armando Martínez Manríquez, trabajamos para fortalecer la seguridad y el bienestar de nuestra zona conurbada.  ¡Seguimos adelante, trabajando unidos por un Tampico más seguro para todas y todos!   #TampicoTeCuida #PactoDelSur";"2024-10-23T17:10:26+0000";"";"";""
"964877296876825_1123385406018019/964877296876825_1118367256519834/964877296876825_1118367256519834";"1133";"38";"2";"964877296876825_1118367256519834";"data";"data.*";"fetched (200)";"2025-11-14 07:58:04.376133";"Facebook:/<post-id>/comments";"";"2024-10-23T17:13:50+0000";"0";"0";""
"964877296876825_1123385406018019/964877296876825_1117781729911720";"41";"1";"1";"964877296876825_1117781729911720";"data";"data.*";"fetched (200)";"2025-11-14 07:56:22.072345";"Facebook:/<page-id>/posts";"Hoy nos reunimos con los alcaldes de Altamira, Armando Martínez Manríquez y de Cd. Madero, Erasmo González Robledo, junto con representantes del Relleno Sanitario del Ejido Francisco Medrano de Altamira, para mejorar los tiempos y procesos del servicio de recolección de basura.   ¡Trabajamos para que nuestra ciudad sea más limpia y eficiente! 💪♻️   #TampicoVaConTodos #PactoDelSur";"2024-10-22T20:47:32+0000";"";"";""
"964877296876825_1123385406018019/964877296876825_1117781729911720/964877296876825_1117781729911720";"1177";"41";"2";"964877296876825_1117781729911720";"data";"data.*";"fetched (200)";"2025-11-14 07:58:05.507960";"Facebook:/<post-id>/comments";"exelente  compromiso de los tres municipios en beneficio  de la ciudadanía,  saludos y bendiciones";"2024-10-22T20:51:13+0000";"0";"0";""
"964877296876825_1123385406018019/964877296876825_1119419986414561";"26";"1";"1";"964877296876825_1119419986414561";"data";"data.*";"fetched (200)";"2025-11-14 07:56:21.422081";"Facebook:/<page-id>/posts";"¡Feliz cumpleaños, Alejandro Fernández Marcos!   Hoy celebramos a una persona comprometida, visionaria y clave en el desarrollo de recursos hídricos para el bienestar social. Gracias por tu liderazgo como Director de Administración y Finanzas, y por tu dedicación incansable en pro del desarrollo social. ¡Que este nuevo año te traiga grandes logros y momentos inolvidables! 🥂🌟";"2024-10-25T14:00:09+0000";"";"";""
"964877296876825_1123385406018019/964877296876825_1119419986414561/964877296876825_1119419986414561";"919";"26";"2";"964877296876825_1119419986414561";"data";"data.*";"fetched (200)";"2025-11-14 07:57:55.984306";"Facebook:/<post-id>/comments";"FELICIDADES Y BENDICIONES ALEJANDRO🙏🙏🙏👏👏👏🥰";"2024-10-25T14:02:55+0000";"0";"0";""
"964877296876825_1123385406018019/964877296876825_1121265469563346";"20";"1";"1";"964877296876825_1121265469563346";"data";"data.*";"fetched (200)";"2025-11-14 07:56:21.422081";"Facebook:/<page-id>/posts";"En Tampico nos sentimos muy contentos de haber sido sede de uno de los torneos internacionales de tenis más importantes del circuito de la WTA.   Felicito al comité organizador y a cada una de las talentosas jugadoras que durante una semana dieron muestra de su gran calidad.   Particularmente felicito a la campeona del Abierto de Tenis Tampico 2024 Marina Stakusic de Canadá. Su persistencia y talento son ejemplo para alcanzar las metas.  Agradezco a los miles de tampiqueños y visitantes que hicieron del Abierto Tampico todo un éxito.  ¡Muchas Felicidades!  #TampicoVaConTodos #AbiertoTampico2024";"2024-10-27T18:27:06+0000";"";"";""
"964877296876825_1123385406018019/964877296876825_1121265469563346/964877296876825_1121265469563346";"862";"20";"2";"964877296876825_1121265469563346";"data";"data.*";"fetched (200)";"2025-11-14 07:57:53.829906";"Facebook:/<post-id>/comments";"muchas felicidades 🏆";"2024-10-27T21:43:04+0000";"0";"0";""
"964877296876825_1123385406018019/474462132406835_122115401996546197";"145";"2";"1";"474462132406835_122115401996546197";"data";"data.*";"fetched (200)";"2025-11-14 07:56:24.461625";"Facebook:/<page-id>/posts";"";"2024-10-28T23:31:02+0000";"";"";""
"964877296876825_1123385406018019/474462132406835_122115178568546197";"156";"2";"1";"474462132406835_122115178568546197";"data";"data.*";"fetched (200)";"2025-11-14 07:56:25.011643";"Facebook:/<page-id>/posts";"Continuamos con el Festival Internacional en la Costa del Seno Mexicano, con la presentación de Mitos, Fábulas y Leyendas de la Huasteca desde Barco Museo del Niño, con el Colectivo Cultural ‘Raíces Huastecas’.   En Tampico impulsamos el arte en todas sus expresiones con la iniciativa del Gobernador Américo Villarreal Anaya para llevar la cultura a todas y todos.   #TampicoVaConTodos";"2024-10-27T22:36:26+0000";"";"";""
"964877296876825_1123385406018019/474462132406835_122114275478546197";"176";"2";"1";"474462132406835_122114275478546197";"data";"data.*";"fetched (200)";"2025-11-14 07:56:25.655772";"Facebook:/<page-id>/posts";"Inicia Campaña de Arborización en Tampico 🌳  Comprometidos con la protección del medio ambiente, ha comenzado una amplia campaña de arborización en el Bulevar Perimetral “Fidel Velázquez”. 🌱  Yahaira Sarahí Cruz Aguilar, Directora de Ecología, destacó que, por instrucciones de nuestra Presidenta Municipal Mónica Zacil Villarreal Anaya, se sembrarán árboles en distintas zonas del municipio.   Hoy se plantaron los primeros 160 árboles de palo de rosa , con el objetivo de mitigar los efectos del cambio climático y mejorar nuestras áreas verdes.  #TampicoVaConTodos";"2024-10-23T23:31:25+0000";"";"";""
"964877296876825_1123385406018019/474462132406835_122114275478546197/474462132406835_122114275478546197";"3082";"176";"2";"474462132406835_122114275478546197";"data";"data.*";"fetched (200)";"2025-11-14 07:59:25.377200";"Facebook:/<post-id>/comments";"*¡Muy bien!* _Árboles_, no palmas, ¡árboles! Bien, la carretera hacia Mante, en los camellones.";"2024-10-26T22:05:48+0000";"0";"0";""
"TampicoGob/474462132406835_122114275478546197/474462132406835_122114275478546197";"3082";"176";"2";"474462132406835_122114275478546197";"data";"data.*";"fetched (200)";"2025-11-14 07:59:25.377200";"Facebook:/<post-id>/comments";"*¡Muy bien!* _Árboles_, no palmas, ¡árboles! Bien, la carretera hacia Mante, en los camellones.";"2024-10-26T22:05:48+0000";"0";"0";""
"964877296876825_1123385406018019/964877296876825_1121976002825626";"16";"1";"1";"964877296876825_1121976002825626";"data";"data.*";"fetched (200)";"2025-11-14 07:56:21.422081";"Facebook:/<page-id>/posts";"Hoy tuve el honor de participar en la Sesión Mensual de la Canaco Tampico, presidida por su titular, Carlos Muñoz González. Durante el encuentro, compartí un resumen de las principales acciones que hemos llevado a cabo en este primer mes de gobierno, así como los proyectos de desarrollo económico, turístico y social que planeamos ejecutar en los próximos meses.  Reconozco profundamente la importancia del sector comercial en el crecimiento de nuestro querido Tampico, y extiendo una cordial invitación a todos los empresarios para que se sumen a la construcción del Plan Municipal de Desarrollo.   #TampicoVaConTodos";"2024-10-28T18:49:40+0000";"";"";""
"964877296876825_1123385406018019/964877296876825_1121976002825626/964877296876825_1121976002825626";"837";"16";"2";"964877296876825_1121976002825626";"data";"data.*";"fetched (200)";"2025-11-14 07:57:52.396740";"Facebook:/<post-id>/comments";"👏 Excelentes acciones de nuestra presidenta Mónica Villarreal, porque #TampicoVaConTodos";"2024-10-28T18:53:06+0000";"0";"0";""
"964877296876825_1123385406018019/474462132406835_122114688260546197";"170";"2";"1";"474462132406835_122114688260546197";"data";"data.*";"fetched (200)";"2025-11-14 07:56:25.011643";"Facebook:/<page-id>/posts";"Así se vivió la Inauguración de la Exposición Fotográfica 𝗖𝗘𝗠𝗣𝗢𝗔𝗟𝗫𝗢́𝗖𝗛𝗜𝗧𝗟, en el lobby del Espacio Cultural Metropolitano. #XantoloTampico2024  ¡Ven a vivirlo!";"2024-10-25T18:35:09+0000";"";"";""
"964877296876825_1123385406018019/474462132406835_122114266616546197";"177";"2";"1";"474462132406835_122114266616546197";"data";"data.*";"fetched (200)";"2025-11-14 07:56:25.655772";"Facebook:/<page-id>/posts";"En el Gobierno municipal nos sentimos muy orgullosos de reconocer y felicitar a las y los médicos en su día, que con su noble profesión llena de amor, compasión y sobre todo ética profesional, contribuyen a mejorar las condiciones de salud y elevar la calidad de vida de las personas.  Feliz Día del Médico  Lic. Mónica Zacil Villarreal Anaya Presidenta Municipal 2024-2027";"2024-10-23T21:58:54+0000";"";"";""
"964877296876825_1123385406018019/474462132406835_122114266616546197/474462132406835_122114266616546197";"3084";"177";"2";"474462132406835_122114266616546197";"data";"data.*";"fetched (200)";"2025-11-14 07:59:25.685462";"Facebook:/<post-id>/comments";"Un gran equipo Médico nos respalda!! Felicidades Drs en horabuena 👏👏👏";"2024-10-23T22:17:03+0000";"2";"0";""
"TampicoGob/474462132406835_122114266616546197/474462132406835_122114266616546197";"3084";"177";"2";"474462132406835_122114266616546197";"data";"data.*";"fetched (200)";"2025-11-14 07:59:25.685462";"Facebook:/<post-id>/comments";"Un gran equipo Médico nos respalda!! Felicidades Drs en horabuena 👏👏👏";"2024-10-23T22:17:03+0000";"2";"0";""
"964877296876825_1123385406018019/474462132406835_122114750642546197";"168";"2";"1";"474462132406835_122114750642546197";"data";"data.*";"fetched (200)";"2025-11-14 07:56:25.011643";"Facebook:/<page-id>/posts";"Favorece Sinergia del Gobierno e Iniciativa Privada a Emprendedores Locales  La Primera Feria de Proveedores de la Cadena Comercial Oxxo 2024 se llevó a cabo en el Espacio Cultural Metropolitano de Tampico. Este evento, coordinado entre el Gobierno de Tamaulipas y el Ayuntamiento de Tampico, busca facilitar el acceso de emprendedores locales a clientes potenciales y fortalecer la economía regional.  Nora Izaguirre Acevedo, Directora de Desarrollo Económico de Tampico, destacó el impulso de la administración municipal encabezada por la Presidenta Mónica Zacil Villarreal Anaya, con la oportunidad que representa esta feria para que productores locales se conviertan en proveedores de las más de 320 tiendas Oxxo en la zona.   Con el apoyo del Gobernador Dr. Américo Villarreal Anaya y el programa “Hecho en Tamaulipas”, se continúa respaldando a los emprendedores de la región.  #TampicoVaConTodos";"2024-10-26T01:29:16+0000";"";"";""
"964877296876825_1123385406018019/474462132406835_122115167606546197";"159";"2";"1";"474462132406835_122115167606546197";"data";"data.*";"fetched (200)";"2025-11-14 07:56:25.011643";"Facebook:/<page-id>/posts";"¡El Xantolo Tampico 2024 está en marcha! Disfruta de una experiencia cultural única con la presentación del Ballet Folklórico en el Jardín de las Artes, METRO, de 19:00 a 22:00 horas.  Además, del 24 al 27 de octubre, podrás recorrer la Muestra Gastronómica y Artesanal, junto con un vibrante Tianguis Cultural.  ¡No te pierdas esta oportunidad de celebrar y vivir nuestras tradiciones!  #TampicoVaConTodos #XantoloTampico2024";"2024-10-27T20:14:09+0000";"";"";""
"964877296876825_1123385406018019/964877296876825_1118595689830324";"31";"1";"1";"964877296876825_1118595689830324";"data";"data.*";"fetched (200)";"2025-11-14 07:56:21.422081";"Facebook:/<page-id>/posts";"Este martes, nos encontramos  con oferentes y locatarios del Mercado Municipal, para darles a conocer la designación del Lic. Alejandro Gutiérrez Guerra como nuevo administrador de este centro de abasto y del lng. Aurelio Cantú Díaz como Director de Mercados.  Me complace mucho que ya conozcan a su equipo de trabajo. Queremos que las cosas funcionen bien, con una comunicación cercana y transparente, y que la confianza que nos están brindando se mantenga durante toda nuestra gestión.  Agradezco la confianza de los comerciantes y reitero que trabajaremos en conjunto para mejorar las instalaciones y la rentabilidad del mercado.  #TampicoVaConTodos";"2024-10-24T01:39:59+0000";"";"";""
"964877296876825_1123385406018019/964877296876825_1118595689830324/964877296876825_1118595689830324";"1038";"31";"2";"964877296876825_1118595689830324";"data";"data.*";"fetched (200)";"2025-11-14 07:57:59.934269";"Facebook:/<post-id>/comments";"MUCHAS FELICIDADES AL LICENCIADO ALEJANDRO GUTIERREZ GUERRA POR SU NOMBRAMIENTO DESEANDOLE MUCHO EXITOOO";"2024-10-25T16:56:59+0000";"0";"0";""
"964877296876825_1123385406018019/474462132406835_122115158264546197";"161";"2";"1";"474462132406835_122115158264546197";"data";"data.*";"fetched (200)";"2025-11-14 07:56:25.011643";"Facebook:/<page-id>/posts";"Se Consolida Tampico como Referente Turístico de Tamaulipas  Destaca Mónica Villarreal éxito del Torneo Internacional de Tenis Femenil Abierto Tampico 2024  Al destacar que el desarrollo de actividades deportivas y culturales son fundamentales en la construcción de entornos de paz y prosperidad, la Presidenta municipal Mónica Zacil Villarreal Anaya subrayó que el Torneo Internacional de Tenis Femenil Abierto Tampico 2024 brindó una gran oportunidad a miles de tampiqueños y visitantes de disfrutar en la Ciudad Deportiva, un espectáculo deportivo de talla mundial.  Tras la culminación del certamen en el que la tenista canadiense Marina Satakusic se alzó con el título tras vencer en la gran final a la rusa Ana Blinkova por parciales de 6-4, 2-6 y 6-4, la alcaldesa porteña felicitó al Comité organizador y a cada una de las atletas participantes, en uno de los eventos tenísticos más importantes del Circuito WTA.  Mónica Villarreal subrayó el compromiso y respaldo del Gobernador del Estado, Dr. Américo Villarreal Anaya y  el interés de su administración por seguir generando las condiciones que faciliten el desarrollo de eventos que contribuyan al fortalecimiento económico y turístico de Tampico.  Villarreal Anaya sostuvo, por último que su administración seguirá impulsando el desarrollo de competencias de esta naturaleza que consoliden el tejido social además de ser factor para impulsar el progreso integral de la zona.";"2024-10-27T19:30:01+0000";"";"";""
"964877296876825_1123385406018019/964877296876825_1118520989837794";"35";"1";"1";"964877296876825_1118520989837794";"data";"data.*";"fetched (200)";"2025-11-14 07:56:22.072345";"Facebook:/<page-id>/posts";"Hoy celebramos a quienes dedican su vida a cuidar la nuestra.  Con profundo orgullo, reconozco el valor, la compasión y la ética de las y los médicos, que con su vocación mejoran nuestra salud y calidad de vida.   ¡Gracias por su incansable labor! ¡Feliz Día del Médico!  #TampicoTeCuida";"2024-10-23T22:43:19+0000";"";"";""
"964877296876825_1123385406018019/964877296876825_1118520989837794/964877296876825_1118520989837794";"1079";"35";"2";"964877296876825_1118520989837794";"data";"data.*";"fetched (200)";"2025-11-14 07:58:01.794281";"Facebook:/<post-id>/comments";"Excelentes médicos de muchos años en servicios médicos Dios los bendiga";"2024-10-23T22:49:28+0000";"0";"0";""
"964877296876825_1123385406018019/474462132406835_122115124646546197";"163";"2";"1";"474462132406835_122115124646546197";"data";"data.*";"fetched (200)";"2025-11-14 07:56:25.011643";"Facebook:/<page-id>/posts";"La plaza Hijas de Tampico, vibró la noche de este sábado con la presentación de 𝗣𝘂𝗻𝘁𝗼 𝗘𝘅𝗮𝗰𝘁𝗼 de Nuevo Laredo, quienes rindieron tributo al rock en inglés y español con canciones de Coda, Inspector, Toto y Journey, dentro del 𝗫𝗫𝗜𝗜 Festival Internacional en la Costa del Seno Mexicano.  ¡No te pierdas las próximas presentaciones! Este festival reúne a 174 agrupaciones en 31 municipios de Tamaulipas del 25 de octubre al 3 de noviembre.   Agenda👉🏼 https://acortar.link/VSK0jE  #TampicoVaConTodos";"2024-10-27T16:26:16+0000";"";"";""
"964877296876825_1123385406018019/964877296876825_1120066566349903";"24";"1";"1";"964877296876825_1120066566349903";"data";"data.*";"fetched (200)";"2025-11-14 07:56:21.422081";"Facebook:/<page-id>/posts";"Hoy tuve el honor de participar en la Asamblea Anual de Juezas y Jueces del Poder Judicial de Tamaulipas. Estoy convencida de que la justicia es una de las demandas más sentidas por nuestra gente, y en este día, en que recordamos la importancia de eliminar la violencia contra la mujer, reafirmo mi compromiso de trabajar de la mano para lograr paz y justicia.  Desde el “Pacto por el Sur,” nos hemos propuesto reducir las brechas de desigualdad en la zona conurbada y generar mayor justicia social a través del humanismo. Estoy segura de que la labor de nuestras juezas y jueces contribuye a brindar condiciones de seguridad y bienestar, especialmente para las mujeres tamaulipecas.  Agradezco la presencia de representantes como el Secretario General de Gobierno, Héctor Joel Villegas González, y el Magistrado Presidente del Supremo Tribunal de Justicia, David Cerda Zúñiga, en este importante evento en Ciudad Madero.   ¡Seguimos adelante por una justicia más expedita, transparente y centrada en la gente!.   #TampicoVaConTodos #TampicoTeCuida";"2024-10-26T03:05:13+0000";"";"";""
"964877296876825_1123385406018019/964877296876825_1120066566349903/964877296876825_1120066566349903";"901";"24";"2";"964877296876825_1120066566349903";"data";"data.*";"fetched (200)";"2025-11-14 07:57:55.264669";"Facebook:/<post-id>/comments";"La reforma va y tiene que ir no hay vuelta atrás la gente lo pide lo exige se requiere es urgente que se haga .... saludos a la señora presidenta de México dra Claudia sheimbaum pardo el pueblo está con usted";"2024-10-26T05:01:21+0000";"0";"0";""
"964877296876825_1123385406018019/964877296876825_1120188133004413";"22";"1";"1";"964877296876825_1120188133004413";"data";"data.*";"fetched (200)";"2025-11-14 07:56:21.422081";"Facebook:/<page-id>/posts";"Celebramos con gran aprecio este día especial, Lic. Paola Del Sol Mejía. Como Directora de Atención Ciudadana, su dedicación y esfuerzo constante inspiran a todos a su alrededor. Le deseamos un año lleno de éxitos, alegría y nuevas oportunidades para seguir marcando la diferencia en nuestra comunidad.";"2024-10-26T14:01:01+0000";"";"";""
"964877296876825_1123385406018019/964877296876825_1120188133004413/964877296876825_1120188133004413";"870";"22";"2";"964877296876825_1120188133004413";"data";"data.*";"fetched (200)";"2025-11-14 07:57:54.545686";"Facebook:/<post-id>/comments";"MUCHAS FELICIDADES 🎊🎉";"2024-10-26T14:02:19+0000";"1";"0";""
"964877296876825_1123385406018019/964877296876825_1122024229487470";"15";"1";"1";"964877296876825_1122024229487470";"data";"data.*";"fetched (200)";"2025-11-14 07:56:21.422081";"Facebook:/<page-id>/posts";"Hoy me reuní con Eduardo Mateos Mauleon, Gerente General de Plaza OXXO en la zona conurbada, y Ana Guevara, Coordinadora de Responsabilidad Social, para dialogar sobre nuevas oportunidades de colaboración en favor del bienestar de nuestra comunidad.  A la reunión asistieron también Luz Adriana Villarreal Anaya, presidenta del Sistema DIF Tampico, y Mariana Altamirano Aceves, Directora de este organismo.  Agradezco a todos ellos su compromiso y disposición para contribuir a un Tampico más próspero y solidario. ¡Seguimos trabajando juntos para construir una mejor ciudad para todos!   #TampicoTeCuida";"2024-10-28T20:35:55+0000";"";"";""
"964877296876825_1123385406018019/964877296876825_1122024229487470/964877296876825_1122024229487470";"821";"15";"2";"964877296876825_1122024229487470";"data";"data.*";"fetched (200)";"2025-11-14 07:57:51.986286";"Facebook:/<post-id>/comments";"";"2024-10-28T20:53:46+0000";"0";"0";""
"964877296876825_1123385406018019/474462132406835_122115429140546197";"144";"2";"1";"474462132406835_122115429140546197";"data";"data.*";"fetched (200)";"2025-11-14 07:56:24.461625";"Facebook:/<page-id>/posts";"“Leo, Luego Existo: Doña Catrina” en el Teatro Experimental   El día de hoy, en el Teatro Experimental del Espacio Cultural Metropolitano, se llevó a cabo el evento “Leo, Luego Existo: Doña Catrina”, una celebración literaria que honra nuestras tradiciones y fomenta el amor por la lectura en nuestra comunidad.  Está expresión es parte de las actividades culturales del Festival Internacional en la Costa del Seno Mexicano, impulsado por el gobernador del estado Américo Villarreal Anaya.  ¡Sigamos impulsando juntos actividades que fortalezcan nuestras raíces y enriquezcan nuestra comunidad!  #TamaulipasEsCultura #TampicoVaConTodos";"2024-10-29T03:45:00+0000";"";"";""
"964877296876825_1123385406018019/474462132406835_122115169028546197";"158";"2";"1";"474462132406835_122115169028546197";"data";"data.*";"fetched (200)";"2025-11-14 07:56:25.011643";"Facebook:/<page-id>/posts";"Firme Impulso a la Cultura Garantiza Mónica Villarreal  Se presenta la Banda Municipal en el Kiosco de la Plaza de Armas  En el marco de las acciones de promoción cultural desarrolladas por el ayuntamiento de Tampico, a través de la Secretaría de Cultura, este domingo tuvo lugar en el kiosco de la Plaza de Armas, la presentación estelar de la Banda Municipal dentro del programa Domingos de Matiné con la Banda.  El concierto congregó a un nutrido público que se dio cita en punto de las 11:00 de la mañana a la plaza principal de la zona centro, para disfrutar un amplio repertorio presentado por la agrupación musical, bajo la dirección del maestro Salvador Vázquez Alarcón.  La Banda Municipal de Tampico con 130 años de historia, se estará presentando cada domingo en el kiosco de la Plaza de Armas y los jueves en la plaza de la Libertad, a iniciativa de la Presidenta municipal Mónica Zacil Villarreal Anaya, como parte de su compromiso e interés por hacer de la cultura un punto de encuentro familiar y un espacio abierto para el fortalecimiento del tejido social.  La Regidora Silvia Olvera Saldívar y el Director de actividades artísticas de la Secretaría de Cultura, Raúl Capistrán García encabezaron el concierto dominical que incluyó la interpretación de grandes obras musicales.";"2024-10-27T20:23:58+0000";"";"";""
"964877296876825_1123385406018019/474462132406835_122115166100546197";"160";"2";"1";"474462132406835_122115166100546197";"data";"data.*";"fetched (200)";"2025-11-14 07:56:25.011643";"Facebook:/<page-id>/posts";"📅 Domingo en el XXII Festival Internacional en la Costa del Seno Mexicano ¡disfruta de manera gratuita de los eventos culturales para toda la familia en distintos puntos de #Tampico!  ▶Mitos, Fábulas y Leyendas de la Huasteca - Colectivo Cultural Raíces Huastecas 🕒 3:00 pm 📍 Barco Museo del Niño  ▶ Arte Deus - Ensamble Musical 🕠 5:30 pm 📍 Teatro Experimental, Espacio Cultural Metropolitano  ▶ Alebrijes Iluminados - Ilumiteatro Monumental 🕢 7:30 pm 📍 Plaza Hijas de Tampico  ▶ Jacinto Verdines - “Bailando al Son del Acordeón” 🕗 8:00 pm 📍 Plaza Hijas de Tampico  ¡No te lo pierdas y vive la cultura en cada rincón de nuestra ciudad!   #TampicoVaConTodos #FestivalCostaSenoMexicano";"2024-10-27T20:04:11+0000";"";"";""
"964877296876825_1123385406018019/474462132406835_122114714972546197";"169";"2";"1";"474462132406835_122114714972546197";"data";"data.*";"fetched (200)";"2025-11-14 07:56:25.011643";"Facebook:/<page-id>/posts";"Encabeza Mónica Villarreal un Gobierno Cercano a los Tampiqueños  La Presidenta municipal, Mónica Zacil Villarreal Anaya, encabezó la 3ra. Jornada del Bienestar en la colonia Solidaridad, Voluntad y Trabajo, donde más de 30 dependencias ofrecieron servicios médicos, productos de la canasta básica, atención ciudadana y programas sociales.  La alcaldesa  fue acompañada de la Presidenta del Sistema para el Desarrollo Integral de la Familia, Luz Adriana Villarreal Anaya; del Delegado municipal de la zona norte, Alejandro Rubio de la Portilla; el titular de Bienestar Social en el municipio, Omar Fabbri Flores; la Directora de los Servicios municipales de Salud, María Ofelia Cantú; y del Director regional Bienestar Federal, Rodolfo Rodríguez Bojorquez, subrayó que el gobierno de Tampico está alineado a las políticas del Gobernador Américo Villarreal Anaya que tienen como principal objetivo, atender la necesidades del pueblo de Tamaulipas.  #TampicoVaConTodos#TampicoTeCuida #BienestarTampico";"2024-10-25T20:45:57+0000";"";"";""
"964877296876825_1123385406018019/474462132406835_122114714972546197/474462132406835_122114714972546197";"3068";"169";"2";"474462132406835_122114714972546197";"data";"data.*";"fetched (200)";"2025-11-14 07:59:23.333186";"Facebook:/<post-id>/comments";"Siempre beneficiando al pueblo tampiqueño...";"2024-10-25T20:55:39+0000";"0";"0";""
"TampicoGob/474462132406835_122114714972546197/474462132406835_122114714972546197";"3068";"169";"2";"474462132406835_122114714972546197";"data";"data.*";"fetched (200)";"2025-11-14 07:59:23.333186";"Facebook:/<post-id>/comments";"Siempre beneficiando al pueblo tampiqueño...";"2024-10-25T20:55:39+0000";"0";"0";""
