Query_Str,Post_URL,Author_Name,Author_Web_Page_URL,Author_Handle,Verified_Status,UTC_Time,Ads,Tweet_Content,Post_ID,Tweet_URL,Reply_Count,Repost_Count,Like_Count,View_Count,Bookmark_Count,Tweet_Image_URL,Replying_to,Reply_to_Whom,Reply_to_Whom_URL,Reply_to_Whom_Username,Reply_to_Whom_Handle,Language,Type
(@@TampicoGob OR @@MonicaVTampico) min_replies:0 min_faves:0 min_retweets:0,https://x.com/search?q=(@@TampicoGob OR @@MonicaVTampico) min_replies:0 min_faves:0 min_retweets:0 until:2024-12-24 since:2024-12-23&src=typed_query,M. Trejo,https://x.com/MJT_Trejo,MJT_Trejo,False,2024-12-23 02:22:34+00:00,False,"@TinaHorneroR Se ve HASTA EN LA SOPA, y la verdad cansa. No pido que se haga a la inversa, sino que se apueste a un equilibrio (que uno por ahí tenga virtudes que el otro no, y lo mismo con los defectos, de tal forma que no se idiotice a ninguno de los dos ni se haga OP al otro)",1871018533402054905,https://x.com/MJT_Trejo/status/1871018533402054905,5,8,425,19930,5,,True,RevovT,https://x.com/RevovT,,RevovT,es,Top
(@@TampicoGob OR @@MonicaVTampico) min_replies:0 min_faves:0 min_retweets:0,https://x.com/search?q=(@@TampicoGob OR @@MonicaVTampico) min_replies:0 min_faves:0 min_retweets:0 until:2024-12-24 since:2024-12-23&src=typed_query,adn Noticias,https://x.com/adnnoticiasmx,adnnoticiasmx,True,2024-12-23 02:25:00+00:00,False,¡Ellos también son familia! 🐾🔥 Una valiente mujer arriesgó su vida para salvar a su perrito atrapado en un incendio en Tampico,1871019143287218480,https://x.com/adnnoticiasmx/status/1871019143287218480,40,680,7090,130355,106,https://pbs.twimg.com/amplify_video_thumb/1870976892662108160/img/VSzRsR2ZgrfyXPyJ.jpg,False,,,,,es,Top
(@@TampicoGob OR @@MonicaVTampico) min_replies:0 min_faves:0 min_retweets:0,https://x.com/search?q=(@@TampicoGob OR @@MonicaVTampico) min_replies:0 min_faves:0 min_retweets:0 until:2024-12-24 since:2024-12-23&src=typed_query,Jair⚓Zitro,https://x.com/jairzitro,jairzitro,False,2024-12-23 02:36:46+00:00,False,"@rubenrivera @MonicaVTampico En poco tiempo, Tampico dejó de brillar. El centro de Tampico no se puede ni caminar por las banquetas, están invadidas de vendedores ambulantes, basura por todos lados, escurrimientos de drenaje. No hay orden por ningún lado, lamentable.",1871022107154587921,https://x.com/jairzitro/status/1871022107154587921,0,0,0,114,0,,True,rubenrivera,https://x.com/rubenrivera,Rubén Rivera,rubenrivera,es,Top
(@@TampicoGob OR @@MonicaVTampico) min_replies:0 min_faves:0 min_retweets:0,https://x.com/search?q=(@@TampicoGob OR @@MonicaVTampico) min_replies:0 min_faves:0 min_retweets:0 until:2024-12-24 since:2024-12-23&src=typed_query,PasoaPaso Tatengue,https://x.com/PaProjiblanco,PaProjiblanco,False,2024-12-23 02:44:13+00:00,False,"Santafesino, tatengue de corazón y Campeón en tierras hondureñas! 🇭🇳 Felicidades @gomezrodriigo 🔟🇦🇹",1871023978216669270,https://x.com/PaProjiblanco/status/1871023978216669270,7,17,202,6682,1,https://pbs.twimg.com/media/Gfc2ZGGXEAAMi21.jpg,False,,,,,es,Top
(@@TampicoGob OR @@MonicaVTampico) min_replies:0 min_faves:0 min_retweets:0,https://x.com/search?q=(@@TampicoGob OR @@MonicaVTampico) min_replies:0 min_faves:0 min_retweets:0 until:2024-12-24 since:2024-12-23&src=typed_query,HPUGAS,https://x.com/hpugas13,hpugas13,False,2024-12-23 03:15:30+00:00,False,"@rubenrivera @MonicaVTampico Gran verdad,cada día estamos peor.",1871031851386806414,https://x.com/hpugas13/status/1871031851386806414,0,0,0,34,0,,True,rubenrivera,https://x.com/rubenrivera,Rubén Rivera,rubenrivera,es,Top
(@@TampicoGob OR @@MonicaVTampico) min_replies:0 min_faves:0 min_retweets:0,https://x.com/search?q=(@@TampicoGob OR @@MonicaVTampico) min_replies:0 min_faves:0 min_retweets:0 until:2024-12-24 since:2024-12-23&src=typed_query,Gustavo Roca,https://x.com/GustavoRocaGOL,GustavoRocaGOL,True,2024-12-23 04:22:01+00:00,False,"🦅👑 Un cierre de año ESPECTACULAR para Motagua. ✅Único hondureño en Concacaf. ✅Rompió hegemonía de 18 juegos sin ganar ante Olimpia. ✅Quitó invicto de local de Olimpia de 48 partidos. ✅Título de campeon celebrando la copa 19. ✅DEJÓ A OLIMPIA SIN PENTACAMPEONATO. ¡SALUD, CAMPEONES! 🎉🍾",1871048593421017421,https://x.com/GustavoRocaGOL/status/1871048593421017421,18,43,332,7209,5,https://pbs.twimg.com/media/GfdMxp6X0AA07hJ.jpg,False,,,,,es,Top
(@@TampicoGob OR @@MonicaVTampico) min_replies:0 min_faves:0 min_retweets:0,https://x.com/search?q=(@@TampicoGob OR @@MonicaVTampico) min_replies:0 min_faves:0 min_retweets:0 until:2024-12-24 since:2024-12-23&src=typed_query,El Necio,https://x.com/ElNecio_Cuba,ElNecio_Cuba,True,2024-12-23 04:40:32+00:00,False,"🇵🇦 Presidente panameño, José Raúl Mulino frente a las amenazas de Trump: “Cada metro cuadrado del canal de Panamá es de Panamá""",1871053251451425154,https://x.com/ElNecio_Cuba/status/1871053251451425154,70,406,1578,88837,73,https://pbs.twimg.com/media/Gfb0TvUWYAAyfEV.jpg,False,,,,,es,Top
(@@TampicoGob OR @@MonicaVTampico) min_replies:0 min_faves:0 min_retweets:0,https://x.com/search?q=(@@TampicoGob OR @@MonicaVTampico) min_replies:0 min_faves:0 min_retweets:0 until:2024-12-24 since:2024-12-23&src=typed_query,Tamtam,https://x.com/Tammywi27443369,Tammywi27443369,False,2024-12-23 05:05:43+00:00,False,@MonicaPaigeTV She hasn’t seen her mother since she was a newborn?,1871059590894461169,https://x.com/Tammywi27443369/status/1871059590894461169,3,3,210,81446,9,,True,MonicaPaigeTV,https://x.com/MonicaPaigeTV,MONICA PAIGE✰TPUSA,MonicaPaigeTV,en,Top
(@@TampicoGob OR @@MonicaVTampico) min_replies:0 min_faves:0 min_retweets:0,https://x.com/search?q=(@@TampicoGob OR @@MonicaVTampico) min_replies:0 min_faves:0 min_retweets:0 until:2024-12-24 since:2024-12-23&src=typed_query,Qué Poca Madre 🇲🇽,https://x.com/QuePocaMadre_Mx,QuePocaMadre_Mx,False,2024-12-23 05:40:31+00:00,False,‼️😨AY NO COMO HAY GENTE TAN PENDEJA 😡🙄CASI SE DESVIVE POR HACER SUS TONTERÍAS 🔫‼️,1871068348974580169,https://x.com/QuePocaMadre_Mx/status/1871068348974580169,52,162,2689,283849,176,https://pbs.twimg.com/amplify_video_thumb/1871068290929336320/img/l-Xo6VuSR2l_k6Al.jpg,False,,,,,es,Top
(@@TampicoGob OR @@MonicaVTampico) min_replies:0 min_faves:0 min_retweets:0,https://x.com/search?q=(@@TampicoGob OR @@MonicaVTampico) min_replies:0 min_faves:0 min_retweets:0 until:2024-12-24 since:2024-12-23&src=typed_query,Qué Poca Madre 🇲🇽,https://x.com/QuePocaMadreMex,QuePocaMadreMex,False,2024-12-23 05:41:28+00:00,False,‼️😨AY NO COMO HAY GENTE TAN PENDEJA 😡🙄CASI SE DESVIVE POR HACER SUS TONTERÍAS 🔫‼️,1871068587261338089,https://x.com/QuePocaMadreMex/status/1871068587261338089,1,15,256,20953,14,https://pbs.twimg.com/amplify_video_thumb/1871068528641499136/img/2mDPec_scqmLZqPE.jpg,False,,,,,es,Top
(@@TampicoGob OR @@MonicaVTampico) min_replies:0 min_faves:0 min_retweets:0,https://x.com/search?q=(@@TampicoGob OR @@MonicaVTampico) min_replies:0 min_faves:0 min_retweets:0 until:2024-12-24 since:2024-12-23&src=typed_query,MAGA TX RANCH WOMAN🇺🇸🇺🇸🍊🍊🍊🍊🍊🐂🐎🐾,https://x.com/txranch45,txranch45,True,2024-12-23 10:41:17+00:00,False,@MonicaPaigeTV God bless you for following through with this child. I wonder if she had ever spoken with her mother in all those years. Can you imagine sending this child alone with the promise her mother is going to meet her and then she doesn't? Ugh. How terrifying for her. You have to wonder,1871144040089243778,https://x.com/txranch45/status/1871144040089243778,13,30,516,113922,10,,True,MonicaPaigeTV,https://x.com/MonicaPaigeTV,MONICA PAIGE✰TPUSA,MonicaPaigeTV,en,Top
(@@TampicoGob OR @@MonicaVTampico) min_replies:0 min_faves:0 min_retweets:0,https://x.com/search?q=(@@TampicoGob OR @@MonicaVTampico) min_replies:0 min_faves:0 min_retweets:0 until:2024-12-24 since:2024-12-23&src=typed_query,Mina,https://x.com/san_down,san_down,False,2024-12-23 12:06:32+00:00,False,"@eatbutches Uma parte da minha família é estrangeira e cumpri meu dever como brasileira de fazer uma imersão em turma da Mônica: comprei gibi no idioma das crianças, levamos no parque, compramos pelúcia, tudo! E hj eles só falam que querem vir pro Brasil ver a Mônica",1871165491823411343,https://x.com/san_down/status/1871165491823411343,1,5,207,20249,8,,True,antitesia,https://x.com/antitesia,jurídico verona moon,antitesia,pt,Top
(@@TampicoGob OR @@MonicaVTampico) min_replies:0 min_faves:0 min_retweets:0,https://x.com/search?q=(@@TampicoGob OR @@MonicaVTampico) min_replies:0 min_faves:0 min_retweets:0 until:2024-12-24 since:2024-12-23&src=typed_query,Mundo en Conflicto 🌎,https://x.com/MundoEConflicto,MundoEConflicto,True,2024-12-23 12:16:10+00:00,False,"🇺🇸🇵🇦 | Tensión internacional: Trump reclamó el Canal de Panamá y Mulino respondió que ""es panameño y lo seguirá siendo"". https://www.canal26.com/internacionales/tension-internacional-trump-reclamo-el-canal-de-panama-y-mulino-respondio-que-es-panameno-y-lo-seguira-siendo--404882?utm_medium=MeC&utm_campaign=DptoRedes&utm_source=Redes",1871167917343285308,https://x.com/MundoEConflicto/status/1871167917343285308,21,55,243,20179,5,,False,,,,,es,Top
(@@TampicoGob OR @@MonicaVTampico) min_replies:0 min_faves:0 min_retweets:0,https://x.com/search?q=(@@TampicoGob OR @@MonicaVTampico) min_replies:0 min_faves:0 min_retweets:0 until:2024-12-24 since:2024-12-23&src=typed_query,Telemundo,https://x.com/TelemundoUY,TelemundoUY,False,2024-12-23 12:59:33+00:00,False,🚨Una mujer murió tras un intento de robo por parte de una pareja que cometió al menos diez arrebatos en la zona de Pocitos https://www.teledoce.com/telemundo/policiales/una-mujer-murio-tras-un-intento-de-robo-por-parte-de-una-pareja-que-cometio-al-menos-diez-arrebatos-en-la-zona-de-pocitos/,1871178832348143988,https://x.com/TelemundoUY/status/1871178832348143988,50,59,204,51888,15,,False,,,,,es,Top
(@@TampicoGob OR @@MonicaVTampico) min_replies:0 min_faves:0 min_retweets:0,https://x.com/search?q=(@@TampicoGob OR @@MonicaVTampico) min_replies:0 min_faves:0 min_retweets:0 until:2024-12-24 since:2024-12-23&src=typed_query,Genshin Impact ES,https://x.com/genshinimpactes,genshinimpactes,True,2024-12-23 13:00:01+00:00,False,"¡Hola, viajero/a! El registro del festival de verano «#JuntosConMavuika» ya está disponible. El registro es gratuito. Sigue las instrucciones de la página y rellena correctamente la información para inscribirte. ◆ Eventos del Abismo y cosplay Club Mallplaza Vespucio: https://hoyo.link/YQlXTaCZx ◆ Evento de colección de sellos Club Mallplaza Vespucio, Norte, Trébo: https://hoyo.link/m1TTYc6dL Club Falabella Antofagasta, Parque Arauco: no es necesario prerregistrarse, puedes participar directamente. ¡Esperamos tu participación! #StandWithMavuika",1871178952775209294,https://x.com/genshinimpactes/status/1871178952775209294,14,89,1163,46094,70,https://pbs.twimg.com/media/Gfe2QOgbIAAhk0W.jpg,False,,,,,es,Top
(@@TampicoGob OR @@MonicaVTampico) min_replies:0 min_faves:0 min_retweets:0,https://x.com/search?q=(@@TampicoGob OR @@MonicaVTampico) min_replies:0 min_faves:0 min_retweets:0 until:2024-12-24 since:2024-12-23&src=typed_query,Sabrina Bacal,https://x.com/sabribacal,sabribacal,True,2024-12-23 13:48:15+00:00,False,"A la amenaza de Trump había que responder de manera inmediata y contundente cómo lo hizo Mulino. Este es el Trump 2.0 que intimida a un país aliado para conseguir lo que quiere: que recibamos migrantes, que rompamos con China, que bajemos peajes o que reabramos la mina.",1871191090575061493,https://x.com/sabribacal/status/1871191090575061493,65,74,315,17969,4,,False,,,,,es,Top
(@@TampicoGob OR @@MonicaVTampico) min_replies:0 min_faves:0 min_retweets:0,https://x.com/search?q=(@@TampicoGob OR @@MonicaVTampico) min_replies:0 min_faves:0 min_retweets:0 until:2024-12-24 since:2024-12-23&src=typed_query,Hermandad de la Macarena,https://x.com/Hdad_Macarena,Hdad_Macarena,True,2024-12-23 14:00:03+00:00,False,"Ya están disponibles en la tienda de recuerdos el pin y el alfiler conmemorativos de la Rosa de Oro entregada a la Virgen de la Esperanza. Recordamos que los beneficios de la tienda se destinan a los fines de nuestra Hermandad, en especial a la caridad y su labor asistencial. #rosadeoromacarena",1871194058506555829,https://x.com/Hdad_Macarena/status/1871194058506555829,3,19,203,29043,18,https://pbs.twimg.com/media/Gfe66WDWoAA4MWz.jpg;https://pbs.twimg.com/ext_tw_video_thumb/1871170741242052608/pu/img/cUn-NWh9ZtrjVpG0.jpg,False,,,,,es,Top
(@@TampicoGob OR @@MonicaVTampico) min_replies:0 min_faves:0 min_retweets:0,https://x.com/search?q=(@@TampicoGob OR @@MonicaVTampico) min_replies:0 min_faves:0 min_retweets:0 until:2024-12-24 since:2024-12-23&src=typed_query,Tamara Suju,https://x.com/TAMARA_SUJU,TAMARA_SUJU,True,2024-12-23 14:45:49+00:00,False,"🌲🧑‍🎄 En nuestro 2do Grupo de Padrinos y Madrinas de la campaña #ApadrinaAUnPresoPoliticoDelMundo, estos son los mensajes de Esperanza y Deseos de Libertad para ellos que enviaron quienes han sido sus voces!😊 María Corina Machado @MariaCorinaYA madrina del Mayor #AdriánDeGouveia Marta Lucia Ramírez @mluciaramirez madrina de Magalli Meda @MagalliMeda Javier Nart Padrino de #JaimeNavarrete Beatriz Becerra @beatrizbecerrab madrina de #MaríaCristinaGarrido Ex Presidente Andrés Pastrana @AndresPastrana_ padrino de #JoeVillamizar Damián Arabia @DamianArabia padrino de Paul David León Daniel Radio @DanielRadioP padrino de Franklin Caldera @FranklinCalderC",1871205575674982553,https://x.com/TAMARA_SUJU/status/1871205575674982553,18,402,822,45966,13,https://pbs.twimg.com/ext_tw_video_thumb/1871205341817401344/pu/img/X50Tw86Nmytg13jF.jpg,False,,,,,es,Top
(@@TampicoGob OR @@MonicaVTampico) min_replies:0 min_faves:0 min_retweets:0,https://x.com/search?q=(@@TampicoGob OR @@MonicaVTampico) min_replies:0 min_faves:0 min_retweets:0 until:2024-12-24 since:2024-12-23&src=typed_query,Angelica Monsalve Gaviria,https://x.com/alazamo123,alazamo123,True,2024-12-23 15:03:43+00:00,False,"Yo nací en los años 70’ en el hospital San Vicente de Paul en Medellín, y viví hasta los 6 años de edad en Manrique Central, toda mi familia vivió la violencia de aquel entonces, y hace unos años, visite a un tío materno que vive en la comuna 13 de Medellín, y recuerdo que me comentaba el terror que vivían, al ver como detrás de su casa amanecían todos los días, cadáveres de niños y jóvenes, y por el miedo nadie sabia quienes los mataban. Colombia debe superar la cultura de la muerte y la violencia, el Estado debe propiciar la vida y la prosperidad, pero no es ni con frases bonitas ni con remiendos a la justicia que lo vamos a lograr, es con una REESTRUCTURACIÓN del Estado Colombiano desde sus cimientos. ¡La muerte y la corrupción se tienen que abolir! Así como el constituyente del 91, para darle paso, al constituyente del 2026.",1871210083159314657,https://x.com/alazamo123/status/1871210083159314657,50,648,1493,30094,18,,True,petrogustavo,https://x.com/petrogustavo,Gustavo Petro,petrogustavo,es,Top
(@@TampicoGob OR @@MonicaVTampico) min_replies:0 min_faves:0 min_retweets:0,https://x.com/search?q=(@@TampicoGob OR @@MonicaVTampico) min_replies:0 min_faves:0 min_retweets:0 until:2024-12-24 since:2024-12-23&src=typed_query,Angelica Monsalve Gaviria,https://x.com/alazamo123,alazamo123,True,2024-12-23 15:08:03+00:00,False,"Yo nací en los años 70' en el hospital San Vicente de Paul en Medellín, y viví hasta los 6 años de edad en Manrique Central, toda mi familia vivió la violencia de aquel entonces, y hace unos años, visite a un tío materno que vive en la comuna 13 de Medellín, y recuerdo que me comentaba el terror que vivían, al ver como detrás de su casa amanecían todos los días, cadáveres de niños y jóvenes, y por el miedo nadie sabia quienes los mataban. Colombia debe superar la cultura de la muerte y la violencia, el Estado debe propiciar la vida y la prosperidad, pero no es ni con frases bonitas ni con remiendos a la justicia que lo vamos a lograr, es con una REESTRUCTURACIÓN del Estado Colombiano desde sus cimientos. ¡La muerte y la corrupción se tienen que abolir! Así como el constituyente del 91, para darle paso, al constituyente del 2026.",1871211172831035506,https://x.com/alazamo123/status/1871211172831035506,71,1088,2043,36949,11,,False,,,,,es,Top
(@@TampicoGob OR @@MonicaVTampico) min_replies:0 min_faves:0 min_retweets:0,https://x.com/search?q=(@@TampicoGob OR @@MonicaVTampico) min_replies:0 min_faves:0 min_retweets:0 until:2024-12-24 since:2024-12-23&src=typed_query,Tomas Diaz Cueto,https://x.com/Tomidiazcueto,Tomidiazcueto,True,2024-12-23 15:11:14+00:00,False,@SoyFeudaleM Una mina que se cago de risa de como le cortaban las polleras a otras mujeres ¿tiene poder de opinión?,1871211973331042680,https://x.com/Tomidiazcueto/status/1871211973331042680,38,76,933,6188,4,,True,SoyFeudaleM,https://x.com/SoyFeudaleM,Marcela Feudale,SoyFeudaleM,es,Top
(@@TampicoGob OR @@MonicaVTampico) min_replies:0 min_faves:0 min_retweets:0,https://x.com/search?q=(@@TampicoGob OR @@MonicaVTampico) min_replies:0 min_faves:0 min_retweets:0 until:2024-12-24 since:2024-12-23&src=typed_query,Nacho Rodriguez (El Chapucero),https://x.com/NachoRgz,NachoRgz,True,2024-12-23 15:20:13+00:00,False,"#VIDEO | El Canal de Panamá es de los panameños. La presidenta de México, @Claudiashein, expresó su solidaridad con el pueblo de #Panamá y su presidente, @JoseRaulMulino, ante las amenazas de Donald Trump de exigir que Washington retome el control de ese estratégico paso.",1871214235516338612,https://x.com/NachoRgz/status/1871214235516338612,93,732,1803,24693,13,https://pbs.twimg.com/ext_tw_video_thumb/1871214021501935616/pu/img/C6BPV0mPA30T9l6Q.jpg,False,,,,,es,Top
(@@TampicoGob OR @@MonicaVTampico) min_replies:0 min_faves:0 min_retweets:0,https://x.com/search?q=(@@TampicoGob OR @@MonicaVTampico) min_replies:0 min_faves:0 min_retweets:0 until:2024-12-24 since:2024-12-23&src=typed_query,LaMaka🌹🇪🇨,https://x.com/UnaTalMaka_,UnaTalMaka_,False,2024-12-23 15:44:29+00:00,False,"Patéticos, me acusaron de ser la cuenta alterna de Villavicencio, luego de Polificción, después q yo era José Najas. Ahora, resulta q soy Tomasi, 🤣 Lo increíble es q crean q las mujeres no podemos llevarnos por delante a la revolución [Solo soy una chica en la red] 😘",1871220340145483846,https://x.com/UnaTalMaka_/status/1871220340145483846,25,123,468,7438,0,,False,,,,,es,Top
(@@TampicoGob OR @@MonicaVTampico) min_replies:0 min_faves:0 min_retweets:0,https://x.com/search?q=(@@TampicoGob OR @@MonicaVTampico) min_replies:0 min_faves:0 min_retweets:0 until:2024-12-24 since:2024-12-23&src=typed_query,໊,https://x.com/wandasattorney,wandasattorney,True,2024-12-23 16:03:17+00:00,False,SHE IS A STUDENT OF THE ANDREW GARFIELD SCHOOL OF LYING MONICA IS COMING HOME!,1871225073438277723,https://x.com/wandasattorney/status/1871225073438277723,9,66,1249,59246,144,https://pbs.twimg.com/ext_tw_video_thumb/1871224073008623616/pu/img/4L2ADdnfKnejMUQ2.jpg,False,,,,,en,Top
(@@TampicoGob OR @@MonicaVTampico) min_replies:0 min_faves:0 min_retweets:0,https://x.com/search?q=(@@TampicoGob OR @@MonicaVTampico) min_replies:0 min_faves:0 min_retweets:0 until:2024-12-24 since:2024-12-23&src=typed_query,Roby 202💛💛💛💛💛 #ProyectoMacri,https://x.com/RobyLentini,RobyLentini,False,2024-12-23 16:07:10+00:00,False,"#MacristasUnidos #VotoPRO FELICES FIESTAS LES DESEO DE CORAZON AMARILLO 💛 A TODOS LOS CORAZONES 💛💛💛💛💛💛 💛💛💛💛💛 Somos los que defendemos los valores , el mérito y la libertad de expresión Siempre con nuestro presidente @mauriciomacri.",1871226048559628415,https://x.com/RobyLentini/status/1871226048559628415,45,178,462,3270,0,https://pbs.twimg.com/media/GffuK6eWQAAVDr8.jpg,False,,,,,es,Top
(@@TampicoGob OR @@MonicaVTampico) min_replies:0 min_faves:0 min_retweets:0,https://x.com/search?q=(@@TampicoGob OR @@MonicaVTampico) min_replies:0 min_faves:0 min_retweets:0 until:2024-12-24 since:2024-12-23&src=typed_query,Michelle Mendoza Muñoz,https://x.com/mmendoza_GT,mmendoza_GT,True,2024-12-23 16:32:58+00:00,False,"Y como cada año desde que me quedé aquí, me conecto haciendo tamalitos. Un abrazo para todos y felices fiestas.",1871232543221018950,https://x.com/mmendoza_GT/status/1871232543221018950,22,13,396,9610,0,,False,,,,,es,Top
(@@TampicoGob OR @@MonicaVTampico) min_replies:0 min_faves:0 min_retweets:0,https://x.com/search?q=(@@TampicoGob OR @@MonicaVTampico) min_replies:0 min_faves:0 min_retweets:0 until:2024-12-24 since:2024-12-23&src=typed_query,RTVC Noticias,https://x.com/RTVCnoticias,RTVCnoticias,True,2024-12-23 16:49:13+00:00,False,"⚖️ Durante más de dos décadas, autoridades locales y nacionales hicieron caso omiso a las súplicas de las madres de víctimas en la Comuna 13 🕊️Con estos nuevos hallazgos, se abre una oportunidad para fortalecer los procesos de verdad, justicia y reparación. 👉 https://lc.cx/2fbdQZ",1871236633359519947,https://x.com/RTVCnoticias/status/1871236633359519947,7,335,485,4520,5,https://pbs.twimg.com/media/Gff23dyXsAAEr8u.jpg,False,,,,,es,Top
(@@TampicoGob OR @@MonicaVTampico) min_replies:0 min_faves:0 min_retweets:0,https://x.com/search?q=(@@TampicoGob OR @@MonicaVTampico) min_replies:0 min_faves:0 min_retweets:0 until:2024-12-24 since:2024-12-23&src=typed_query,Impudor Político,https://x.com/ImpudorPolitico,ImpudorPolitico,False,2024-12-23 16:49:51+00:00,False,"🚨 AVISO IMPORTANTE 🚨 Para Donald Trun, digo TRUMP de parte de Morena, AMLO y Claudia Sheinbaum. Todo México, disfruten 🫢",1871236790977479073,https://x.com/ImpudorPolitico/status/1871236790977479073,0,76,212,19574,13,https://pbs.twimg.com/media/Gff38VoawAQOlh_.jpg,False,,,,,es,Top
(@@TampicoGob OR @@MonicaVTampico) min_replies:0 min_faves:0 min_retweets:0,https://x.com/search?q=(@@TampicoGob OR @@MonicaVTampico) min_replies:0 min_faves:0 min_retweets:0 until:2024-12-24 since:2024-12-23&src=typed_query,Mónica Velásquez,https://x.com/MoniVelasquezV,MoniVelasquezV,True,2024-12-23 16:55:53+00:00,False,"Duele la indolencia, Duele la ausencia, Duelen las lágrimas, Duelen los gritos de justicia, Duelen los más frágiles, Duelen los que sufren en silencio, Duelen las vidas quebradas, Duelen los vacíos de quienes no están.",1871238308824584268,https://x.com/MoniVelasquezV/status/1871238308824584268,92,334,575,18788,8,https://pbs.twimg.com/media/Gff5UuaXUAAqtLJ.jpg,False,,,,,es,Top
(@@TampicoGob OR @@MonicaVTampico) min_replies:0 min_faves:0 min_retweets:0,https://x.com/search?q=(@@TampicoGob OR @@MonicaVTampico) min_replies:0 min_faves:0 min_retweets:0 until:2024-12-24 since:2024-12-23&src=typed_query,Momoiro_sama,https://x.com/MomoiroAguiraru,MomoiroAguiraru,False,2024-12-23 17:23:11+00:00,False,"Suena el despertador, te levantas sin ganas. Lunes de nuevo. Volteas, y ahí está ella, sonriéndote; su mirada ilumina tu día. Te hace sentir que puedes con todo. Es Momoiro, en cada mes de su calendario, dándote la motivación que necesitas para seguir adelante. La vida es buena",1871245180030042452,https://x.com/MomoiroAguiraru/status/1871245180030042452,7,15,361,91793,21,https://pbs.twimg.com/media/Gff_kvCX0AAoYlG.jpg,False,,,,,es,Top
(@@TampicoGob OR @@MonicaVTampico) min_replies:0 min_faves:0 min_retweets:0,https://x.com/search?q=(@@TampicoGob OR @@MonicaVTampico) min_replies:0 min_faves:0 min_retweets:0 until:2024-12-24 since:2024-12-23&src=typed_query,La Tía Sandra,https://x.com/TuTiaSandra,TuTiaSandra,True,2024-12-23 17:58:06+00:00,False,📢 TANIA RINCON y VANESSA CLAUDIO ¿Quién es tu conductora favorita? 🔥 #programaHoy #VengaLaAlegria #Alextremo #VanessaClaudio #vla #TaniaRincon #televisa #tvazteca,1871253965733831098,https://x.com/TuTiaSandra/status/1871253965733831098,115,13,215,42022,32,https://pbs.twimg.com/ext_tw_video_thumb/1740761157718179840/pu/img/ESz4ITifUlCpNHil.jpg,False,,,,,es,Top
(@@TampicoGob OR @@MonicaVTampico) min_replies:0 min_faves:0 min_retweets:0,https://x.com/search?q=(@@TampicoGob OR @@MonicaVTampico) min_replies:0 min_faves:0 min_retweets:0 until:2024-12-24 since:2024-12-23&src=typed_query,Sofi Lo Piccolo,https://x.com/sofilopiccolo,sofilopiccolo,True,2024-12-23 18:05:06+00:00,False,"@TommyShelby_30 Que raro, si a mi me dijeron que pintando bancos de color rojo, creando un ministerio de la mujer y haciéndole a los violadores participar de “cursos de género” iban a bajar los femicidios",1871255729245680073,https://x.com/sofilopiccolo/status/1871255729245680073,9,41,1392,17025,8,,True,TommyShelby_30,https://x.com/TommyShelby_30,SheIby,TommyShelby_30,es,Top
(@@TampicoGob OR @@MonicaVTampico) min_replies:0 min_faves:0 min_retweets:0,https://x.com/search?q=(@@TampicoGob OR @@MonicaVTampico) min_replies:0 min_faves:0 min_retweets:0 until:2024-12-24 since:2024-12-23&src=typed_query,@pinchagua19,https://x.com/pinchagua19,pinchagua19,False,2024-12-23 18:21:22+00:00,False,LA MAMÁ DE LA MAMÁ DE LA MAMÁ DE LOS CÁRTELES MEXICANOS..... 😎🇪🇨,1871259822295032161,https://x.com/pinchagua19/status/1871259822295032161,24,156,298,3064,1,https://pbs.twimg.com/media/GfgM5GAXkAAAS7Z.jpg,False,,,,,es,Top
(@@TampicoGob OR @@MonicaVTampico) min_replies:0 min_faves:0 min_retweets:0,https://x.com/search?q=(@@TampicoGob OR @@MonicaVTampico) min_replies:0 min_faves:0 min_retweets:0 until:2024-12-24 since:2024-12-23&src=typed_query,CeciliaOrozcoTascón,https://x.com/CeciliaOrozcoT,CeciliaOrozcoT,True,2024-12-23 18:22:50+00:00,False,"Se dice abogado y filántropo. No debe ser ni lo uno ni lo otro: quien así habla y juzga, basado solo odios, fue mal graduado y tiene pobre opinión de sí mismo. El fracasado parece ser quien proyecta su autocompasión en personajes exitosos como Mónica R. Ignorancia supina.",1871260192949813703,https://x.com/CeciliaOrozcoT/status/1871260192949813703,31,830,1717,26244,7,,False,,,,,es,Top
