Query_Str,Post_URL,Author_Name,Author_Web_Page_URL,Author_Handle,Verified_Status,UTC_Time,Ads,Tweet_Content,Post_ID,Tweet_URL,Reply_Count,Repost_Count,Like_Count,View_Count,Bookmark_Count,Tweet_Image_URL,Replying_to,Reply_to_Whom,Reply_to_Whom_URL,Reply_to_Whom_Username,Reply_to_Whom_Handle,Language,Type
(@@TampicoGob OR @@MonicaVTampico) min_replies:0 min_faves:0 min_retweets:0,https://x.com/search?q=(@@TampicoGob OR @@MonicaVTampico) min_replies:0 min_faves:0 min_retweets:0 until:2024-12-18 since:2024-12-17&src=typed_query,Lisa.B,https://x.com/Ana9Lisa,Ana9Lisa,False,2024-12-17 08:36:16+00:00,False,"Buenos días mundo, ¡Ya soy tía!, mi sobrinita ya está aquí. Bienvenida a este mundo, es un poco perro, pero tu tía te trae risas, colorinchis, abrazos, y te va a enseñar muchas palabrotas. Wiiiiii 🩷🩷🩷🩷🩷🩷🩷🩷🩷🩷🩷🩷",1868938249949040650,https://x.com/Ana9Lisa/status/1868938249949040650,145,12,759,10449,0,,False,,,,,es,Top
(@@TampicoGob OR @@MonicaVTampico) min_replies:0 min_faves:0 min_retweets:0,https://x.com/search?q=(@@TampicoGob OR @@MonicaVTampico) min_replies:0 min_faves:0 min_retweets:0 until:2024-12-18 since:2024-12-17&src=typed_query,Manos de Heroes,https://x.com/manosdeheroes,manosdeheroes,False,2024-12-17 11:10:20+00:00,False,"¿Se acuerdan de Naomi? Fue la primera niña a quien le dimos una mano de héroe, allá por el 2020. Naomi hoy tiene 12 años y su mamá Mónica nos escribió para contarnos que estaba yendo a clases de guitarra y precisaba un adaptador para que logre sostener la púa.",1868977021063512160,https://x.com/manosdeheroes/status/1868977021063512160,2,47,342,12912,0,https://pbs.twimg.com/media/Ge_wsOoWgAAhUYj.jpg,False,,,,,es,Top
(@@TampicoGob OR @@MonicaVTampico) min_replies:0 min_faves:0 min_retweets:0,https://x.com/search?q=(@@TampicoGob OR @@MonicaVTampico) min_replies:0 min_faves:0 min_retweets:0 until:2024-12-18 since:2024-12-17&src=typed_query,⛓️‍💥🇻🇪Tequeño🇻🇪⛓️‍💥,https://x.com/tequenoqueopina,tequenoqueopina,False,2024-12-17 11:30:27+00:00,False,"La hija de Maria Corina Machado es literalmente Maria Corina Machado jovencita. Que cosa tan impresionante. La sonrisa es idéntica. Y obvio: la educación, los modales, los valores, la clase, la elegancia y sobretodo LA DECENCIA. Lo vuelvo a repetir: EL LIDERAZGO QUE ✨MERECEMOS✨",1868982085177974833,https://x.com/tequenoqueopina/status/1868982085177974833,71,746,2894,36996,16,,False,,,,,es,Top
(@@TampicoGob OR @@MonicaVTampico) min_replies:0 min_faves:0 min_retweets:0,https://x.com/search?q=(@@TampicoGob OR @@MonicaVTampico) min_replies:0 min_faves:0 min_retweets:0 until:2024-12-18 since:2024-12-17&src=typed_query,Jair,https://x.com/mondomo79,mondomo79,True,2024-12-17 11:39:56+00:00,False,"@PaoHerreraC Tenaz como empieza el escrito. Todo termina siendo personal y es una periodista de bastante reputación, se pierden las formas, se dean contagiar del resto, se termina haciendo parte del rebaño.",1868984469858009285,https://x.com/mondomo79/status/1868984469858009285,5,54,205,2337,0,https://pbs.twimg.com/media/Ge_3eArXYAAXPy_.jpg,True,PaoHerreraC,https://x.com/PaoHerreraC,Paola Herrera,PaoHerreraC,es,Top
(@@TampicoGob OR @@MonicaVTampico) min_replies:0 min_faves:0 min_retweets:0,https://x.com/search?q=(@@TampicoGob OR @@MonicaVTampico) min_replies:0 min_faves:0 min_retweets:0 until:2024-12-18 since:2024-12-17&src=typed_query,Traductor 🥹💕💐,https://x.com/TraductorTeAma,TraductorTeAma,True,2024-12-17 12:31:58+00:00,False,"El detalle de esto no es la reaparición de la corrupta Tolosa Paz. El detalle clave es que esta vez aparece con un rosario colgado al cuello. Hace unos años era con pañuelito verde. Ahora ""Dios patria y familia"" https://x.com/elduckpost/status/1868609476670235043/video/1",1868997565150380060,https://x.com/TraductorTeAma/status/1868997565150380060,556,828,4030,137171,61,,False,,,,,es,Top
(@@TampicoGob OR @@MonicaVTampico) min_replies:0 min_faves:0 min_retweets:0,https://x.com/search?q=(@@TampicoGob OR @@MonicaVTampico) min_replies:0 min_faves:0 min_retweets:0 until:2024-12-18 since:2024-12-17&src=typed_query,Teresa Christina C.🦁💜🇦🇷,https://x.com/Tcristina77,Tcristina77,True,2024-12-17 12:46:40+00:00,False,"POR FAVOR ESCUCHEN !! EL PERIODISTA DE LENTES SE LLAMA TOMÁS MOSCIATTI, ES BASTANTE DIRECTO, PERO MILEI ES UN MILAGRO!! CHILE TE AMA @JMilei y YO MUCHO MAS! VLLC!!! ❤️🇦🇷",1869001262618046975,https://x.com/Tcristina77/status/1869001262618046975,11,174,564,8199,29,https://pbs.twimg.com/ext_tw_video_thumb/1869001204706967552/pu/img/jUbU5mTP39-269lr.jpg,False,,,,,es,Top
(@@TampicoGob OR @@MonicaVTampico) min_replies:0 min_faves:0 min_retweets:0,https://x.com/search?q=(@@TampicoGob OR @@MonicaVTampico) min_replies:0 min_faves:0 min_retweets:0 until:2024-12-18 since:2024-12-17&src=typed_query,silvia mensegar,https://x.com/SilviaMylo,SilviaMylo,False,2024-12-17 13:02:18+00:00,False,"Pobrecito a su edad implorando por una familia rodando por ahí como esos abuelillos que nadie quiere qué pena 😢 💔 🚨🚨🚨🚨 BOBY NECESITA HOGAR 🏠💙💙 El frío y la edad le pasan factura 😢 tiene dolores y necesita hogar calientito 🙏 *Es un perro súper tranquilo, tiene 6 años 🧡 *Pasea muy bien con la correa 👌 *Sabe hacer sus necesidades fuera *Es un perro grande, cruce de mastín *Está desparasitado, chipado, vacunado y castrado ✅ *Se lleva muy bien con otros perros y niños ❤️👶 Necesita una familia que le de cariño y amor que nunca ha tenido en su vida 💔 📍está en Madrid, puede viajar 🚘 ☎️Contacto 665319474",1869005197705388265,https://x.com/SilviaMylo/status/1869005197705388265,45,904,790,22752,13,https://pbs.twimg.com/media/GfAKUm4WUAASfYN.jpg,False,,,,,es,Top
(@@TampicoGob OR @@MonicaVTampico) min_replies:0 min_faves:0 min_retweets:0,https://x.com/search?q=(@@TampicoGob OR @@MonicaVTampico) min_replies:0 min_faves:0 min_retweets:0 until:2024-12-18 since:2024-12-17&src=typed_query,Mhoni Vidente,https://x.com/mhonividente,mhonividente,True,2024-12-17 13:31:48+00:00,False,Hoy abro mIs brazos al Éxito y recordaré que cada dificultad y problema que se presenten será como una experiencia de vida para ser mejor persona. Hoy no me dejare vencer y sacare mi Fuerza Espiritual para lograr lo que tanto deseo HOY SERE UN TRUINFADOR,1869012623003648215,https://x.com/mhonividente/status/1869012623003648215,54,65,557,23554,4,https://pbs.twimg.com/media/GfARE4nXoAAAVIN.jpg,False,,,,,es,Top
(@@TampicoGob OR @@MonicaVTampico) min_replies:0 min_faves:0 min_retweets:0,https://x.com/search?q=(@@TampicoGob OR @@MonicaVTampico) min_replies:0 min_faves:0 min_retweets:0 until:2024-12-18 since:2024-12-17&src=typed_query,MARIA ANDREA NIETO,https://x.com/MAndreaNieto,MAndreaNieto,True,2024-12-17 13:44:38+00:00,False,"Estoy feliz!! Gracias, GRACIAS a los jueces de este país!! Le GANAMOS una TUTELA al gobierno de la potencia mundial de la “vida”, que promueve el odio y la persecución en contra de las periodistas. La justicia le ordena a la UNP PROTEGER mis derechos constitucionales A LA VIDA y a la integridad física, y le ordena a la UNP, un nuevo estudio de riesgo, con el fin de aumentar mis medidas de seguridad, debido a las diferentes amenazas que a diario recibo, por cuenta del matoneo que proviene desde la Casa de Nariño y los bodegueros del gobierno que difunden odio y mentiras en mi contra. La UNP solo me asignó un chaleco antibalas (que se demoró en entregar que porque no había mi talla) y un escolta de protección. Y ya. Pero a los angelitos de la primera línea y “gestores de paz” los protege con esquemas completos de seguridad. No voy a parar y ya adelanté procesos cautelares en instancias judiciales internacionales. Los gobiernos comunistas (Cuba, Venezuela, Nicaragua) persiguen a la prensa libre porque así se pueden perpetuar en el poder. Daré la pelea porque presidente PETRO: USTED Y SU GOBIERNO ESTÁN OBLIGADOS A CUMPLIR CON LA LEY.",1869015851317305607,https://x.com/MAndreaNieto/status/1869015851317305607,1222,2099,4704,95886,31,https://pbs.twimg.com/media/GfAUAQoXwAAvrt5.jpg,False,,,,,es,Top
(@@TampicoGob OR @@MonicaVTampico) min_replies:0 min_faves:0 min_retweets:0,https://x.com/search?q=(@@TampicoGob OR @@MonicaVTampico) min_replies:0 min_faves:0 min_retweets:0 until:2024-12-18 since:2024-12-17&src=typed_query,Alejandro Armenta,https://x.com/armentapuebla_,armentapuebla_,True,2024-12-17 13:51:27+00:00,False,"Cholita de mi alma, hace 11 años nos dejaste, pero no te llevaste tu alegría, tu cariño, tu sabiduría y tu amor, ese se quedó con nosotros.🕊️ Siempre honro tus consejos, eh,☝🏻 muchos poblanos y poblanas ya se los aprendieron, porque no me canso de repetirlos y de ponerlos en práctica...""Ser siempre útil, acomedido y agradecido"". Te amo mamá.🤍",1869017567899058484,https://x.com/armentapuebla_/status/1869017567899058484,54,76,234,7703,0,https://pbs.twimg.com/media/GfAMIpJXAAAsloN.jpg,False,,,,,es,Top
(@@TampicoGob OR @@MonicaVTampico) min_replies:0 min_faves:0 min_retweets:0,https://x.com/search?q=(@@TampicoGob OR @@MonicaVTampico) min_replies:0 min_faves:0 min_retweets:0 until:2024-12-18 since:2024-12-17&src=typed_query,🔥🤍❤️🤍👑..MAR..👑🤍❤️🤍🔥,https://x.com/1MarkachorrAmoR,1MarkachorrAmoR,False,2024-12-17 14:06:49+00:00,False,"Buendiaaa a Todxs... Te Amo... Como Se Aman Las Almas Gemelas.. Como Se Aman Los Amantes.... .... Verdaderos... Con Pasión, Con Entrega... Con Todo El Corazón...💞 Musikero Muy Pronto...Agitados..🔥 Miel Prohibida 🥐 ☕️Con Aroma a Mujer 👄 Martes Lo Quiero Todoooo😉 🎶",1869021434384994783,https://x.com/1MarkachorrAmoR/status/1869021434384994783,28,10,282,8145,3,https://pbs.twimg.com/media/GfAZFr8XsAAVo9l.jpg,False,,,,,es,Top
(@@TampicoGob OR @@MonicaVTampico) min_replies:0 min_faves:0 min_retweets:0,https://x.com/search?q=(@@TampicoGob OR @@MonicaVTampico) min_replies:0 min_faves:0 min_retweets:0 until:2024-12-18 since:2024-12-17&src=typed_query,Ayo LópezVital,https://x.com/caminoflorido,caminoflorido,True,2024-12-17 14:17:00+00:00,False,"morena la Ca… Regó... ¡Otra Vez! Ésto es como una comedia y nos reiríamos mucho si no estuvieran destruyendo el país. Resulta que morena sabe que las reformas que ha hecho son ilegales y que se recibirán miles de amparos. Así que se reunieron los genios más genios, imagina a yazmín, a noroña, la clauz y monreal y se les ocurrió una súper idea ¡ya se, dijo uno, acabemos con el derecho de amparo! Todos sus secuaces le aprendieron, pero en eso alguien dijo ""pero esa ley no va a impedir que se amaren de todas las leyes mal hechas que ya hicimos"" Ah, ha de haber exclamado uno de los supervillanos de ésta historia ¿Y que tal si hacemos una ley que diga que ya no valga ningún amaro, nisiquiera los que había antes? Y todos aplaudieron y se felicitaron por su genialidad Imagina! Es como si hicieran una ley que prohíbe que uses el color blanco y luego te multan por todas las veces que antes hubieses usado el color blanco! Así se las gasta éste gobierno y éste régimen y el que no vea ya con claridad la intención de instaurar una dictadura o es cómplice o no quiere ver la realidad! ¿Así o mas ignorantes y autoritarios? Pero la regaron y no van a poder cumplir su plan! Pero, podemos detenerlo. TODO! Sí TODO, lo podemos echar para atrás. Necesitamos de México entero. Por encima de la Ley, NADIE Apoyar al 100% al poder judicial y revertir el atropello del poder legislativo y judicial Envía una carta para que se giren las órdenes de aprehensión correspondientes a los que se encuentran en desacato de órdenes de jueces federales, faltas que ameritan de 3 a 9 años de prisión Exijamos que presenten su renuncia y se pongan a disposición del ministerio público. ¡Ésto revierte la reforma judicial y todo lo que conlleva! Te anexo una carta para que envíes al Fiscal General del Estado Lic. Bryant Alejandro García Ramírez fiscal@fgecolima.mx Haz lo siguiente: 1. Descarga la carta https://tinyurl.com/SeDetieneReforma 2. Fírmala con tu nombre 3. Envíala al Fiscal General del Estado Lic. Bryant Alejandro García Ramírez fiscal@fgecolima.mx Únete a los guerreros de Camino Florido, estamos creando herramientas y soluciones que darán cada vez más poder a la ciudadanía. Podemos enfrentar a la dictadura si nos unimos. Envíame un mensaje a ayo@caminoflorido.com y logremos re-instaurar un gobierno legítimo en nuestro país. Yo soy Ayo, de CaminoFlorido ¡Tihui, Tihui!",1869023997977154001,https://x.com/caminoflorido/status/1869023997977154001,96,495,705,14141,28,https://pbs.twimg.com/ext_tw_video_thumb/1868903075999539200/pu/img/0xn3o-bIaYnbKu_t.jpg,False,,,,,es,Top
(@@TampicoGob OR @@MonicaVTampico) min_replies:0 min_faves:0 min_retweets:0,https://x.com/search?q=(@@TampicoGob OR @@MonicaVTampico) min_replies:0 min_faves:0 min_retweets:0 until:2024-12-18 since:2024-12-17&src=typed_query,Manuel Alberto Samaniego Rodríguez,https://x.com/M_SamaniegoR,M_SamaniegoR,False,2024-12-17 14:20:37+00:00,False,En 6 meses en @asambleapa nunca vi a Ronaldo machado (femicida). Hoy veo que es un supuesto asesor y PERMANENTE. Es momento de modificar la ley de contrataciones públicas y sacar todas las botellas y delincuentes blindados que dañan nuestro país. DIOS BENDIGA PANAMÁ🇵🇦,1869024906895310865,https://x.com/M_SamaniegoR/status/1869024906895310865,49,161,605,20121,4,,False,,,,,es,Top
(@@TampicoGob OR @@MonicaVTampico) min_replies:0 min_faves:0 min_retweets:0,https://x.com/search?q=(@@TampicoGob OR @@MonicaVTampico) min_replies:0 min_faves:0 min_retweets:0 until:2024-12-18 since:2024-12-17&src=typed_query,Mónica Palacios,https://x.com/MoniPalaciosZ,MoniPalaciosZ,True,2024-12-17 15:03:40+00:00,False,"🛑 #URGENTE 🛑 Ante el descarado atraco millonario que está ejecutando el gobierno de #DanielNoboa con #Progen, he iniciado desde mi despacho un proceso de fiscalización para detener este saqueo. No permitiremos que sigan robando al pueblo, especialmente en medio de una crisis eléctrica provocada intencionalmente por la negligencia y complicidad de este Gobierno. ¡Los responsables de este abuso tendrán que rendir cuentas al país!",1869035740165992681,https://x.com/MoniPalaciosZ/status/1869035740165992681,292,1064,1995,56504,10,https://pbs.twimg.com/media/GfAlsGNWgAAyXPl.jpg,False,,,,,es,Top
(@@TampicoGob OR @@MonicaVTampico) min_replies:0 min_faves:0 min_retweets:0,https://x.com/search?q=(@@TampicoGob OR @@MonicaVTampico) min_replies:0 min_faves:0 min_retweets:0 until:2024-12-18 since:2024-12-17&src=typed_query,Jhonf Fonseca,https://x.com/Jhonffonseca,Jhonffonseca,True,2024-12-17 15:25:43+00:00,False,"Quiero hacer un sondeo de cuántas personas seguimos apoyando a María Corina Machado, la 'dama de hierro' Háganmelo saber ♥️🔁",1869041292350771422,https://x.com/Jhonffonseca/status/1869041292350771422,168,822,3900,35679,21,https://pbs.twimg.com/ext_tw_video_thumb/1868992588235059200/pu/img/vHJQ3oER4ejO7xpi.jpg,False,,,,,es,Top
(@@TampicoGob OR @@MonicaVTampico) min_replies:0 min_faves:0 min_retweets:0,https://x.com/search?q=(@@TampicoGob OR @@MonicaVTampico) min_replies:0 min_faves:0 min_retweets:0 until:2024-12-18 since:2024-12-17&src=typed_query,Radio Pichincha,https://x.com/radio_pichincha,radio_pichincha,True,2024-12-17 15:28:50+00:00,False,"🔴 #Atención || “Ante el descarado atraco millonario que está ejecutando el gobierno de Daniel Noboa con Progen, he iniciado desde mi despacho un proceso de fiscalización para detener este saqueo”, menciona la asambleísta @MoniPalaciosZ a través de su cuenta de X.",1869042073607004166,https://x.com/radio_pichincha/status/1869042073607004166,14,161,237,5240,2,https://pbs.twimg.com/media/GfAr24vXoAAEu_5.jpg;https://pbs.twimg.com/media/GfAr24tW4AAF-kn.jpg,False,,,,,es,Top
(@@TampicoGob OR @@MonicaVTampico) min_replies:0 min_faves:0 min_retweets:0,https://x.com/search?q=(@@TampicoGob OR @@MonicaVTampico) min_replies:0 min_faves:0 min_retweets:0 until:2024-12-18 since:2024-12-17&src=typed_query,Mónica Soto Icaza✍,https://x.com/MonicaSotoIcaza,MonicaSotoIcaza,True,2024-12-17 15:41:41+00:00,False,"Soy poderosa. En mí habitan todas las mujeres de mi historia: las que han sufrido, las que ríen a carcajadas. Las que odian, las que aman, las que viven, las que desean morir... #PorUnaVidaSexy 🔥 Mónica Soto Icaza",1869045310305276303,https://x.com/MonicaSotoIcaza/status/1869045310305276303,50,37,874,9841,12,https://pbs.twimg.com/media/GfAuzXWWMAAVNwT.jpg,False,,,,,es,Top
(@@TampicoGob OR @@MonicaVTampico) min_replies:0 min_faves:0 min_retweets:0,https://x.com/search?q=(@@TampicoGob OR @@MonicaVTampico) min_replies:0 min_faves:0 min_retweets:0 until:2024-12-18 since:2024-12-17&src=typed_query,Sofia. 👸 ☘️,https://x.com/LSofiaDim,LSofiaDim,False,2024-12-17 15:45:23+00:00,False,"Copio su tesis, amagó a la UNAM y a todas las instancias, se valió del influyentismo yes muy probable que acabe como ministra de la suprema corte. Morena nunca estuvo en contra de la corrupción, simplemente querían ser parte de la corrupción.",1869046239603613802,https://x.com/LSofiaDim/status/1869046239603613802,79,460,865,7714,5,https://pbs.twimg.com/media/GfAvpfzbgAA1sP4.jpg,False,,,,,es,Top
(@@TampicoGob OR @@MonicaVTampico) min_replies:0 min_faves:0 min_retweets:0,https://x.com/search?q=(@@TampicoGob OR @@MonicaVTampico) min_replies:0 min_faves:0 min_retweets:0 until:2024-12-18 since:2024-12-17&src=typed_query,Inés María Chapman Waugh,https://x.com/InesMChapman,InesMChapman,False,2024-12-17 16:02:48+00:00,False,Una marcha contra la ignominia imperial #UnidosXCuba #TumbaElBloqueo http://www.granma.cu/cuba/2024-12-16/una-marcha-contra-la-ignominia-imperial-16-12-2024-22-12-27 Via @Granma_Digital,1869050622533898663,https://x.com/InesMChapman/status/1869050622533898663,26,511,371,2520,0,,False,,,,,es,Top
(@@TampicoGob OR @@MonicaVTampico) min_replies:0 min_faves:0 min_retweets:0,https://x.com/search?q=(@@TampicoGob OR @@MonicaVTampico) min_replies:0 min_faves:0 min_retweets:0 until:2024-12-18 since:2024-12-17&src=typed_query,San Andrés,https://x.com/Monomante71,Monomante71,False,2024-12-17 16:04:47+00:00,False,"Se imaginan a esta dupla en algún matinal? Bueno nunca los veremos seguramente porque son periodistas de verdad como Claudia Salas y Pollo Valdivia @tocshowtvmas Porque ya estamos hartos de los Gonzalo Ramírez, Karina Álvarez, Neme, Del Río, Repenning",1869051122889244954,https://x.com/Monomante71/status/1869051122889244954,302,1355,3618,53892,21,https://pbs.twimg.com/media/GfA0F0OXEAAa91k.jpg,False,,,,,es,Top
(@@TampicoGob OR @@MonicaVTampico) min_replies:0 min_faves:0 min_retweets:0,https://x.com/search?q=(@@TampicoGob OR @@MonicaVTampico) min_replies:0 min_faves:0 min_retweets:0 until:2024-12-18 since:2024-12-17&src=typed_query,Hollman Morris,https://x.com/HOLLMANMORRIS,HOLLMANMORRIS,True,2024-12-17 16:20:31+00:00,False,"Hoy, además de compartir unos buenos tamales, sonrisas e historias, compartimos la certeza de que en @RTVCco todos somos parte fundamental. Aquí no hay roles pequeños ni trabajos invisibles, cada esfuerzo cuenta y cada persona suma para construir lo que hoy somos. ¡LA SEÑAL DE LA GENTE! Aquí reconocemos, valoramos y agradecemos el trabajo diario, porque en esta casa todos hacemos la diferencia. Gracias por ser el corazón que mantiene viva esta misión. Gracias por su dedicación, su calidez y su compromiso. ¡Hoy celebramos juntos lo que somos, un equipo unido y fuerte! ¡Les quiero mucho!",1869055080369881475,https://x.com/HOLLMANMORRIS/status/1869055080369881475,26,108,224,3270,1,https://pbs.twimg.com/media/GfA3rxHWAAM-kUb.jpg;https://pbs.twimg.com/media/GfA3rxHWAAIKZl0.jpg;https://pbs.twimg.com/media/GfA3rxDWAAc9a4I.jpg;https://pbs.twimg.com/media/GfA3rxHWAAYvAN2.jpg,False,,,,,es,Top
(@@TampicoGob OR @@MonicaVTampico) min_replies:0 min_faves:0 min_retweets:0,https://x.com/search?q=(@@TampicoGob OR @@MonicaVTampico) min_replies:0 min_faves:0 min_retweets:0 until:2024-12-18 since:2024-12-17&src=typed_query,Fundación Toby,https://x.com/FundacionToby,FundacionToby,True,2024-12-17 16:23:05+00:00,False,"NUGGET 🥹🩵✨🐾 Traemos actualización de las más esperadas!! El perrito que rescatamos de madrugada en Amecameca, que tenía fracturadas ambas patitas delanteras 🥲 Pues va súper bien amigos! Ayer fue a revisión a clínica del valle, se quedó en observación, ya apoya y camina, también está ganando peso 🩵 En cuanto llegue a la pensión les mandamos videos 🥰 les juro que este perrito es un bombón!! Por otro lado les comparto su cuenta de gastos médicos, perdón por pedirles ayuda pero vean nada más este milagro hecho pelitos!! Nos ayudarían a cubrir sus gastos? Por favor querida comunidad!! Por nugget 🙏🩵🐾✨ Cuentas Toby - BANCOMER Cuenta: 0117412991 Clabe: 012180001174129915 Tarjeta: 4555113008742068 - SANTANDER Cuenta: 60577008001 Clabe: 014180605770080014 Tarjeta: 5579070082854475 - Mercado pago Clabe: 722969010583593935 Tarjeta: 5428780103864245 - Paypal https://www.paypal.com/paypalme/fundaciontoby",1869055725743563068,https://x.com/FundacionToby/status/1869055725743563068,3,239,438,17406,3,https://pbs.twimg.com/amplify_video_thumb/1869055581920829440/img/TzPUNcBBoz9BtW60.jpg;https://pbs.twimg.com/media/GfA4Jiha8AE_a4k.jpg,False,,,,,es,Top
(@@TampicoGob OR @@MonicaVTampico) min_replies:0 min_faves:0 min_retweets:0,https://x.com/search?q=(@@TampicoGob OR @@MonicaVTampico) min_replies:0 min_faves:0 min_retweets:0 until:2024-12-18 since:2024-12-17&src=typed_query,MÓNICA 🍷🍋,https://x.com/moni4monica,moni4monica,False,2024-12-17 16:37:44+00:00,False,"Que lástima aquellos que no os habéis molestado en rascar un poquito debajo de la piel de estas personas. Quedaros con la gente que vive de apariencias, de cara a la galería, qué yo me quedaré siempre con la gente REAL. #GH17D",1869059413144977664,https://x.com/moni4monica/status/1869059413144977664,23,83,428,7020,5,https://pbs.twimg.com/media/GfA7NdLWgAAmlgB.jpg,False,,,,,es,Top
(@@TampicoGob OR @@MonicaVTampico) min_replies:0 min_faves:0 min_retweets:0,https://x.com/search?q=(@@TampicoGob OR @@MonicaVTampico) min_replies:0 min_faves:0 min_retweets:0 until:2024-12-18 since:2024-12-17&src=typed_query,Vane!,https://x.com/VaneDeCol,VaneDeCol,True,2024-12-17 16:41:39+00:00,False,"“Usted se parece mucho a Luis Gilberto Murillo, Juan Fernando Cristo, Laura Sarabia, Claudia Lopez” Dios mio: eso es peor que a uno le digan Hp. JAJAJAJAJAJAJAAJJAJA",1869060400584831172,https://x.com/VaneDeCol/status/1869060400584831172,10,90,339,6854,3,,False,,,,,es,Top
(@@TampicoGob OR @@MonicaVTampico) min_replies:0 min_faves:0 min_retweets:0,https://x.com/search?q=(@@TampicoGob OR @@MonicaVTampico) min_replies:0 min_faves:0 min_retweets:0 until:2024-12-18 since:2024-12-17&src=typed_query,Flor 🌺,https://x.com/Flor96037468,Flor96037468,True,2024-12-17 16:45:40+00:00,False,"Mentiras no dijo Poncho, el me cae de la patada pero dijo la verdad. Esta señora es la peor ganadora de todas las casas que han existido. Solo repite y repite las cosas como perico y ganó por pura Nacionalidad.",1869061411646881992,https://x.com/Flor96037468/status/1869061411646881992,41,62,1085,44375,19,,False,,,,,es,Top
(@@TampicoGob OR @@MonicaVTampico) min_replies:0 min_faves:0 min_retweets:0,https://x.com/search?q=(@@TampicoGob OR @@MonicaVTampico) min_replies:0 min_faves:0 min_retweets:0 until:2024-12-18 since:2024-12-17&src=typed_query,LA MONA QUILOMBERA 2.0 🗡🐵,https://x.com/MONAQUILOMBERA,MONAQUILOMBERA,False,2024-12-17 16:54:57+00:00,False,TRONK ME PAGÓ PARA PONER A LUZ AHI 📩💸💸,1869063747404448023,https://x.com/MONAQUILOMBERA/status/1869063747404448023,16,6,319,8770,2,,True,MONAQUILOMBERA,https://x.com/MONAQUILOMBERA,,MONAQUILOMBERA,es,Top
(@@TampicoGob OR @@MonicaVTampico) min_replies:0 min_faves:0 min_retweets:0,https://x.com/search?q=(@@TampicoGob OR @@MonicaVTampico) min_replies:0 min_faves:0 min_retweets:0 until:2024-12-18 since:2024-12-17&src=typed_query,Mónica Corrales Malvic,https://x.com/monicacorrales,monicacorrales,True,2024-12-17 17:05:50+00:00,False,"Premios van, premios vienen, premios obnubilan. Un cuarto de siglo exhibiendo los trofeos internacionales recibidos, en una vitrina rodeada por víctimas de tortura, prisión, muerte y miseria.",1869066486368846100,https://x.com/monicacorrales/status/1869066486368846100,26,143,249,7966,2,,False,,,,,es,Top
(@@TampicoGob OR @@MonicaVTampico) min_replies:0 min_faves:0 min_retweets:0,https://x.com/search?q=(@@TampicoGob OR @@MonicaVTampico) min_replies:0 min_faves:0 min_retweets:0 until:2024-12-18 since:2024-12-17&src=typed_query,Cendy Robles,https://x.com/cendyrobles,cendyrobles,True,2024-12-17 17:07:54+00:00,False,"No tengo ojos para nadie Solo para ti Mi corazón te pertenece Y yo ya te lo di Cuando llegaste a mí (“Todo porque te amo”, El Frizian 🎵) #cendyrobles ❤️😍 #Mexico #Tamaulipas #NuevoLaredo #Matamoros #Reynosa #CdVictoria #Tampico #Madero #Altamira #Mante #SanFernando #Hidalgo #Tula #Jaumave #Casas #Miquihuana #Bustamante #Palmillas #Llera #Güémez #Mty #NL #CDMX",1869067008047989202,https://x.com/cendyrobles/status/1869067008047989202,39,36,666,10758,61,https://pbs.twimg.com/media/GfBChf7aYAAxpUP.jpg,False,,,,,es,Top
