Query_Str,Post_URL,Author_Name,Author_Web_Page_URL,Author_Handle,Verified_Status,UTC_Time,Ads,Tweet_Content,Post_ID,Tweet_URL,Reply_Count,Repost_Count,Like_Count,View_Count,Bookmark_Count,Tweet_Image_URL,Replying_to,Reply_to_Whom,Reply_to_Whom_URL,Reply_to_Whom_Username,Reply_to_Whom_Handle,Language,Type
(@@TampicoGob OR @@MonicaVTampico) min_replies:0 min_faves:0 min_retweets:0,https://x.com/search?q=(@@TampicoGob OR @@MonicaVTampico) min_replies:0 min_faves:0 min_retweets:0 until:2024-12-19 since:2024-12-18&src=typed_query,Luis Aníbal Rincón Arguello. ® 🇨🇴,https://x.com/Rincon001A,Rincon001A,True,2024-12-18 22:49:30+00:00,False,"Atención 🇨🇴 Vicky Dávila acaba de hacer el trino del mes ""Si yo estuviera en Semana la volvería a tumbar de su cargo. Ahora estoy dedicada a que gente como usted nunca vuelva a ser gobierno"" Tremenda mujer ! Bravoooo Vicky",1869515361147932799,https://x.com/Rincon001A/status/1869515361147932799,92,2195,5395,39615,17,https://pbs.twimg.com/media/GfHaUG1WcAAwzrp.jpg,False,,,,,es,Top
(@@TampicoGob OR @@MonicaVTampico) min_replies:0 min_faves:0 min_retweets:0,https://x.com/search?q=(@@TampicoGob OR @@MonicaVTampico) min_replies:0 min_faves:0 min_retweets:0 until:2024-12-19 since:2024-12-18&src=typed_query,Juan Pablo Guanipa,https://x.com/JuanPGuanipa,JuanPGuanipa,True,2024-12-18 22:53:02+00:00,False,"Mi querida Amanda Sofía hoy estás de cumpleaños y cuánto me gustaría estar contigo, como siempre he estado, en esta fecha tan importante para ti. Este es el número 12 y tienes toda una vida por delante. Le doy gracias a Dios por tenerte y por ayudarnos, junto a tu mami, a hacer de ti una niña buena, estudiosa, excelente como hija, hermana, sobrina, nieta, prima, amiga. Hemos vivido circunstancias difíciles este año y, gracias a Dios, las vamos asumiendo con la misma fortaleza que Él mismo nos ha dado. Sabes que estoy allí contigo, que en mi ausencia física, obligada por la realidad, he hecho todo lo posible por estar presente día a día. Disfruta tu día con alegría y démosle gracias a Dios y a la Virgen por todo, por lo que hemos pasado, por este presente y por el esperanzador futuro al que tenemos derecho. A Dios le pido que tú y tus hermanos estén siempre juntos y en armonía y que cuando nos reencontremos valoremos mucho más toda esta experiencia de vida y de familia. Te amo mucho mi Amanda. Dios te bendiga, Tu papá",1869516249635647659,https://x.com/JuanPGuanipa/status/1869516249635647659,146,1078,5751,80293,31,https://pbs.twimg.com/media/GfHbHo4XwAAw1tn.jpg;https://pbs.twimg.com/media/GfHbHo5XoAAV-Te.jpg,False,,,,,es,Top
(@@TampicoGob OR @@MonicaVTampico) min_replies:0 min_faves:0 min_retweets:0,https://x.com/search?q=(@@TampicoGob OR @@MonicaVTampico) min_replies:0 min_faves:0 min_retweets:0 until:2024-12-19 since:2024-12-18&src=typed_query,EchyllaVAMC,https://x.com/Echylla_VAMC,Echylla_VAMC,False,2024-12-18 22:54:35+00:00,False,Mônica &amp; Samcelsus. 🗝️ #turmadamonica #GuiltyGear,1869516641643724987,https://x.com/Echylla_VAMC/status/1869516641643724987,2,104,379,4190,45,https://pbs.twimg.com/media/GfHbXn_WQAAua7T.jpg;https://pbs.twimg.com/ext_tw_video_thumb/1869516584751894528/pu/img/UT80JEOeA9bJxeqg.jpg,False,,,,,pt,Top
(@@TampicoGob OR @@MonicaVTampico) min_replies:0 min_faves:0 min_retweets:0,https://x.com/search?q=(@@TampicoGob OR @@MonicaVTampico) min_replies:0 min_faves:0 min_retweets:0 until:2024-12-19 since:2024-12-18&src=typed_query,Pam ✨,https://x.com/mpam_cf,mpam_cf,False,2024-12-18 23:25:00+00:00,False,Jajaja al @_PonchoDeNigris se lo acabaron en Telemundo… que gozadera!!! 😂 1. Le dijeron que dejara de culpar a la empresa y aceptara lo que hizo. 2. Le dijeron que él empezó a faltarle al respeto y por eso la otra se defendió (y si… el un día antes se burló diciendo que MP era hombre pero según él era broma) y que dejara de hacerse la víctima 3. Dijeron que se colgaba de personas como Wendy y Maripily para dar de qué hablar 😂😂😂,1869524295472521399,https://x.com/mpam_cf/status/1869524295472521399,7,82,515,111150,93,https://pbs.twimg.com/amplify_video_thumb/1869524079587270656/img/L2SgwhmqsVZWktQ5.jpg;https://pbs.twimg.com/amplify_video_thumb/1869524079687983104/img/WcSuAER_C5MH0mcH.jpg;https://pbs.twimg.com/amplify_video_thumb/1869524079591489536/img/_2LqGJ3NEfPU6RnD.jpg,False,,,,,es,Top
(@@TampicoGob OR @@MonicaVTampico) min_replies:0 min_faves:0 min_retweets:0,https://x.com/search?q=(@@TampicoGob OR @@MonicaVTampico) min_replies:0 min_faves:0 min_retweets:0 until:2024-12-19 since:2024-12-18&src=typed_query,Carlos,https://x.com/Carlos543518412,Carlos543518412,False,2024-12-18 23:30:59+00:00,False,"#Tampico Nuevamente sin pasar camión de la basura Col. Niños Heroes y San Francisco,para eso querían gobernar.@TampicoGob",1869525799117992090,https://x.com/Carlos543518412/status/1869525799117992090,0,0,0,50,0,,False,,,,,es,Top
(@@TampicoGob OR @@MonicaVTampico) min_replies:0 min_faves:0 min_retweets:0,https://x.com/search?q=(@@TampicoGob OR @@MonicaVTampico) min_replies:0 min_faves:0 min_retweets:0 until:2024-12-19 since:2024-12-18&src=typed_query,Laura,https://x.com/UlaVaz,UlaVaz,False,2024-12-18 23:42:02+00:00,False,"Pero saben qué es lo que más me encabrona? Que la Gómez no es una niña migrante o descendiente de mexicanos que no habla español porque sus papás no se lo enseñaron para cuidarla de violencia o discriminación, como sucede con muchos otros o las lenguas indígenas en México.",1869528579144643012,https://x.com/UlaVaz/status/1869528579144643012,2,9,296,8765,5,,False,,,,,es,Top
(@@TampicoGob OR @@MonicaVTampico) min_replies:0 min_faves:0 min_retweets:0,https://x.com/search?q=(@@TampicoGob OR @@MonicaVTampico) min_replies:0 min_faves:0 min_retweets:0 until:2024-12-19 since:2024-12-18&src=typed_query,Tampico Gob,https://x.com/TampicoGob,TampicoGob,False,2024-12-18 23:43:28+00:00,False,"Damas voluntarias de “El Ropero del Pobre” entregaron 37 despensas al Heroico Cuerpo de Bomberos de Tampico, reconociendo su labor. La alcaldesa @MonicaVTampico destacó la solidaridad y compromiso en apoyo a estos héroes. #TampicoTeCuida",1869528942719463649,https://x.com/TampicoGob/status/1869528942719463649,0,0,1,74,0,https://pbs.twimg.com/media/GfHmp56XoAAO4Bc.jpg;https://pbs.twimg.com/media/GfHmp56WAAEDvnZ.jpg;https://pbs.twimg.com/media/GfHmp58WgAEZsP1.jpg;https://pbs.twimg.com/media/GfHmp58XMAA0Ebw.jpg,False,,,,,es,Top
(@@TampicoGob OR @@MonicaVTampico) min_replies:0 min_faves:0 min_retweets:0,https://x.com/search?q=(@@TampicoGob OR @@MonicaVTampico) min_replies:0 min_faves:0 min_retweets:0 until:2024-12-19 since:2024-12-18&src=typed_query,Tampico Gob,https://x.com/TampicoGob,TampicoGob,False,2024-12-18 23:46:03+00:00,False,"El Gobierno de Tampico, liderado por la presidenta @MonicaVTampico, inició las Jornadas por la Paz en la colonia Solidaridad, Voluntad y Trabajo, con la participación de dependencias municipales y la Mesa de Seguridad, para atender problemáticas sociales.",1869529590441574825,https://x.com/TampicoGob/status/1869529590441574825,0,0,1,73,0,https://pbs.twimg.com/media/GfHnPflWQAAJwcl.jpg;https://pbs.twimg.com/media/GfHnPfkW8AAs7uk.jpg;https://pbs.twimg.com/media/GfHnPfqWEAADjZ0.jpg;https://pbs.twimg.com/media/GfHnPfsWMAAOCaq.jpg,False,,,,,es,Top
(@@TampicoGob OR @@MonicaVTampico) min_replies:0 min_faves:0 min_retweets:0,https://x.com/search?q=(@@TampicoGob OR @@MonicaVTampico) min_replies:0 min_faves:0 min_retweets:0 until:2024-12-20 since:2024-12-19&src=typed_query,Juan Theories,https://x.com/JuanTeories,JuanTeories,False,2024-12-19 00:17:04+00:00,False,"Muchacho, el creador de Dormitabis esta por alla",1869537395475132457,https://x.com/JuanTeories/status/1869537395475132457,14,114,886,10192,32,https://pbs.twimg.com/media/GfHuWjiWUAAAIxa.jpg,False,,,,,es,Top
(@@TampicoGob OR @@MonicaVTampico) min_replies:0 min_faves:0 min_retweets:0,https://x.com/search?q=(@@TampicoGob OR @@MonicaVTampico) min_replies:0 min_faves:0 min_retweets:0 until:2024-12-20 since:2024-12-19&src=typed_query,Monocromía,https://x.com/monocromia02,monocromia02,False,2024-12-19 00:41:57+00:00,False,Jax aprovechandose de que Mino no habla #DigitalCircus #gummigooxpomni #gummigoofanart #gummigoo #pomni #pomnifanart #PomnixGummygoo #TheAmazingDigitalCircus #TheAmazingDigitalCircusPomni #jaxTADC #jaxdigitalcircus,1869543660628697287,https://x.com/monocromia02/status/1869543660628697287,13,173,2828,55006,320,https://pbs.twimg.com/media/GfHz6yyWsAACJNw.jpg,False,,,,,es,Top
(@@TampicoGob OR @@MonicaVTampico) min_replies:0 min_faves:0 min_retweets:0,https://x.com/search?q=(@@TampicoGob OR @@MonicaVTampico) min_replies:0 min_faves:0 min_retweets:0 until:2024-12-20 since:2024-12-19&src=typed_query,NOTIVIZA,https://x.com/Notiviza,Notiviza,True,2024-12-19 00:43:01+00:00,False,"La alcaldesa, Mónica Villarreal Anaya, exhortó al nuevo Director del Sistema DIF Tampico a trabajar con compromiso y humanismo a favor de la sociedad tampiqueña. https://www.notivizanoreste.com.mx/estado/nombran-a-nuevo-director-del-sistema-dif-tampico/ @MonicaVTampico @DIF_Tampico @TampicoGob",1869543927654797540,https://x.com/Notiviza/status/1869543927654797540,0,1,0,23,0,https://pbs.twimg.com/media/GfHzv2hWAAAI3O4.jpg,False,,,,,es,Top
(@@TampicoGob OR @@MonicaVTampico) min_replies:0 min_faves:0 min_retweets:0,https://x.com/search?q=(@@TampicoGob OR @@MonicaVTampico) min_replies:0 min_faves:0 min_retweets:0 until:2024-12-20 since:2024-12-19&src=typed_query,LA MONA QUILOMBERA 2.0 🗡🐵,https://x.com/MONAQUILOMBERA,MONAQUILOMBERA,False,2024-12-19 01:07:41+00:00,False,ELLA DESFILÓ Y DEROGARON EL ABORTO LEGAL Y LA LEY DEL MATRIMONIO IGUALITARIO,1869550136688562431,https://x.com/MONAQUILOMBERA/status/1869550136688562431,26,103,1915,216070,45,https://pbs.twimg.com/ext_tw_video_thumb/1869550105566564352/pu/img/Ivsj1Fa1vSj9E1ir.jpg,False,,,,,es,Top
(@@TampicoGob OR @@MonicaVTampico) min_replies:0 min_faves:0 min_retweets:0,https://x.com/search?q=(@@TampicoGob OR @@MonicaVTampico) min_replies:0 min_faves:0 min_retweets:0 until:2024-12-20 since:2024-12-19&src=typed_query,Marce y ya😁,https://x.com/marcelamvzyya,marcelamvzyya,False,2024-12-19 01:08:39+00:00,False,"Sí, soy una flaquita tolimense de casi 37 años de 1.60 metros de estatura...y así me amo❤❤❤❤❤❤❤❤❤",1869550379865952510,https://x.com/marcelamvzyya/status/1869550379865952510,508,189,10164,484796,281,https://pbs.twimg.com/media/GfH5zbEWcAIVFF9.jpg,False,,,,,es,Top
(@@TampicoGob OR @@MonicaVTampico) min_replies:0 min_faves:0 min_retweets:0,https://x.com/search?q=(@@TampicoGob OR @@MonicaVTampico) min_replies:0 min_faves:0 min_retweets:0 until:2024-12-20 since:2024-12-19&src=typed_query,Magdalena Bay Brasil,https://x.com/magdalenabaybra,magdalenabaybra,False,2024-12-19 01:14:27+00:00,False,"🚨🎂 Hoje 18 de Dezembro Mica Tenenbaum (Magdalena Bay) completa 29 anos! Hoje é um dia especial, pois celebramos mais um ano da vida de alguém que inspira com sua arte e criatividade. Parabéns! Mica 🎉🎈",1869551837688512641,https://x.com/magdalenabaybra/status/1869551837688512641,4,50,308,5958,4,https://pbs.twimg.com/media/GfH7e-RXcAADFop.jpg;https://pbs.twimg.com/media/GfH7e-RWYAA7Tgn.jpg,False,,,,,pt,Top
(@@TampicoGob OR @@MonicaVTampico) min_replies:0 min_faves:0 min_retweets:0,https://x.com/search?q=(@@TampicoGob OR @@MonicaVTampico) min_replies:0 min_faves:0 min_retweets:0 until:2024-12-20 since:2024-12-19&src=typed_query,Wicho Olea,https://x.com/tixwilx1916,tixwilx1916,False,2024-12-19 01:33:53+00:00,False,"Cómo no van a odiarla las gordas feministas si es todo lo que ellas no son. Es blanca, delgada, católica, heterosexual, inteligente, capaz, tiene papas y recibió amor de niña.",1869556726825103533,https://x.com/tixwilx1916/status/1869556726825103533,11,26,284,46467,23,https://pbs.twimg.com/ext_tw_video_thumb/1869449080599883776/pu/img/ILfRH_7zEPUQ634J.jpg,False,,,,,es,Top
(@@TampicoGob OR @@MonicaVTampico) min_replies:0 min_faves:0 min_retweets:0,https://x.com/search?q=(@@TampicoGob OR @@MonicaVTampico) min_replies:0 min_faves:0 min_retweets:0 until:2024-12-20 since:2024-12-19&src=typed_query,Washington Andrade Escobar,https://x.com/Drwandradee,Drwandradee,True,2024-12-19 01:39:58+00:00,False,"🐫🪡MÁS FACIL PASAR UN CAMELLO POR EL OJO DE UNA AGUJA..|| que vergonzoso ver a una ministra de Estado (@MinTrabajoEc) intentar sostener un ‘chaulafán jurídico’ para disimular una persecución política en contra de otra mujer, la Vicepresidenta Verónica Abad. En su intervención la Sra. @ivonneabogada es una mezcla de #Chimoltrufia con #Cantinflas igual a su presidente Mr. Daniel Noboa. #YaBasta #Papelón #NoboaNuncaMás",1869558259041829128,https://x.com/Drwandradee/status/1869558259041829128,43,468,772,23482,9,https://pbs.twimg.com/amplify_video_thumb/1869558172232364032/img/t_SmwfVjdESDbmY-.jpg;https://pbs.twimg.com/amplify_video_thumb/1869558172223967232/img/JMKiyorgJGPTr2UA.jpg,False,,,,,es,Top
(@@TampicoGob OR @@MonicaVTampico) min_replies:0 min_faves:0 min_retweets:0,https://x.com/search?q=(@@TampicoGob OR @@MonicaVTampico) min_replies:0 min_faves:0 min_retweets:0 until:2024-12-20 since:2024-12-19&src=typed_query,LA MONA QUILOMBERA 2.0 🗡🐵,https://x.com/MONAQUILOMBERA,MONAQUILOMBERA,False,2024-12-19 02:14:27+00:00,False,"EL VIEJO PAJERO QUE CAGÓ A LA MUJER 20 AÑOS DANDO CLASES DE MORAL EN EL PRIMETIME Y VOTANDO MUJERES, GROUNDBREAKING #GranHermano",1869566939821121706,https://x.com/MONAQUILOMBERA/status/1869566939821121706,15,83,856,13143,5,,False,,,,,es,Top
(@@TampicoGob OR @@MonicaVTampico) min_replies:0 min_faves:0 min_retweets:0,https://x.com/search?q=(@@TampicoGob OR @@MonicaVTampico) min_replies:0 min_faves:0 min_retweets:0 until:2024-12-20 since:2024-12-19&src=typed_query,Vox Populi Noticias,https://x.com/VoxPopuliNoti,VoxPopuliNoti,True,2024-12-19 02:19:13+00:00,False,Nombran a Nuevo Director del Sistema DIF Tampico Mónica Villarreal preside Cabildo en Tampico y nombra al Dr. Israel González como nuevo director del DIF. https://voxpopulinoticias.com.mx/2024/12/nombran-director-del-sistema-dif-tampico/ #DIFTamapico #Tampico @MonicaVTampico,1869568135696994657,https://x.com/VoxPopuliNoti/status/1869568135696994657,0,0,0,140,0,https://pbs.twimg.com/media/GfIKGabXEAAPyrk.jpg,False,,,,,es,Top
(@@TampicoGob OR @@MonicaVTampico) min_replies:0 min_faves:0 min_retweets:0,https://x.com/search?q=(@@TampicoGob OR @@MonicaVTampico) min_replies:0 min_faves:0 min_retweets:0 until:2024-12-20 since:2024-12-19&src=typed_query,Xavier Jordan,https://x.com/XavierJordanM,XavierJordanM,True,2024-12-19 02:31:09+00:00,False,".@TamiaVillavice1 .@agentedelcaos33 Ecuador 🇪🇨 Por favor Difundir !! Mañana es un día importante para la Justicia, la transparencia y al verdad. Las hermanas Tamia y Amanda Villavicencio Sandoval, por orden judicial obligatoria e ineludible en EEUU, deben presentarse mañana a dar su testimonio en el proceso por difamación que llevamos mi familia y yo en este país contra la señora Diana Salazar Méndez. Las 90 preguntas están listas y esperan respuestas precisas y documentadas de las Villavicencio Sandoval. Ahora tienen la oportunidad de jugar en la cancha de una Justicia independiente y sin sesgos como es la de las Cortes de la Florida. Donde solo se defiende la verdad !! Nuestro abogado, les estará esperando desde las 8 am, ya sea de manera presencial o vía telemática. Hasta mañana señoras, que triunfe la Justicia y termine la difamación. La Familia se Respeta 👊 @MiamiDadeCourts @CNNEE @soyfdelrincon @Telemundo51 @CorteNacional @FiscaliaEcuador #Ecuador #Mafiamediática",1869571140558958712,https://x.com/XavierJordanM/status/1869571140558958712,47,354,535,399631,11,https://pbs.twimg.com/amplify_video_thumb/1869571134305312769/img/KBtyINalrQ51zoi7.jpg;https://pbs.twimg.com/media/GfINCozW0AAlaSJ.jpg;https://pbs.twimg.com/media/GfINCo0WQAAJbK8.jpg;https://pbs.twimg.com/media/GfINCo0W0AAEOeW.jpg,False,,,,,es,Top
(@@TampicoGob OR @@MonicaVTampico) min_replies:0 min_faves:0 min_retweets:0,https://x.com/search?q=(@@TampicoGob OR @@MonicaVTampico) min_replies:0 min_faves:0 min_retweets:0 until:2024-12-20 since:2024-12-19&src=typed_query,LA MONA QUILOMBERA 2.0 🗡🐵,https://x.com/MONAQUILOMBERA,MONAQUILOMBERA,False,2024-12-19 02:43:09+00:00,False,"MANDEMOS A JENIFER AL CAMPO ASI SE DEDICA A ORDEÑAR, JENIFER AL 9009",1869574159342379329,https://x.com/MONAQUILOMBERA/status/1869574159342379329,155,429,3505,84136,18,https://pbs.twimg.com/media/GfIPylZXoAAPJGX.jpg,False,,,,,es,Top
(@@TampicoGob OR @@MonicaVTampico) min_replies:0 min_faves:0 min_retweets:0,https://x.com/search?q=(@@TampicoGob OR @@MonicaVTampico) min_replies:0 min_faves:0 min_retweets:0 until:2024-12-20 since:2024-12-19&src=typed_query,LA MONA QUILOMBERA 2.0 🗡🐵,https://x.com/MONAQUILOMBERA,MONAQUILOMBERA,False,2024-12-19 03:27:34+00:00,False,"CHICAS NO SE PREOCUPEN, QUE MIS FAVORITOS SALEN DE PLACA PRIMEROS 🤏🏼🐒",1869585337091305544,https://x.com/MONAQUILOMBERA/status/1869585337091305544,27,51,970,17734,10,https://pbs.twimg.com/media/GfIZ9KSW0AAWI9A.jpg,False,,,,,es,Top
(@@TampicoGob OR @@MonicaVTampico) min_replies:0 min_faves:0 min_retweets:0,https://x.com/search?q=(@@TampicoGob OR @@MonicaVTampico) min_replies:0 min_faves:0 min_retweets:0 until:2024-12-20 since:2024-12-19&src=typed_query,Monocromía,https://x.com/monocromia02,monocromia02,False,2024-12-19 03:28:27+00:00,False,Pomni es muy intensa a veces jajaja #DigitalCircus #gummigooxpomni #gummigoofanart #gummigoo #pomni #pomnifanart #PomnixGummygoo #TheAmazingDigitalCircus #TheAmazingDigitalCircusPomni,1869585561482387816,https://x.com/monocromia02/status/1869585561482387816,74,895,15721,180413,1947,https://pbs.twimg.com/media/GfIaJLLW0AAzF5u.jpg,False,,,,,es,Top
(@@TampicoGob OR @@MonicaVTampico) min_replies:0 min_faves:0 min_retweets:0,https://x.com/search?q=(@@TampicoGob OR @@MonicaVTampico) min_replies:0 min_faves:0 min_retweets:0 until:2024-12-20 since:2024-12-19&src=typed_query,David Ed Castellanos,https://x.com/dect1608,dect1608,True,2024-12-19 04:49:10+00:00,False,"Arranca la campaña ""Reyetón”. La alcaldesa @MonicaVTampico invita a la ciudadanía a donar juguetes para llevar esperanza a la niñez en situación vulnerable. ¡Haz tu parte! #Reyetón2024 #Tampico … Por cierto lo que ya se notó es que la clase política atendió el llamado",1869605874840584461,https://x.com/dect1608/status/1869605874840584461,1,0,0,263,0,https://pbs.twimg.com/media/GfIsofiXcAAOS8N.jpg;https://pbs.twimg.com/media/GfIsofhXMAA7dLg.jpg;https://pbs.twimg.com/media/GfIsofhWEAAkMrX.jpg,False,,,,,es,Top
(@@TampicoGob OR @@MonicaVTampico) min_replies:0 min_faves:0 min_retweets:0,https://x.com/search?q=(@@TampicoGob OR @@MonicaVTampico) min_replies:0 min_faves:0 min_retweets:0 until:2024-12-20 since:2024-12-19&src=typed_query,Disfrutona morrr 💋,https://x.com/Dr4maland,Dr4maland,False,2024-12-19 05:39:20+00:00,False,No se puede ser tannmentirosaaaa who hace malabares para cuidar al niñito y laburar mientras vos te rascas la concha a cuatro manos y garchas todo el día y lo ves una o dos veces a la semana. Malamadrela. Y encima tuviste que traer a la veneca porque sola nunca pudiste. Mentirosa,1869618499821469891,https://x.com/Dr4maland/status/1869618499821469891,32,6,291,25830,15,https://pbs.twimg.com/media/GfI4HUsWYAAJpKq.jpg,False,,,,,es,Top
(@@TampicoGob OR @@MonicaVTampico) min_replies:0 min_faves:0 min_retweets:0,https://x.com/search?q=(@@TampicoGob OR @@MonicaVTampico) min_replies:0 min_faves:0 min_retweets:0 until:2024-12-20 since:2024-12-19&src=typed_query,La Derecha Diario Uruguay,https://x.com/DerechaDiarioUY,DerechaDiarioUY,True,2024-12-19 12:07:50+00:00,False,🇺🇾 | INTERNA ENTRE SUBVERSIVOS. Los familiares de ex terroristas comunistas están enojados con los ex terroristas tupamaros debido a que la francotiradora Lucía Topolansky declaró que algunas personas de izquierda mintieron para meter presos a inocentes.,1869716269211193842,https://x.com/DerechaDiarioUY/status/1869716269211193842,46,132,430,21280,25,https://pbs.twimg.com/amplify_video_thumb/1869509099953508355/img/lc8pTD2dd-Nd9TEj.jpg,False,,,,,es,Top
(@@TampicoGob OR @@MonicaVTampico) min_replies:0 min_faves:0 min_retweets:0,https://x.com/search?q=(@@TampicoGob OR @@MonicaVTampico) min_replies:0 min_faves:0 min_retweets:0 until:2024-12-20 since:2024-12-19&src=typed_query,Claudio X. González G.,https://x.com/ClaudioXGG,ClaudioXGG,True,2024-12-19 13:29:07+00:00,False,"Me apena que después de llenarse la boca con palabras como “transparencia”, “honestidad” y “austeridad”, en los hechos la presidenta sirva de TAPADERA para la opacidad, la corrupción, el robo y el despilfarro del erario nacional. #SonPeores",1869736723804283096,https://x.com/ClaudioXGG/status/1869736723804283096,432,1700,3376,39839,23,https://pbs.twimg.com/media/GfKjo_ibcAALp1W.jpg,False,,,,,es,Top
(@@TampicoGob OR @@MonicaVTampico) min_replies:0 min_faves:0 min_retweets:0,https://x.com/search?q=(@@TampicoGob OR @@MonicaVTampico) min_replies:0 min_faves:0 min_retweets:0 until:2024-12-20 since:2024-12-19&src=typed_query,TAN BIONICA,https://x.com/tanbionica,tanbionica,True,2024-12-19 15:01:59+00:00,False,"¡Hola, Perú! 🇵🇪 ✨ La Última Noche Mágica Tour llega a Lima. 🗓 13 de marzo de 2025 📍Anfiteatro Parque de la Exposición. Preventa con tarjetas BBVA 20, 21 y 22 de diciembre a través de @TicketmasterPE Venta general desde el 23 de diciembre.",1869760094893961517,https://x.com/tanbionica/status/1869760094893961517,27,129,395,22497,10,https://pbs.twimg.com/media/GfK3S44WIAASvtD.jpg,False,,,,,es,Top
(@@TampicoGob OR @@MonicaVTampico) min_replies:0 min_faves:0 min_retweets:0,https://x.com/search?q=(@@TampicoGob OR @@MonicaVTampico) min_replies:0 min_faves:0 min_retweets:0 until:2024-12-20 since:2024-12-19&src=typed_query,TAN BIONICA,https://x.com/tanbionica,tanbionica,True,2024-12-19 16:41:56+00:00,False,¡Paraguay! 🇵🇾 🫶 Nos volvemos a ver en La Última Noche Mágica Tour en Asunción. 🗓 8 de marzo de 2025 📍Jockey Club Entradas a la venta desde el 20 de diciembre a las 13 hs por @TicketeaPy . Descuentos exclusivos para clientes de @ueno_py .,1869785248273445372,https://x.com/tanbionica/status/1869785248273445372,27,444,1551,53430,30,https://pbs.twimg.com/media/GfLPqBBW4AA_1z-.jpg,False,,,,,es,Top
(@@TampicoGob OR @@MonicaVTampico) min_replies:0 min_faves:0 min_retweets:0,https://x.com/search?q=(@@TampicoGob OR @@MonicaVTampico) min_replies:0 min_faves:0 min_retweets:0 until:2024-12-20 since:2024-12-19&src=typed_query,$yrupDrip27 🪼(Geezy&TopBoy Stan),https://x.com/SyrupDrip27,SyrupDrip27,False,2024-12-19 17:00:47+00:00,False,La Ex de Anuel (Mamá de Pablito) comenta en el post de Molusco sobre el tanque de Anuel,1869789989728596357,https://x.com/SyrupDrip27/status/1869789989728596357,4,14,682,23174,18,https://pbs.twimg.com/media/GfLUFfuWMAAff9m.jpg,False,,,,,es,Top
(@@TampicoGob OR @@MonicaVTampico) min_replies:0 min_faves:0 min_retweets:0,https://x.com/search?q=(@@TampicoGob OR @@MonicaVTampico) min_replies:0 min_faves:0 min_retweets:0 until:2024-12-20 since:2024-12-19&src=typed_query,Cendy Robles,https://x.com/cendyrobles,cendyrobles,True,2024-12-19 17:25:26+00:00,False,Mi mamá les manda saludos y les desea felices fiestas🎄☃️ #cendyrobles ❤️😍 #Mexico #Tamaulipas #NuevoLaredo #Matamoros #Reynosa #CdVictoria #Tampico #Madero #Altamira #Mante #SanFernando #Hidalgo #Tula #Jaumave #Casas #Miquihuana #Bustamante #Palmillas #Llera #Güémez #Mty #NL #CDMX,1869796195972923478,https://x.com/cendyrobles/status/1869796195972923478,39,15,425,7893,14,https://pbs.twimg.com/media/GfLZurmW8AAlKvj.jpg,False,,,,,es,Top
(@@TampicoGob OR @@MonicaVTampico) min_replies:0 min_faves:0 min_retweets:0,https://x.com/search?q=(@@TampicoGob OR @@MonicaVTampico) min_replies:0 min_faves:0 min_retweets:0 until:2024-12-20 since:2024-12-19&src=typed_query,Gustavo Macalpin,https://x.com/GustavoMacalpin,GustavoMacalpin,False,2024-12-19 18:25:26+00:00,False,¿Santo Tomás de los Plátanos? #OperativoEnjambre #ClaudiaSheinbaum #Harfuch #OmarGarciaHarfuch,1869811295840800939,https://x.com/GustavoMacalpin/status/1869811295840800939,11,133,564,8767,3,https://pbs.twimg.com/amplify_video_thumb/1869810864347590656/img/x0L2ok9mB4XEainT.jpg,False,,,,,es,Top
(@@TampicoGob OR @@MonicaVTampico) min_replies:0 min_faves:0 min_retweets:0,https://x.com/search?q=(@@TampicoGob OR @@MonicaVTampico) min_replies:0 min_faves:0 min_retweets:0 until:2024-12-20 since:2024-12-19&src=typed_query,Erasmo González,https://x.com/erasmoglz,erasmoglz,False,2024-12-19 19:56:56+00:00,False,"Feliz cumpleaños a mi amiga @MonicaVTampico, Presidenta Municipal de Tampico. Te deseo un año lleno de éxitos, salud y muchos logros en todo lo que te propongas. ¡Que sigas alcanzando grandes metas por el bienestar de Tampico #aDarle!",1869834320191598739,https://x.com/erasmoglz/status/1869834320191598739,1,0,2,104,0,https://pbs.twimg.com/media/GfL8Z2JWsAAnYiV.jpg,False,,,,,es,Top
(@@TampicoGob OR @@MonicaVTampico) min_replies:0 min_faves:0 min_retweets:0,https://x.com/search?q=(@@TampicoGob OR @@MonicaVTampico) min_replies:0 min_faves:0 min_retweets:0 until:2024-12-20 since:2024-12-19&src=typed_query,🌹Ross 🌹,https://x.com/rosana_guerra,rosana_guerra,False,2024-12-19 20:01:01+00:00,False,Ya q andan con sus grúas #Tampico A ver si en esta esquina Faja de Oro y Calle Félix de Jesús se traen una. Esta esquina se congestiona porq se estacionan en ambos lados de la calle. Hay escuelas y guardería y una placita comercial. @MonicaVTampico,1869835349813539324,https://x.com/rosana_guerra/status/1869835349813539324,0,0,0,175,0,https://pbs.twimg.com/media/GfL9ViQasAQ277t.jpg,False,,,,,es,Top
