fecha_semana,nombre_semana,author,datetime,datetime_parsed_utc,url,text,replies,retweets,likes,bookmarks,views,query_used,is_reply,in_reply_to_url
,semana_03febrero_26_09febrero_26,@MonicaVTampico,2026-02-03T22:19:58.000Z,2026-02-03T22:19:58+00:00,https://x.com/MonicaVTampico/status/2018811728977707221,"Hoy sostuve una reunión de trabajo y diálogo con José Luis Aranza Aguilar, Delegado del IMSS en Tamaulipas. Desde el Gobierno de Tampico seguimos apostando al trabajo colaborativo.",1,1,3,0,0,from:MonicaVTampico since:2026-02-03 until:2026-02-09,False,
,semana_03febrero_26_09febrero_26,@SanchezLlovera,2026-02-09T22:04:14.000Z,2026-02-09T22:04:14+00:00,https://x.com/SanchezLlovera/status/2020982096735633733,Todos los días dices que estás trabajando por la gente pero la verdad no se nota la parquímetros se volvieron recaudatorios hoy tu personal amedrentó aún adulto mayor que tenía su placa que estaba en lugar de discapacitados y le dijo “hágale como pueda”,0,0,0,0,0,reply_to:https://x.com/MonicaVTampico/status/2018811728977707221,True,https://x.com/MonicaVTampico/status/2018811728977707221
,semana_03febrero_26_09febrero_26,@TampicoGob,2026-02-05T18:03:58.000Z,2026-02-05T18:03:58+00:00,https://x.com/TampicoGob/status/2019472080794697939,"Hoy conmemoramos el Día de la Constitución, una fecha que nos recuerda la promulgación de la Constitución Política de los Estados Unidos Mexicanos de 1917. Un documento que sentó las bases de la justicia, la libertad y los derechos que nos unen como nación.",0,0,1,0,0,from:TampicoGob since:2026-02-03 until:2026-02-09,False,
,semana_03febrero_26_09febrero_26,@TampicososTV,2026-02-06T20:05:19.000Z,2026-02-06T20:05:19+00:00,https://x.com/TampicososTV/status/2019865005882323071,"Para carnaval el que tiene @MonicaVTampico con tanto cochinero por toda la ciudad, aquí las quejas y evidencias! @TampicoGob",0,0,0,0,0,@TampicoGob since:2026-02-03 until:2026-02-09,False,
,semana_03febrero_26_09febrero_26,@el_naufraghost,2026-02-08T14:22:24.000Z,2026-02-08T14:22:24+00:00,https://x.com/el_naufraghost/status/2020503485884834281,Esta cuenta dirá que tmb es culpa de @MonicaVTampico ….,0,1,0,0,0,@MonicaVTampico since:2026-02-03 until:2026-02-09,False,
,semana_03febrero_26_09febrero_26,@VoxPopuliNoti,2026-02-07T04:02:00.000Z,2026-02-07T04:02:00+00:00,https://x.com/VoxPopuliNoti/status/2019984967875367152,"Mónica Villarreal Anaya fortalece la construcción de paz desde las colonias La presidenta municipal, Mónica Villarreal Anaya, promueve la seguridad y el cambio social en Tampico https:// voxpopulinoticias.com.mx/2026/02/monica -villarreal-anaya-trabaja-por-la-paz-en-colonias-de-tampico/ … #MónicaVillarrealAnaya #Paz #Colonias @MonicaVTampico",0,0,0,0,0,@MonicaVTampico since:2026-02-03 until:2026-02-09,False,
,semana_03febrero_26_09febrero_26,@VoxPopuliNoti,2026-02-06T01:51:12.000Z,2026-02-06T01:51:12+00:00,https://x.com/VoxPopuliNoti/status/2019589664328544638,"Refuerza Mónica Villarreal gobierno cercano con audiencia pública en la Colonia Borreguera de Tampico, Tamaulipas El propósito es escuchar de manera directa las inquietudes de la población y brindar atención inmediata https:// voxpopulinoticias.com.mx/2026/02/refuer za-monica-villarreal-gobierno-cercano-con-audiencia-publica-en-la-colonia-borreguera-de-tampico-tamaulipas/ … #Tampico #Tamaulipas @MonicaVTampico",0,0,0,0,0,@MonicaVTampico since:2026-02-03 until:2026-02-09,False,
,semana_03febrero_26_09febrero_26,@RedTampico,2026-02-05T15:09:09.000Z,2026-02-05T15:09:09+00:00,https://x.com/RedTampico/status/2019428086337663055,"Ceremonia del CIX Aniversario de la promulgación de la Constitución Política de los Estados Unidos Mexicanos de 1917 #Tampico encabeza por autoridades civiles y militares , así como la Alcaldesa @MonicaVTampico",0,0,0,0,0,@MonicaVTampico since:2026-02-03 until:2026-02-09,False,
,semana_03febrero_26_09febrero_26,@VoxPopuliNoti,2026-02-05T01:59:49.000Z,2026-02-05T01:59:49+00:00,https://x.com/VoxPopuliNoti/status/2019229445018824822,"Mónica Villarreal fortalece la identidad cívica en planteles educativos de Tampico, Tamaulipas Autoridades municipales entregaron 151 lienzos a planteles de educación básica y media superior https:// voxpopulinoticias.com.mx/2026/02/monica -villarreal-fortalece-la-identidad-civica-en-planteles-educativos-de-tampico-tamaulipas/ … #Tampico #Tamaulipas @MonicaVTampico",0,0,0,0,0,@MonicaVTampico since:2026-02-03 until:2026-02-09,False,
,semana_03febrero_26_09febrero_26,@CronicaDigital,2026-02-04T01:22:57.000Z,2026-02-04T01:22:57+00:00,https://x.com/cdtamaulipas/status/2018857779331768610,La UAT y Gobierno de Tampico formarán expertos en psicología forense https:// cdtamaulipas.mx/2026/02/la-uat -y-gobierno-de-tampico-formaran-expertos-en-psicologia-forense/ … @UAT_mx @UATPrensa @DamasoAnayaUAT @MonicaVTampico,0,0,0,0,0,@MonicaVTampico since:2026-02-03 until:2026-02-09,False,
,semana_03febrero_26_09febrero_26,@MennyValdz,2026-02-03T15:04:01.000Z,2026-02-03T15:04:01+00:00,https://x.com/MennyValdz/status/2018702017967895014,"1 Ene 2026 fue detenido ""EL SERAPIO"" Lider""CDG FACCION ROJOS""de #Aldama #Tamaulipas /Secuestros extorsiones drogas ejecuciones ,indocumentados ilegales etc) FUÈ PUESTO por ""EL R3"" LIDER de la zona sur (Protegido por @FGJ_Tam @dr_avillarreal @MonicaVTampico alcaldesa #Tampico",0,3,36,0,0,@MonicaVTampico since:2026-02-03 until:2026-02-09,False,
,semana_03febrero_26_09febrero_26,@RedTampico,2026-02-03T05:11:48.000Z,2026-02-03T05:11:48+00:00,https://x.com/RedTampico/status/2018552982082564544,"El Círculo Ciudadano reconoció y felicitó las acciones en vialidad que viene haciendo la Presidenta Municipal en #Tampico @MonicaVTampico por conducto de Tránsito y Vialidad, buscando la reducción de accidentes y recomendaciones a respetar la velocidad y señalamientos viales.",0,0,0,0,0,@MonicaVTampico since:2026-02-03 until:2026-02-09,False,
,semana_03febrero_26_09febrero_26,@yosoytampico,2026-02-03T00:49:07.000Z,2026-02-03T00:49:07+00:00,https://x.com/yosoytampico/status/2018486877221728476,"Anuncian #BLOQUEO este martes a las 7:00 am, a la altura del paso superior del ""Posada"", en #TAMPICO, por desaparición de cadete. @SEMAR_mx @gobtam @SSP_GobTam @SEGOB_mx @MonicaVTampico @ESMIC_EJC #Tampico #Madero #Altamira #Posada #Ayuda #SeBusca #Cadete #Naval #SEMAR",0,7,4,0,0,@MonicaVTampico since:2026-02-03 until:2026-02-09,False,
,semana_03febrero_26_09febrero_26,@TampicososTV,2026-02-08T02:43:10.000Z,2026-02-08T02:43:10+00:00,https://x.com/TampicososTV/status/2020327517161152536,"Clemente salió molesto, aventó las vendas y no quiso salir por donde se estaban haciendo los cambios! | 81’ 0 vs 1 ¡CAMBIOS DEL PROFE ‘CHIMA’! Francisco Martínez “Pantera” Oliver Pérez Luis Razo “Wiwi” José a Clemente #YoSoyCeleste",2,0,0,0,0,reply_to:https://x.com/el_naufraghost/status/2020503485884834281,True,https://x.com/el_naufraghost/status/2020503485884834281
,semana_03febrero_26_09febrero_26,@VoxPopuliNoti,2026-02-07T04:02:00.000Z,2026-02-07T04:02:00+00:00,https://x.com/VoxPopuliNoti/status/2019984967875367152/history,"Mónica Villarreal Anaya fortalece la construcción de paz desde las colonias La presidenta municipal, Mónica Villarreal Anaya, promueve la seguridad y el cambio social en Tampico https:// voxpopulinoticias.com.mx/2026/02/monica -villarreal-anaya-trabaja-por-la-paz-en-colonias-de-tampico/ … #MónicaVillarrealAnaya #Paz #Colonias @MonicaVTampico",0,0,0,0,0,reply_to:https://x.com/VoxPopuliNoti/status/2019984967875367152,True,https://x.com/VoxPopuliNoti/status/2019984967875367152
,semana_03febrero_26_09febrero_26,@CronicaDigital,2026-02-04T01:22:57.000Z,2026-02-04T01:22:57+00:00,https://x.com/cdtamaulipas/status/2018857779331768610/history,La UAT y Gobierno de Tampico formarán expertos en psicología forense https:// cdtamaulipas.mx/2026/02/la-uat -y-gobierno-de-tampico-formaran-expertos-en-psicologia-forense/ … @UAT_mx @UATPrensa @DamasoAnayaUAT @MonicaVTampico,0,0,0,0,0,reply_to:https://x.com/cdtamaulipas/status/2018857779331768610,True,https://x.com/cdtamaulipas/status/2018857779331768610
,semana_03febrero_26_09febrero_26,@RaulCuevas24750,2026-02-08T16:42:45.000Z,2026-02-08T16:42:45+00:00,https://x.com/RaulCuevas24750/status/2020538803010642180,Y puede ser candidata de Cd Madero o de Tampico porque cuenta con 2 domicilios. También la hermana del Huachicolero @Dr_AVillarreal trae una colota que le pisen a Mónica Villarreal después de regalar un predio para una iglesia Pan de Vida a su primo Nasan de Los Reyes Villarreal,0,1,5,0,0,"""monica villarreal"" since:2026-02-03 until:2026-02-09",False,
,semana_03febrero_26_09febrero_26,@portalnt,2026-02-08T03:32:32.000Z,2026-02-08T03:32:32+00:00,https://x.com/portalnt/status/2020339941679702119,Mónica Villarreal encabeza celebración del Día del Recolector https:// noticiasdetampico.mx/monica-villarr eal-encabeza-celebracion-del-dia-del-recolector/ …,0,0,0,0,0,"""monica villarreal"" since:2026-02-03 until:2026-02-09",False,
,semana_03febrero_26_09febrero_26,@EContre17,2026-02-08T03:22:21.000Z,2026-02-08T03:22:21+00:00,https://x.com/EContre17/status/2020337375730421811,,0,0,0,0,0,"""monica villarreal"" since:2026-02-03 until:2026-02-09",False,
,semana_03febrero_26_09febrero_26,@EleeseNoticias,2026-02-08T02:54:26.000Z,2026-02-08T02:54:26+00:00,https://x.com/EleeseNoticias/status/2020330350052847975,Mónica Villarreal encabeza celebración del Día del Recolector,0,0,0,0,0,"""monica villarreal"" since:2026-02-03 until:2026-02-09",False,
,semana_03febrero_26_09febrero_26,@LindaPriro97266,2026-02-08T02:44:40.000Z,2026-02-08T02:44:40+00:00,https://x.com/LindaPriro97266/status/2020327892761379203,"X el que publiques qué el narco ratero de propiedades y cómplice de narcos políticos el Lic. y notario Carlos Pérez Hernández CARPER zona centro Tampico eso mucha gente lo sabe lo narco maldito qué es cómplice de narcos vecinos Col.Fdo.San Pedro Tampico, narco Mónica Villarreal A",0,0,1,0,0,"""monica villarreal"" since:2026-02-03 until:2026-02-09",False,
,semana_03febrero_26_09febrero_26,@EleeseNoticias,2026-02-08T00:07:32.000Z,2026-02-08T00:07:32+00:00,https://x.com/EleeseNoticias/status/2020288348540268640,Mónica Villarreal Anaya fortalece la construcción de paz desde las colonias https:// eleese.com.mx/2026/02/07/mon ica-villarreal-anaya-fortalece-la-construccion-de-paz-desde-las-colonias/ …,0,0,0,0,0,"""monica villarreal"" since:2026-02-03 until:2026-02-09",False,
,semana_03febrero_26_09febrero_26,@elgraficotamps,2026-02-07T17:59:41.000Z,2026-02-07T17:59:41+00:00,https://x.com/elgraficotamps/status/2020195778598244848,Mónica Villarreal Anaya fortalece la construcción de paz desde las colonias,0,0,0,0,0,"""monica villarreal"" since:2026-02-03 until:2026-02-09",False,
,semana_03febrero_26_09febrero_26,@LaRedAltamiraMx,2026-02-07T10:19:43.000Z,2026-02-07T10:19:43+00:00,https://x.com/LaRedAltamiraMx/status/2020080024791941440,LA RED: Fortalece Mónica Villarreal Anaya la construcción de paz desde las colonias Click para leer más WEB: https:// laredmultimedia.com/fortalece-moni ca-villarreal-anaya-la-construccion-de-paz-desde-las-colonias/ … #SomosLARED #EstamosEnTodasPartes #RED58TeInforma,0,0,0,0,0,"""monica villarreal"" since:2026-02-03 until:2026-02-09",False,
,semana_03febrero_26_09febrero_26,@portalnt,2026-02-07T03:05:36.000Z,2026-02-07T03:05:36+00:00,https://x.com/portalnt/status/2019970772450587087,Mónica Villarreal Anaya fortalece la construcción de paz desde las colonias https:// noticiasdetampico.mx/monica-villarr eal-anaya-fortalece-la-construccion-de-paz-desde-las-colonias/ …,0,1,1,0,0,"""monica villarreal"" since:2026-02-03 until:2026-02-09",False,
,semana_03febrero_26_09febrero_26,@CronicaDigital,2026-02-06T12:05:14.000Z,2026-02-06T12:05:14+00:00,https://x.com/cdtamaulipas/status/2019744187822784768,"Mónica Villarreal: Su futuro, en el aire.",0,0,0,0,0,"""monica villarreal"" since:2026-02-03 until:2026-02-09",False,
,semana_03febrero_26_09febrero_26,@portalnt,2026-02-06T04:27:26.000Z,2026-02-06T04:27:26+00:00,https://x.com/portalnt/status/2019628980744405441,Refuerza Mónica Villarreal gobierno cercano con audiencia pública en la Borreguera https:// noticiasdetampico.mx/refuerza-monic a-villarreal-gobierno-cercano-con-audiencia-publica-en-la-borreguera/ …,0,0,0,0,0,"""monica villarreal"" since:2026-02-03 until:2026-02-09",False,
,semana_03febrero_26_09febrero_26,@EContre17,2026-02-06T03:59:04.000Z,2026-02-06T03:59:04+00:00,https://x.com/EContre17/status/2019621843754221873,,0,0,0,0,0,"""monica villarreal"" since:2026-02-03 until:2026-02-09",False,
,semana_03febrero_26_09febrero_26,@HOYTamaulipas,2026-02-06T03:51:44.000Z,2026-02-06T03:51:44+00:00,https://x.com/HOYTamaulipas/status/2019619995550966202,#Tampico #Tamaulipas Refuerza #MónicaVillarreal gobierno cercano con audiencia pública en la Borreguera - Entérate,0,0,0,0,0,"""monica villarreal"" since:2026-02-03 until:2026-02-09",False,
,semana_03febrero_26_09febrero_26,@Reporteroszona,2026-02-06T02:08:53.000Z,2026-02-06T02:08:53+00:00,https://x.com/Reporteroszona/status/2019594113113604260,"¡Trabajamos hoy para prevenir mañana! Siguiendo las instrucciones de nuestra Presidenta Mónica Villarreal, nuestras cuadrillas se encuentran en la colonia Solidaridad, Voluntad y Trabajo (Borreguera) realizando una limpieza del canal pluvial a cielo abierto.",0,0,1,0,0,"""monica villarreal"" since:2026-02-03 until:2026-02-09",False,
,semana_03febrero_26_09febrero_26,@larazontampico,2026-02-05T21:16:15.000Z,2026-02-05T21:16:15+00:00,https://x.com/larazontampico/status/2019520468605366752,"| Con el objetivo de vigilar la calidad del aire y reducir el impacto ambiental, el Ayuntamiento de #Tampico lanzó la convocatoria para la compra de tres equipos de monitoreo atmosférico, informó la alcaldesa Mónica Villarreal Anaya. https:// expreso.press/?p=765796",0,0,0,0,0,"""monica villarreal"" since:2026-02-03 until:2026-02-09",False,
,semana_03febrero_26_09febrero_26,@EContre17,2026-02-05T05:34:21.000Z,2026-02-05T05:34:21+00:00,https://x.com/EContre17/status/2019283433592352999,,0,0,0,0,0,"""monica villarreal"" since:2026-02-03 until:2026-02-09",False,
,semana_03febrero_26_09febrero_26,@EContre17,2026-02-05T05:27:04.000Z,2026-02-05T05:27:04+00:00,https://x.com/EContre17/status/2019281601235153094,,0,0,0,0,0,"""monica villarreal"" since:2026-02-03 until:2026-02-09",False,
,semana_03febrero_26_09febrero_26,@portalnt,2026-02-05T02:43:52.000Z,2026-02-05T02:43:52+00:00,https://x.com/portalnt/status/2019240528819204303,Carnaval Conurbado 2026 Posiciona al Sur de Tamaulipas como Principal Destino Turístico: Mónica Villarreal https:// noticiasdetampico.mx/carnaval-conur bado-2026-posiciona-al-sur-de-tamaulipas-como-principal-destino-turistico-monica-villarreal/ …,0,0,0,0,0,"""monica villarreal"" since:2026-02-03 until:2026-02-09",False,
,semana_03febrero_26_09febrero_26,@EleeseNoticias,2026-02-05T02:19:06.000Z,2026-02-05T02:19:06+00:00,https://x.com/EleeseNoticias/status/2019234297241293061,Carnaval Conurbado 2026 Posiciona al Sur de Tamaulipas como Principal Destino Turístico: Mónica Villarreal https:// eleese.com.mx/2026/02/04/car naval-conurbado-2026-posiciona-al-sur-de-tamaulipas-como-principal-destino-turistico-monica-villarreal/ …,0,0,0,0,0,"""monica villarreal"" since:2026-02-03 until:2026-02-09",False,
,semana_03febrero_26_09febrero_26,@EDUCATAM,2026-02-05T02:15:06.000Z,2026-02-05T02:15:06+00:00,https://x.com/EDUCATAM/status/2019233291417653740,"a escuelas e instituciones públicas en la ciudad de Tampico. En este acto en el que también estuvo presente la presidenta municipal, Mónica Villarreal Anaya, participaron escuelas desde preescolar hasta nivel medio superior y se fortaleció la identidad,",1,2,0,0,0,"""monica villarreal"" since:2026-02-03 until:2026-02-09",False,
,semana_03febrero_26_09febrero_26,@portalnt,2026-02-05T01:53:29.000Z,2026-02-05T01:53:29+00:00,https://x.com/portalnt/status/2019227849262002181,Mónica Villarreal fortalece la identidad cívica en planteles educativos de Tampico https:// noticiasdetampico.mx/monica-villarr eal-fortalece-la-identidad-civica-en-planteles-educativos-de-tampico/ …,0,0,0,0,0,"""monica villarreal"" since:2026-02-03 until:2026-02-09",False,
,semana_03febrero_26_09febrero_26,@EleeseNoticias,2026-02-05T01:40:26.000Z,2026-02-05T01:40:26+00:00,https://x.com/EleeseNoticias/status/2019224565692657765,Mónica Villarreal fortalece la identidad cívica en planteles educativos de Tampico https:// eleese.com.mx/2026/02/04/mon ica-villarreal-fortalece-la-identidad-civica-en-planteles-educativos-de-tampico/ …,0,0,0,0,0,"""monica villarreal"" since:2026-02-03 until:2026-02-09",False,
,semana_03febrero_26_09febrero_26,@HOYTamaulipas,2026-02-05T01:34:06.000Z,2026-02-05T01:34:06+00:00,https://x.com/HOYTamaulipas/status/2019222971437707455,#Tamaulipas #MónicaVillarreal fortalece la identidad cívica en planteles educativos de #Tampico - Entérate,0,0,0,0,0,"""monica villarreal"" since:2026-02-03 until:2026-02-09",False,
,semana_03febrero_26_09febrero_26,@EDUCATAM,2026-02-04T22:11:00.000Z,2026-02-04T22:11:00+00:00,https://x.com/EDUCATAM/status/2019171861477658828,"Entrega de Escudo de Armas de Tamaulipas para escoltas de la ciudad de Tampico; evento presidido por el secretario de Educación, Miguel Ángel Valdez García, y la presidenta municipal de Tampico, Mónica Villarreal Anaya.",0,5,4,0,0,"""monica villarreal"" since:2026-02-03 until:2026-02-09",False,
,semana_03febrero_26_09febrero_26,@JuanPizanaMtz,2026-02-04T17:01:30.000Z,2026-02-04T17:01:30+00:00,https://x.com/JuanPizanaMtz/status/2019093970597326926,"ENTREGA DE BANDERAS DEL ESTADO DE TAMAULIPAS A ESCUELAS PÚBLICAS La compañera presidenta Mónica Villarreal, a través de la Dirección de Educación, junto al gobierno del estado el Dr. Américo Villarreal, se llevó a cabo la entrega de Banderas del Estado de Tamaulipas a 151",1,0,0,0,0,"""monica villarreal"" since:2026-02-03 until:2026-02-09",False,
,semana_03febrero_26_09febrero_26,@OscarMalibran,2026-02-04T16:00:02.000Z,2026-02-04T16:00:02+00:00,https://x.com/OscarMalibran/status/2019078501526077613,"#LOCAL| Director de Deportes de Tampico Visitó la Unidad Deportiva de Puertas Coloradas El Director de Deportes de Tampico, Jorge Lozano Ceceña, realizó una reunión de trabajo en la Unidad Deportiva Puertas Coloradas, tal y como lo indica la Presidenta, Mónica Villarreal.",0,0,0,0,0,"""monica villarreal"" since:2026-02-03 until:2026-02-09",False,
,semana_03febrero_26_09febrero_26,@LaRedAltamiraMx,2026-02-04T07:13:51.000Z,2026-02-04T07:13:51+00:00,https://x.com/LaRedAltamiraMx/status/2018946084391801330,LA RED: Suscribe Mónica Villarreal un Histórico acuerdo con la UAT Click para leer más WEB: https:// laredmultimedia.com/suscribe-monic a-villarreal-un-historico-acuerdo-con-la-uat/ … #SomosLARED #EstamosEnTodasPartes #RED58TeInforma,0,0,0,0,0,"""monica villarreal"" since:2026-02-03 until:2026-02-09",False,
,semana_03febrero_26_09febrero_26,@EContre17,2026-02-04T04:31:56.000Z,2026-02-04T04:31:56+00:00,https://x.com/EContre17/status/2018905337047425371,,0,0,0,0,0,"""monica villarreal"" since:2026-02-03 until:2026-02-09",False,
,semana_03febrero_26_09febrero_26,@VoxPopuliNoti,2026-02-04T03:04:32.000Z,2026-02-04T03:04:32+00:00,https://x.com/VoxPopuliNoti/status/2018883340825190602,Suscribe Mónica Villarreal histórico acuerdo con la UAT para la creación de especialidad en psicología forense El convenio permitirá fortalecer la atención integral de las problemáticas sociales y contribuir a un sistema de justicia con enfoque humano https:// voxpopulinoticias.com.mx/2026/02/suscri be-monica-villarreal-historico-acuerdo-con-la-uat-para-la-creacion-de-especialidad-en-psicologia-forense/ …,0,0,0,0,0,"""monica villarreal"" since:2026-02-03 until:2026-02-09",False,
,semana_03febrero_26_09febrero_26,@portalnt,2026-02-04T02:38:35.000Z,2026-02-04T02:38:35+00:00,https://x.com/portalnt/status/2018876812743373018,Suscribe Mónica Villarreal Histórico Acuerdo con la UAT para la Creación de Especialidad en Psicología Forense https:// noticiasdetampico.mx/suscribe-monic a-villarreal-historico-acuerdo-con-la-uat-para-la-creacion-de-especialidad-en-psicologia-forense/ …,0,0,0,0,0,"""monica villarreal"" since:2026-02-03 until:2026-02-09",False,
,semana_03febrero_26_09febrero_26,@EleeseNoticias,2026-02-04T02:32:58.000Z,2026-02-04T02:32:58+00:00,https://x.com/EleeseNoticias/status/2018875397551833246,Suscribe Mónica Villarreal Histórico Acuerdo con la UAT para la Creación de Especialidad en Psicología Forense https:// eleese.com.mx/2026/02/03/sus cribe-monica-villarreal-historico-acuerdo-con-la-uat-para-la-creacion-de-especialidad-en-psicologia-forense/ …,0,0,0,0,0,"""monica villarreal"" since:2026-02-03 until:2026-02-09",False,
,semana_03febrero_26_09febrero_26,@HOYTamaulipas,2026-02-04T01:14:26.000Z,2026-02-04T01:14:26+00:00,https://x.com/HOYTamaulipas/status/2018855633471361511,#Tampico #Tamaulipas Suscribe #MónicaVillarreal histórico acuerdo con la @UAT_mx - Entérate,0,0,0,0,0,"""monica villarreal"" since:2026-02-03 until:2026-02-09",False,
,semana_03febrero_26_09febrero_26,@VoxPopuliNoti,2026-02-04T00:34:20.000Z,2026-02-04T00:34:20+00:00,https://x.com/VoxPopuliNoti/status/2018845544051773529,Inaugura Mónica Villarreal primera etapa de techumbre en el Hospital “Dr. Carlos Canseco” La primera etapa de la techumbre busca brindar resguardo y mejores condiciones https:// voxpopulinoticias.com.mx/2026/02/famili as-ya-cuentan-con-techumbre-en-hospital-de-tampico/ … #Tampico #MónicaVillarreal #Tamaulipas,0,0,0,0,0,"""monica villarreal"" since:2026-02-03 until:2026-02-09",False,
,semana_03febrero_26_09febrero_26,@EContre17,2026-02-03T23:23:31.000Z,2026-02-03T23:23:31+00:00,https://x.com/EContre17/status/2018827721657487646,,0,0,0,0,0,"""monica villarreal"" since:2026-02-03 until:2026-02-09",False,
,semana_03febrero_26_09febrero_26,@DamasoAnayaUAT,2026-02-03T21:22:51.000Z,2026-02-03T21:22:51+00:00,https://x.com/DamasoAnayaUAT/status/2018797352841314735,"Damos un paso más en el fortalecimiento académico de la @UAT_mx con la creación de la Especialidad en Psicología Forense, que iniciará en agosto de 2026, como resultado de un convenio entre la UAT y el municipio de Tampico que encabeza, Mónica Villarreal",1,2,3,0,0,"""monica villarreal"" since:2026-02-03 until:2026-02-09",False,
,semana_03febrero_26_09febrero_26,@SessionLiveVic,2026-02-03T21:13:08.000Z,2026-02-03T21:13:08+00:00,https://x.com/SessionLiveVic/status/2018794911491862558,"Este video analiza las posibilidades de reelección de Amalia Ávalos y Mónica Villarreal, basándose en la opinión pública. ¿Quién crees que ganará? #Elecciones #Política",0,0,0,0,0,"""monica villarreal"" since:2026-02-03 until:2026-02-09",False,
,semana_03febrero_26_09febrero_26,@SindicalEl,2026-02-03T01:00:26.000Z,2026-02-03T01:00:26+00:00,https://x.com/SindicalEl/status/2018489724545991041,MÓNICA VILLARREAL COMPARTE TRADICIONES Y CERCANÍA CON LA GENTE EN LA PLAZA DE ARMAS https:// elsindicalprensa.com/2026/02/02/mon ica-villarreal-comparte-tradiciones-y-cercania-con-la-gente-en-la-plaza-de-armas/ …,0,0,0,0,0,"""monica villarreal"" since:2026-02-03 until:2026-02-09",False,
,semana_03febrero_26_09febrero_26,@VoxPopuliNoti,2026-02-03T00:42:11.000Z,2026-02-03T00:42:11+00:00,https://x.com/VoxPopuliNoti/status/2018485130512253362,Conmemoran en Tampico el Día de la Candelaria con Tradicional Tamaliza Mónica Villarreal encabeza la popular celebración https:// voxpopulinoticias.com.mx/2026/02/tampic o-celebra-el-dia-de-la-candelaria-con-tamales/ … #Tampico #DíadelaCandelaria #MónicaVillarreal,0,0,0,0,0,"""monica villarreal"" since:2026-02-03 until:2026-02-09",False,
,semana_03febrero_26_09febrero_26,@RaulCuevas24750,2026-02-08T16:31:50.000Z,2026-02-08T16:31:50+00:00,https://x.com/RaulCuevas24750/status/2020536059352801676,Se acuerdan cuando la Peggy de @Ursula_PSM robó un iPhone a un Diputado del Pan en el @CongresoTams después que viajaba a la CDMX en Autobús y extorsionaba al CONALEP con el MARRANO de su Viejo. Ahora en días pasados hizo un fiestón en el Centro de Convenciones de Cd Madero,10,227,376,0,0,reply_to:https://x.com/RaulCuevas24750/status/2020538803010642180,True,https://x.com/RaulCuevas24750/status/2020538803010642180
,semana_03febrero_26_09febrero_26,@RaulCuevas24750,2026-02-08T16:36:19.000Z,2026-02-08T16:36:19+00:00,https://x.com/RaulCuevas24750/status/2020537186504900788,Cabe mencionar que anda promoviéndose de Presidenta para tapar el $aqueo desmedido de @erasmoglz gastando varios millones en el pachangon. Y nomás vean las ESTUPIDECES de INICIATIVAS que promueve de dar risa. Pero se jacta de conocimiento. Siendo que quien le impuso fué la mamá,1,1,6,0,0,reply_to:https://x.com/RaulCuevas24750/status/2020538803010642180,True,https://x.com/RaulCuevas24750/status/2020538803010642180
,semana_03febrero_26_09febrero_26,@DerechaDiarioMX,2026-02-07T19:40:00.000Z,2026-02-07T19:40:00+00:00,https://x.com/DerechaDiarioMX/status/2020221022251921585,"| TREMENDA CARADURA: La narcoinútil Claudia Sheinbaum se pasó de cómica y afirmó en un mitín partidista que con el narcopartido ""la corrupción en México había acabado"" desatando la burla y la crítica por su cinismo.",281,2688,6694,0,0,reply_to:https://x.com/LindaPriro97266/status/2020327892761379203,True,https://x.com/LindaPriro97266/status/2020327892761379203
