Query_Str,Post_URL,Author_Name,Author_Web_Page_URL,Author_Handle,Verified_Status,UTC_Time,Ads,Tweet_Content,Post_ID,Tweet_URL,Reply_Count,Repost_Count,Like_Count,View_Count,Bookmark_Count,Tweet_Image_URL,Replying_to,Reply_to_Whom,Reply_to_Whom_URL,Reply_to_Whom_Username,Reply_to_Whom_Handle,Language,Type
(@@TampicoGob OR @@MonicaVTampico) min_replies:0 min_faves:0 min_retweets:0,https://x.com/search?q=(@@TampicoGob OR @@MonicaVTampico) min_replies:0 min_faves:0 min_retweets:0 until:2025-03-07 since:2025-03-06&src=typed_query,Blog del Narco México,https://x.com/blogdelnarcomex,blogdelnarcomex,True,2025-03-06 17:13:57+00:00,False,"Camila una mujer Sicaria Venezolana resultó herida al atacar a Soldados en Apatzingán, Michoacán, sus compañeros corrieron y la dejaron (Información en el enlace) https://www.blogdelnarco.org/2025/03/camila-una-mujer-sicaria-venezolana.html",1897697171018784790,https://x.com/blogdelnarcomex/status/1897697171018784790,76,142,1429,125063,53,https://pbs.twimg.com/media/GlX5bETWAAAq8Lp.jpg;https://pbs.twimg.com/media/GlX5bl4X0AEPj0M.jpg,False,,,,,es,Top
(@@TampicoGob OR @@MonicaVTampico) min_replies:0 min_faves:0 min_retweets:0,https://x.com/search?q=(@@TampicoGob OR @@MonicaVTampico) min_replies:0 min_faves:0 min_retweets:0 until:2025-03-07 since:2025-03-06&src=typed_query,shadow 🇨🇱,https://x.com/8cielos,8cielos,False,2025-03-06 17:26:07+00:00,False,"Tonka tomicic sabía todo lo que hacía su marido …. Pero bueno esto es así , justicia de mierda …. Un buen abogado , unos papeles que se pierdan y estamos ….",1897700230436429829,https://x.com/8cielos/status/1897700230436429829,8,54,221,12563,1,,False,,,,,es,Top
(@@TampicoGob OR @@MonicaVTampico) min_replies:0 min_faves:0 min_retweets:0,https://x.com/search?q=(@@TampicoGob OR @@MonicaVTampico) min_replies:0 min_faves:0 min_retweets:0 until:2025-03-07 since:2025-03-06&src=typed_query,Honor Y Gloria ❤🔥 Jara Presidenta,https://x.com/JoviNomas,JoviNomas,False,2025-03-06 17:31:11+00:00,False,"Si Sebastián Piñera fue presidente DOS VECES después de haber estado prófugo por robar el banco de Talca claro que Tonka Tomicic puede volver a la tv, si no, pregúntenle al estafador y papito corazón Mauricio Israel",1897701505005695417,https://x.com/JoviNomas/status/1897701505005695417,24,346,1429,28955,7,,False,,,,,es,Top
(@@TampicoGob OR @@MonicaVTampico) min_replies:0 min_faves:0 min_retweets:0,https://x.com/search?q=(@@TampicoGob OR @@MonicaVTampico) min_replies:0 min_faves:0 min_retweets:0 until:2025-03-07 since:2025-03-06&src=typed_query,CONAGO,https://x.com/CONAGO_oficial,CONAGO_oficial,False,2025-03-06 17:41:23+00:00,False,"La CONAGO reconoce el esfuerzo y liderazgo de la Presidenta de México, @Claudiashein, en la negociación con el gobierno de los Estados Unidos, que resultó en la eliminación de aranceles a los productos mexicanos incluidos en el T-MEC. Consulta el comunicado completo:",1897704072771158500,https://x.com/CONAGO_oficial/status/1897704072771158500,20,160,292,9195,3,https://pbs.twimg.com/media/GlX_y6kW8AAnyoE.jpg,False,,,,,es,Top
(@@TampicoGob OR @@MonicaVTampico) min_replies:0 min_faves:0 min_retweets:0,https://x.com/search?q=(@@TampicoGob OR @@MonicaVTampico) min_replies:0 min_faves:0 min_retweets:0 until:2025-03-07 since:2025-03-06&src=typed_query,Monica gab. Lic. en Interiorismo!!,https://x.com/MonicaToledoCa1,MonicaToledoCa1,False,2025-03-06 17:52:06+00:00,False,En cuanto 💰💰💰nos va a salir este chistecito para defender a los carteles del narco??? Pinche gobierno populista.,1897706771520930238,https://x.com/MonicaToledoCa1/status/1897706771520930238,82,422,632,7327,3,https://pbs.twimg.com/media/GlYCPyFakAADk_W.jpg,False,,,,,es,Top
(@@TampicoGob OR @@MonicaVTampico) min_replies:0 min_faves:0 min_retweets:0,https://x.com/search?q=(@@TampicoGob OR @@MonicaVTampico) min_replies:0 min_faves:0 min_retweets:0 until:2025-03-07 since:2025-03-06&src=typed_query,Carlos Vijnovsky Zenteno,https://x.com/CarlosVZenteno,CarlosVZenteno,True,2025-03-06 17:53:48+00:00,False,"Seamos sinceros, Xóchitl o Máynez se habrían doblado a la primera, no tienen la capacidad política y ni de negociación como lo tiene nuestra Presidenta. El Pueblo de México está en las mejores manos.",1897707199402537441,https://x.com/CarlosVZenteno/status/1897707199402537441,160,217,833,12900,5,,False,,,,,es,Top
(@@TampicoGob OR @@MonicaVTampico) min_replies:0 min_faves:0 min_retweets:0,https://x.com/search?q=(@@TampicoGob OR @@MonicaVTampico) min_replies:0 min_faves:0 min_retweets:0 until:2025-03-07 since:2025-03-06&src=typed_query,Mascos 🌞,https://x.com/mascos69,mascos69,False,2025-03-06 18:27:58+00:00,False,Salviamo Mariavittoria ❤️ Queste cose non possiamo perdercele 😁🤣❤️ #Tommavi #resistenzatommavi #morline #Grandefratello,1897715796949750123,https://x.com/mascos69/status/1897715796949750123,3,19,296,10821,68,https://pbs.twimg.com/ext_tw_video_thumb/1897715662438461440/pu/img/tKf_Fv_uF_FgbXRL.jpg,False,,,,,it,Top
(@@TampicoGob OR @@MonicaVTampico) min_replies:0 min_faves:0 min_retweets:0,https://x.com/search?q=(@@TampicoGob OR @@MonicaVTampico) min_replies:0 min_faves:0 min_retweets:0 until:2025-03-07 since:2025-03-06&src=typed_query,Colo-Colo Femenino,https://x.com/ColoColoFem,ColoColoFem,False,2025-03-06 18:53:38+00:00,False,"𝐒𝐞 𝐯𝐢𝐞𝐧𝐞 𝐞𝐥 𝐝𝐞𝐛𝐮𝐭 𝐝𝐞 𝐥𝐚𝐬 𝐀𝐥𝐛𝐚𝐬 🤟🏻⚪️⚫️ Este sábado 08 de marzo, desde las 11:00 horas, visitamos a Huachipato en Talcahuano por la primera fecha de la Liga de Primera 🏆🇨🇱 📺📱Transmite Huachipato #VamosLasAlbas #VamosPorTodo #Centenar100",1897722256975184269,https://x.com/ColoColoFem/status/1897722256975184269,5,19,227,2397,2,https://pbs.twimg.com/media/GlYQVEbXUAAv-Ur.jpg,False,,,,,es,Top
(@@TampicoGob OR @@MonicaVTampico) min_replies:0 min_faves:0 min_retweets:0,https://x.com/search?q=(@@TampicoGob OR @@MonicaVTampico) min_replies:0 min_faves:0 min_retweets:0 until:2025-03-07 since:2025-03-06&src=typed_query,Dr. Roberto Morales Ojeda,https://x.com/DrRobertoMOjeda,DrRobertoMOjeda,False,2025-03-06 18:59:23+00:00,False,"En esta fértil tierra pinareña, el tabaco crece con características distintivas. Sobre su siembra, cosecha y procesamiento reflexionamos con productores en los tres municipios visitados. #JnidosXCuba",1897723704437592093,https://x.com/DrRobertoMOjeda/status/1897723704437592093,27,951,758,5051,0,https://pbs.twimg.com/media/GlYRpNKWMAAmC_y.jpg;https://pbs.twimg.com/media/GlYRpQZWcAAB1YO.jpg;https://pbs.twimg.com/media/GlYRpY9XwAADSlV.jpg;https://pbs.twimg.com/media/GlYRpiuXsAApgys.jpg,False,,,,,es,Top
(@@TampicoGob OR @@MonicaVTampico) min_replies:0 min_faves:0 min_retweets:0,https://x.com/search?q=(@@TampicoGob OR @@MonicaVTampico) min_replies:0 min_faves:0 min_retweets:0 until:2025-03-07 since:2025-03-06&src=typed_query,🇮🇱 мαѕтєя σf ρυρρєтѕ #TUCAM 🇺🇦,https://x.com/ManuelVegaMX,ManuelVegaMX,False,2025-03-06 19:22:45+00:00,False,"@makugo @Claudiashein Cómo panista con 39 años de militancia te digo, que si asistes, de ser alguien que se admiraba, pasarás a ser una gran decepción. Y alguien a quien, dentro de la militancia, perderás todo apoyo y respaldo. https://x.com/makugo/status/1897654171014230022?t=YP4QEZfPx8pZkeohFirkrg&s=19",1897729582771716200,https://x.com/ManuelVegaMX/status/1897729582771716200,5,84,300,2484,0,,True,makugo,https://x.com/makugo,Mauricio Kuri,makugo,es,Top
(@@TampicoGob OR @@MonicaVTampico) min_replies:0 min_faves:0 min_retweets:0,https://x.com/search?q=(@@TampicoGob OR @@MonicaVTampico) min_replies:0 min_faves:0 min_retweets:0 until:2025-03-06 since:2025-03-05&src=typed_query,Mia 🍋,https://x.com/Mialygosa,Mialygosa,True,2025-03-06 19:26:36+00:00,False,🔷 | Solo las cuentas verificadas pueden responder este tweet.,1897730550820937796,https://x.com/Mialygosa/status/1897730550820937796,36,8,199,29870,4,,False,,,,,es,Top
(@@TampicoGob OR @@MonicaVTampico) min_replies:0 min_faves:0 min_retweets:0,https://x.com/search?q=(@@TampicoGob OR @@MonicaVTampico) min_replies:0 min_faves:0 min_retweets:0 until:2025-03-07 since:2025-03-06&src=typed_query,Pampino,https://x.com/PampaPampino,PampaPampino,False,2025-03-06 19:29:05+00:00,False,"@lorenafriesm @desbordes @ana_maria_yanez Ahora?🤣🤣🤣 después de 4 años en la administración del PC, se viene a preocupar de la Comuna? son unos cara de palo...!!",1897731177345106087,https://x.com/PampaPampino/status/1897731177345106087,2,31,238,1559,0,,True,lorenafriesm,https://x.com/lorenafriesm,Lorena Fries,lorenafriesm,es,Top
(@@TampicoGob OR @@MonicaVTampico) min_replies:0 min_faves:0 min_retweets:0,https://x.com/search?q=(@@TampicoGob OR @@MonicaVTampico) min_replies:0 min_faves:0 min_retweets:0 until:2025-03-07 since:2025-03-06&src=typed_query,Libertad Digital,https://x.com/libertaddigital,libertaddigital,True,2025-03-06 19:30:09+00:00,False,"🔴 #ÚLTIMAHORA | Conde-Pumpido forzó un comunicado judicial denunciando una ""campaña de presiones"" al TC tras el ultimátum del Supremo Informa @miguelpr83 https://www.libertaddigital.com/espana/2025-03-06/conde-pumpido-forzo-comunicado-judicial-denunciando-campana-presiones-tc-ultimatum-supremo-7224851/",1897731447961612768,https://x.com/libertaddigital/status/1897731447961612768,22,213,224,5300,3,,False,,,,,es,Top
(@@TampicoGob OR @@MonicaVTampico) min_replies:0 min_faves:0 min_retweets:0,https://x.com/search?q=(@@TampicoGob OR @@MonicaVTampico) min_replies:0 min_faves:0 min_retweets:0 until:2025-03-07 since:2025-03-06&src=typed_query,voluntas 🎀,https://x.com/bonfireheart190,bonfireheart190,False,2025-03-06 19:30:27+00:00,False,NON C'ERA BISOGNO DI IMPEGNARSI TANTO SONO DEVASTATA DE VA STA TA 😀😀😀😀😀😀😀 #tommavi,1897731522192388195,https://x.com/bonfireheart190/status/1897731522192388195,1,9,206,8595,55,https://pbs.twimg.com/ext_tw_video_thumb/1897730936780840960/pu/img/govuivGV4XKDuRkF.jpg,False,,,,,it,Top
(@@TampicoGob OR @@MonicaVTampico) min_replies:0 min_faves:0 min_retweets:0,https://x.com/search?q=(@@TampicoGob OR @@MonicaVTampico) min_replies:0 min_faves:0 min_retweets:0 until:2025-03-07 since:2025-03-06&src=typed_query,Guía Deportiva9,https://x.com/GuiaDeportiva9,GuiaDeportiva9,True,2025-03-06 20:20:51+00:00,False,Mónica Arredondo está en sus últimos días o semanas en Fox sports MX. Tubi 🇲🇽 sería su nueva casa. 😭🥺,1897744206841466881,https://x.com/GuiaDeportiva9/status/1897744206841466881,11,22,440,18286,24,https://pbs.twimg.com/media/GlYkTMzWIAAJtAK.jpg,False,,,,,es,Top
(@@TampicoGob OR @@MonicaVTampico) min_replies:0 min_faves:0 min_retweets:0,https://x.com/search?q=(@@TampicoGob OR @@MonicaVTampico) min_replies:0 min_faves:0 min_retweets:0 until:2025-03-07 since:2025-03-06&src=typed_query,Canal 1 San Juan,https://x.com/Canal1SanJuan1,Canal1SanJuan1,False,2025-03-06 20:25:07+00:00,False,"@goyii_cm Tengo la sensación que la Tana lo está haciendo a propósito. La dejan sin fumar, ella los deja sin comer 🤭",1897745279325290970,https://x.com/Canal1SanJuan1/status/1897745279325290970,13,7,917,31488,2,,True,goyii_cm,https://x.com/goyii_cm,goyii 🌐,goyii_cm,es,Top
(@@TampicoGob OR @@MonicaVTampico) min_replies:0 min_faves:0 min_retweets:0,https://x.com/search?q=(@@TampicoGob OR @@MonicaVTampico) min_replies:0 min_faves:0 min_retweets:0 until:2025-03-07 since:2025-03-06&src=typed_query,Blog del Narco México,https://x.com/blogdelnarcomx,blogdelnarcomx,False,2025-03-06 20:35:08+00:00,False,"Camila una mujer Sicaria Venezolana resultó herida al atacar a Soldados en Apatzingán, Michoacán, sus compañeros corrieron y la dejaron (Información en el enlace) https://www.blogdelnarco.org/2025/03/camila-una-mujer-sicaria-venezolana.html",1897747799464169729,https://x.com/blogdelnarcomx/status/1897747799464169729,9,19,287,35664,14,https://pbs.twimg.com/media/GlYnjIlWkAE0yHP.jpg;https://pbs.twimg.com/media/GlYnkH4XgAA6pCM.jpg,False,,,,,es,Top
(@@TampicoGob OR @@MonicaVTampico) min_replies:0 min_faves:0 min_retweets:0,https://x.com/search?q=(@@TampicoGob OR @@MonicaVTampico) min_replies:0 min_faves:0 min_retweets:0 until:2025-03-07 since:2025-03-06&src=typed_query,M,https://x.com/MConurbasic,MConurbasic,True,2025-03-06 20:39:20+00:00,False,"LLAMADO A LA SOLIDARIDAD 📣 Se busca dar con nombre y paradero de esta argolluda incogible criada sin afecto que anduvo ayer gaseando jubilados en el Congreso. Si alguien tiene información de esta enferma HIJADEPUTA, por favor compartalo. GRACIAS.",1897748858291011825,https://x.com/MConurbasic/status/1897748858291011825,81,3736,15573,674260,282,https://pbs.twimg.com/media/GlYoh3vWYAAwNWm.jpg,False,,,,,es,Top
(@@TampicoGob OR @@MonicaVTampico) min_replies:0 min_faves:0 min_retweets:0,https://x.com/search?q=(@@TampicoGob OR @@MonicaVTampico) min_replies:0 min_faves:0 min_retweets:0 until:2025-03-07 since:2025-03-06&src=typed_query,Mr.Wanchope,https://x.com/WanchopeMr,WanchopeMr,False,2025-03-06 20:58:17+00:00,False,— Me han dado 20 puñaladas. — Échate rosa de mosqueta.,1897753627265040826,https://x.com/WanchopeMr/status/1897753627265040826,23,119,395,20794,4,,False,,,,,es,Top
(@@TampicoGob OR @@MonicaVTampico) min_replies:0 min_faves:0 min_retweets:0,https://x.com/search?q=(@@TampicoGob OR @@MonicaVTampico) min_replies:0 min_faves:0 min_retweets:0 until:2025-03-07 since:2025-03-06&src=typed_query,🐾🐾Gatitos a salvo🐾🐾,https://x.com/gatitosasalvo,gatitosasalvo,True,2025-03-06 21:09:27+00:00,False,Les quiero presentar a mi nuevo gathijo. Se llama MOLCAS Ya me siento Blanca Nieves y los 7 enanos ahora sí. 🤭🤭😬😬,1897756434533872093,https://x.com/gatitosasalvo/status/1897756434533872093,24,52,396,4716,2,https://pbs.twimg.com/media/GlYvavvboAA5sSB.jpg;https://pbs.twimg.com/media/GlYva1yWIAEoXCl.jpg;https://pbs.twimg.com/media/GlYvawfbwAAMlWF.jpg;https://pbs.twimg.com/media/GlYvaxXbwAAlUQw.jpg,False,,,,,es,Top
(@@TampicoGob OR @@MonicaVTampico) min_replies:0 min_faves:0 min_retweets:0,https://x.com/search?q=(@@TampicoGob OR @@MonicaVTampico) min_replies:0 min_faves:0 min_retweets:0 until:2025-03-07 since:2025-03-06&src=typed_query,Vivo En Marte,https://x.com/VivoenMarte2,VivoenMarte2,True,2025-03-06 21:12:54+00:00,False,"El es Miguel Rodríguez y el es el responsable de levantar al ciudadano americano en #Reynosa #Tamaulipas está misma lacra también se dedica a traficar armas y drogas en dicha ciudad fronteriza. También participa en un canal de Youtube llamado ""Los Juniors Team"" donde hacen vídeo blogs. El propietario de ese canal es del hermano de Miguel Rodríguez. En el último video que subieron a su canal a la mitad del vídeo se logra observar brevemente al secuestrador del Miguel Rodríguez en el video aparece con una polo manga corta marca Coach.",1897757303711187358,https://x.com/VivoenMarte2/status/1897757303711187358,0,105,671,84179,71,https://pbs.twimg.com/media/GlYwNIRWYAAooRD.jpg;https://pbs.twimg.com/media/GlYwNWoXsAEsXlr.jpg;https://pbs.twimg.com/media/GlYwNg9XkAESc8r.jpg;https://pbs.twimg.com/media/GlYwNSiXcAEga9D.jpg,False,,,,,es,Top
(@@TampicoGob OR @@MonicaVTampico) min_replies:0 min_faves:0 min_retweets:0,https://x.com/search?q=(@@TampicoGob OR @@MonicaVTampico) min_replies:0 min_faves:0 min_retweets:0 until:2025-03-07 since:2025-03-06&src=typed_query,Vivo En Marte,https://x.com/VivoenMarte2,VivoenMarte2,True,2025-03-06 21:26:35+00:00,False,"Actualización: La cuazita que va caminando con los demás cuazitos en este vídeo es apodada ""La Chaparra 35"" es una sicaria activa de los mentados ""Chucky's"" grupo que pertenece al Cartel del Noreste/Zetas de #NuevoLaredo #Tamaulipas",1897760749071520090,https://x.com/VivoenMarte2/status/1897760749071520090,0,46,736,144340,138,https://pbs.twimg.com/media/GlYzWC_XUAAZlob.jpg;https://pbs.twimg.com/media/GlYzWCOWoAE59Fs.jpg;https://pbs.twimg.com/media/GlYzWD4W0AA9rk2.jpg,False,,,,,es,Top
(@@TampicoGob OR @@MonicaVTampico) min_replies:0 min_faves:0 min_retweets:0,https://x.com/search?q=(@@TampicoGob OR @@MonicaVTampico) min_replies:0 min_faves:0 min_retweets:0 until:2025-03-07 since:2025-03-06&src=typed_query,Hagov Tendencias,https://x.com/hagov_tendencia,hagov_tendencia,False,2025-03-06 21:30:27+00:00,False,“Ponzidemia” Porque la actual pareja de Nicolás Márquez lanzó su cursito para estafar gente.,1897761719906095174,https://x.com/hagov_tendencia/status/1897761719906095174,80,276,2477,68085,94,https://pbs.twimg.com/ext_tw_video_thumb/1897657444454539264/pu/img/mgyx-UlzhLAGS2BR.jpg,False,,,,,es,Top
(@@TampicoGob OR @@MonicaVTampico) min_replies:0 min_faves:0 min_retweets:0,https://x.com/search?q=(@@TampicoGob OR @@MonicaVTampico) min_replies:0 min_faves:0 min_retweets:0 until:2025-03-07 since:2025-03-06&src=typed_query,Alessandra Rojo de la Vega,https://x.com/AlessandraRdlv,AlessandraRdlv,True,2025-03-06 21:42:29+00:00,False,"Caminando las calles de la colonia Guerrero, con la brigada violeta llevando los Puntos Violeta puerta por puerta. Queremos que todas las mujeres sepan que no están solas y que tienen un espacio seguro cerca de ellas. La seguridad y el apoyo son prioridad. #MujeresAlFrente",1897764748613357709,https://x.com/AlessandraRdlv/status/1897764748613357709,74,164,439,33455,6,https://pbs.twimg.com/media/GlY28e-bwAIEXYz.jpg;https://pbs.twimg.com/media/GlY28fEbwAAZbgj.jpg;https://pbs.twimg.com/media/GlY28e_bEAA-nqX.jpg;https://pbs.twimg.com/media/GlY28fAbwAIgOSM.jpg,False,,,,,es,Top
(@@TampicoGob OR @@MonicaVTampico) min_replies:0 min_faves:0 min_retweets:0,https://x.com/search?q=(@@TampicoGob OR @@MonicaVTampico) min_replies:0 min_faves:0 min_retweets:0 until:2025-03-07 since:2025-03-06&src=typed_query,Marco Antonio Aguirre,https://x.com/marcoaguiro,marcoaguiro,False,2025-03-06 21:43:33+00:00,False,"La secretaria de Cultura del gobierno de Rocío Nahle, Xóchitl Molina, mandó a su guarura a bloquear de cualquier forma a la reportera Concepción Sánchez, quien sólo buscaba una declaración de porque mandó a dormir al piso a los indígenas que fueron a una exposición de artesanías a las oficinas de esa dependencia. El guarura cumplió y hasta empujó a la reportera, mientras Xóchitl corría lo más rápido que pudo.",1897765015568236853,https://x.com/marcoaguiro/status/1897765015568236853,84,3027,4216,101591,66,https://pbs.twimg.com/media/GlY3I1HXIAAx4vN.jpg;https://pbs.twimg.com/media/GlY3I1PXAAAx8QR.jpg;https://pbs.twimg.com/media/GlY3KoSX0AAltC-.jpg,False,,,,,es,Top
(@@TampicoGob OR @@MonicaVTampico) min_replies:0 min_faves:0 min_retweets:0,https://x.com/search?q=(@@TampicoGob OR @@MonicaVTampico) min_replies:0 min_faves:0 min_retweets:0 until:2025-03-07 since:2025-03-06&src=typed_query,SPR Informa,https://x.com/SPRInforma,SPRInforma,True,2025-03-06 21:46:43+00:00,False,"#Nacional El presidente de la Confederación de Cámaras Industriales de los Estados Unidos Mexicanos (@CONCAMIN), Alejandro Malagón, reconoció que la presidenta Claudia Sheinbaum (@Claudiashein), así como su equipo de trabajo, llevaron a cabo un buen desarrollo en la llamada con el presidente de los #EstadosUnidos, Donald Trump (@POTUS), para pausar los aranceles sobre los productos mexicanos incluidos en el #TMEC. Tras sostener una reunión con la mandataria mexicana en Palacio Nacional, señaló que #Mexico está haciendo su trabajo en los temas que se ha comprometido [...], estamos muy contentos porque lo que vamos encontrando es congruencia por el trabajo que se está haciendo"", y agregó que el sector empresarial estará presente en la asamblea que convocó la presidenta Sheinbaum el próximo domingo 9 de marzo en el Zócalo.",1897765814490530063,https://x.com/SPRInforma/status/1897765814490530063,21,772,2185,39140,62,https://pbs.twimg.com/ext_tw_video_thumb/1897764412238315521/pu/img/sfj2eFdDH9TJ3M_P.jpg,False,,,,,es,Top
(@@TampicoGob OR @@MonicaVTampico) min_replies:0 min_faves:0 min_retweets:0,https://x.com/search?q=(@@TampicoGob OR @@MonicaVTampico) min_replies:0 min_faves:0 min_retweets:0 until:2025-03-07 since:2025-03-06&src=typed_query,SinLínea.Mx,https://x.com/SinLinea_Mx,SinLinea_Mx,True,2025-03-06 22:48:17+00:00,False,"¡Hasta que dijeron una verdad en @AtypicalTeve! 🔴“Si quieren un narco político, vayan a España, agarren a Felipe Calderón y entréguenlo a EU…” 😆 ‼️La cara de #MarianaGómez (@marianagc) no tiene precio.",1897781306806632588,https://x.com/SinLinea_Mx/status/1897781306806632588,177,2670,5412,67973,142,https://pbs.twimg.com/ext_tw_video_thumb/1897780778005647360/pu/img/oUtaK8wq15i99L9J.jpg,False,,,,,es,Top
(@@TampicoGob OR @@MonicaVTampico) min_replies:0 min_faves:0 min_retweets:0,https://x.com/search?q=(@@TampicoGob OR @@MonicaVTampico) min_replies:0 min_faves:0 min_retweets:0 until:2025-03-07 since:2025-03-06&src=typed_query,🌜Lunatica🌛,https://x.com/ariannaambro,ariannaambro,False,2025-03-06 22:52:54+00:00,False,"TOMMASO CHE VA CONTRO LORENZO, HELENA CHE PORTA VIA JAVIER, OOOH CHE STA SUCCEDENDOO #tommavi #helevier",1897782468226224155,https://x.com/ariannaambro/status/1897782468226224155,1,31,604,15928,12,https://pbs.twimg.com/tweet_video_thumb/GlZHF9FXoAArrNU.jpg,False,,,,,it,Top
(@@TampicoGob OR @@MonicaVTampico) min_replies:0 min_faves:0 min_retweets:0,https://x.com/search?q=(@@TampicoGob OR @@MonicaVTampico) min_replies:0 min_faves:0 min_retweets:0 until:2025-03-07 since:2025-03-06&src=typed_query,Michael Chen,https://x.com/chenmapty,chenmapty,True,2025-03-06 22:58:42+00:00,False,Por fin! Estaremos en Ciudad de Panamá solo por 1 día! Sabores de Colón con todo el FLOW gastronómico! 🗓️ Domingo 16 de marzo ⏰ 10:00 AM a 7:00 PM 📍Rooftop (estacionamientos) El Dorado Mall Tendremos 🍽️ comida | 💃 presentaciones | 🏎️ car fashion | 🎶 música | 🎨 artesanías y mucho más! Arriba Colón!,1897783930553819311,https://x.com/chenmapty/status/1897783930553819311,16,130,277,18039,20,https://pbs.twimg.com/amplify_video_thumb/1897783676588478464/img/kKZvWkyzEJHUWLMA.jpg,False,,,,,es,Top
(@@TampicoGob OR @@MonicaVTampico) min_replies:0 min_faves:0 min_retweets:0,https://x.com/search?q=(@@TampicoGob OR @@MonicaVTampico) min_replies:0 min_faves:0 min_retweets:0 until:2025-03-07 since:2025-03-06&src=typed_query,Tecate Emblema,https://x.com/TecateEmblema,TecateEmblema,False,2025-03-06 23:00:07+00:00,False,¡Estamos listxs para crear nuevos momentos emblemáticos! 😍 It’s finally here! 💜 El festival más top pintará de colores la CDMX este 16 y 17 de Mayo 💅🏻☁️🌈😍🦄🩷💙💚🧡💛🩵 ¡Nos vemos pronto amixes! #PreventaBanamex: 14 de Marzo a partir de las 2pm,1897784285446520978,https://x.com/TecateEmblema/status/1897784285446520978,331,750,1196,389936,58,https://pbs.twimg.com/media/GlZIv7SXQAETBls.jpg,False,,,,,es,Top
(@@TampicoGob OR @@MonicaVTampico) min_replies:0 min_faves:0 min_retweets:0,https://x.com/search?q=(@@TampicoGob OR @@MonicaVTampico) min_replies:0 min_faves:0 min_retweets:0 until:2025-03-07 since:2025-03-06&src=typed_query,Témoris Grecko,https://x.com/temoris,temoris,True,2025-03-06 23:06:33+00:00,False,"Nos hemos preguntado qué sería de México si Xóchitl hubiera tenido que enfrentar a Trump. ¿Pero qué me dicen de Monreal, Adán Augusto? Y... el ranchero Fox? El muñequito Peña? El Borolas? Trump se los come de un bocado y se los saca de los dientes con un palillo. No soy creyente pero me dan ganas de sanclaudiarme, digo, santiguarme.",1897785902719541329,https://x.com/temoris/status/1897785902719541329,196,231,1110,33438,12,,False,,,,,es,Top
(@@TampicoGob OR @@MonicaVTampico) min_replies:0 min_faves:0 min_retweets:0,https://x.com/search?q=(@@TampicoGob OR @@MonicaVTampico) min_replies:0 min_faves:0 min_retweets:0 until:2025-03-07 since:2025-03-06&src=typed_query,voluntas 🎀,https://x.com/bonfireheart190,bonfireheart190,False,2025-03-06 23:08:11+00:00,False,"Ma che cosa ne sanno della loro relazione? Ma chi sono per sindacare? T: ""Se devo uscire esco ma esco con lei"" MV: ""Amore mio"" aiutatemi a dire PIÙ FORTI DI TUTTO 🫂🫂🫂 #tommavi",1897786316579881214,https://x.com/bonfireheart190/status/1897786316579881214,1,26,552,10893,34,,False,,,,,it,Top
(@@TampicoGob OR @@MonicaVTampico) min_replies:0 min_faves:0 min_retweets:0,https://x.com/search?q=(@@TampicoGob OR @@MonicaVTampico) min_replies:0 min_faves:0 min_retweets:0 until:2025-03-07 since:2025-03-06&src=typed_query,Marino Vinicio Castillo H.,https://x.com/mcastillo1985,mcastillo1985,False,2025-03-06 23:11:14+00:00,False,Si usted reconoce este personaje y al verlo le causa ansiedad... tómese la pastilla... #TBTerrorífico,1897787081386278942,https://x.com/mcastillo1985/status/1897787081386278942,98,16,246,17485,3,https://pbs.twimg.com/media/GlZLSwNXAAAQaOX.jpg,False,,,,,es,Top
(@@TampicoGob OR @@MonicaVTampico) min_replies:0 min_faves:0 min_retweets:0,https://x.com/search?q=(@@TampicoGob OR @@MonicaVTampico) min_replies:0 min_faves:0 min_retweets:0 until:2025-03-07 since:2025-03-06&src=typed_query,Jaume Osante,https://x.com/Jaume_Osante,Jaume_Osante,False,2025-03-06 23:11:24+00:00,False,Histórico vuelo inaugural Tampico-Dallas/Ft. Worth impulsa el turismo y la inversión en Tamaulipas @erasmoglz @MonicaVTampico @armando_4t https://jaumeosante.com/tamaulipas/historico-vuelo-inaugural-tampico-dallas-ft-worth-impulsa-el-turismo-y-la-inversion-en-tamaulipas/,1897787124469977554,https://x.com/Jaume_Osante/status/1897787124469977554,0,0,0,23,0,,False,,,,,es,Top
