Query_Str,Post_URL,Author_Name,Author_Web_Page_URL,Author_Handle,Verified_Status,UTC_Time,Ads,Tweet_Content,Post_ID,Tweet_URL,Reply_Count,Repost_Count,Like_Count,View_Count,Bookmark_Count,Tweet_Image_URL,Replying_to,Reply_to_Whom,Reply_to_Whom_URL,Reply_to_Whom_Username,Reply_to_Whom_Handle,Language,Type
(@@TampicoGob OR @@MonicaVTampico) min_replies:0 min_faves:0 min_retweets:0,https://x.com/search?q=(@@TampicoGob OR @@MonicaVTampico) min_replies:0 min_faves:0 min_retweets:0 until:2025-03-08 since:2025-03-07&src=typed_query,LuisCardenasMX,https://x.com/LuisCardenasMx,LuisCardenasMx,True,2025-03-07 18:39:49+00:00,False,"💔 ATACAN ADOLESCENTE CON AUTISMO. Sofía, una niña con autismo, sufre bullying en secundaria de Villahermosa 📍En una secundaria de #Villahermosa, #Tabasco, denuncian que Sofía ha sido víctima de agresiones constantes por parte de sus compañeros. No es la primera vez que ocurre, y lo peor: otros estudiantes incitan la violencia en su contra. 🔴 Padres de familia y organizaciones exigen acciones inmediatas para proteger a Sofía y frenar el acoso escolar. ¿Hasta cuándo se permitirá la violencia en las escuelas? Información de @LaHoraMX #NoAlBullying #JusticiaParaSofía",1898081164952584491,https://x.com/LuisCardenasMx/status/1898081164952584491,71,216,311,19818,15,https://pbs.twimg.com/ext_tw_video_thumb/1898080768645062656/pu/img/-p8R_OzdKG9kyrLJ.jpg,False,,,,,es,Top
(@@TampicoGob OR @@MonicaVTampico) min_replies:0 min_faves:0 min_retweets:0,https://x.com/search?q=(@@TampicoGob OR @@MonicaVTampico) min_replies:0 min_faves:0 min_retweets:0 until:2025-03-08 since:2025-03-07&src=typed_query,Verónica,https://x.com/dravero6,dravero6,False,2025-03-07 18:42:20+00:00,False,"MCM : lo más seguro es que no me leas, porque solo soy una ciudadana venezolana, pero yo si a ti, porque desgraciadamente eres una figura pública. Quiero decirte desde lo más profundo de mi ser que el verdadero clamor de los venezolanos es “que gente como tú ”más nunca hable en nombre de nosotros ! Y que se les aplique la ley Simón Bolívar @dcabellor @jorgerpsuv Te han vendido como una súper mujer, cuando en este país en cada esquina existen muchísimas pero muchísimas mujeres con más méritos que los tuyos, académicamente, físicamente y además espiritualmente y que además nos sentimos profundamente venezolanas, profundamente patriotas y bolivarianas! Si somos bolivarianos, nos gustan las 8 estrellas , nos gusta ser quemaitos, nos gusta ser tropicales ! Más allá del cursito del marketing y trabajo de tu imagen para parecer cool, y clases de oratoria, solo veo una mujer profundamente frustrada, abatida derrotada y muy histerica .. contrólate ! De todos modos la justicia te espera .. cada post cada entrevista que pagas sirve solo para hundirte un poco más … #MariaApatridaPresaYa @",1898081800033124777,https://x.com/dravero6/status/1898081800033124777,166,302,363,41202,10,https://pbs.twimg.com/amplify_video_thumb/1898070490516013059/img/UBkkz3CNcpl1sDYp.jpg,False,,,,,es,Top
(@@TampicoGob OR @@MonicaVTampico) min_replies:0 min_faves:0 min_retweets:0,https://x.com/search?q=(@@TampicoGob OR @@MonicaVTampico) min_replies:0 min_faves:0 min_retweets:0 until:2025-03-08 since:2025-03-07&src=typed_query,Rocío Nahle,https://x.com/rocionahle,rocionahle,False,2025-03-07 18:42:24+00:00,False,"¡Es tiempo de mujeres! En conmemoración del Día de la Mujer, reafirmamos nuestro compromiso de ser reconocidas con equidad y empoderamiento, así como de cuidarnos y protegernos a través de los programas 'Amiga, yo te apoyo' y 'Veracruzana protegida'. #SiLlegaUnaLlegamosTodas🤝",1898081816063463545,https://x.com/rocionahle/status/1898081816063463545,27,85,243,7560,0,https://pbs.twimg.com/media/GldXQUYXUAAAvsn.jpg,False,,,,,es,Top
(@@TampicoGob OR @@MonicaVTampico) min_replies:0 min_faves:0 min_retweets:0,https://x.com/search?q=(@@TampicoGob OR @@MonicaVTampico) min_replies:0 min_faves:0 min_retweets:0 until:2025-03-08 since:2025-03-07&src=typed_query,Guillermo Hambrook,https://x.com/Hambrook7,Hambrook7,False,2025-03-07 18:53:02+00:00,False,Gracias a Luis Lacalle Pou y Raúl Lozano tuvo vivienda esa señora; hay un novel video donde agradecía y decía que no tenía que llamar al comunal cuando llovía. Recuerdo el vestido blanco floreado. La señora bastante ingrata. Me alegro que tenga un techo.,1898084492515959060,https://x.com/Hambrook7/status/1898084492515959060,144,176,537,59986,27,https://pbs.twimg.com/amplify_video_thumb/1898028402520596480/img/J6thrCBR33bSU4LP.jpg,False,,,,,es,Top
(@@TampicoGob OR @@MonicaVTampico) min_replies:0 min_faves:0 min_retweets:0,https://x.com/search?q=(@@TampicoGob OR @@MonicaVTampico) min_replies:0 min_faves:0 min_retweets:0 until:2025-03-08 since:2025-03-07&src=typed_query,Gelatina,https://x.com/somosgelatina,somosgelatina,True,2025-03-07 19:05:31+00:00,False,Llega Bang Bang con @marcos_aramburu y @tomasquintinp 10 DE MARZO. 10AM.,1898087632543871299,https://x.com/somosgelatina/status/1898087632543871299,28,65,964,45714,10,https://pbs.twimg.com/amplify_video_thumb/1898087553808412672/img/fRJtZQgp1Mm2pBtw.jpg,False,,,,,es,Top
(@@TampicoGob OR @@MonicaVTampico) min_replies:0 min_faves:0 min_retweets:0,https://x.com/search?q=(@@TampicoGob OR @@MonicaVTampico) min_replies:0 min_faves:0 min_retweets:0 until:2025-03-08 since:2025-03-07&src=typed_query,Toribio Pérez Golarons,https://x.com/haydemasiados,haydemasiados,False,2025-03-07 19:52:22+00:00,False,"@d_cerca Cuando Jamon't y Camarón se dan la mano, magrebí cimitarra contra navajote gitano, por las rosas de sangre mocita ahora yacen mojados de sangre el Moja y el Tano. Llegó la de la Guadaña, la que no engaña, y segando dos vidas sufridas, se llevó, también, la escoria de España.",1898099423940419910,https://x.com/haydemasiados/status/1898099423940419910,7,23,283,8283,20,,True,d_cerca,https://x.com/d_cerca,D-Cerca,d_cerca,es,Top
(@@TampicoGob OR @@MonicaVTampico) min_replies:0 min_faves:0 min_retweets:0,https://x.com/search?q=(@@TampicoGob OR @@MonicaVTampico) min_replies:0 min_faves:0 min_retweets:0 until:2025-03-08 since:2025-03-07&src=typed_query,Mauricio MGL,https://x.com/MglMauricio,MglMauricio,True,2025-03-07 19:52:42+00:00,False,"🛑HITLER SE ENTERA🛑 que nuestra Presidenta Claudia Sheinbaum @Claudiashein hace un llamado a la unidad y convoca a todos los Mexicanos el Domingo 9 de Marzo al Zócalo. Informará las medidas que tomaría si Trump insiste en imponer aranceles de 25% de manera unilateral, violando el tratado del T-MEC. Si al diálogo y la colaboración, pero no a la renuncia del respeto de nuestra soberanía. México es un pueblo maravilloso y ejemplar. La oposición miserable, Mezquina y vende patrias, se pone del lado de los intereses extranjeros. #TenemosMuchaPresidenta #AlZocaloConMiPresidenta #TRAIDORES_A_LA_PATRIA RT 🇲🇽👇",1898099506740113509,https://x.com/MglMauricio/status/1898099506740113509,246,1212,2099,105574,209,https://pbs.twimg.com/amplify_video_thumb/1898098711126822912/img/UTmMpiSe1vGItuRu.jpg,False,,,,,es,Top
(@@TampicoGob OR @@MonicaVTampico) min_replies:0 min_faves:0 min_retweets:0,https://x.com/search?q=(@@TampicoGob OR @@MonicaVTampico) min_replies:0 min_faves:0 min_retweets:0 until:2025-03-08 since:2025-03-07&src=typed_query,Jaume Osante,https://x.com/Jaume_Osante,Jaume_Osante,False,2025-03-07 20:20:17+00:00,False,DIF Tampico y Universidad del Atlántico Firman Convenio @TampicoGob https://jaumeosante.com/tamaulipas/dif-tampico-y-universidad-del-atlantico-firman-convenio/,1898106451727450429,https://x.com/Jaume_Osante/status/1898106451727450429,0,0,0,24,0,,False,,,,,es,Top
(@@TampicoGob OR @@MonicaVTampico) min_replies:0 min_faves:0 min_retweets:0,https://x.com/search?q=(@@TampicoGob OR @@MonicaVTampico) min_replies:0 min_faves:0 min_retweets:0 until:2025-03-08 since:2025-03-07&src=typed_query,debate y debate,https://x.com/debateydebate,debateydebate,True,2025-03-07 20:29:37+00:00,False,Imagina o quão foda vc tem que ser pra tatuar a MÔNICA pq vc literalmente interpretou A MÔNICA,1898108799505854893,https://x.com/debateydebate/status/1898108799505854893,20,2728,60358,1106079,566,,False,,,,,pt,Top
(@@TampicoGob OR @@MonicaVTampico) min_replies:0 min_faves:0 min_retweets:0,https://x.com/search?q=(@@TampicoGob OR @@MonicaVTampico) min_replies:0 min_faves:0 min_retweets:0 until:2025-03-08 since:2025-03-07&src=typed_query,goyii 🌐,https://x.com/goyii_cm,goyii_cm,False,2025-03-07 20:59:34+00:00,False,"jkjkjk LO QUE CONTABA LA TANA. - ""Tuve peleas muy fuertes, una vez estuve 2 años sin hablarme con mi mamá, porque ella me pidió que le mande una foto de mi pareja de ese momento, para ponerla de wpp, porque quería mostrarlo como que era su novio"". #GranHermano",1898116336431018131,https://x.com/goyii_cm/status/1898116336431018131,2,17,227,8764,26,https://pbs.twimg.com/ext_tw_video_thumb/1898115300672819200/pu/img/xlpFH4W9829fmzYx.jpg,False,,,,,es,Top
(@@TampicoGob OR @@MonicaVTampico) min_replies:0 min_faves:0 min_retweets:0,https://x.com/search?q=(@@TampicoGob OR @@MonicaVTampico) min_replies:0 min_faves:0 min_retweets:0 until:2025-03-08 since:2025-03-07&src=typed_query,Colombia Oscura,https://x.com/ColombiaOscura,ColombiaOscura,True,2025-03-07 21:22:14+00:00,False,"#MARAVILLOSO 🐦 En varias comunidades digitales circula este video ocurrido en el 2022 pero que ha vuelto a ser tendencia debido al mágico momento que protagoniza un ave en el brazo de una servidora del Ministerio de Música del Santuario Rosa Mística, ubicado en Tenjo (C/marca).",1898122041821172179,https://x.com/ColombiaOscura/status/1898122041821172179,20,228,2060,115576,144,https://pbs.twimg.com/ext_tw_video_thumb/1898121970639671296/pu/img/n3RzqrZfpcVhPhbF.jpg,False,,,,,es,Top
(@@TampicoGob OR @@MonicaVTampico) min_replies:0 min_faves:0 min_retweets:0,https://x.com/search?q=(@@TampicoGob OR @@MonicaVTampico) min_replies:0 min_faves:0 min_retweets:0 until:2025-03-08 since:2025-03-07&src=typed_query,⋆.˚꩜ coni .ᐟ˙⋆ 💙,https://x.com/todayisco,todayisco,False,2025-03-07 21:40:10+00:00,False,well enough time has passed it's time to see HER again on the tl,1898126553457782871,https://x.com/todayisco/status/1898126553457782871,3,380,1302,20985,128,https://pbs.twimg.com/ext_tw_video_thumb/1578196804344188929/pu/img/eQuaXKnsPcqcJ48Z.jpg,False,,,,,en,Top
(@@TampicoGob OR @@MonicaVTampico) min_replies:0 min_faves:0 min_retweets:0,https://x.com/search?q=(@@TampicoGob OR @@MonicaVTampico) min_replies:0 min_faves:0 min_retweets:0 until:2025-03-08 since:2025-03-07&src=typed_query,Rocío Nahle,https://x.com/rocionahle,rocionahle,False,2025-03-07 22:05:21+00:00,False,"🆘🙋‍♀️ VERACRUZANA PROTEGIDA Hechos y apoyos concretos!! En el marco del día de la mujer, anunciamos el programa de Veracruzana Protegida y Amiga yo te apoyo. Sin necesidad de una denuncia y a través de una aplicación, se brindará protección inmediata y coordinada.",1898132891269480560,https://x.com/rocionahle/status/1898132891269480560,18,173,475,7774,7,https://pbs.twimg.com/amplify_video_thumb/1898132773187047424/img/olevRYj6gj5zvbU4.jpg,False,,,,,es,Top
(@@TampicoGob OR @@MonicaVTampico) min_replies:0 min_faves:0 min_retweets:0,https://x.com/search?q=(@@TampicoGob OR @@MonicaVTampico) min_replies:0 min_faves:0 min_retweets:0 until:2025-03-08 since:2025-03-07&src=typed_query,Acción Nacional,https://x.com/AccionNacional,AccionNacional,True,2025-03-07 22:17:38+00:00,False,"🟣 Recordamos el legado ejemplar de nuestra primera Gobernadora electa en Puebla: Martha Erika Alonso, una mujer comprometida y entregada al servicio público. ¡Seguimos #ConstruyendoEnIgualdad! #OrgulloPanista #MujeresDeAcción",1898135984245743672,https://x.com/AccionNacional/status/1898135984245743672,55,88,261,6344,4,https://pbs.twimg.com/media/GleInVvbEAAij8K.jpg,False,,,,,es,Top
(@@TampicoGob OR @@MonicaVTampico) min_replies:0 min_faves:0 min_retweets:0,https://x.com/search?q=(@@TampicoGob OR @@MonicaVTampico) min_replies:0 min_faves:0 min_retweets:0 until:2025-03-08 since:2025-03-07&src=typed_query,Pampa,https://x.com/elpamperop,elpamperop,True,2025-03-07 22:37:09+00:00,False,Guillermo Moreno en Tandil. A la pasada un trabajador lo vio y le pidió que se suba a su camioneta para sacar foto,1898140892260708728,https://x.com/elpamperop/status/1898140892260708728,4,48,355,10195,6,https://pbs.twimg.com/ext_tw_video_thumb/1898140863496122368/pu/img/YsojdwL-4OPd9AXp.jpg,False,,,,,es,Top
(@@TampicoGob OR @@MonicaVTampico) min_replies:0 min_faves:0 min_retweets:0,https://x.com/search?q=(@@TampicoGob OR @@MonicaVTampico) min_replies:0 min_faves:0 min_retweets:0 until:2025-03-08 since:2025-03-07&src=typed_query,Comentóloga ⭐️,https://x.com/LaComentologa,LaComentologa,False,2025-03-07 22:45:26+00:00,False,"🔥 Hermanas, no olvidemos y que no nos quieran ver la cara🔥 Mañana Día Internacional de la Mujer #8M, como si nada, María Fernanda Centeno probablemente aparecerá jugando el papel de víctima, burlándose del feminismo y queriendo limpiar su imagen con lágrimas de cocodrilo. Pero aquí estamos para recordarle al mundo quién es realmente y lo que ha hecho para pisotear un movimiento que ha costado vidas y lucha. 📌 No olvidemos que: 🔻 Judicializó su denuncia en tiempo récord gracias a sus influencias, mientras miles de mujeres esperan justicia por años y son ignoradas. 🔻 Mintió diciendo que tenía el respaldo de 16 colectivos feministas, cuando TODOS salieron a desmentirla porque sabían que su problema no era violencia, sino su negocio de pseudociencia llamado grafología. 🔻 Se disfrazó de “mujer violentada” cuando lo único que realmente le importaba era su imagen y su negocio de charlatanería. Mañana veremos si vuelve a hacer su circo. Pero lo que es seguro es que la justicia en este país no es para todas. Que no nos engañe con su discurso de falsa sororidad. No somos su audiencia. No somos su estrategia. No somos su coartada. 📢 No más oportunistas colgándose del feminismo para salvar su reputación. La lucha es real y no permitiremos que la usen como cortina de humo. 🚨 #NoNosCallamos #JusticiaParaTodas #ElFeminismoNoEsTuEscudo",1898142980323561578,https://x.com/LaComentologa/status/1898142980323561578,16,125,494,8470,6,,False,,,,,es,Top
(@@TampicoGob OR @@MonicaVTampico) min_replies:0 min_faves:0 min_retweets:0,https://x.com/search?q=(@@TampicoGob OR @@MonicaVTampico) min_replies:0 min_faves:0 min_retweets:0 until:2025-03-08 since:2025-03-07&src=typed_query,divina 🫧,https://x.com/moneditadicobre,moneditadicobre,False,2025-03-07 23:01:44+00:00,False,"hoy este txiquitín empieza su primera gira, que orgullo 🤧⭐️",1898147082516431351,https://x.com/moneditadicobre/status/1898147082516431351,1,71,722,9081,25,https://pbs.twimg.com/media/GleStbeW0AAo9kC.jpg,False,,,,,es,Top
(@@TampicoGob OR @@MonicaVTampico) min_replies:0 min_faves:0 min_retweets:0,https://x.com/search?q=(@@TampicoGob OR @@MonicaVTampico) min_replies:0 min_faves:0 min_retweets:0 until:2025-03-08 since:2025-03-07&src=typed_query,Majo 🍄,https://x.com/majogm,majogm,True,2025-03-07 23:16:20+00:00,False,"Y bien amigos, se nos viene el pampero. Metan la ropa y las macetas porque el viento va a soplar lindo. Recomendación de madre? Quédense en casa esta noche.",1898150755971854568,https://x.com/majogm/status/1898150755971854568,59,101,1054,68579,12,https://pbs.twimg.com/media/GleWDK5WYAAjBq8.jpg,False,,,,,es,Top
(@@TampicoGob OR @@MonicaVTampico) min_replies:0 min_faves:0 min_retweets:0,https://x.com/search?q=(@@TampicoGob OR @@MonicaVTampico) min_replies:0 min_faves:0 min_retweets:0 until:2025-03-08 since:2025-03-07&src=typed_query,Embajada Países Bajos MX 🇳🇱🇲🇽,https://x.com/NLinMexico,NLinMexico,False,2025-03-07 23:59:54+00:00,False,"🇳🇱🌷🇲🇽 Un tulipán bautizado para honrar a la #MujerIndígena, celebrando también el #DíaDeLaMujer y a la primera presidenta de México @Claudiashein 💜 Abrimos hilo ⤵️ 🧵 1/5",1898161718041166299,https://x.com/NLinMexico/status/1898161718041166299,115,884,3152,65017,73,https://pbs.twimg.com/media/GlegBU4WkAACavm.jpg,False,,,,,es,Top
(@@TampicoGob OR @@MonicaVTampico) min_replies:0 min_faves:0 min_retweets:0,https://x.com/search?q=(@@TampicoGob OR @@MonicaVTampico) min_replies:0 min_faves:0 min_retweets:0 until:2025-03-09 since:2025-03-08&src=typed_query,Emisoras Unidas,https://x.com/EmisorasUnidas,EmisorasUnidas,True,2025-03-08 00:00:01+00:00,False,"#EUNacionales | Inauguran la clínica de la mujer ""Lucrecia Hernández Mack"" Está ubicada en la zona 5 de Mixco y se enfocará en la detección temprana del cáncer de cérvix. https://emisorasunidas.com/nacional/2025/03/07/inauguracion-clinica-mujer-lucrecia-hernandez-mack/",1898161746453709168,https://x.com/EmisorasUnidas/status/1898161746453709168,51,40,203,10890,3,,False,,,,,es,Top
(@@TampicoGob OR @@MonicaVTampico) min_replies:0 min_faves:0 min_retweets:0,https://x.com/search?q=(@@TampicoGob OR @@MonicaVTampico) min_replies:0 min_faves:0 min_retweets:0 until:2025-03-09 since:2025-03-08&src=typed_query,Tampicosos 🌶️🔥,https://x.com/TampicososTV,TampicososTV,False,2025-03-08 00:48:30+00:00,False,"JAJAJAJAJAJA, está igual. Se recontra mamaron, @TampicoGob, @MonicaVTampico.",1898173949772464503,https://x.com/TampicososTV/status/1898173949772464503,10,16,63,3417,1,https://pbs.twimg.com/media/GlerJbDXEAAxjbZ.jpg,False,,,,,es,Top
(@@TampicoGob OR @@MonicaVTampico) min_replies:0 min_faves:0 min_retweets:0,https://x.com/search?q=(@@TampicoGob OR @@MonicaVTampico) min_replies:0 min_faves:0 min_retweets:0 until:2025-03-09 since:2025-03-08&src=typed_query,MMónica🇨🇴,https://x.com/MmonicaGonCa,MmonicaGonCa,False,2025-03-08 01:14:26+00:00,False,Mojada y no como me gusta😭😭😭😓😓😓😣😣🤫🤭,1898180474977055009,https://x.com/MmonicaGonCa/status/1898180474977055009,21,7,606,25528,20,https://pbs.twimg.com/media/GlexFEnWgAA5trp.jpg,False,,,,,es,Top
(@@TampicoGob OR @@MonicaVTampico) min_replies:0 min_faves:0 min_retweets:0,https://x.com/search?q=(@@TampicoGob OR @@MonicaVTampico) min_replies:0 min_faves:0 min_retweets:0 until:2025-03-09 since:2025-03-08&src=typed_query,Duanalia🦋✨️🦋✨️🦋,https://x.com/Duana_Lipa,Duana_Lipa,False,2025-03-08 01:14:56+00:00,False,Día previo al Día Internacional de la mujer. La prensa Mexicana hace gala de su misoginia. Reporteros de programas de @Azteca promueven e incitan al 0dio a Mujeres artistas. Pero mañana los verán vestidos de Morado o con el moñito en la pantalla. ¿La razón? Se comportan agresivos,1898180601938694459,https://x.com/Duana_Lipa/status/1898180601938694459,6,80,580,7573,16,https://pbs.twimg.com/ext_tw_video_thumb/1898180554375221248/pu/img/yisYcIYqExVb4bo4.jpg,False,,,,,es,Top
(@@TampicoGob OR @@MonicaVTampico) min_replies:0 min_faves:0 min_retweets:0,https://x.com/search?q=(@@TampicoGob OR @@MonicaVTampico) min_replies:0 min_faves:0 min_retweets:0 until:2025-03-09 since:2025-03-08&src=typed_query,Ing. Enrique Acevedo Rodriguez.,https://x.com/tuespacio_1,tuespacio_1,False,2025-03-08 01:33:33+00:00,False,"@TampicososTV @TampicoGob @MonicaVTampico Una verguenza, pero habra gente que hasta les aplauda",1898185287915708520,https://x.com/tuespacio_1/status/1898185287915708520,0,0,1,138,0,,True,TampicososTV,https://x.com/TampicososTV,Tampicosos 🌶️🔥,TampicososTV,es,Top
(@@TampicoGob OR @@MonicaVTampico) min_replies:0 min_faves:0 min_retweets:0,https://x.com/search?q=(@@TampicoGob OR @@MonicaVTampico) min_replies:0 min_faves:0 min_retweets:0 until:2025-03-09 since:2025-03-08&src=typed_query,enrique sanchez,https://x.com/enrique35879459,enrique35879459,False,2025-03-08 01:40:26+00:00,False,"@MonicaVTampico A ver cuando pasa a recoger la basura en zona norte, los contenedores se están desbordando, una pena este gobierno ….",1898187018896613465,https://x.com/enrique35879459/status/1898187018896613465,0,0,0,17,0,,True,MonicaVTampico,https://x.com/MonicaVTampico,Mónica Villarreal Anaya,MonicaVTampico,es,Top
(@@TampicoGob OR @@MonicaVTampico) min_replies:0 min_faves:0 min_retweets:0,https://x.com/search?q=(@@TampicoGob OR @@MonicaVTampico) min_replies:0 min_faves:0 min_retweets:0 until:2025-03-09 since:2025-03-08&src=typed_query,brozo xmiswebs,https://x.com/brozoxmiswebs,brozoxmiswebs,False,2025-03-08 02:03:59+00:00,False,"⚡️ ¡Mis chamacos! Hoy en #TeneBrozo : Tres pistas que van de una asamblea informativa al festival del bienestar, revelaremos la lista secreta de las exigencias de Trump a Claudia, y en el estudio el vocero del PAN, @JTrianaT . ¡Órale! 🔴 Video Completo -> https://youtu.be/cE_9BaLVpOs?si=hF0jeZuzoW6WIxc5 #InformaciónParaTi @latinus_us",1898192945100067247,https://x.com/brozoxmiswebs/status/1898192945100067247,124,1074,3123,274537,95,https://pbs.twimg.com/amplify_video_thumb/1898192516488310784/img/M3u8ara_l2VTlHgi.jpg,False,,,,,es,Top
(@@TampicoGob OR @@MonicaVTampico) min_replies:0 min_faves:0 min_retweets:0,https://x.com/search?q=(@@TampicoGob OR @@MonicaVTampico) min_replies:0 min_faves:0 min_retweets:0 until:2025-03-09 since:2025-03-08&src=typed_query,josetheisk,https://x.com/pepekann,pepekann,False,2025-03-08 02:06:53+00:00,False,@TampicososTV @TampicoGob @MonicaVTampico No tienen vergüenza,1898193674279723180,https://x.com/pepekann/status/1898193674279723180,0,0,1,118,0,,True,TampicososTV,https://x.com/TampicososTV,Tampicosos 🌶️🔥,TampicososTV,es,Top
(@@TampicoGob OR @@MonicaVTampico) min_replies:0 min_faves:0 min_retweets:0,https://x.com/search?q=(@@TampicoGob OR @@MonicaVTampico) min_replies:0 min_faves:0 min_retweets:0 until:2025-03-09 since:2025-03-08&src=typed_query,NOTIVIZA,https://x.com/Notiviza,Notiviza,True,2025-03-08 02:22:32+00:00,False,"La Universidad Autónoma de Tamaulipas (UAT) llevó a cabo el Foro «Mujeres Líderes que Inspiran», el cual reunió a destacadas figuras del ámbito político y académico de Tamaulipas. https://www.notivizanoreste.com.mx/estado/expone-la-uat-en-foro-universitario-el-liderazgo-de-la-mujer-tamaulipeca/ @UAT_mx @Carmenliliacrv @MonicaVTampico @DamasoAnayaUAT",1898197613750464797,https://x.com/Notiviza/status/1898197613750464797,0,1,0,25,0,,False,,,,,es,Top
(@@TampicoGob OR @@MonicaVTampico) min_replies:0 min_faves:0 min_retweets:0,https://x.com/search?q=(@@TampicoGob OR @@MonicaVTampico) min_replies:0 min_faves:0 min_retweets:0 until:2025-03-09 since:2025-03-08&src=typed_query,Rey De Copas  💙🚂,https://x.com/reydecopas090,reydecopas090,False,2025-03-08 02:28:44+00:00,False,@TampicososTV @TampicoGob @MonicaVTampico Jaja y nisoqueira es el mismo tramo de la foto,1898199175604416523,https://x.com/reydecopas090/status/1898199175604416523,0,0,0,120,0,,True,TampicososTV,https://x.com/TampicososTV,Tampicosos 🌶️🔥,TampicososTV,es,Top
(@@TampicoGob OR @@MonicaVTampico) min_replies:0 min_faves:0 min_retweets:0,https://x.com/search?q=(@@TampicoGob OR @@MonicaVTampico) min_replies:0 min_faves:0 min_retweets:0 until:2025-03-09 since:2025-03-08&src=typed_query,Erizo,https://x.com/ErizoCL,ErizoCL,False,2025-03-08 02:59:46+00:00,False,"La lobbista de SOQUIMICH, Carolina Tohá, creyó que podía pasearse tranquilamente por santiago después de todo lo que robó con las boletas falsas y luego en la muni de Stgo.",1898206982487646382,https://x.com/ErizoCL/status/1898206982487646382,16,290,463,8170,5,https://pbs.twimg.com/media/GlfJHtbWgAAPJaH.jpg,False,,,,,es,Top
(@@TampicoGob OR @@MonicaVTampico) min_replies:0 min_faves:0 min_retweets:0,https://x.com/search?q=(@@TampicoGob OR @@MonicaVTampico) min_replies:0 min_faves:0 min_retweets:0 until:2025-03-09 since:2025-03-08&src=typed_query,un humilde obrero,https://x.com/FrankRe11831760,FrankRe11831760,False,2025-03-08 03:16:07+00:00,False,@TampicososTV @TampicoGob @MonicaVTampico Jajaja son una cagada está administración,1898211096776843521,https://x.com/FrankRe11831760/status/1898211096776843521,0,0,2,121,0,,True,TampicososTV,https://x.com/TampicososTV,Tampicosos 🌶️🔥,TampicososTV,es,Top
(@@TampicoGob OR @@MonicaVTampico) min_replies:0 min_faves:0 min_retweets:0,https://x.com/search?q=(@@TampicoGob OR @@MonicaVTampico) min_replies:0 min_faves:0 min_retweets:0 until:2025-03-09 since:2025-03-08&src=typed_query,nat jurídico turma da mônica,https://x.com/its_nyat,its_nyat,True,2025-03-08 03:20:28+00:00,False,"idade: bem, o super trunfo da turma da mônica diz que ele tem 20 anos aparência em vida: muitas versões causa da morte: acho que a versão mais popular é a que foi esmagado dentro de um carro no ferro velho (por isso as perninhas curtas)",1898212191892849138,https://x.com/its_nyat/status/1898212191892849138,22,90,2441,44528,123,https://pbs.twimg.com/media/GlfN7YBWIAECiVm.jpg;https://pbs.twimg.com/media/GlfN7cMW4AA9rvf.jpg;https://pbs.twimg.com/media/GlfN7e8WgAEyngT.jpg,False,,,,,pt,Top
